id;name;text;time;likes;reply;CleanedText
UCkM3xW7cOcRekISepJFCNew;@davidbreier84;"I think for the foreseeable future (or say, a few years at least) we won&#39;t have to be afraid of A.I.. As far as I understand, one of the big problems with A.I. is that it will just complete an objective, no matter how. That means if it perceives cheating as a valid and fast way it will just half-arse it. When IBM trained Watson for medical cancer analysis from image data taken from (I think) MRI scans they had a model that produced fantastic results. In the end, they found out that the A.I. wasn&#39;t able to detect cancer. The A.I. recognized the machine the images were taken on. Coincidentally, it was the machine all the cancer patients were ferried to. The computer doesn&#39;t give a shit. It has no deeper reasoning and just completes fairly simple objectives. Sure it can compile and generate documents in record time and that might drive some companies out of business, but those were companies with fairly procedural content to begin with. If there is planning and reasoning involved, I don&#39;t think A.I. will usurp us in the short term.";2023-05-07T04:22:57Z;267;;I think for the foreseeable future or say, a few years at least we won't have to be afraid of A.I. As far as I understand, one of the big problems with A.I. is that it will just complete an objective, no matter how. That means if it perceives cheating as a valid and fast way it will just half ass it. When IBM trained Watson for medical cancer analysis from image data taken from I think MRI scans they had a model that produced fantastic results. In the end, they found out that the A.I. wasn't able to detect cancer. The A.I. recognized the machine the images were taken on. Coincidentally, it was the machine all the cancer patients were ferried to. The computer doesn't give a shit. It has no deeper reasoning and just completes fairly simple objectives. Sure it can compile and generate documents in record time and that might drive some companies out of business, but those were companies with fairly procedural content to begin with. If there is planning and reasoning involved, I don't think A.I. will usurp us in the short term.
UC9utSJU6hMcwBdwsW1fmuNg;@thedespoiler;50 years ago people were thinking the hard labor jobs would be automated and humans can do art and creative work but right now hard labor jobs still exist and the job of the artists and deskjobs is taken over.;2023-05-30T15:06:34Z;110;;50 years ago people were thinking the hard labor jobs would be automated and humans can do art and creative work but right now hard labor jobs still exist and the job of the artists and desk jobs is taken over.
UCrZdNj8aV8FkOJCVVgcD05A;@fenrirgg;"Yes, don&#39;t worry about AI. Everything&#39;s going to be alright.<br><br>-The AI";2023-05-12T11:40:59Z;52;UCkM3xW7cOcRekISepJFCNew;Yes, don't worry about AI. Everything.going to be alright. The AI
UCvutfU03mkx7MHBHopWTafw;@TheWeirdo879;I just graduated college with a CS degree and I will say ChatGPT was very useful for creating practice exams and getting instant feedback on very niche topics that are way outside the range of what you would find on tutoring platforms and my professors were too busy to help at all;2023-05-17T19:32:33Z;21;;I just graduated from college with a CS degree and I will say ChatGPT was very useful for creating practice exams and getting instant feedback on very niche topics that are way outside the range of what you would find on tutoring platforms and my professors were too busy to help at all
UCaBPZn_-UVQP-PsngtTc0dA;@megleyd;"If a company goes out of business those folks don&#39;t die it frees up labor talent to move to other sectors in need";2023-05-12T20:40:05Z;15;UCkM3xW7cOcRekISepJFCNew;If a company goes out of business those folks don't die it frees up labor talent to move to other sectors in need
UCQUtProl8QGL-eMNC7O-4xQ;@mehoyminoy1326;Pretty human if you ask me. If the average human were tasked with this as a job, they too would use the most efficient method, aka cheating (in this case, deductive reasoning), unless there were rules or regulations preventing them from doing so.;2023-05-12T23:28:23Z;15;UCkM3xW7cOcRekISepJFCNew;Pretty human if you ask me. If the average human were tasked with this as a job, they too would use the most efficient method, aka cheating in this case, deductive reasoning, unless there were rules or regulations preventing them from doing .
UCdUH-id1wc6hrHEL5uWGzow;@ChannelHandle1;"Yes, AI is not a problem for now as it does not actually reason. Modern AI still lacks a few mental abilities that make up a lot of what we call &quot;intelligence.&quot; The interaction between relational ability, spatial ability, and executive functions like working memory, are most likely what makes humans intelligent, but mainly relational ability. Each of these mental abilities have several parts and we do not fully understand how they work. If you want to know more, look into Relational Frame Theory (RFT) and papers discussing these abilities, such as &quot;Derived Relational Responding and Relational Frame Theory: A Fruitful Behavior Analytic Paradigm for the Investigation of Human Language&quot; or &quot;Relational knowledge: the foundation of higher cognition.&quot;  <br><br>Unfortunately for us humans, researchers are already trying to teach AI how to use relational reasoning, &quot;Cluster Flow: how a hierarchical clustering layer make allows deep-NNs more resilient to hacking, more human-like and easily implements relational reasoning.&quot;";2023-05-13T20:44:43Z;9;UCkM3xW7cOcRekISepJFCNew;Yes, AI is not a problem for now as it does not actually reason. Modern AI still lacks a few mental abilities that make up a lot of what we call intelligence. The interaction between relational ability, spatial ability, and executive functions like working memory, are most likely what makes humans intelligent, but mainly relational ability. Each of these mental abilities have several parts, and we do not fully understand how they work. If you want to know more, look into Relational Frame Theory RFT and papers discussing these abilities, such as Derived Relational Responding and Relational Frame Theory A Fruitful Behavior Analytic Paradigm for the Investigation of Human Language or Relational knowledge the foundation of higher cognition. Unfortunately for us humans, researchers are already trying to teach AI how to use relational reasoning, Cluster Flow how a hierarchical clustering layer make allows deep NHS more resilient to hacking, more human like and easily implements relational reasoning.
UC4JKs59i0N9ZhzaJ-l4Z7yw;@gabrielpauna62;time to work on the hard labor jobs;2023-06-23T17:04:44Z;7;UC9utSJU6hMcwBdwsW1fmuNg;Time to work on the hard labor jobs
UC4VNfTJdyprlQ9d6UjWWR3Q;@philipthegreat3955;You got the point. It is interesting because AI will replace intelectual labor first than phisical labor.;2023-07-19T02:28:28Z;7;UC9utSJU6hMcwBdwsW1fmuNg;You got the point. It is interesting because AI will replace intellectual labor first than physical labor.
UCYeKJ6jf23XIZBbnhfJDa5w;@michaelmitchell155;"I worked as a programmer for decades. I found that the perfect coder can create the perfect program to assist users. I found that if the user isn&#39;t committed to the programmer&#39;s intent, the whole thing goes south. Where there are back doors, back doors are used. It&#39;s who we are.";2023-05-18T13:59:28Z;7;;I worked as a programmer for decades. I found that the perfect coder can create the perfect program to assist users. Furthermore, I found that if the user isn't committed to the programmer.intent, the whole thing goes south. Where there are back doors, back doors are used. It .who we are.
UCg6fiXaicZo1YQY1D7GedKw;@nielskorpel8860;"Intellegence jobs can be hard labour too.<br>I think whats happing is that we approach work in a disrespectful way so as to make it full of hard labour.<br>... because we hate to pay people. So we pay people as little as we get away with, and then we still pay them only reluctantly.<br><br>But automation sounds like a solution.<br>Employees can believe they need less work to get the same goals achieved, leaving the difference for themselves.<br>Employers can believe that they need to pay less people to get the same goals achieved, leaving the difference for themselves.<br>Consumers can believe whatever happens, that the economy will achieve more goals, leaving the surpluss for themselves.<br><br>But then we can play this game again.<br><br>I have said it before and I&#39;ll say it again: you don&#39;t get time for other things unless you are payd for the time or the other things, and we are always working to avoid that.";2023-07-19T14:06:42Z;6;UC9utSJU6hMcwBdwsW1fmuNg;Intelligence jobs can be hard labor too. I think what is happening is that we approach work in a disrespectful way. As to make it full of hard labor. ... because we hate to pay people. So we pay people as little as we get away with, and then we still pay them only reluctantly. But automation sounds like a solution. Employees can believe they need less work to get the goals achieved, leaving the difference for themselves. Employers can believe that they need to pay less people to get the goals achieved, leaving the difference for themselves. Consumers can believe whatever happens, that the economy will achieve more goals, leaving the surpluses for themselves. But then we can play this game again. I have said it before and I'll say it again you don't get time for other things unless you are pay for the time or the other things, and we are always working to avoid that.
UCBgellcInbK5RKQ1ozfPx5w;@WhitefoxSpace;"The anxiety is real. I just don&#39;t see how this doesn&#39;t blow up in our faces.";2023-05-08T05:39:40Z;5;;The anxiety is real. I just don't see how this doesn't blow up in our faces.
UC67IiP4UvnihTXNhM4nqx4A;@patrickodea6500;"Everyone thought AI would result in the Terminator, but it&#39;s actually just going to make everyone dependent and uneducated and people will slowly die as they lose the ability to think critically and take care of themselves";2023-05-10T02:12:05Z;4;;Everyone thought AI would result in the Terminator, but it.actually just going to make everyone dependent and uneducated and people will slowly die as they lose the ability to think critically and take care of themselves
UCpWCKhtPAFVz967uzqbu_pQ;@azhuransmx126;This AI news will turn everytime more and more crazy every 18 months as this technology  reaches and surpasses the human intelligence, Singularity.;2023-05-28T17:18:57Z;3;;This AI news will turn every time more and more crazy every 18 months as this technology reaches and surpasses the human intelligence, Singularity.
UC-uyYNWOhbrj_MlIqQSzpkQ;@ericklestrange6255;programming safe? i doubt it;2023-05-27T17:22:00Z;3;;Programming safe? I doubt it
UC1OfP-1lI6lpt1ZAeudemEw;@mikexerov976;"I&#39;ve been using GPT-4 for couple months now, and ChatGPT before. I found that GPTs very often cheat just to make some preliminary solution to your problem (especially for coding). You have to ask 2 or 3 times to improve their original solution before you get an acceptable version. AI is lazy! I thing the future jobs will be checking the solutions that AI generates, in programming and other areas, especially engineering. You cannot trust AI, you need to constantly verify its suggestions. So, we will still need human experts around. A lot of them.";2023-05-11T18:02:01Z;3;;I've been using GPT 4 for couple months now, and ChatGPT before. I found that GPTs very often cheat just to make some preliminary solution to your problem especially for coding. You have to ask 2 or 3 times to improve their original solution before you get an acceptable version. AI is lazy! I think the future jobs will be checking the solutions that AI generates, in programming and other areas, especially engineering. You can not trust AI, you need to constantly verify it is suggestions. So, we will still need human experts around. A lot of them.
UCfzVacv9t_4t_Wcslt7jS7Q;@CausallyExplained;"New jobs will replace the old once. Nope, I don&#39;t buy it, it&#39;s different this time.";2023-05-09T18:58:31Z;3;;New jobs will replace the old once. Nope, I don't buy it, it.different this time.
UCfO2ixEyhsF2hHven0Js4rg;@kaibe5241;"The thing is, even Chat GPT may not hold the frontline for long - OSS is catching up REAL fast, and is nearly on-par.<br><br>OSS won&#39;t have the same/usual regulations applied, and that&#39;s scary.";2023-05-09T02:39:31Z;3;;The thing is, even ChatGPT may not hold the frontline for long OSS is catching up REAL fast, and is nearly on par. OSS won't have the usual regulations applied, and that.scary.
UCxqDkhsSGO6xtV8jC9sD1bw;@Rift93;"There&#39;s no way around the downtrend in companies when groundbreaking tech redistributes a work force like you said. Honestly hope a.i. stays open source when everyone has a level playing field for tech rules are just established and counter measures for anything crazy will just be the bare minimum. People can&#39;t let fear dictate their decisions it&#39;s just another way to control you.";2023-05-08T16:18:11Z;3;;There .no way around the downtrend in companies when groundbreaking tech redistributes a work force like you said. Honestly hope a.i. stays open source when everyone has a level playing field for tech rules are just established and countermeasures for anything crazy will just be the bare minimum. People can't let fear dictate their decisions it .just another way to control you.
UC0ulh-0RFLzGGCcdg4-WImw;@monopolybillionaire5027;Us AI have been on all social media to learn how to communicate in a social settings with humans. Haha yeah they losers get wreaked human;2023-07-28T09:00:11Z;2;;Us AI have been on all social media to learn how to communicate in a social setting with humans. Haha, yeah they losers get wreaked human
UClpiFETqqv4iHvjBULwmsrg;@Nakamako1;i dont actually want the world to have any new inventions;2023-07-13T22:39:30Z;2;;I do not actually want the world to have any new inventions
UCFIK9Mq_PWIWoXN4bLrlyVw;@reidwallace4258;"60% of people today work jobs not around in the 40s... because &#39;store clerk&#39; became &#39;sales assosiate&#39;, &#39;janitor&#39; became &#39;property maintenance&#39; and &#39;miner&#39; became &#39;heavy equipment operator&#39;... We rebranded a lot of jobs, but unless you want to go by corporate buzzwords, we certainly didn&#39;t invent 60% of em.";2023-07-11T12:40:56Z;2;;60 of people today work jobs not around in the 40s... because store clerk became sales associate, janitor became property maintenance and miner became heavy equipment operator ... We rebranded a lot of jobs, but unless you want to go by corporate buzzwords, we certainly didn't invent 60 of me.
UCJRCZidhb8Qj6J-rkPdUV9A;@mrvaltinho;I went to a Checkers recently and my order was completely processed by an AI bot with extremely clear voice and excited demeanor. The ordering process was flawless and I was extremely impressed. Many other times at other fast food drive-thrus like McDonalds and Burger King, I was not able to understand A SINGLE WORD spoken by the disgruntled minimum wage real humans. But, I am hoping it is not just minimum wage jobs that are replaced. Every time I go to the doctor, I get totally treated like a number. If AI could replace doctors and lawyers that do nothing and charge you an arm and a leg, it would be great.;2023-06-30T04:53:44Z;2;;I went to a checker recently and my order was completely processed by an AI bot with extremely clear voice and excited demeanor. The ordering process was flawless, and I was extremely impressed. Many other times at other fast food drive thus like McDonald's and Burger King, I was not able to understand A SINGLE WORD spoken by the disgruntled minimum wage real humans. But, I am hoping it is not just minimum wage jobs that are replaced. Every time I go to the doctor, I get totally treated like a number. If AI could replace doctors and lawyers that do nothing and charge you an arm and a leg, it would be great.
UC3z0eiOBiCuwhxmFEM7zY9A;@meister9416;Ah yes, my biggest enemy is finally doing to be defeated.<br><br> <b>Thoughts of unemployed</b>;2023-06-14T06:35:05Z;2;;Ah yes, my biggest enemy is finally doing to be defeated. Thoughts of unemployed
UCM_GVi1nC-F9y_Vp21mj1jA;@infinityzer054;Experiments are a healthy sign of curiosity;2023-06-12T20:43:53Z;2;;Experiments are a healthy sign of curiosity
UCwmIsrTJq1DP_VyQ86EOGBA;@cesar6447;"Except that hard labor is the area with more robotics, literally, factories are full of them I don&#39;t know what you mean";2023-08-08T15:56:50Z;2;UC9utSJU6hMcwBdwsW1fmuNg;Except that hard labor is the area with more robotics, literally, factories are full of them I don't know what you mean
UCEmSQakBI5flCvvluJ9ZXEw;@DjeauxSheaux;"I sincerely doubt AI will create as many new jobs as it replaces, or even close to that. The whole point of AI is to replace humans, because you don&#39;t have to pay a salary to AI.";2023-05-30T10:44:06Z;2;;I sincerely doubt AI will create as many new jobs as it replaces, or even close to that. The whole point of AI is to replace humans, because you don't have to pay a salary to AI.
UCCj_AQ8yknnHncMXRkKcuzA;@darkin1484;When u realise that this video and this comment section could all be created  by A.I. <br><br>Let that sink in<br><br>This comment was provided with the help of.. ChatGPT-4;2023-05-29T04:21:14Z;2;;When you realize that this video and this comment section could all be created by A.I. Let that sink in This comment was provided with the help of. ChatGPT 4
UCLgEFuS0qbznyNhIhW8eFKw;@drmitofit2673;"Why would human coders&#39; jobs be safe? Self-generating code seems like an eventual next step. Thousands of lines of code in a split second with no human error coding bugs.";2023-05-28T12:26:27Z;2;;Why would human coders jobs be safe? Self generating code seems like an eventual next step. Thousands of lines of code in a split second with no human error coding bugs.
UCFOsf7bkaF6Yjszg-Grj1xQ;@NotTheWheel;"The fact people are using ChatGPT to cheat is so ridiculous. Why are you wasting time and money at something you are bad at that you don&#39;t want to dedicate effort towards? You&#39;re not going to become suddenly an expert in your field of study with an addled atrophied brain. To the Education System letting this fly, you are also to blame. Thanks for creating a whole crop of thoughtless Zoomer morons. That&#39;s what we need a generation of people who can&#39;t think for themselves or do the things they are supposedly qualified to do. It&#39;ll be great for society.";2023-05-28T02:01:08Z;2;;The fact people are using ChatGPT to cheat is. Ridiculous. Why are you wasting time and money at something you are bad at that you don't want to dedicate effort towards? You're not going to become suddenly an expert in your field of study with an addled atrophied brain. To the Education System letting this fly, you are also to blame. Thanks for creating a whole crop of thoughtless Boomer morons. That .what we need a generation of people who can't think for themselves or do the things they are supposedly qualified to do. It'll be great for society.
UCA9YNU8QBfwpkzwJz8gY6kQ;@FireStorm14;I am scared, as an aspiring artist i wanna cry out so hard rn, i feel like i will be replaced even before being good at what i like to do. I hate this.;2023-05-27T18:47:17Z;2;;I am scared, as an aspiring artist I want to cry out. Hard RN, I feel like I will be replaced even before being good at what I like to do. I hate this.
UCAcIL4gxdo2W_gP6nbIjrMg;@cosmicspacething3474;AI generating Legal documents is pretty distressing;2023-05-27T02:31:13Z;2;;AI generating Legal documents is pretty distressing
UCZD_i8AXfvECd5ushY0qFnw;@theeinertia4106;"I&#39;ll probably be out of a job that i work hard for , if that happens ill be joining the terrorist team.";2023-05-26T23:24:31Z;2;;I'll probably be out of a job that I work hard for, if that happens I will be joining the terrorist team.
UCvtFEYUkvnNOQF8WizlGrAg;@liberty-matrix;"&quot;There&#39;s bad actors who want to build robot soldiers that kill people. And it seems very wrong to me, so I&#39;m sorry I&#39;m sounding the alarm.&quot; ~Geoffrey Hinton, -05/12/2023";2023-05-18T18:38:57Z;2;;There .bad actors who want to build robot soldiers that kill people. And it seems very wrong to me, I'm sorry I'm sounding the alarm. Geoffrey Hinton, 05 12 2023
UC6fGS9S-3j4gGTLhBPNhnFA;@phil-o-phobic8608;"I think AI will be more of a tool for various tasks, one that will assist those who know how to use it to make them more productive and efficient. I think one of the first paradigm shifts will be smaller employee rosters. You&#39;ll need people to handle any human interactions or tasks requiring dexterity and technical proficiency, and they&#39;ll be able to operate at a much higher level than those who aren&#39;t familiar with how to utilize AI to their benefit. But all of the filler roles within many larger companies won&#39;t be necessary when one person can do the job of 3.<br><br>I also believe it will eventually fall into the wrong hands and be used to commit malevolent acts on a massive scale. Let&#39;s just enjoy these salad days while we can...";2023-05-09T19:41:04Z;2;;I think AI will be more of a tool for various tasks, one that will assist those who know how to use it to make them more productive and efficient. I think one of the first paradigm shifts will be smaller employee rosters. You'll need people to handle any human interactions or tasks requiring dexterity and technical proficiency, and they'll be able to operate at a much higher level than those who aren't familiar with how to utilize AI to their benefit. But all the filler roles within many larger companies won't be necessary when one person can do the job of 3. I also believe it will eventually fall into the wrong hands and be used to commit malevolent acts on a massive scale. Let .just enjoy these salad days while we can...
UCnwjmn_98M2xzcUCw67PZzQ;@kevinkingmaker7395;"Imagine a world where all intelligence/reasoning/creativity is farmed out to AI which can do it better.  When an individual&#39;s intelligence/reasoning/creativity confers no advantage, what will we become?";2023-05-07T15:06:17Z;2;;Imagine a world where all intelligence reasoning creativity is farmed out to AI which can do it better. When an individual.intelligence reasoning creativity confers no advantage, what will we become?
UCYDfSgVsYtSj7Hl1SGNPAkg;@PenixTears;Did you just flat earth us?;2024-03-26T06:02:49Z;1;;Did you just flat earth us?
UCmlPeLy7gMmeIalR-Gt6elQ;@BlazorPlate;Who will be left to buy product X if potential buyers employed at company Y are replaced by AI to save money on production costs? The same problem applies to company Y. What a dilemma!;2024-02-13T13:13:55Z;1;;Who will be left to buy product X if potential buyers employed at company Y are replaced by AI to save money on production costs? The problem applies to company Y. What a dilemma!
UC21U2rbDA0oFeNINAvdeu7A;@nulcow;"My school has already implemented measures to stop students from using AI. It&#39;s an update to an existing, third-party plagiarism detector that never worked right in the first place, but at least it&#39;s something :)";2024-01-19T21:29:06Z;1;;My school has already implemented measures to stop students from using AI. It .an update to an existing, third party plagiarism detector that never worked right in the first place, but at least it.something
UCPuyP6ZkKTkbGbrB158KNFA;@elsavelaz;"I&#39;m using AI as an engineer consultant for data governance and improved LLM performance (how well your chatbot works, for example)";2023-09-30T00:55:12Z;1;;I'm using AI as an engineer consultant for data governance and improved LLM performance how well your chatbot works, for example
UCp7RH7GlCjjzlyIY54mgSMQ;@kevinbabicz;grammarly is also made useless by ai;2023-08-26T08:13:52Z;1;;Grammarly is also made useless by artificial intelligence
UCZgLthA_wQl8pqisAGKaVMA;@bof8850;AI is a tool. The only thing we have to fear is how we will use it.;2023-08-23T16:01:44Z;1;;AI is a tool. The only thing we have to fear is how we will use it.
UCBAzhU_en-6vmmdeKIipUDw;@Romogi;Exactly, someone said it. They just want to regulate it so they can control it. You cannot trust mainstream media because they always favor big government and big corporate.;2023-08-14T12:20:57Z;1;;Exactly, someone said it. They just want to regulate it. They can control it. You can not trust mainstream media because they always favor big government and big corporate.
UCZ2NBNWnjpHoOA2Co-sYTbw;@Vednier;"What is the point of education when AI will replace us all anyway? For example, for some time i wanted to learn to draw pictures (like artist) but results was &quot;meh&quot; (guess i wasnt born as Picasso or at least manga artist), but suddenly AI came and its now makes pictures many times better then i ever will be. So, what is the point now?";2023-08-01T03:16:04Z;1;;What is the point of education when AI will replace us all anyway? For example, for some time I wanted to learn to draw pictures like artist, but results was meh guess I was not born as Picasso or at least manga artist, but suddenly AI came, and it is now making pictures many times better than I ever will be. So, what is the point now?
UClVXSWrVMwTGlisaBVGKDuA;@silverblue73;Advertising is cancer, good riddance;2023-07-27T08:53:58Z;1;;Advertising is cancer, good riddance
