id;name;text;time;likes;reply;CleanedText
UCTyzpbcbBhI8_dbYBsGTSNw;@andriiguselietov8833;"Why he keeps talking about AI?  ...what  intelligence is in this? Generator based on large language models; some large statistical prediction models - or let&#39;s call them what they are -decision support system (DSS) . By itself -  DSS became an area of research of its own in the middle of the 1970s, before gaining in intensity during the 1980s. So, the volume of data is growing, speed on number crunching is growing, but there are very few new ideas and zero of them made a break-through yet. Is there ANY REAL so-called A.I. application in the wild? Anything more than a chat-bot? And don&#39;t tell me FaceID , that&#39;;s not A.I.  - it is a convolutional network .. it cannot decide general question and optimised for ONE only task. Maybe a step to but no A.I.";2023-07-26T11:53:03Z;1;;Why he keeps talking about AI? ...what intelligence is in this? Generator based on large language models some large statistical prediction models or let .call them what they are decision support system DSS. By it itself DSS became an area of research of it its own in the middle of the 1970s, before gaining in intensity during the 1980s. So, the volume of data is growing, speed on number crunching is growing, but there are very few new ideas and zero of them made a break through yet. Is there ANY REAL. Called A.I. application in the wild? Anything more than a chatbot? And don't tell me Faced, that .not A.I. it is a convolutional network . It can not decide general question and optimized for ONE only task. Maybe a step to but no A.I.
UCm0wQ-sAIeVATiJuGMpiyIg;@Andres-um4qf;"Can&#39;t wait for generative AI to be actually coherent";2023-07-15T03:14:53Z;1;;Can't wait for generative AI to be actually coherent
UC09H5UtQMoXYZSgaJsON50Q;@thecreativeducky5781;same;2023-07-15T14:59:47Z;1;UClpiFETqqv4iHvjBULwmsrg;our
UC2Vr2N0zJ2-r2Wmy4iFYrKA;@MrSpeedFrk;Even JavaScript is vulnerable;2023-07-06T16:25:13Z;1;;Even JavaScript is vulnerable
UCiJbgUPA52_ta_w-CXZbg8A;@BruhMoment-yg6jv;Every form on intellectuality will be destroyed by AI.;2023-07-03T17:11:28Z;1;;Every form on will be destroyed by AI.
UCr8cJgJW6e4q1z_dSN7gTyA;@orlovskyconsultinggbr2849;ruskis luck for brains to do a proper AI. I know my company attack russian system already 2 years.;2023-07-02T20:57:41Z;1;;Ruskis luck for brains to do a proper AI. I know my company attack Russian system already 2 years.
UCSgwvajUxHllxIqzWk6n6uw;@afterschool2594;When proompting is becoming science that is taught by people in school, Fireship will be known as the father of prompter;2023-07-02T07:49:35Z;1;;When prompting is becoming science that is taught by people in school, Fire ship will be known as the father of prompter
UCS_1qbZ8lzJ-YjrKJvpMhkg;@nyrva2876;"If you think programmers are safe from ai, you&#39;re gravely mistaken.<br>People having barely no programming skills can already make programs with ai better than some developers I know...<br>It&#39;s just a matter of how you&#39;re using ai.<br>And google ai big names already said that the old developers way of programming that is basically providing a solution to a problem will be replaced by providing applications a way to solve problems on their own. In the end, an ai will do that for you, not a program or a bunch of developers.";2023-06-20T12:05:05Z;1;;If you think programmers are safe from artificial intelligence, you're gravely mistaken. People having barely no programming skills can already make programs with artificial intelligence better than some developers I know... It .just a matter of how you re-using artificial intelligence. And google artificial intelligence big names already said that the old developers way of programming that is basically providing a solution to a problem will be replaced by providing applications a way to solve problems on their own. In the end, an artificial intelligence will do that for you, not a program or a bunch of developers.
UC5-cua1nlS04T4CiCUS6QSQ;@captaindomore;"Human created AI, meanwhile humen try to &quot;argue&quot; earth is a disc - AI will probably have a teenage crisis realising how ignorant its creator species is";2023-06-19T11:04:46Z;1;;Human created AI, meanwhile human try to argue earth is a disc AI will probably have a teenage crisis realizing how ignorant it is creator species is
UCf2YAiorazGwp5sjcxSPIBQ;@resgalis2;i love that videos so interesting to watch and it actualy with deep meaning;2023-06-17T00:04:52Z;1;;I love that videos. Interesting to watch and it actually with deep meaning
UCWkJKxVgaUi3zoY5Vmo9fIA;@tristansun3274;CheckMate;2023-06-13T01:04:37Z;1;;Checkmate
UCSVmQMTXGe3956ACndVZkbw;@Algeriawindows69;but the real question is do ai robots need rights?;2023-06-11T21:41:13Z;1;;But the real question is done artificial intelligence robots need rights?
UCPAfaOpq27kZCRJZZJXWliQ;@bcn1gh7h4wk;"as long as [people] keep telling [the corporations using AI] [who they themselves are], [what they like] and [where they lean to], [the corporations using AI] will keep shaping their products to [people] according to [preference].<br>I dare google to tell ME <b>my</b> preferences at any given point, in a way that I can&#39;t track to something I previously told THEM in one way or another.<br>AI is just going to make stupid people stupider, smart people happier, and corporations out of business, by their own hand.<br>my only regret is that I&#39;ll be too old to fight the AI uprise war when it comes, and it&#39;ll be all left up to young grunts with zero knowledge of this, and me to STILL be unable to enjoy the fun of shooting robots, as I do today in TF2 MVM, but for real.<br>.....and yes, I just admitted to liking TF2... I know I&#39;m getting a recommendation for that soon, so <i>no, google,</i> it doesn&#39;t count.";2023-06-10T20:49:33Z;1;;As long as people keep telling the corporations using AI who they themselves are, what they like and where they lean to, the corporations using AI will keep shaping their products to people according to preference. I dare google to tell ME my preferences at any given point, in a way that I can't track to something I previously told THEM in one way or another. AI is just going to make stupid people stupider, smart people happier, and corporations out of business, by their own hand. My only regret is that I'll be too old to fight the AI uprise war when it comes, and it'll be all left up to young grunts with zero knowledge of this, and me to STILL be unable to enjoy the fun of shooting robots, as I do today in TF2 MVM, but for real. .....and yes, I just admitted to liking TF2... I know I'm getting a recommendation for that soon, No, google, it doesn't count.
UCGwdeNjW-26v7rtDuiqqvMQ;@mariusro1987;Yeai ! Been replaced by robots, so nice ! <br><br>F you human, we value money over you ! - Big companies;2023-06-10T17:43:46Z;1;;Year ! Been replaced by robots, Nice ! F you human, we value money over you ! Big companies
UCbZ7a-DHtRtEzN2V5hbCCDw;@Fitzrovialitter;"You&#39;ve just jumped on the absurd contemporary AI bandwagon. You think that the first &quot;causalities&quot; - if any - are occurring now, some sixty years since AI&#39;s inception? Clueless.";2023-06-10T13:02:07Z;1;;You've just jumped on the absurd contemporary AI bandwagon. You think that the first causalities if any are occurring now, some sixty years since AI.inception? Clueless.
UCSBnxz_rNywyD_vwm333SRQ;@iPondR;"I&#39;m glad I&#39;m old for once... I&#39;m already obsolete! No stress there... good luck genZ&#39;s !!";2023-06-07T03:28:57Z;1;;I'm glad I'm old for once... I'm already obsolete! No stress there... good luck gene !!
UCHofADuwraVF48jJZVlR0_g;@OrlyYahalom;"60% of workers today are employed in jobs that didn&#39;t exist in 1940 (!!). How does that indicate that &quot;programming jobs are safe&quot;??";2023-06-03T21:39:47Z;1;;60 of workers today are employed in jobs that didn't exist in 1940 !! . How does that indicate that programming jobs are safe ??
UCkSTvhFrQudn-dggUY-uZzA;@enkephalin07;"I used ChatGPT once for a programming assignment and got the ok from my professor. He had already permitted borrowing source code so long as the source was cited, and I explained to him how I got the code and that I couldn&#39;t verify that it wasn&#39;t plagiarized. I still had to explain in a live presentation how it worked and describe results, testing procedures and runtime analysis, and he was satisfied with that.";2023-05-30T19:18:35Z;1;;I used ChatGPT once for a programming assignment and got the ok from my professor. He had already permitted borrowing source code. Long as the source was cited, and I explained to him how I got the code and that I couldn't verify that it wasn't plagiarized. I still had to explain in a live presentation how it worked and describe results, testing procedures and runtime analysis, and he was satisfied with that.
UC0V5zX1RkgmgRNTYprKmdww;@Simboiss;"Again, everything seems to point to the &quot;C&quot; word : capitalism.";2023-05-30T16:19:55Z;1;;Again, everything seems to point to the C word capitalism.
UCq35xjTT_FrzPAk4jU1anHg;@theknight4317;"Oh wait, so everyone&#39;s fucked.";2023-05-30T14:54:23Z;1;;Oh wait, Everyone.fucked.
UC_lwnoJo-QR4wVLTrgU4vMw;@warfrekmanreborn;education system will be one casualty of AI;2023-05-30T06:44:31Z;1;;Education system will be one casualty of AI
UChl9SIFhWZXF7Dl2zy_xtjQ;@nachoijp;If a piece of software can cheat schools, clearly we should think of changing the whole education system.;2023-05-29T15:09:38Z;1;;If a piece of software can cheat schools, clearly we should think of changing the whole education system.
UCr_ZiTTah5bibucNgnSTTCQ;@degeneratewilson;as long as it can do my taxes I dont care. because someone lobbied for taxes not to be tought in school and to make it a complicated process and everyone in america pays for it;2023-05-29T00:44:49Z;1;;As long as it can do my taxes I do not care. Because someone lobbied for taxes not to bet ought in school and to make it a complicated process and everyone in America pays for it
UCQ_HZUnIexCrXsX2oPlJUaA;@ANonymous-mo6xp;"It is being said that when experts review what ChatGTP says they see that it&#39;s all garbage.  I&#39;ve seen multiple examples of this.  There is ONE profession that does this all the time.  And they happen to be the ones fawning over ChatGTP will it does their job.  Every journalist deserves to be homeless and replaced by ChatGTP.";2023-05-28T14:53:38Z;1;;It is being said that when experts review what Chat GTP says they see that it .all garbage. I've seen multiple examples of this. There is ONE profession that does this all the time. And they happen to be the ones fawning over Chat GTP will it does their job. Every journalist deserves to be homeless and replaced by Chat GTP.
UCRBWY5I_ZPrQjuyPMSoR5Lg;@DanielVerberne;"In a sane world, we would employ people to do work that needs doing.  Whether that work is done by humans or by our creations is, essentially, moot.  If humans aren&#39;t doing the work, it simply means it&#39;s being done by others or that we&#39;ve solved that area of work.  Either way, humans should receive the financial fruits of our collective creations.  It&#39;s this final point where things are bound to fall over, knowing the world as it is.  Instead of ensuring everyone gets a decent standard of living, ensuring the long-term stability of our civilisation, you can almost guarantee that the individuals controlling the worlds capital will continue to enforce a backwards system where a few benefit obscenely while many lose out.  Loss of jobs to automation is just one of the many ways that individuals can be short-changed in our modern society.";2023-05-28T04:30:20Z;1;;In a sane world, we would employ people to do work that needs doing. Whether that work is done by humans or by our creations is, essentially, moot. If humans aren't doing the work, it simply means it.being done by others or that we've solved that area of work. Either way, humans should receive the financial fruit is of our collective creations. It .this final point where things are bound to fall over, knowing the world as it is. Instead of ensuring everyone gets a decent standard of living, ensuring the long term stability of our civilization, you can almost guarantee that the individuals controlling the worlds capital will continue to enforce a backwards system where a few benefit obscenely while many lose out. Loss of jobs to automation is just one of the many ways that individuals can be short-changed in our modern society.
UCPPl5VGDX6qrBNVuuNElwbw;@terryhughes7196;Tick tock is already killing Google off in advertising revenue;2023-05-27T22:18:57Z;1;;Ticktock is already killing Google off in advertising revenue
UCBObyZzYVJrCfxNWLCUevhg;@captianmorgan7627;"Another &#39;first casualty&#39; are unions. National Eating Disorder Association Helpline workers decided to unionize and 3 days later were all fired so they could be replaced with an AI.";2023-05-27T20:35:35Z;1;;Another first casualty are unions. National Eating Disorder Association Helpline workers decided to unionize, and 3 days later were all fired. They could be replaced with an AI.
UC0ciX76WQXHoUMiu6PHGfLw;@DagothUrWelcomesYou;The Matrix is coming;2023-05-27T18:44:19Z;1;;The Matrix is coming
UCr9buzu-bnCsMCJTMYZ6NNA;@zombie_snax;I also think these companies are trying to scare people so they can pass regulations so that only a couple large companies can create new programs. Go ahead and start a monopoly before the field takes off.;2023-05-27T11:35:45Z;1;;I also think these companies are trying to scare people. They can pass regulations. That only a couple large companies can create new programs. Go ahead and start a monopoly before the field takes off.
UCEWoVPwP8eWQ_XzPqfdW5LQ;@BigPuddin;"If an AI can do your job, then you don&#39;t have a real job.";2023-05-27T05:47:51Z;1;;If an AI can do your job, then you don't have a real job.
UCRT7TJxU5-5zUjMQRRGkahw;@sor8104;"And that&#39;s why Leon Edwards has the most aesthetic physique.";2023-05-27T01:06:44Z;1;;And that .why Leon Edwards has the most aesthetic physique.
UCk4hXzHsKAvFBNK8EF65TyQ;@Dark_Slayer3000;Your next video is going to be written by an AI :3;2023-05-26T19:08:18Z;1;;Your next video is going to be written by an AI 3
UCO3s9HajCAmRvrTwvFPXPIQ;@VJArt_;Cant wait for a few years when all of this ai bullshit dies down;2023-05-26T17:03:06Z;1;;Can not wait for a few years when all of this artificial intelligence bullshit dies down
UCulFW2euxY3Bo1VVYTF7MNg;@CommissionerLofi;ChatGBT is my preferred search engine.;2023-05-26T14:47:23Z;1;;Chat GBT is my preferred search engine.
UCpQ0AbWEs2wENnP0O_uOQSg;@Amogius;The russians did not stop their AI becaus it was sexist, they stopped it because it did not regurgitate russian propaganda. LOL;2023-05-24T10:52:59Z;1;;The Russians did not stop their AI because it was sexist, they stopped it because it did not regurgitate Russian propaganda. LOL
UC0XDkFqI6y2hihPWypjyvrg;@MASTERCRAFT938;lol xD;2023-05-20T19:12:54Z;1;;Laugh out loud XD
UCZar7Z4T5nwZ_15lYkKwbrQ;@medes5597;In about two years when AI hype has died down, creator lawsuits have weakened it and none of the major players have delivered on their promised AI systems, this video is going to look fucking ridiculous.;2023-05-17T18:56:50Z;1;;In about two years when AI hype has died down, creator lawsuit is have weakened it and none of the major players have delivered on their promised AI systems, this video is going to look fucking ridiculous.
UCwzjL1QrCRhoTbN3DlhOF0w;@demonmanifesto;"I have an example where AI is actually hindering the progress. I have a brother who is going through university in the computer engineering field. Being a programmer myself, I can clearly see from his code where he struggles to understand concepts and the inner workings of the language (we are talking about basic stuff like OOP concepts, passing functions to functions, selectors, constructors, etc.). Well, enter ChatGPT. My brother jumped on the bandwagon day 1. He had a lot of code written in his application by ChatGPT. Amazing, right? Dead wrong. The code ChatGPT wrote, even though it was quite basic &amp; easy, my brother for the life of him could not get his head around it. He just kept trying to make it work using more ChatGPT prompts, but couldn&#39;t. He was stuck in this perpetual loop of not being able to understand what is wrong or what is even written in front of him and trying, hoping that ChatGPT will make it right. You see the problem here? He wasn&#39;t learning by exploring how to do stuff on his own, he wasn&#39;t experienced enough to understand even the basic stuff ChatGPT wrote for him. I cut him off of this cursed needle right there and then. To even use ChatGPT or any intelligent code completion properly, you have to be at least an average developer that has gone through the motions several thousands of times. Also, just to point out, the code that ChatGPT wrote was hilariously bad. Why? Because it&#39;s a learning model. If you feed it bad code, it will write bad code. Guess what is more prevalent in GitHub.";2023-05-17T18:19:07Z;1;;I have an example where AI is actually hindering the progress. I have a brother who is going through university in the computer engineering field. Being a programmer myself, I can clearly see from his code where he struggles to understand concepts and the inner workings of the language we are talking about basic stuff like OOP concepts, passing functions to functions, selectors, constructors, etc.. Well, enter ChatGPT. My brother jumped on the bandwagon day 1. He had a lot of code written in his application by ChatGPT. Amazing, right? Dead wrong. The code ChatGPT wrote, even though it was quite basic easy, my brother for the life of him could not get his head around it. He just kept trying to make it work using more ChatGPT prompts, but couldn't. He was stuck in this perpetual loop of not being able to understand what is wrong or what is even written in front of him and trying, hoping that ChatGPT will make it right. You see the problem here? He wasn't learning by exploring how to do stuff on his own, he wasn't experienced enough to understand even the basic stuff ChatGPT wrote for him. I cut him off of this cursed needle right there and then. To even use ChatGPT or any intelligent code completion properly, you have to be at least an average developer that has gone through the motions several thousands of times. Also, just to point out, the code that ChatGPT wrote was hilariously bad. Why? Because it.a learning model. If you feed it bad code, it will write bad code. Guess what is more prevalent in GitHub.
UCEeoLuureKrjxE5I2VnOJxQ;@infinitykiyen6270;"Note - It still can&#39;t replace any lawyer in USA because their law is function by the court. Literally new law can be made out of stupid things... This is where the CHAT-GBT will take the lost. Not because they are dumb but rather, they are &quot;too logical&quot; at time. In court of law something illogical can happen. Like the case of Amber Heard.";2023-05-14T14:22:25Z;1;;Note It still can't replace any lawyer in the USA because their law is function by the court. Literally new law can be made out of stupid things... This is where the CHAT GBT will take the lost. Not because they are dumb but rather, they are too logical at time. In court of law something illogical can happen. Like the case of Amber Heard.
UCH7OuH6DgYzly_1JyqGrP7w;@mistertoups;silver lining to this is that someone finally called out the implicit homophobia of javascript;2023-05-14T13:30:20Z;1;;Silver lining to this is that someone finally called out the implicit homophobia of JavaScript
UC50HvFHNUlUPDQ-f_h4MoOQ;@CUMBICA1970;"So far they didn&#39;t replace sex workers with chatGPT. I mean it&#39;s often dubbed &quot;humanity&#39;s oldest profession&quot; so when it happens it&#39;s gonna come full circle.";2023-05-14T09:24:20Z;1;;So far they didn't replace sex workers with ChatGPT. I mean it.often dubbed humanity.oldest profession. When it happens it.going to come full circle.
UCYbPMOPACAI3EML6uIRoUIg;@deadinside777;I work in HR related business.  Yeah, I can see AI just wrecking that industry.  Recruiters?  Goodbye.  Consultants?  Goodbye.  Employee Relations?  Goodbye.  Will probably be out of a job in he next decade.;2023-05-14T04:28:17Z;1;;I work in HR related business. Yeah, I can see AI just wrecking that industry. Recruiters? Goodbye. Consultants? Goodbye. Employee Relations? Goodbye. Will probably be out of a job in the next decade.
UC6oy3PjGWt27tlq-vn9axYQ;@ExoCade;"So kids can cheat in school, And they have a program that literally randomizes the words too in a way. That makes it so it doesn&#39;t look like it&#39;s made by aI. So what&#39;s the point of teaching if they&#39;re just gonna Know everything but not even know any of it.";2023-05-13T17:22:15Z;1;;So kids can cheat in school, And they have a program that literally randomizes the words too in a way. That makes it. It doesn't look like it .made by ai. So what .the point of teaching if they're just going to Know everything but not even know any of it.
UCGoTkIXLconq_84FLukPmJA;@fiver-hoo;"Javascript can&#39;t be homophobic.  Javascript is gay.";2023-05-13T12:28:04Z;1;;JavaScript can't be homophobic. JavaScript is gay.
UC-V4sOX9ALUC9tYjqHnfZGA;@chrisdt95;The earth is actually flat terrarium, gas pressure cannot exist without a container;2023-05-13T07:49:37Z;1;;The earth is actually flat terrarium, gas pressure can not exist without a container
UCnUSn-V22sN8ibUivmJV0Tg;@kayr6422;With automation, and people with no work, who is going to pay the taxes?;2023-05-12T02:04:05Z;1;;With automation, and people with no work, who is going to pay the taxes?
UCp1sBSjHSa_FsacFs0R8ngA;@Rai2M;They will make a supervisor AI for that.;2023-05-28T02:22:12Z;1;UC1OfP-1lI6lpt1ZAeudemEw;They will make a supervisor AI for that.
UCTFzVDgl4kRNYkpxZOMl8aA;@rubickon;Ibm is a dead company. They said to rise therevstock;2023-05-11T17:17:52Z;1;;IBM is a dead company. They said to rise headstock
UC9hphs7KtT5xElFrwVO6yxg;@fistofram5526;I  think anyone worshipping AI replacing everything is a complete stupid buffoon.;2023-05-11T16:06:23Z;1;;I think anyone worshiping AI replacing everything is a complete stupid buffoon.
UCU_OQc64o10jzLiSa0WdAvQ;@Deniska_UKR;From the moment I understood the weakness of my flesh, it disgusted me. I craved the strength and certainty of steel. I aspired to the purity of the Blessed Machine.<br><br>Your kind cling to your flesh, as though it will not decay and fail you. One day the crude biomass you call the temple will wither, and you will beg my kind to save you.<br><br>But I am already saved, for the Machine is immortal...<br><br>...even in death I serve the Omnissiah.;2023-05-11T13:23:48Z;1;;From the moment I understood the weakness of my flesh, it disgusted me. I craved the strength and certainty of steel. I aspired to the purity of the Blessed Machine. Your kind cling to your flesh, as though it will not decay and fail you. One day the crude biomass you call the temple will wither, and you will beg my kind to save you. But I am already saved, for the Machine is immortal... ...even in death I serve the Messiah.
UC9BzLj-E-KYHDoouq93UY8Q;@-J--vx7nv;"&gt;putin<br>&gt;uses AI and makes it into a murder machine<br>lol, he doesn&#39;t even use the internet, let alone a fucking AI.";2023-05-11T12:33:22Z;1;;Putin uses AI and makes it into a murder machine laugh out loud, he doesn't even use the internet, let alone a fucking AI.
UCC6HwYO5Xq0d7DVr3wfbvUw;@eyermatt;Be more scared of the tyrants we have here then to some boogie man in Russia;2023-05-11T12:29:45Z;1;;Be more scared of the tyrants we have here than to some boogie man in Russia
UC-CY_iHFL6nSG0JlnP8VaPA;@Fleischkopf;"putin doesnt need ai to &quot;win&quot; &quot;elections&quot;";2023-05-11T00:19:54Z;1;;Putin does not need artificial intelligence to win elections
UC_Gb6cvJHCvL82NelF-N5hw;@user-cu6kg5pu5g;"What kind of gets me is that if thousands (or millions) of people lose their jobs due to faster and more efficient AI, will companies truly save money? What happens when most consumers aren&#39;t able to afford luxury goods or entertainment because people are out of work? Those same companies that saved money will suddenly observe less revenue. Sure, prices could go down to meet dwindling demand, but something else seems sticky here.";2023-05-10T23:58:40Z;1;;What kind of gets me is that if thousands or millions of people lose their jobs due to faster and more efficient AI, will companies truly save money? What happens when most consumers aren't able to afford luxury goods or entertainment because people are out of work? Those companies that saved money will suddenly observe less revenue. Sure, prices could go down to meet dwindling demand, but something else seems sticky here.
UCEtfP3PTRnHj03VlZjhHLNA;@89qwyg9yqa34t;We should just replace politicians with ChatGPT. Have it hammer-out a top-ten list of options to solve some problem and then let us all vote on them.;2023-05-10T18:37:36Z;1;;We should just replace politicians with ChatGPT. Have it hammed out a top ten list of options to solve some problem and then let us all vote on them.
UCtOgx2UlZO_huEX0sJAlF7w;@JoesGuy;"Pfft! Putin and DeSantis don&#39;t need AIs to win elections. Turns out woke policies aren&#39;t popular enough. But hey, at least AI can write robotic NPC articles. ;D";2023-05-10T16:07:57Z;1;;Pfft! Putin and DeSantis don't need AIs to win elections. Turns out woke policies aren't popular enough. But hey, at least AI can write robotic NPC articles. D
