id;name;text;time;likes;reply;CleanedText
UCzu27GKl9zH5mLeX5l3YCrg;@hochangyaw4477;A language teaching robot may have already been made possible, but I doubt that there will be a robot teaching dialects anytime soon.;2024-04-14T10:16:19Z;0;;A language teaching robot may have already been made possible, but I doubt that there will be a robot teaching dialects anytime soon.
UCRjMO8AqjFpQU567C0puuvQ;@Nique3900;There are already AI apps on play Store that teach English;2024-04-19T04:47:02Z;0;UCzu27GKl9zH5mLeX5l3YCrg;There are already AI apps on play Store that teach English
UC0MtD6NHoB1yYR_f2csD2FA;@amalbanerjee1935;Nonsense and dumb reporting;2024-04-14T09:38:09Z;0;;Nonsense and dumb reporting
UC1TJXuoDT5SrsBQ1Qajfhzg;@kevingeorge5049;Make it faster;2024-04-14T07:43:24Z;0;;Make it faster
UCTtue7eWaLKCwWzxND8jokg;@testtest-co9hk;Hype HYpe and more Hype. Microsoft has vested interest in open ai and they have loaded their apps with ai so they would definitely support ai with these gloomy predictions.;2024-04-14T05:53:01Z;0;;Hype and more Hype. Microsoft has vested interest in open artificial intelligence, and they have loaded their apps with artificial intelligence. They would definitely support artificial intelligence with these gloomy predictions.
UCnEjFcJ-jiFrEf8Wj5ccajw;@umtatraining;"Humanoid drones, using AI, will almost certainly replace all &#39;human&#39; jobs, over a period of time.";2024-04-14T05:12:34Z;0;;Humanoid drones, using AI, will almost certainly replace all human jobs, over a period of time.
UCY8hUCKZ5hCrZThQQ12cbUg;@Zeon7510;"Can&#39;t photograph weddings if people don&#39;t have jobs to afford a wedding ya know. Indirectly impacted.";2024-04-30T17:06:50Z;0;UC6IkfsyquLuxGXrx9qALs_w;Can't photograph weddings if people don't have jobs to afford a wedding ya know. Indirectly impacted.
UCrGq0mDb3bsqGy_j6et-ViA;@SolomonSunder;You might get affected by people with AI assisted tools. Imagine there is a system which tells where to place the camera, and takes pictures automatically based on pose etc. It would be a cut in manpower and make money. My colleague had a self picture tool with high res for birthday parties. He only gave the equipment + software on rent.;2024-04-30T20:46:42Z;0;UC6IkfsyquLuxGXrx9qALs_w;You might get affected by people with AI assisted tools. Imagine there is a system which tells where to place the camera, and takes pictures automatically based on pose etc. It would be a cut in manpower and make money. My colleague had a self picture tool with high-res for birthday parties. He only gave the equipment software on rent.
UCZEVKBaD5joidLC6wG_dY2w;@debashisraykarmakar836;The most safe job now is to developer for AI;2024-04-14T04:04:26Z;0;;The most safe job now is to developer for AI
UCoJ91S2KV3_iaw1ZpFqM6GA;@anandpaulraj8094;Waiting for AI to replace my job and my bosses job!;2024-04-14T01:35:27Z;0;;Waiting for AI to replace my job and my bosses job!
UCvOPJGATFQbKTKMjWGX0FOA;@collins1231;AI will bring more jobs. Gates is a scam;2024-04-13T20:44:43Z;0;;AI will bring more jobs. Gates is a scam
UCh48rsA8qr6ige8iYGXkoRQ;@tentimesful;in programing I liked when intellisence gave me by tab to writedown the long method name and also when I write alot of lines to put in a method with the variables names copied to finish that method of the lines i have written to reuse it in other methods again lol is nice.... but my strongest factor is write in google the functions I need in words and voila they bring the methods scrambled but I can copy it and paste it and make it 10 times bigger in the program I need, let alone the programs I wrote to fit in to my program I need by copying paste in another program I need to make with minor adjustments lol... p.s I can read super fast for information I need and exclude false information...;2024-04-13T19:08:35Z;0;;In programing, I liked when intelligence gave me by tab to write down the long method name and also when I write a lot of lines to put in a method with the variables names copied to finish that method of the lines I have written to reuse it in other methods again laugh out loud is nice.... but my strongest factor is written in google the functions I need in words and voilà they bring the methods scrambled, but I can copy it and paste it and make it 10 times bigger in the program I need, let alone the programs I wrote to fit in to my program I need by copying paste in another program I need to make with minor adjustments laugh out loud... p. I can read superfast for information I need and exclude false information...
UCLJFaaJGTbJKIPoAreQO5_Q;@alokrgit123;It will take almost 10 years for AI to replace people plus you need more AI engineers who can develop and train deepmap and neural networks these journalist just show half baked information just one logic they no fear and panic sells good.;2024-04-13T18:51:30Z;0;;It will take almost 10 years for AI to replace people plus you need more AI engineers who can develop and train DeepMap and neural networks this journalist just show half-baked information just one logic they no fear and panic sells good.
UC6xttWeapwUMSO-jJdghLgQ;@princejain8;"AI  mostly gives right answer.<br>But I always agree and support my boss&#39;s decision right or wrong.<br><br>So AI can never replace me.";2024-04-13T16:23:09Z;0;;AI mostly gives right answer. But I always agree and support my boss.decision right or wrong. So AI can never replace me.
UCSx9efuB2EJ15w66zrfxXBQ;@trip_t2122;Also sports;2024-04-24T16:08:05Z;0;UCjlWpSGF5VQRtNQDaCtDDbw;Also sports
UCmu9D15flBTYDzCAkCmXCpg;@MrAnvith1993;I am telling you the world would be a much depressed place where its AI who lack emotions running the world.;2024-04-13T11:06:29Z;0;;I am telling you the world would be a much depressed place where it is AI who lack emotions running the world.
UCXnoV1T2Z-iXdL4yjuqQxOQ;@SapphireTvYt;And farmers;2024-04-13T10:33:15Z;0;;And farmers
UC2V74i3H2VBeOx7UVDUiR_Q;@nageshtagadur;all our jobs are in jeopardy,.. only the bars, redlight areas are safe,.. because the salaries for state government ,... come from there,... during covid,... we have seen it,...!;2024-04-13T09:12:53Z;0;;All our jobs are in jeopardy,. Only the bars, relight areas are safe,. Because the salaries for state government, ... come from there, ... during covid, ... we have seen it, ...!
UCzHLf2targV65N3kjCxVpMw;@ericking2611;Lovemom;2024-04-13T08:45:49Z;0;;Love mom
UCAHE3Yqt5-EEmzKcR4ok0Sw;@tinaing2374;Is your recession Al.proof?;2024-04-13T08:18:17Z;0;;Is your recession Al. Proof?
UCsP_u6jQ-PTXTZ0hXzS4MVQ;@appukuttan3006;I dont think so  it can happen before a year;2024-04-17T04:18:32Z;0;UC7OD5ldvfnQfspSQCuLon1Q;I do not think. It can happen before a year
UCosMi9bvsfSx_ISyriOiadw;@Roushan-xg1dv;"Tm kitna bada bala popat bana rahe hu sab ko kud bhi hu hu ,u don&#39;t know  any thing about al jake saerch kero sky net Nevada chat gtp , copilot , dekhu to aage aage kya huta , aisa lagta tere pass koi bhi basic knowledge  nahi hai ,islia fault ka baat kerta tm i am engineering  itne bade bade you tuber jiske 5 million  subscriber  hai jo dar rahe al se even bo kud codings  kerte hai ,or tm hu ek manah jisko kuch bhi nahi pata hai";2024-04-17T10:34:30Z;0;UC7OD5ldvfnQfspSQCuLon1Q;Tm kidney bad ball Popeye band race HU SAB KO mud BHI hu, you don't know anything about all Jake search hero sky net Nevada chat GTP, copilot, Delhi to aage Kay hut, Asia LEGTA tier pass KOI BHI basic knowledge Nazi HAI, ilia fault key beat Berta TM I am engineering ITN bade YouTuber like 5 million subscriber HAI Jo DAR race all. Even Beau mud codings were HAI, or TM HU EK MANA risk such BHI Nazi data HAI
UC8xEkmLLqjVIAVUX_r_7Rdw;@raishunil5468;India will lead AI revolution in next 3 years. India will rule the AI sector.;2024-04-13T06:32:15Z;0;;India will lead AI revolution in next 3 years. India will rule the AI sector.
UCGiEbolvviNVcFUpnALlmUA;@MededSmith;Cant wait for AI to do my brain surgery;2024-04-13T06:31:42Z;0;;Can not wait for AI to do my brain surgery
UCM8YAiQtw3z5zVDh8JTwaYg;@lelin4732;"Those twerking &quot;fan only&quot; superstars are immune to every AI forever. Mens always suffer it&#39;s an universal fact";2024-04-13T06:23:02Z;0;;Those twerking fan only superstars are immune to every AI forever. Men always suffer it .a universal fact
UCjI37tZjrZ5Up16OvEUKhYw;@ambivertical;The CEO?;2024-04-17T05:04:40Z;0;UCK_0ZwYQYmiKG45OC05lDpg;The CEO?
UClZ2bAePjdJ3Y81cwVAaHOw;@pesgamer00;"This is why I&#39;m learning AI and Machine Learning instead of traditional programming.";2024-04-13T05:56:17Z;0;;This is why I'm learning AI and Machine Learning instead of traditional programming.
UCaRuVFSP1MaMEqPXs1qMN_g;@mithunshet5922;There will be a model in future to create AI models too..;2024-04-13T05:40:00Z;0;;There will be a model in future to create AI models too.
UCiSYCrARGvZ14vK2vouA4zw;@worldnews1545;"Why everyone is crying on ai.  Are you all guys relying on software jobs ? There are 200+ different job titles which pay huge salaries... And why are people very much bothered about ai.. nothing to worry atleast for about 200 years.. because in 1900 tech was so good..  everyone assumed we will do intergalactic travel.. by 2020...  Today my foot.. humans lost creativity.. and creativity is no more... Rules regulations killed everything.... It&#39;s unlikely that ai will be employed everywhere... Soon rules will come to remove ai completely from existence...  History is proof..  all problems are just temporary...";2024-04-13T05:38:42Z;0;;Why everyone is crying on artificial intelligence. Are you all guys relying on software jobs ? There are 200 different job titles which pay huge salaries... And why are people very much bothered about artificial intelligence. Nothing to worry at least for about 200 years. Because in 1900 tech was. Good. Everyone assumed we will do intergalactic travel. By 2020... Today my foot. Humans lost creativity. And creativity is no more... Rules regulations killed everything.... It.unlikely that artificial intelligence will be employed everywhere... Soon rules will come to remove artificial intelligence completely from existence... History is proof. All problems are just temporary...
UClz1ckLGCJ3kT_KgxmuVDCg;@polyteky;can you list some from the 200+;2024-04-13T14:59:18Z;0;UCiSYCrARGvZ14vK2vouA4zw;Can you list some from the 200
UCtMFjxrk9tmCHRi1CsKz54A;@stanleymaxon;As a beginner what do I need to do? How can I invest, on which platform? If you know any please share.;2024-04-13T04:45:38Z;0;UC3DQao8Q94gxF8uREuA8f8w;As a beginner what do I need to do? How can I invest, on which platform? If you know any please share.
UCxQNrXeBUEiLja7lOOB8XAQ;@ashishsharma4853;Pakode yojna;2024-04-13T04:30:47Z;0;;Parade young
UCsJCI0J7YuaaHIA1PytZeCg;@jdsheleg8332;I want to see a drone with AI delivering dog food and water to a front door.;2024-04-13T03:49:14Z;0;;I want to see a drone with AI delivering dog food and water to a front door.
UCUB6baFW4kvLsLzlZ-kp5Ug;@stephanieellison7834;"AI and its Impact on Society<br><br>Oct 31, 2023, updated on April 11, 2024<br><br>We must ask ourselves, &quot;What will happen when AI has taken 85% of jobs present in 2020?  What will we do?  How will we eat and survive without incomes from jobs or other means?&quot;  What is disturbing is that while AI is taking these jobs, the gov&#39;t and the corporations have not done ANYTHING to prepare us for an AI&#39;ed civilization.  They have not said anything about major retraining of an entire economy to something else, and they have not followed up on a discussion of universal basic income.  This is supposedly supported by a lack of information in the latest government budgets submitted and approved as reported by some YouTube videos.<br><br>It appears that the US gov&#39;t and the corporations intend to kill off the majority of Americans passively, through starvation from lack of income to buy food.  (check and see if farming production is declining or will start to decline ahead of the &quot;starvation phase&quot;)  (also check to see if the &quot;makeup&quot; of robot equipment allocation would change to reflect a trend away from retail and services for the masses, possibly indicating an extinction of the American public - this means taking a robot from Chipotle and repurposing it for some other job not related to the public, or scrapping affected robots to be remade for some other purpose that has nothing to do with the public)  It appears that the decline of farming has already started with the state of Maine buying farm land under the pretext that there are &quot;forever chemicals&quot; present at around 20 parts per TRILLION (safe level is said to be only 4 parts per TRILLION), which does not make sense, BUT this would rope in a LOT of land across the US.  Other states may follow suit in addition to the ten states that have similar laws in place.<br><br>This way, there are only enough people alive to get some things done, and the rest is done by AI, and the survivors who planned this can claim the whole country for themselves.  Imagine having an estate mansion half the size of a mall on several dozen thousand acres of land, and robots would be used to maintain and clean the estates and do the farming FOR THE ESTATE OWNERS.  The White Man&#39;s wet dream of civilization.  What will the Native Americans south of the US border do when they see this coming, especially when they can buy firearms legally now?  Hopi prophecy...";2024-04-13T03:31:08Z;0;;AI and it is Impact on Society Oct 31, 2023, updated on April 11, 2024, We must ask ourselves What will happen when AI has taken 85 of jobs present in 2020? What will we do? How will we eat and survive without incomes from jobs or other means? What is disturbing is that while AI is taking these jobs, the gov t and the corporations have not done ANYTHING to prepare us for an AI ed civilization. They have not said anything about major retraining of an entire economy to something else, and they have not followed up on a discussion of universal basic income. This is supposedly supported by a lack of information in the latest government budgets submitted and approved as reported by some YouTube videos. It appears that the US gov t and the corporations intend to kill off the majority of Americans passively, through starvation from lack of income to buy food. Check and see if farming production is declining or will start to decline ahead of the starvation phase also check to see if the makeup of robot equipment allocation would change to reflect a trend away from retail and services for the masses, possibly indicating an extinction of the American public this means taking a robot from Chipotle and repurposing it for some other job not related to the public, or scrapping affected robots to be remade for some other purpose that has nothing to do with the public It appears that the decline of farming has already started with the state of Maine buying farm land under the pretext that there are forever chemicals present at around 20 parts per TRILLION safe level is said to be only 4 parts per TRILLION, which does not make sense, BUT this would rope in a LOT of land across the US. Other states may follow suit in addition to the ten states that have similar laws in place. This way, there are only enough people alive to get some things done, and the rest is done by AI, and the survivors who planned this can claim the whole country for themselves. Imagine having an estate mansion half the size of a mall on several dozen thousand acres of land, and robots would be used to maintain and clean the estates and do the farming FOR THE ESTATE OWNERS. The White Man .wet dream of civilization. What will the Native Americans south of the US border do when they see this coming, especially when they can buy firearms legally now? Hopi prophecy...
UCELaOutJxxyfoHD5gGWauQw;@nishantc9100;Covid made people lazy.  Now AI will make people more lazy.;2024-04-13T02:17:47Z;0;;Covid made people lazy. Now AI will make people more lazy.
