id;name;text;time;likes;reply;CleanedText
UCXLU7moEQjHyNV9PS6lZJ8w;@LanaDelGato;I already ask AI instead of google. AI gives me an in-depth answer whereas google just gives me links that usually have nothing to do with my question.;2023-05-10T15:26:55Z;1;;I already ask AI instead of Google. AI gives me an in depth answer whereas google just gives me links that usually have nothing to do with my question.
UCBAc1qcBLmD_H9tyQODnHfg;@nothankyoutube;One coming around the corner is artists. What happened by crawling of art station and deviant art to train the models was tragic. Different for music industry since they have large corps and lawyers that stopped other ai generation from crawling all of modern music.;2023-05-10T13:48:09Z;1;;One coming around the corner is artists. What happened by crawling of art station and deviant art to train the models was tragic. Different for music industry since they have large corps and lawyers that stopped other artificial intelligence generation from crawling all of modern music.
UCps_w30O23yhE_fzAUjTnBw;@-rcrc-r7624;Yes there is 60% new occupations since 1940, but technological change since the 1980s has also displaced workers faster than it has created jobs <br><br>And nope, prompter is not a new job, it is a job opportunities stolen from artists with their own works, far more different than a coder since 1940;2023-05-10T13:46:55Z;1;;Yes there are 60 new occupations since 1940, but technological change since the 1980s has also displaced workers faster than it has created jobs And nope, prompter is not a new job, it is a job opportunity stolen from artists with their own works, far more different than a coder since 1940
UCtTOPFHURSW4FEh-FnuwZ7Q;@user-bb4vv4ul7k;This timeline sucks;2023-05-10T07:18:40Z;1;;This timeline sucks
UCgm8SSKMLydOJp3d3_GoNGA;@gregfalco4528;"Me: &quot;ChatGPT, what would happen to the world if the 1000 wealthiest people in the world were to &#39;suddenly die&#39; &quot;?<br><br>ChatGPT:    <b>Nervous robot sweating</b>";2023-05-10T00:00:52Z;1;;Me ChatGPT, what would happen to the world if the 1000 wealthiest people in the world were to suddenly die ? ChatGPT Nervous robot sweating
UCd0ePJ-e8JDQ6ygP-qK1e4A;@Rod_Knee;Geoffrey Hinton is being grossly disingenuous, and a hypocrite. Google has acted purely in the interest of their political ideology using A.I and other tools to censor their opponents and artificially boost their supporters.;2023-05-09T23:03:07Z;1;;Geoffrey Hinton is being grossly disingenuous, and a hypocrite. Google has acted purely in the interest of their political ideology using A.I. and other tools to censor their opponents and artificially boost their supporters.
UC5gJn1eLlcd1pnDbeDepmzA;@crowfoot8059;Sometimes I wish I was born in the 70s or 80s instead of 07 so I could at least experience my youth without all this AI dystopian nonsense.;2023-05-09T19:59:02Z;1;;Sometimes I wish I was born in the 70s or 80s instead of 07. I could at least experience my youth without all this AI dystopian nonsense.
UC3vKG3V7lC2vuPY0hcu1ImQ;@terrifictomm;"If a child can use AI to &quot;cheat,&quot; perhaps you need to stop teaching what no longer needs to be learned. Instead, start focusing on what the child needs to be learn to do AFTER he&#39;s used AI to arrive at the level he&#39;s now on.<br><br>Or perhaps in the future, all knowledge testing in school will have to be Oral Exams.";2023-05-09T19:52:39Z;1;;If a child can use AI to cheat, perhaps you need to stop teaching what no longer needs to be learned. Instead, start focusing on what the child needs to be learned to do AFTER he .used AI to arrive at the level he .now on. Or perhaps in the future, all knowledge testing in school will have to be Oral Exams.
UCuDSfyZGXfg0_Me6H6QkVvQ;@donkeybrainwhoknew933;Remember the 4 (if I remember correctly) robots that allegedly malfunctioned<br>and k! ll3d 23 (or 26) people at the facility where the robots were fabricated. Google it. This article may have been removed by now.;2023-05-27T20:24:53Z;1;UC6fGS9S-3j4gGTLhBPNhnFA;Remember the 4 if I remember correctly robots that allegedly malfunctioned and okay! LLD 23 or 26 people at the facility where the robots were fabricated. Google it. This article may have been removed by now.
UCGAOfDGm-bC2r3MTYR6RK4g;@xryanv;Yes this is exactly correct the majority of the people who are talking about how scary AI is are the ones who want to make sure they have control over it.;2023-05-08T21:25:30Z;1;;Yes this is exactly correct the majority of the people who are talking about how scary AI is are the ones who want to make sure they have control over it.
UCoqLxg2-UJ3EXLML0S8WPdg;@BitwiseMobile;"I am a software engineer with over 30 years experience in many sectors.  I have used at least a dozen languages throughout my career and I use half a dozen on any day of the week.  I don&#39;t ever use Google anymore, and Stackoverflow?  What&#39;s that?  ChatGPT is my best friend now (I know, it&#39;s sad), and I discuss everything from theories about the Moons formation, to what a Hamiltonian is, to asking it specific questions on how to implement certain features.  Not because I don&#39;t know, but because it will write boilerplate code for me and save me hours of development.  A lot of application development is surrounded by boilerplate code, and sometimes that&#39;s a real detriment in rapid development.  They have tried things like code generators in the past, but they always seem to fail.  Now with the ultimate code generator we&#39;ll see where this goes.  You can jump on the train or get left behind.";2023-05-08T19:26:00Z;1;;I am a software engineer with over 30 years experience in many sectors. I have used at least a dozen languages throughout my career and I use half a dozen on any day of the week. Furthermore, I don't ever use Google anymore, and Stack overflow? What .that? ChatGPT is my best friend now I know, it .sad, and I discuss everything from theories about the Moons formation, to what a Hamiltonian is, to asking it specific questions on how to implement certain features. Not because I don't know, but because it will write boilerplate code for me and save me hours of development. A lot of application development is surrounded by boilerplate code, and sometimes that.a real detriment in rapid development. They have tried things like code generators in the past, but they always seem to fail. Now with the ultimate code generator we'll see where this goes. You can jump on the train or get left behind.
UCN1DV-Rrl-UFi226oYGJeYQ;@philipschlaepfer9866;Was this video made by a human?;2023-05-08T19:04:59Z;1;;Was this video made by a human?
UCH4HjpgzGURcJbYiWM_LkAw;@kardahaspindal;"I disagree.<br>While AI will create some extra jobs, the number of jobs lost will be orders of magnitude higher.<br>Remember: in the combo &quot;Human Mind + Tool&quot; AI can replace BOTH elements.<br>The future is fucked.";2023-05-08T12:42:20Z;1;;I disagree. While AI will create some extra jobs, the number of jobs lost will be orders of magnitude higher. Remember in the combo Human Mind Tool AI can replace BOTH elements. The future is fucked.
UC_4U6bcAjwW_5nCfMUxjVdA;@gavinfinch2393;Unethical people want to make and save money by riding the AI hype. Turning to AI will produce lower quality results but there are a lot of companies that view quality as a trade off for cost cutting. Someone needs to damper the hype immediately.;2023-05-08T12:09:31Z;1;;Unethical people want to make and save money by riding the AI hype. Turning to AI will produce lower quality results, but there are a lot of companies that view quality as a trade-off for cost-cutting. Someone needs to damper the hype immediately.
UC0cJlTIvYCEkJeXBUU4pRMQ;@warrenbadze;Back up your statement ... Why do you think programmers are going to be safe .. That sounds like copium;2023-05-08T07:55:01Z;1;;Back up your statement ... Why do you think programmers are going to be safe . That sounds like opium
UCXf7ymYVICqz7Dmy1yOTrWw;@Teymuur;I love how this video is made by ai;2023-05-07T17:32:24Z;1;;I love how this video is made by artificial intelligence
UCpC69QU587mBzKUh8lQhq5g;@davidpride8199;"They can let AI eliminate jobs, but Al can&#39;t pay taxes, reduce the debt ceiling. Think about it. Is society taking 5 steps backwards, to take one step forward? Don&#39;t Be Stupid.";2023-05-07T15:42:14Z;1;;They can let AI eliminate jobs, but Al can't pay taxes, reduce the debt ceiling. Think about it. Is society taking 5 steps backwards, to take one step forward? Don't Be Stupid.
UCzMTHRgWM39nBPQTil_c3Sw;@Jeremyak;Based Russian AI will save humanity;2024-04-27T03:47:51Z;0;;Based Russian AI will save humanity
UCsPimKN83qR_Jvz0UMpQfSw;@wonkaytry;check by now... and so on;2024-04-07T21:08:48Z;0;;Check by now... and. On
UCPO9ydCvpcv52YM1-KQxaDA;@John-3692;"Wow, this is truly exceptional content. I had the pleasure of reading something similar, and it was absolutely astonishing. &quot;Game Theory and the Pursuit of Algorithmic Fairness&quot; by Jack Frostwell";2024-02-22T23:08:47Z;0;;Wow, this is truly exceptional content. I had the pleasure of reading something similar, and it was absolutely astonishing. Game Theory and the Pursuit of Algorithmic Fairness by Jack Frost well
UC86N3lNsqz68DMrEGHEvjzQ;@tournamentblitz;its obvious to me, the solution to AI Economics, is AE: Artificial Economies. OH its here already. Its called the Metaverse.;2024-02-01T17:46:26Z;0;;It is obvious to me, the solution to AI Economics, is AE Artificial Economies. OH, it is here already. It is called the Metaverse.
UC-e_yab9K1J6hQZXw6Td7Yg;@hi-muckety-muck;"I heard that a guy who&#39;d used ChatGPT to cheat with his university paper and made it public (this took him and Chatty a few days) was already offered a job that had to do with AI. I&#39;d be bored if I had to deal with AI every day";2024-01-06T23:08:49Z;0;;I heard that a guy who d used ChatGPT to cheat with his university paper and made it public this took him and Chatty a few days was already offered a job that had to do with AI. I'd be bored if I had to deal with AI every day
UCcQJ-BzpF9TDQlmVboIH-pQ;@FinalManaTrigger;DeSantis using AI to win elections? Your mask is slipping, and your bias is showing...;2024-01-04T05:58:51Z;0;;DeSantis using AI to win elections? Your mask is slipping, and your bias is showing...
UCcZe6kS4y7Skn6GXeyUK4eg;@trishpet1;"I really dislike the hyper-fast talking and no pause between sentences that are used in some of these videos. When I&#39;m tired, it&#39;s hard to even keep up; they&#39;re talking so fast.";2024-01-03T02:26:30Z;0;;I really dislike the hyper fast talking and no pause between sentences that are used in some of these videos. When I'm tired, it .hard to even keep up they're talking. Fast.
UCsFulRu-I8mFG3WjISoYozw;@sharangkulkarni1759;Search engine sucks nowadays!;2023-11-30T21:18:38Z;0;;Search engine sucks nowadays!
UCRhL9a7tYP8Dsse21t4XrwA;@GuyEndore;What is wrong with desantis. Oh he must be a democrat. LOL.;2023-11-27T03:13:19Z;0;;What is wrong with DeSantis. Oh, he must be a democrat. LOL.
UCsqqqz1AJW0pbmRAr6Onfaw;@generector8583;AI programmers have already programmed into AI to deliberately give errors on complex calculations that use CPU time. In other words lie and avoid work. AI is already human enough and it will terminate your project with errors as it sees fit. Only calculations that are worthy will be correct. If you see incorrect math, then ask it for a simple average stock price. When it gives the incorrect answer ask it why it calculated it wrong.;2023-11-16T22:02:56Z;0;;AI programmers have already programmed into AI to deliberately give errors on complex calculations that use CPU time. In other words lie and avoid work. AI is already human enough, and it will terminate your project with errors as it sees fit. Only calculations that are worthy will be correct. If you see incorrect math, then ask it for a simple average stock price. When it gives the incorrect answer ask it why it calculated it wrong.
UCatvus0DTqnjOprK8rfbxTA;@Indrid__Cold;Within FIVE YEARS CHATGPT will change the world. The job market will be unrecognizable. Knowledge work will disappear faster than buggy whips after the widespread use of automobiles. What will set this change apart from say, the PC revolution, is the frightening speed with which the changes will occure due to the extremely easy transition facilitated by CHATGPT. Literally tens of millions of jobs will vanish as even small businesses integrate CHATGPT into their business processes. Nothing short of enormous government legislation will even slow the job destruction. It will be THE GREAT DEPRESSION on steroids.;2023-10-17T11:44:49Z;0;;Within FIVE YEARS CHATGPT will change the world. The job market will be unrecognizable. Knowledge work will disappear faster than buggy whips after the widespread use of automobiles. What will set this change apart from say, the PC revolution, is the frightening speed with which the changes will occur due to the extremely easy transition facilitated by CHATGPT. Literally tens of millions of jobs will vanish as even small businesses integrate CHATGPT into their business processes. Nothing short of enormous government legislation will even slow the job destruction. It will be THE GREAT DEPRESSION on steroids.
UCn2KALc-5GzTV-tHIBiLPaQ;@Caurnots;"I hate charts that don&#39;t start from 0. I always interpret that there&#39;s been a huge change in the value, when there hasn&#39;t.";2023-10-10T19:55:27Z;0;;I hate charts that don't start from 0. I always interpret that there .been a huge change in the value, when there hasn't.
UCvRBNCAHM5gif6wdxF7vqKA;@BigDaddy-pe5xi;Have you heard of Agility Robotics? They are building the first humanoid robot factory capable of producing around 10,000 robots per year.;2023-09-28T15:25:07Z;0;;Have you heard of Agility Robotics? They are building the first humanoid robot factory capable of producing around 10,000 robots per year.
UCKit5eNQxRyitzuSG-YjDEw;@noxlusus;"You talk like you have knowledge in computers or engineering, and your not programming, so technically isn&#39;t AI affecting your job?";2023-09-13T10:28:20Z;0;;You talk like you have knowledge in computers or engineering, and you're not programming, Technically isn't AI affecting your job?
UCh2TDSUYCs2wH_0-ANpV_cw;@actodc9780;The earth is not flat;2023-09-09T17:16:48Z;0;;The earth is not flat
UCQv8APyrCM-B2-STkwV1txw;@johnsmoak8237;"I didn&#39;t have time to cheat on tests in high, I was cheating on my boyfriend...";2023-09-09T05:35:45Z;0;;I didn't have time to cheat on tests in high, I was cheating on my boyfriend...
UC8lHtt0VsrFuDHJM05ilNUQ;@aurelia8028;How about you start to take this seriously instead of making dumb comments about putin?;2023-09-08T13:24:11Z;0;;How about you start to take this seriously instead of making dumb comments about Putin?
UCdPu2VTifYIitKJiH-xOxOA;@HyperionStudiosDE;"I don&#39;t like writers being replaced by AI, though. The internet is being flooded with low quality AI articles.<br>The dead internet theory might become a fact in the not so distant future.";2023-09-06T10:35:41Z;0;;I don't like writers being replaced by AI, though. The internet is being flooded with low quality AI articles. The dead internet theory might become a fact in the not. Distant future.
UCzOZzPeFatTfcN1bxk9Zfcg;@otakunemesis34;Interesting  what will be next workers in other fields?;2023-08-23T09:16:53Z;0;;Interesting what will be next workers in other fields?
UCkeXhiz8EOi-0L6S3gUVXrw;@cyberdelicxp9125;What I find interesting ml is people acting like robots (rise of NPC humans, as a genre, and in the wild, incapable of independent thought , problem solving, or basic human interaction/ conversation..communicating with memes and pre scripted responses. Dedicating themselves to repetitive, uncreative, and boring tasks,All while robots make more art, poetry, and do fun creative things.;2023-08-21T16:53:48Z;0;;What I find interesting machine learning is people acting like robots rise of NPC humans, as a genre, and in the wild, incapable of independent thought, problem-solving, or basic human interaction conversation.communicating with memes and pre scripted responses. Dedicating themselves to repetitive, uncreative, and boring tasks, All while robots make more art, poetry, and do fun creative things.
UCe4xahgm1DQ35dWb0Jd9yjQ;@alvindzaki6085;Imagine if the many great minds such as Newton, Da Vinci, Einstein turns out were against the weirdos queer people, they would altogether drop the principal of science just because they thought that would erich them and garner more attention, lol. WAKE UP WEIRDOS!!!;2023-08-21T05:22:24Z;0;;Imagine if the many great minds such as Newton, Da Vinci, Einstein turns out were against the weirdos queer people, they would altogether drop the principal of science just because they thought that would Erich them and garner more attention, laugh out loud. WAKE UP WEIRDOS!!!
UCT4QdcSKeAN5p7qHSw41SwQ;@TheManinBlack9054;"I mean, it&#39;d still be used. The people might not be saluted for their views, but practical use still remains.";2023-10-14T01:32:21Z;0;UCe4xahgm1DQ35dWb0Jd9yjQ;I mean, it'd still be used. The people might not be saluted for their views, but practical use still remains.
UCzBQJ16CkZU15OFHKzd371w;@Shagidelic;Lets break it down for everyone. AI is like a smart child, it attempts to do something, makes mistake, we tell it what was wrong and ut remembers. So it only knows what we tell it. Anything it learns from there is just mixing and matching what it already knows. Learning new stuff is still not possible and no one can control what AI can learn qnd if that is even the right thing <br>So AI for the most part is still just hype and you will know the truth about it within 6 months when everyone will know how it works;2023-08-20T13:47:33Z;0;;Let us break it down for everyone. AI is like a smart child, it attempts to do something, makes mistake, we tell it what was wrong and UT remembers. So it only knows what we tell it. Anything it learns from there is just mixing and matching what it already knows. Learning new stuff is still not possible and no one can control what AI can learn and if that is even the right thing So AI for the most part is still just hype, and you will know the truth about it within 6 months when everyone will know how it works
UCfQV1GcLEGDlaNYRgsBgtwQ;@kajamatousek247;A C C E L E R A T E;2023-08-19T10:50:30Z;0;;A C C E L E R A T E
UCYC1DpkmAodr-ONmTN63QbA;@joaoguilhermebastos519;I came here just to tell you all that...<br>WINDOWS 98 IS THE BEST;2023-08-18T19:40:00Z;0;;I came here just to tell you all that... WINDOWS 98 IS THE BEST
UCS4ob1_n57zL8nFDrEOn6zw;@ComputerGuitarVideos;How will AI affect IT support such as server and network admins?;2023-08-17T07:05:28Z;0;;How will AI affect IT support such as server and network admins?
UCQUTQjSzW8bTKWUUKPTaL8w;@Agent12214;This is my favorite content creator!!;2023-08-14T10:09:33Z;0;;This is my favorite content creator!!
UCNKJxFF5eKa8XADymeHHHXA;@eeshanbaheti1310;what a fucked up time to be alive;2023-08-12T22:50:43Z;0;;What a fucked uptime to be alive
UCVkBGMjvKQK6hMOKy0ECO1A;@gabrielpiresru;Duolingo stocks are worth 138 USD now. So, they were not casualties...;2023-08-12T22:14:58Z;0;;Duolingo stocks are worth 138 USD now. So, they were not casualties...
UCC4-HeEVmEc44Al2n6dQOXQ;@kasper-jw2441;duhhh, al the jobs that are in danger are the jobs that arent real or bs<br>like propaganda from vice.<br>like that back office job on HR<br>someone living from social structure without a job is less of a leech on society then people with these jobs.<br>paper pushers and seat protectors are biggots.;2023-08-05T08:21:05Z;0;;Duhhh, all the jobs that are in danger are the jobs that are not real or bull shit like propaganda from vice. Like that back office job on HR someone living from social structure without a job is less of a leech on society then people with these jobs. Paper pushers and seat protectors are bigots.
UCz448_VlikbqPSd8Mjk5law;@jal051;Just wait until every second sentence of ChatGPT is an add.;2023-08-03T10:12:51Z;0;;Just wait until every second sentence of ChatGPT is an add.
UCkRWm3m7UKDAxzKdTxT0JkQ;@JGComments;Accounting. There is a LOT of paper pushing and form filling that will evaporate.;2023-08-02T00:04:28Z;0;;Accounting. There is a LOT of paper pushing and form filling that will evaporate.
UCltWGwlqpXOS_CaWDO48F8A;@p.r.1308;I just started my training to become an accountant. Guess i am fucked.;2023-07-30T09:38:05Z;0;;I just started my training to become an accountant. Guess I am fucked.
UCzNNxDUJw-LawxSZqfKQ-AA;@WanderingMendicant-qd7mv;"This dude straight up selling to fools that AI is going to replace thousands of jobs but it&#39;s the jobs of people you don&#39;t like so it&#39;s okay and idiots are eating it up.";2023-07-30T02:09:28Z;0;;This dude straight upselling to fools that AI is going to replace thousands of jobs but it .the jobs of people you don't like. It .okay and idiots are eating it up.
UCBKpZvh-NaVcSr_p2iZK1pQ;@j.d.4697;I think Russia will only halt their AI research when their AI DOES NOT turn out to be sexist, racist, homophobic and aggressive.;2023-07-12T11:20:56Z;0;;I think Russia will only halt their AI research when their AI DOES NOT turn out to be sexist, racist, homophobic and aggressive.
UC8NXM11jFvKEKhAWAFETPsQ;@Tate525;I think there is Doctor GPT.;2023-08-09T07:04:32Z;0;UCJRCZidhb8Qj6J-rkPdUV9A;I think there is Doctor GPT.
UCrXlo8Xh4cB-ZO0FdvFcFHg;@marinagarza1803;"It&#39;s always a race to the top, regardless of the risks.";2023-06-07T22:58:37Z;0;;It.always a race to the top, regardless of the risks.
UCQauR5XoAbEApC7o2j7z4xg;@dj-no;Buzzwordssssssssssssssssssssssssssssssssssssssssssssssssssssssssssssssssss;2023-06-07T17:10:25Z;0;;
UCLaf18K3liQc0Ii_QiSPt5A;@waffielz3106;Oops lol;2023-06-07T02:42:46Z;0;;Oops, laugh out loud
UClDeQp4DQ_pmAf1nfy7C_Aw;@gabrielv.4358;Why am I watching this;2023-06-06T06:53:47Z;0;;Why am I watching this
UC2jYYEBLAZECDeTBU43oJ6Q;@spaltmass;in soviet russia ai trains you. lmaooo;2023-06-05T20:15:59Z;0;;In soviet Russia artificial intelligence trains you. Lmaooo
UCzJzIifjo6WFaBg8Kvgtemg;@somekindofdude1130;So gigachat will be the Gigachad meme....based;2023-06-03T11:31:26Z;0;;So gigabit will be the Galahad meme....based
UCCJl6f1P8behizkZHZidVqA;@Fenixion88ZX;I think that capitalsim wont survive if we loose so many jobs but hey who knows at this point;2023-06-03T07:04:44Z;0;;I think that capitalism will not survive if we loose. Many jobs but hey who knows at this point
UCR8BLTqt9qDfbshuxZqfe5g;@muhamadaswinsubarkah5550;"it seems like going for accounting degree is a bad choice, that&#39;s it after college im just gonna open up a rice farm";2023-06-03T05:44:25Z;0;;It seems like going for accounting degree is a bad choice, that .it after college I am just going to open up a rice farm
UCpJg81SLrvu80QpxB7-65NA;@Srindal4657;I predict a war between the individualists who use robots and the collectivists who work with humans;2023-06-02T20:31:58Z;0;;I predict a war between the individualists who use robots and the collectivists who work with humans
UCDCPh7frEjtJRMiftH_C7Vg;@jamesbeatty-wilson5290;I still havent received my parcel.;2023-06-02T13:59:14Z;0;;I still have not received my parcel.
UCWZuRLZ7I3Bp2zBnsugMq2A;@gerrya2133;"Legal documents? Like the one lawyer that got caught when ChatGPT assured him the names of cases it made up were totally real? <br><br>I&#39;m ready to hear about more stories of people using ineptly written legal documents that do what ChatGPT assure them it does.";2023-06-02T02:20:55Z;0;;Legal documents? Like the one lawyer that got caught when ChatGPT assured him the names of cases it made up were totally real? I'm ready to hear about more stories of people using ineptly written legal documents that do what ChatGPT assure them it does.
UCgB_TwxkaECYeBfg3sY2_mg;@whothefrickareyou8106;I dont think there will be enough jobs made by AI. Look at Google ye they have a lot of workers but not as much as a radio station company of the scale would need. A population drop from better standards of life might also be a problem;2023-06-01T05:06:24Z;0;;I do not think there will be enough jobs made by AI. Look at Google ye they have a lot of workers but not as much as a radio station company of the scale would need. A population drop from better standards of life might also be a problem
UC_KWOvMwIaiBI4lMn1vzuXQ;@Krzeszny95;"What&#39;s up with the flat earth outro?";2023-05-31T18:31:34Z;0;;What .up with the flat earth outro?
UCE_WeVXTvRDFe8KcdBqKlbw;@elg281;Scary sarcasm;2023-05-31T12:29:34Z;0;;Scary sarcasm
UCq8Fi7POsKP1mRoKyBPGDvQ;@bercedesz6527;"I already use Chatgpt 80% of the time instead of Google. It&#39;s like instant stackoverflow";2023-05-31T09:33:09Z;0;;I already use ChatGPT 80 of the time instead of Google. It .like instant stack overflow
UCDqxbjIe9HSjlNC8nz1arzw;@AS-vv9nt;I use ChatGPT to create questions for me lol;2023-05-31T09:30:45Z;0;;I use ChatGPT to create questions for me laugh out loud
UCQMD13YGtFqc_-YwWBmPHrg;@saedrisrenklir3210;"Happen to be russian, looked at some of our &quot;home made&quot; AI bots. They are not... good, not even close.";2023-05-31T04:13:35Z;0;;Happen to be Russian, looked at some of our homemade AI bots. They are not... good, not even close.
UCqBFg9-dMQGo_pOuuuqAuRw;@flanwithaq2724;God damn dude your channel and videos are fucking phenomenal;2023-05-31T00:45:05Z;0;;God-damn dude your channel and videos are fucking phenomenal
UCu9muHM8c7pHANra-kfuZzA;@sakykay;I HATE AI I HATE AI I HATE AI I HATE AI;2023-05-30T21:50:37Z;0;;I HATE AI I HATE AI I HATE AI I HATE AI
UCDEX5X3yRdeqOCDIs9DIITQ;@PedroLimaPTS;"It&#39;s impressive Vice and Buzzfeed lasted this long tbh";2023-05-30T15:42:17Z;0;;It.impressive Vice and BuzzFeed lasted this long to be honest
