id;name;text;time;likes;reply;CleanedText;ProcessText;SentimentScore;ActualLabel
UCjZDWIImx0LkygTlXIRJqLg;@zo1dberg;Not sure why companies need CEOs for with this technology.;2024-03-11T11:17:01Z;0;;Not sure why companies need CEOs for with this technology.;not sure company need ceo technology;-0.5860000252723694;Negative
UC4OjWKjFlomMz7XDvBTzy8Q;@mrpadrezeus9529;Is not fair, the AI should be a tool for us, the developers, not for the companies to lay off us and we start struggling even more. AI is a tool from devs to do our life easier, not to make the companies get more profits and start making our life even harder looking for a job, this is not going to end well. The people have good thoughts about this, but the companies only want more profits...;2024-03-09T15:58:31Z;0;;Is not fair, the AI should be a tool for us, the developers, not for the companies to lay off us and we start struggling even more. AI is a tool from devs to do our life easier, not to make the companies get more profit is and start making our life even harder looking for a job, this is not going to end well. The people have good thoughts about this, but the companies only want more profit is...;not fair ai tool developer not company lay start struggle even ai tool devs life easier not make company get profit start make life even hard look job not go end well people good thought company want profit;-0.5820000171661377;Negative
UCj9OGrHs5HF5HBgQA59fY7Q;@user-ju3eo3rj9h;Ai might be taking over. But it will not last because of one word…R E P R E S E N T A T I V E!!!;2024-03-07T23:05:20Z;0;;Ai might be taking over. But it will not last because of one word R E P R E S E N T A T I V E!!!;ai take not last word r e p r e e n v e;-0.6899999976158142;Negative
UCHmaB8BNeamASrhbyKNmabQ;@198-rx;A paradox is that the AI works more than humans. 🤔;2024-03-07T21:35:42Z;0;;A paradox is that the AI works more than humans.;paradox ai work human;0.23399999737739563;Negative
UCkk2lS4gILocQOzWobDfAqQ;@AF-hh2ph;"Its just crazy how there are people who are developing something to make humans themselves obsolete. Technology meets with capitalism to enrich the lives of a few at the expense of the many. The next 5-10 years are going to be a scary time, as the divide between the lower and upper classes moves farther and farther apart with the complete eradication of the middle class. As humans themselves become obsolete in the workforce, so will human rights. This is real. We&#39;re looking down the barrel of the de-evolution of our society because very few want to automate very basic human actions such as creativity and judgment. But also our voices and faces now as well.. how and where does it end? We need to think, how will AI enrich the value of humans to other humans? The answer is: IT WILL DO THE OPPOSITE! The solution? Boycott software automation of all kinds and fear AI with your life.";2024-03-05T22:56:14Z;0;;It is just crazy how there are people who are developing something to make humans themselves obsolete. Technology meets with capitalism to enrich the lives of a few at the expense of the many. The next 5 10 years are going to be a scary time, as the divide between the lower and upper classes moves farther and farther apart with the complete eradication of the middle class. As humans themselves become obsolete in the workforce, Will human rights. This is real. We re looking down the barrel of the devolution of our society because very few want to automate very basic human actions such as creativity and judgment. But also our voices and faces now as well. How and where does it end? We need to think, how will AI enrich the value of humans to other humans? The answer is IT WILL DO THE OPPOSITE! The solution? Boycott software automation of all kinds and fear AI with your life.;crazy people develop something make human obsolete technology meet capitalism enrich life expense many next year go scary time divide low upper class move farther far apart complete eradication middle class human become obsolete workforce human right real look barrel devolution society want automate basic human action creativity judgment also voice face well end need think ai enrich value human human answer opposite solution boycott software automation kind fear ai life;-0.4230000078678131;Negative
UCHA87db7TH1_HaI6kdd_1YA;@JJSeattle;"Desk jobs are the assembly workers of 1950&#39;s, then came automation 😮";2024-03-05T15:59:35Z;0;;Desk jobs are the assembly workers of 1950 , then came automation;desk job assembly worker come automation;-0.10000000149011612;Negative
UCG3uHX1QGtUM4TgwRpidr0g;@dennis.teevee;AI is nothing but a flash in the pan FAD  ☠️💩😈🤡🤣😂🤦🤦‍♂️;2024-03-05T11:07:59Z;0;;AI is nothing but a flash in the pan FAD;ai nothing flash pan fad;-0.8870000243186951;Negative
UCk52qSNJjjo9ftWT4LKrsZA;@ALifeAfterLayoff;You cannot be serious with this comment.;2024-03-05T15:58:24Z;0;UCG3uHX1QGtUM4TgwRpidr0g;You can not be serious with this comment.;not serious comment;-0.8460000157356262;Negative
UC5rp1e1l8EQCiU5oanqwggA;@censoredeveryday3320;Yes my IT job was eliminated by automation and outsourcing to India.;2024-03-04T08:18:07Z;0;;Yes my IT job was eliminated by automation and outsourcing to India.;job eliminate automation outsource india;-0.6830000281333923;Negative
UCUJhKO1KhtD23uyOnOKr-og;@noudjoumbenabid3378;Thanks for this very important video. I agree with you on every point. I have seen myself some code written by AI, that was sold to my previous company for the price of as a human made it. And it was the worst code I’ve ever seen. It never worked lol😊;2024-03-04T06:26:31Z;0;;Thanks for this very important video. I agree with you on every point. I have seen myself some code written by AI, that was sold to my previous company for the price of as a human made it. And it was the worst code I have ever seen. It never worked laugh out loud;thanks important video agree point see code write ai sell previous company price human make bad code ever see never work loud;-0.03799999877810478;Negative
UCsNcyJ_a-GlcaPimpMt0i_w;@yoyo-ue5pf;I make the AI, so i am good lol;2024-03-03T20:04:57Z;0;;I make the AI, I am good laugh out loud;make ai good laugh loud;0.9520000219345093;Positive
UCC2-yMJUTNX_OCJpTraZwIg;@mattanderson6672;"Defund the government, stop paying tax<br>The can&#39;t put us all in prison<br><br>Thanks";2024-03-03T11:33:19Z;0;;Defund the government, stop paying tax The can not put us all in prison Thanks;government stop pay tax not put prison thanks;-0.8149999976158142;Negative
UCl-pfPRzv9R7YPnOTT7n7pQ;@mx0x0;AI cant eliminate jobs..companies eliminate jobs.;2024-03-02T02:04:06Z;0;;AI can not eliminate jobs.companies eliminate jobs.;ai not eliminate jobs.companies eliminate job;-0.6169999837875366;Negative
UCP3mMuNSUhfqeEv6XMRebsQ;@herp_derpingson;ChatGPT can definitely understand transferable skills. Try it on your resume.;2024-03-01T22:38:16Z;0;;ChatGPT can definitely understand transferable skills. Try it on your resume.;chatgpt definitely understand transferable skill try resume;0.8040000200271606;Positive
UCQCkMdtapXM7u5qGLGo1W5w;@Liurika;"It makes me thinks probably in order to protect the viability of the economy, companies will have to pay a kind of &quot;permit&quot; to use AI so all those people who just won&#39;t be able to work in anything get any kind of living wage 🤔 what would be another alternative? Go back to the countryside and live off our land?";2024-03-01T12:28:24Z;0;;It makes me thinks probably in order to protect the viability of the economy, companies will have to pay a kind of permit to use AI. All those people who just will not be able to work in anything get any kind of living wage what would be another alternative? Go back to the countryside and live off our land?;make think probably order protect viability economy company pay kind permit use ai people not able work anything get kind living wage alternative go back countryside live land;-0.6769999861717224;Negative
UCOlwIWhuGxzrGx1m_gdG3ww;@sarakesten5352;What about a crisis counselor, therapist, or a nurse?? What do you think??;2024-03-01T04:10:21Z;0;;What about a crisis counselor, therapist, or a nurse?? What do you think??;crisis counselor therapist nurse think;-0.32499998807907104;Negative
UCR0Ia-WqQn27OxEAb6Bq9Pw;@manumusa9224;"Most of those jobs blacks are working at,  will be eliminated by AI, plus they&#39;ll be laid off whether in a union job or not";2024-02-29T21:10:18Z;0;;Most of those jobs blacks are working at, will be eliminated by AI, plus they ll be laid off whether in a union job or not;job black work eliminate ai lay union job not;-0.9070000052452087;Negative
UCFeZztUJTMoHt4AzdGNgV4g;@SDVGUY;The work industry where you have to spend more than 8 hours to make a living... Gone.;2024-02-29T07:38:50Z;0;;The work industry where you have to spend more than 8 hours to make a living... Gone.;work industry spend hour make living go;-0.6370000243186951;Negative
UCyxmLKdc_zsnW1xBsshV4ig;@rafnicdao9283;"No, AI can&#39;t write working code most of the time. They probably get 70% there so you still need someone who understands code to fix the mistakes";2024-02-29T02:02:23Z;0;;No, AI can not write working code most of the time. They probably get 70 there. You still need someone who understands code to fix the mistakes;ai not write work code time probably get still need someone understand code fix mistake;-0.527999997138977;Negative
UCk52qSNJjjo9ftWT4LKrsZA;@ALifeAfterLayoff;Then companies will say they can reduce their coding workforce by 70%.;2024-02-29T03:12:19Z;0;UCyxmLKdc_zsnW1xBsshV4ig;Then companies will say they can reduce their coding workforce by 70 .;company say reduce coding workforce;0.06700000166893005;Negative
UCpAMGIfBV7xocDqiC7xrzwA;@zaviusfirerave;Good. No more technologically challenged crazy old women in HR;2024-02-29T00:46:26Z;0;;Good. No more  challenged crazy old women in HR;good challenged crazy old woman hr;0.15700000524520874;Negative
UCv4dZ_NHdwwO7Cn2CsVs8yA;@joemangune;I am A.I.;2024-02-28T22:49:03Z;0;;I am A.I.;a.i;0.00800000037997961;Negative
UC_Serq0m0_gT9L7kR2uFoTQ;@Astral_Dusk;"AI: I&#39;ll just do everything you lazy humans.<br><br>Humans: Hey! .. I helped";2024-02-28T22:34:45Z;0;;AI I ll just do everything you lazy humans. Humans Hey! . I helped;ai everything lazy human human hey help;-0.17499999701976776;Negative
UCr1jbrydOJ3-cYj4DF2lH-A;@RichardDambrosi;AI coming for my job really AI whats to be laid off;2024-02-28T22:24:18Z;0;;AI coming for my job really AI what is to be laid off;ai come job really ai lay;-0.34700000286102295;Negative
UCxg1MOT3J1aVk8ihdaRQWUQ;@theteleisewilliamsexperience;Im a diesel Mechanic 🤷🏾‍♀️;2024-02-28T22:10:23Z;0;;I am a diesel Mechanic;diesel mechanic;0.003000000026077032;Negative
UCBus_sgPC017LKH67mgIoOw;@mecuniverse3042;"Ai will take many jobs   company don&#39;t care as they wanna save money as much possible.Future is coming that we have to fight with computer.";2024-02-28T21:43:41Z;0;;Ai will take many jobs company do not care as they want to save money as much possible. Future is coming that we have to fight with computer.;ai take many job company not care want save money much possible future come fight computer;-0.6740000247955322;Negative
UCQ5gkM4nM3qLMGv1YG5hoCg;@johnmorris4347;Honestly, this is scary.;2024-02-28T19:29:11Z;0;;Honestly, this is scary.;honestly scary;-0.9300000071525574;Negative
UCygU8gq24bxX35_OenmJGCw;@2flight;"Look outside. That&#39;s reality out there.";2024-02-28T15:51:26Z;0;;Look outside. That .reality out there.;look .reality;0.0;Negative
UCxJt8ocEPxvKjINq39BZ0yQ;@krzysztofgie7936;AI tools are not creating clean code. We are not here yet;2024-02-28T10:45:13Z;0;;AI tools are not creating clean code. We are not here yet;ai tool not create clean code not yet;-0.4169999957084656;Negative
UCZ83CMIFEAtOxbxkz9iaYyg;@dan-cj1rr;but chat gpt is not agi;2024-02-28T00:28:55Z;0;;But ChatGPT is not AGI;chatgpt not agi;-0.1940000057220459;Negative
UCwX496KeryxazQ5-v9L9qOQ;@mardigrasqueenofthesouth8847;ya some insight into roles NOT eliminated would have been helpful;2024-02-28T00:28:05Z;0;;Ya some insight into roles NOT eliminated would have been helpful;insight role not eliminate helpful;-0.8560000061988831;Negative
UC82I_wPCZ22b88VdnUWt_oQ;@dailyweathertoronto6275;Why giant tech companies are doing this? What is hapenning?<br>Answer 1: blah blah blah, AI, <br>Answer 2: because they being told to do so. It is according to the plan.;2024-02-27T19:59:42Z;0;;Why giant tech companies are doing this? What is hapenning? Answer 1 blah blah blah, AI, Answer 2 because they being told to do . It is according to the plan.;giant tech company hapenning answer blah blah blah ai answer tell accord plan;-0.07199999690055847;Negative
UCyg-rkHUOBkek7kPMsZS7oA;@HOLLYWOODFAKERS;Maybe if we we replace teachers we might get some literacy coming out of high schools- and college.;2024-02-27T04:40:34Z;0;;Maybe if we replace teachers we might get some literacy coming out of high schools and college.;maybe replace teacher get literacy come high school college;0.006000000052154064;Negative
UCf7hNImShgh_J3Y5psj_BiA;@ezonlinegaming;AIs replacing programmers is wrong. Although AI can produce clean code - its only efficient at creating code snippets, not whole - functional systems that still needs to be built based from specific client needs. At most - it can only serve as a tool for programmers to build more complex systems.;2024-02-27T03:03:38Z;0;;AIs replacing programmers is wrong. Although AI can produce clean code it is only efficient at creating code snippets, not whole functional systems that still needs to be built based from specific client needs. At most it can only serve as a tool for programmers to build more complex systems.;ai replace programmer wrong ai produce clean code efficient create code snippet not whole functional system still need build base specific client need serve tool programmer build complex system;-0.4650000035762787;Negative
UCU_R_5g0XdA0jkxMnwGZszA;@rembautimes8808;Look forward to hearing from the perspective of a photographer how AI generated videos fare vs real ones.;2024-02-26T23:25:43Z;0;;Look forward to hearing from the perspective of a photographer how AI generated videos fare vs real ones.;look forward hear perspective photographer ai generate video fare vs real one;0.25600001215934753;Negative
UC4_fBjvs7EB3dwp4mTsewGQ;@112313;"The people who got afraid of AI, are probably the same ppl many other people says aren&#39;t doing much to justify their job. I mean, if a fast food worker can be effectively taken over by a kiosk, well....<br><br>Also HR getting replaced by AI...gee.... who would have thought?<br><br>With the advent of new technologies, it is inevitable that some jobs will become obsolete. The challenge for you is to make a job for yourself that is not easily replaced.";2024-02-26T23:03:23Z;0;;The people who got afraid of AI, are probably the our people many other people say are not doing much to justify their job. I mean, if a fast food worker can be effectively taken over by a kiosk, well.... Also HR getting replaced by AI...gee.... who would have thought? With the advent of new technologies, it is inevitable that some jobs will become obsolete. The challenge for you is to make a job for yourself that is not easily replaced.;people get afraid ai probably people many people say not much justify job mean fast food worker effectively take kiosk well .... also hr get replace ai gee .... think advent new technology inevitable job become obsolete challenge make job not easily replace;-0.3100000023841858;Negative
UC4_fBjvs7EB3dwp4mTsewGQ;@112313;So, basically, these window knockers are out of a job? So, what is the problem?;2024-02-26T22:54:11Z;0;;So, basically, these window knockers are out of a job? So, what is the problem?;basically window knocker job problem;-0.6010000109672546;Negative
UCk52qSNJjjo9ftWT4LKrsZA;@ALifeAfterLayoff;I’m sorry to hear that!  Did they directly say it was due to Ai?;2024-02-26T22:23:12Z;0;UCUNBONmGiqLY2LXHZstXGcA;I am sorry to hear that! Did they directly say it was due to Ai?;sorry hear directly say due ai;-0.40700000524520874;Negative
UCEOIf9oNAlWYL4qXsZBbLsQ;@patrykplaskaty43;"So who&#39;ll buy the stuff that companies produce, if the workforce will be replaced by AI?<br>Ads are worthless if they don&#39;t sell the product.";2024-02-26T21:40:57Z;0;;So who ll buy the stuff that companies produce, if the workforce will be replaced by AI? Ads are worthless if they do not sell the product.;buy stuff company produce workforce replace ai ad worthless not sell product;-0.6940000057220459;Negative
UCag7IhSD25PJpyffwGdmN8w;@loubydal7812;"@@ALifeAfterLayoff By the way I find it&#39;s a great and very helpful channel. One way or another we all have gone through these situations. Thanks for your support.";2024-02-26T21:15:23Z;0;UCag7IhSD25PJpyffwGdmN8w;By the way I find it .a great and very helpful channel. One way or another we all have gone through these situations. Thanks for your support.;way find .a great helpful channel way go situation thanks support;0.4399999976158142;Negative
UCkuWzI-bA_-TealBW6-u6dA;@Drforbin941;Are you people ever going to get off the AI Hype band wagon !;2024-02-26T17:37:55Z;0;;Are you people ever going to get off the AI Hype bandwagon !;people ever go get ai hype bandwagon;-0.828000009059906;Negative
UCk52qSNJjjo9ftWT4LKrsZA;@ALifeAfterLayoff;Head in sand, my friend.;2024-02-26T19:05:32Z;0;UCkuWzI-bA_-TealBW6-u6dA;Head in sand, my friend.;head sand friend;-0.2460000067949295;Negative
UCkuWzI-bA_-TealBW6-u6dA;@Drforbin941;"@@ALifeAfterLayoffFirst of all. your not not my friend. Your nothing but a con artist Recruiter trying to make a living on youtube because you know what racket recruiting is. 2nd I have a MS in computer science and have worked is this field forever. I also do ALOT of investing and have seen the ELON&#39;s come and go. So your the one with your head in the sand. Go buy some hyperloop, or better yet buy nvidia.";2024-02-26T19:12:20Z;0;UCkuWzI-bA_-TealBW6-u6dA;Of all. you are not my friend. Your nothing but a con artist Recruiter trying to make a living on YouTube because you know what racket recruiting is. 2nd I have an MS in computer science and have worked is this field forever. I also do LOT of investing and have seen the ELON .come and go. So you are the one with your head in the sand. Go buy some Hyperloop, or better yet buy NVIDIA.;not friend nothing con artist recruiter try make living youtube know racket recruiting nd computer science work field forever also lot invest see elon .come go head sand go buy hyperloop good yet buy nvidia;-0.289000004529953;Negative
UCSWZCa_sMM5sH0YZ_TZoK3w;@SiimKoger;We are literally going to have human VS machine war before the end of this century unless UBI or something similar is put in place.;2024-02-26T17:05:32Z;0;;We are literally going to have human VS machine war before the end of this century unless FBI or something similar is put in place.;literally go human vs machine war end century fbi something similar put place;-0.9210000038146973;Negative
UCXbB-Na31F80U-lq1oSKVYw;@claudiajay8291;But someone has to know how to use AI…;2024-02-26T17:04:40Z;0;;But someone has to know how to use AI;someone know use ai;-0.014000000432133675;Negative
UCopL7JV_L7PGt62MfVfQxhQ;@quantumhype9839;"Time for UBI.<br>Can&#39;t have all the added profits from reducing payrolls only going to the top execs.";2024-02-26T14:37:35Z;0;;Time for FBI. Can't have all the added profit is from reducing payrolls only going to the top execs.;time fbi n't added profit reduce payroll go top exec;-0.5600000023841858;Negative
UCRXiiSMyRFYizGFzZDo62uA;@legionofboombap4705;"The surprised face in the thumbnail?! C&#39;mon man, you&#39;re better than this.";2024-02-26T14:34:02Z;0;;The surprised face in the thumbnail?! C Mon man, you re better than this.;surprised face thumbnail c mon man good;0.20000000298023224;Negative
UCnVjpbgZxcEX6tJyJuNWsZA;@bartell20j;Teachers may be replaced by a monitor.  Children are too unruly to be left to just an AI. A human needs to be present;2024-02-26T13:36:44Z;0;;Teachers may be replaced by a monitor. Children are too unruly to be left to just an AI. A human needs to be present;teacher replace monitor child unruly leave ai human need present;-0.2800000011920929;Negative
UCumcxx56L3RBh02fq_HmRKA;@joshuakaeble7810;"I don&#39;t care about starving, being unemployed, poor or AI destroying the universe and killing all of us in the most brutal way possible.  The only thing I gotta know is:  Where the HELL do you get your sweaters?!?!";2024-02-26T05:11:36Z;0;;I do not care about starving, being unemployed, poor or AI destroying the universe and killing all of us in the most brutal way possible. The only thing I have to know is Where the HELL do you get your sweaters?!?!;not care starving unemployed poor ai destroy universe kill brutal way possible thing know hell get sweater;-0.4490000009536743;Negative
UClDrLzcnpjaUG_HFPxi6EIA;@el8243;To summarized they removed human.. hahaha lets see what will be the future.. good luck human!;2024-02-26T03:54:09Z;0;;To summarized they removed human. Hahaha let us see what will be the future. Good luck human!;summarize remove human hahaha let see future good luck human;0.335999995470047;Negative
UCoOCSHlIsrlab6rJZPNHXhw;@Paula-sw2tt;Wonder how it will affect the mental health field in particular Clinical Case Managers?;2024-02-26T00:49:51Z;0;;Wonder how it will affect the mental health field in particular Clinical Case Managers?;wonder affect mental health field particular clinical case manager;-0.06300000101327896;Negative
UCkty4AQ7dQM1dwqBfRvjYHg;@Oldspartan65;They can have mine if A.I had my job it would cry electronic tears;2024-02-25T22:37:33Z;0;;They can have mine if A.I. had my job it would cry electronic tears;mine a.i job cry electronic tear;-0.5820000171661377;Negative
UCrDHPhwqo25SF097ZzDyT2w;@ronjcharity;AI the terminator of jobs :) before companies can automate they need a detailed understanding of what they are automating. Most are CMMI 0 - all tacit.;2024-02-25T20:04:36Z;0;;AI the terminator of jobs before companies can automate they need a detailed understanding of what they are automating. Most are CMI 0 all tacit.;terminator job company automate need detailed understanding automate cmi tacit;-0.009999999776482582;Negative
UCeK6_cRiTYM3sFzZlK9eZog;@stephthestar90;"I think that a lot of office-based jobs will be largely gone by the end of the decade, but sectors which require human input such as teaching and healthcare will be safe.  On the other hand the rise of AI could create new jobs that don&#39;t exist now";2024-02-25T19:03:15Z;0;;I think that a lot of office based jobs will be largely gone by the end of the decade, but sectors which require human input such as teaching and healthcare will be safe. On the other hand the rise of AI could create new jobs that do not exist now;think lot office base job largely go end decade sector require human input teaching healthcare safe hand rise ai create new job not exist;0.16300000250339508;Negative
UCCrF8PiFjvfpfKRpTgRfnSg;@MeaHeaR;ÕMĞ é PôWéŘ-PhÛľĽ;2024-02-25T18:12:53Z;0;;M P W pH;p w ph;-0.0020000000949949026;Negative
UCRZe1-Ue95-hGcGoFUq-snQ;@RemoteJobsWorldwide;💙💙💙💙💙💙💙💙💙💙💙💙💙;2024-02-25T16:35:53Z;0;;;;0.0;Negative
UC6MQ5B4CyiUC_8ITk1QBt_Q;@malhalsey4994;Google is cracking down on AI generated content on websites. So don’t write out copywriting, especially for niches you specialize in! 😉;2024-02-25T16:26:08Z;0;;Google is cracking down on AI generated content on websites. So do not write out copywriting, especially for niches you specialize in!;google crack ai generate content website not write copywriting especially niche specialize;-0.5230000019073486;Negative
UCk8Gnqjv5Ldd44n1rw3fFYA;@SampaosLim510;I work in a warehouse. End of story;2024-02-25T15:19:19Z;0;;I work in a warehouse. End of story;work warehouse end story;-0.13199999928474426;Negative
UCH7qYGGcvlzN5Aq8XDqAG2w;@adiaz1182;"Im so glad im a janitor. AI can&#39;t mop the floor.";2024-02-25T15:14:39Z;0;;I am . Glad I am a janitor. AI can not mop the floor.;glad janitor ai not mop floor;-0.057999998331069946;Negative
UCA-GkL-Ti_j5ZBa-M2gvc0A;@Stovetopcookie;Manual jobs.  Construction.  Assembly.;2024-02-25T14:24:52Z;0;;Manual jobs. Construction. Assembly.;manual job construction assembly;-0.007000000216066837;Negative
UCNwaR2njjoHdgF3YANF62yw;@SanityIsland;Who needs jobs when you have despotic government?;2024-02-25T11:47:09Z;0;;Who needs jobs when you have despotic government?;need job despotic government;-0.9409999847412109;Negative
UC9UagiB72VoL4_wQT_N8BBw;@fieldsofgold775;Oh what a shame. A photographic model is going to have to get a real job 😂. <br>I think 🤔 maybe health care careers maybe a solid career path.;2024-02-25T11:42:05Z;0;;Oh, what a shame. A photographic model is going to have to get a real job . I think maybe health care careers maybe a solid career path.;shame photographic model go get real job think maybe health care career maybe solid career path;-0.3700000047683716;Negative
UCW7Pybs104hhPARqxxF1CJQ;@MargaretCampbell583;If people are displaced then who will buy the goods;2024-02-25T05:38:17Z;0;;If people are displaced then who will buy the goods;people displace buy good;-0.5889999866485596;Negative
UCW7Pybs104hhPARqxxF1CJQ;@MargaretCampbell583;I do think AI will come for a lot of jobs one has to be realistic;2024-02-25T05:13:28Z;0;;I do think AI will come for a lot of jobs one has to be realistic;think ai come lot job realistic;0.12800000607967377;Negative
