id;name;text;time;likes;reply;CleanedText;ProcessText;SentimentScore;ActualLabel
UC_llQ-KYWuAtXAH7ge_LcCg;@riffmondo9733;Oh a former hedge fund manager who sell AI?<br><br>Now I see why he is so full of it.;2024-04-05T14:01:41Z;0;;Oh, a former hedge fund manager who sell AI? Now I see why he is. Full of it.;former hedge fund manager sell ai see full;0.2709999978542328;Negative
UCAfFjFxWQuMoE8CLUkJOHbg;@Qpublishing09;Tom Biliyew? Who is he?;2024-04-05T00:54:20Z;0;;Tom Bilayer? Who is he?;tom bilayer;-0.0020000000949949026;Negative
UCAfFjFxWQuMoE8CLUkJOHbg;@Qpublishing09;Who is this guy?;2024-04-05T00:53:50Z;0;;Who is this guy?;guy;-0.04800000041723251;Negative
UCAfFjFxWQuMoE8CLUkJOHbg;@Qpublishing09;These people are no body;2024-04-05T00:53:23Z;0;;These people are nobody;people nobody;-0.8799999952316284;Negative
UCTXB2tHhh_uVmMEaoZ6Kuug;@aspcia;Love this, thank you.  I remember having my son on scratch in kindergarten thinking it could help him as he got older .... eh. Lol.   I think addressing basic resources is important, too.  Water, food, etc.;2024-04-05T00:41:35Z;0;;Love this, thank you. I remember having my son on scratch in kindergarten thinking it could help him as he got older .... eh. laughing out loud. I think addressing basic resources is important, too. Water, food, etc.;love thank remember son scratch kindergarten think help get old .... eh laugh loud think address basic resource important water food;0.3009999990463257;Negative
UC_NPMSKJStVNsn6Npd4mfNA;@Venusanddiamonds;You killing real art soul with ai;2024-04-22T13:59:35Z;0;UCDPHcGNt3jqocwnvXLRfaWg;You are killing real art soul with AI;kill real art soul ai;-0.8190000057220459;Negative
UCgVp-_0YJkOzMF03bLPK_ow;@mitch3745;Amazing thank you for the behind the scenes!;2024-04-04T03:26:53Z;0;;Amazing thank you for the behind the scenes!;amaze thank behind scene;0.9549999833106995;Positive
UCXi53KsyH3px8f6VN-Qrrew;@myautodidacticism;"I think art will be fine because no matter what people are always going to seek out something made by another person because that sense of connection is what&#39;s important with art.";2024-04-04T03:01:45Z;0;;I think art will be fine because no matter what people are always going to seek out something made by another person because that sense of connection is what .important with art.;think art fine matter people always go seek something make person sense connection .important art;0.3930000066757202;Negative
UC6uo1nyZZzNI6afS_eW37bw;@apcook34;Who will buy goods if no one has a job.?;2024-04-04T02:23:08Z;0;;Who will buy goods if no one has a job.?;buy good one job;-0.39800000190734863;Negative
UCctPGIRXi8Kw1pq1Zb01Cug;@mjs1231;All bs, not needed and is pure societal cancer;2024-03-31T22:40:26Z;0;;All bull shit, not needed and is pure societal cancer;bull shit not need pure societal cancer;-0.9129999876022339;Negative
UCp3wUwgAF3W4Uu6KE-UyPNw;@goldfishi5776;Praeceptum primum#1 You cannot stop the advancement of technology.<br>#2 Government is no more or less trustworthy than society as a whole.;2024-03-29T14:59:20Z;0;;Precept primum 1 You can not stop the advancement of technology. 2 Government is no more or less trustworthy than society as a whole.;primum not stop advancement technology government less trustworthy society whole;-0.19599999487400055;Negative
UCqDxBvKNU2FxlgaiqfPO4Mg;@ShowMeWhatINeedToKnow;Agree.  People are freaking out too much.;2024-04-25T03:18:50Z;0;UCVvTmHrdpBHnbw8Xy_Y9ybg;Agree. People are freaking out too much.;agree people freak much;-0.38199999928474426;Negative
UCZCyKwZKbiBOwrBSdHv3svQ;@franzliszt4257;"What is going to happen if Putin takes Ukraine. With the population largely against being part of Russia and Russia having zero inhibition to use anything to suppress them they will use technology to suppress them. On top of what they are going to use (rape, torture, murder) they could apply AI to fight the Ukrainians and manipulate Western opinion. <br>Russia may not be alone, but the timing is very much in Russia&#39;s favor unless the West reacts. <br>AI in the hands of ruthless actors is a huge threat to mankind.";2024-03-17T16:54:50Z;0;;What is going to happen if Putin takes Ukraine. With the population largely against being part of Russia and Russia having zero inhibition to use anything to suppress them they will use technology to suppress them. On top of what they are going to use rape, torture, murder they could apply AI to fight the Ukrainians and manipulate Western opinion. Russia may not be alone, but the timing is very much in Russia .favor unless the West reacts. AI in the hands of ruthless actors is a huge threat to mankind.;go happen putin take ukraine population largely part russia russia inhibition use anything suppress use technology suppress top go use rape torture murder apply ai fight ukrainian manipulate western opinion russia not alone timing much russia .favor west react ai hand ruthless actor huge threat mankind;-0.7850000262260437;Negative
UCbwEic0XkyYyQ6V6SnwQMbA;@4amsid;this was incredible! 🙏;2024-03-16T15:31:32Z;0;;This was incredible!;incredible;0.9290000200271606;Positive
UCsJIDDfJ0nQjBDT44PsdX8A;@ArtofWEZ;The problem is even the top the AI chain the CEO or entrepreneur is better run by an ai. Where is the meaning when the most human part is best done by AI?;2024-03-16T00:59:02Z;0;;The problem is even the top the AI chain the CEO or entrepreneur is better run by an AI. Where is the meaning when the most human part is best done by AI?;problem even top ai chain ceo entrepreneur well run ai meaning human part best ai;-0.6309999823570251;Negative
UC1dBis1MKrCpwshs1f4Cnvw;@parish-royaltyadventure5881;We are in the middle of the greatest story ever told, and its bigger than AI which is what is artificial intelligence in contrast to conscious intelligence.;2024-03-15T05:13:26Z;0;;We are in the middle of the greatest story ever told, and it is bigger than AI which is what is artificial intelligence in contrast to conscious intelligence.;middle great story ever tell big ai artificial intelligence contrast conscious intelligence;0.7590000033378601;Positive
UC1dBis1MKrCpwshs1f4Cnvw;@parish-royaltyadventure5881;Saturation points - too much information cant be absorbed and it becomes meaningless. When an algorithm picks up on your interest, and then blasts you with advertisements it actually becomes a turnoff. So its a failure I would say.;2024-03-15T04:54:56Z;0;;Saturation points too much information can not be absorbed and it becomes meaningless. When an algorithm picks up on your interest, and then blasts you with advertisements it actually becomes a turnoff. So it is a failure I would say.;saturation point much information not absorb become meaningless algorithm pick interest blast advertisement actually become turnoff failure say;-0.8669999837875366;Negative
UC1dBis1MKrCpwshs1f4Cnvw;@parish-royaltyadventure5881;Yes, I want to be involved in the conversation. AI with consciousness. Reset with Consciousness. That is the path that even nikola tesla promoted.;2024-03-15T04:52:54Z;0;;Yes, I want to be involved in the conversation. AI with consciousness. Reset with Consciousness. That is the path that even Nikola Tesla promoted.;want involve conversation ai consciousness reset consciousness path even nikola tesla promote;0.18799999356269836;Negative
UCvU0EaH8_lvZbpEdi0D6yBg;@johnadams3800;"The preoccupation with the concern for profits over the concern for the general well being of the collective has always been the Achille&#39;s heel of the human condition, stopping is from ascending to greater modalities of social structuring.  AI as a tool will be used to further this preoccupation,  doubtless.  It&#39;s tragic that human intelligence routinely and geometrically outpaces human wisdom.";2024-03-14T11:56:19Z;0;;The preoccupation with the concern for profit is over the concern for the general well being of the collective has always been the Achilles .heel of the human condition, stopping is from ascending to greater modalities of social structuring. AI as a tool will be used to further this preoccupation, doubtless. It .tragic that human intelligence routinely and geometrically outpaces human wisdom.;preoccupation concern profit concern general well collective always achilles .heel human condition stop ascend great modality social structuring ai tool use far preoccupation doubtless .tragic human intelligence routinely geometrically outpaces human wisdom;-0.46299999952316284;Negative
UCj9f-y3VezPB4hvAcwpcISw;@murdock3829;Im going to master python and dedicate my life to AI.;2024-03-14T01:23:03Z;0;;I am going to master python and dedicate my life to AI.;go master python dedicate life ai;0.7900000214576721;Positive
UCSNOEhPDxKh_ARyait-42Pg;@picketf;"Ai still halucinating all the time..I tell ChatGPT to give me a list of 25 famous people born at a specific date; I check and about half is not born on that date. I ask when a specific person from that list is born it gives me a new date, I then ask why it gave me the wrong date of birth and it proceeds to correct to yet another, a third date of birth. I then ask at what age Nobunaga Oda, the unifier of Japan, died and it gives me the obvious false age, while at the same time mentioning his date of birth and date of death. If it can&#39;t even do basic math, I really find it hard to believe in the benefit.";2024-03-13T20:29:25Z;0;;Ai still hallucinating all the time. I tell ChatGPT to give me a list of 25 famous people born at a specific date I check and about half is not born on that date. I ask when a specific person from that list is born it gives me a new date, I then ask why it gave me the wrong date of birth, and it proceeds to correct to yet another, a third date of birth. Furthermore, I then ask at what age Nonage Odd, the unifier of Japan, died, and it gives me the obvious false age, while at the our time mentioning his date of birth and date of death. If it can not even do basic math, I really find it hard to believe in the benefit.;ai still hallucinate time tell chatgpt give list famous people bear specific date check half not bear date ask specific person list bear give new date ask give wrong date birth proceed correct yet third date birth furthermore ask age nonage odd unifier japan die give obvious false age time mention date birth date death not even basic math really find hard believe benefit;-0.777999997138977;Negative
UCNev-n87r5zqYodRg0xkfSg;@alfiecooke7322;Wonderful conversation from A fabulously knowledgeable guest.  More people in charge of AI as Emad.. Genius with a polymath level scope on his explanations. Brilliant analogies..;2024-03-12T22:31:53Z;0;;Wonderful conversation from A fabulously knowledgeable guest. More people in charge of AI as Mad. Genius with a polymath level scope on his explanations. Brilliant analogies.;wonderful conversation fabulously knowledgeable guest people charge ai mad genius polymath level scope explanation brilliant analogy;0.5130000114440918;Positive
UC6ysr5dBv_DQO1KnAnx0rag;@briancordero7674;We are brainwashed to cheer for the heroes who make us the losers. The Indians cheer for the cowboys. We vote in our own disinterest in hope of being better than we are , committing suicide in the process.;2024-03-12T04:56:18Z;0;;We are brainwashed to cheer for the heroes who make us the losers. The Indians cheer for the cowboys. We vote in our own disinterest in hope of being better than we are, committing suicide in the process.;brainwash cheer hero make loser indian cheer cowboy vote disinterest hope good commit suicide process;-0.4399999976158142;Negative
UCZ0l4L1vl4Hoz5xFjjDQGzQ;@katiecox8128;I should have watched this sooner;2024-03-12T02:15:24Z;0;;I should have watched this sooner;watch sooner;0.9610000252723694;Positive
UCo3j_4kopE7F2-Fxd7973HQ;@DeclanRyanRising;Im already asking chat gpt 4 how I can prepare myself to advance in motion pictures under this new shift. And it told me how.  Crazy shit.;2024-03-10T23:21:45Z;0;;I am already asking ChatGPT 4 how I can prepare myself to advance in motion pictures under this new shift. And it told me how. Crazy shit.;already ask chatgpt prepare advance motion picture new shift tell crazy shit;0.03799999877810478;Negative
UCoDgyoXVYzcSPjjrlRihXdw;@enzymfx;what did it tell you?;2024-03-11T15:58:58Z;0;UCo3j_4kopE7F2-Fxd7973HQ;What did it tell you?;tell;0.0;Negative
UC2LXc6I_dEe3Clsq2LXHJ1g;@sebastianb.1926;soul is more than pattern. human beings are not automatons.;2024-03-09T16:53:31Z;0;;Soul is more than pattern. Human beings are not automatons.;soul pattern human not automaton;0.06599999964237213;Negative
UCB5wgcDuQkQ_1iWyU59K2Hg;@sam-ww1wk;Checking in 7 months later, when AI has tripled in capabilities.;2024-03-08T21:35:56Z;0;;Checking in 7 months later, when AI has tripled in capabilities.;check month later ai triple capability;0.39500001072883606;Negative
UCPDjbjhzaAjo0noC8oRauUg;@MrPodgikins;"The idea that AI can write code is ridiculous.  We are a decade away from that minimum.  <br><br>It augments it, but not replace.  When they train AI models, they actually don&#39;t fully know how the new version will behave";2024-03-07T19:47:59Z;0;;The idea that AI can write code is ridiculous. We are a decade away from that minimum. It augments it, but not replace. When they train AI models, they actually do not fully know how the new version will behave;idea ai write code ridiculous decade away minimum augment not replace train ai model actually not fully know new version behave;-0.35499998927116394;Negative
UC0RVwcj7MXx6UlHqi4g6aFg;@benox50;Actually makes me happy to be asexual;2024-03-07T18:30:40Z;0;;Actually makes me happy to be asexual;actually make happy asexual;0.9470000267028809;Positive
UCsHncdzVMe8wpD6p1gAW-6Q;@CorinneIsIn;Humans are about to discover what a marvel we truly are. Mark my words.;2024-03-07T15:31:11Z;0;;Humans are about to discover what a marvel we truly are. Mark my words.;human discover marvel truly mark word;0.4740000069141388;Positive
UC9umVpWg2srIhdVtivDjklw;@DanielDwire;We should use AI to replace unempathetic, creatively bankrupt entrepreneurs;2024-03-07T10:15:33Z;0;;We should use AI to replace unsympathetic, creatively bankrupt entrepreneurs;use ai replace unsympathetic creatively bankrupt entrepreneur;-0.6209999918937683;Negative
UCxWU7PU91di2YYYovweoqUA;@deePark_;This host is beyond annoying. There are gems dripping out of his guests mouth, and he keeps interrupting with inane soliloquy.;2024-03-05T20:22:43Z;0;;This host is beyond annoying. There are gems dripping out of his guests mouth, and he keeps interrupting with inane soliloquy.;host annoy gem drip guest mouth keep interrupt inane soliloquy;-0.8450000286102295;Negative
UCVehPqXgHLpl0OTGeib21Bg;@patriciareilly530;"Can  AI  be hooked up to holograms?   We could have Taylor do her Eras tour in our own living rooms.  I&#39;m 81 years old  trying to get the hang of these new things.  The YouTube algorithm sent this to me.";2024-03-05T13:58:23Z;0;;Can AI be hooked up to holograms? We could have Taylor do her Eras tour in our own living rooms. I m 81 years old trying to get the hang of these new things. The YouTube algorithm sent this to me.;ai hook holograms taylor eras tour living room year old try get hang new thing youtube algorithm send;0.1340000033378601;Negative
UCp_AoABxZUy1ciFqyEN4NSQ;@saviolicious5;"Watching this today 04/03/2024. You&#39;ll be happy to know the world has not collapsed. Gloom and doom unfortunately gets you views on you tube but doesn&#39;t reflect reality. Responsible AI will catalyze the effectiveness of people";2024-03-05T07:17:41Z;0;;Watching this today 04 03 2024. You ll be happy to know the world has not collapsed. Gloom and doom unfortunately gets you views on YouTube but does not reflect reality. Responsible AI will catalyze the effectiveness of people;watch today happy know world not collapse gloom doom unfortunately get view youtube not reflect reality responsible ai catalyze effectiveness people;0.26100000739097595;Negative
UCfcU_iQqqLLlvfkLlRfhnEg;@blackmontony;"Please have him back as a monthly guest, because all of this stuff if moving so fast. Im an artist/sculptor, and I wished there was an episode dedicated to &quot;how creatives could use it to keep up&quot;...aritists, sculptors, writers, designers, singers, dancers etc. I heard that one guy set up his camera and used it to help him get better at yoga because it used vision to tell him whenever he was off with a pose.";2024-03-04T03:23:15Z;0;;Please have him back as a monthly guest, because all of this stuff if moving. Fast. I am an artist sculptor, and I wished there was an episode dedicated to how creatives could use it to keep up ...artists, sculptors, writers, designers, singers, dancers etc. I heard that one guy set up his camera and used it to help him get better at yoga because it used vision to tell him whenever he was off with a pose.;please back monthly guest stuff move fast artist sculptor wish episode dedicate creatives use keep artist sculptor writer designer singer dancer etc hear guy set camera use help get good yoga use vision tell whenever pose;0.5659999847412109;Positive
UCRm3ZRKqcATfDO0HwWb_Gdg;@Gordo022059;Wow he nailed me I’m 65 now you’ll prob find me under a rock , seriously tho, very informative;2024-03-04T01:43:46Z;0;;Wow, he nailed me I am 65 now you will prob find me under a rock, seriously though, very informative;wow nail prob find rock seriously informative;0.9269999861717224;Positive
UCCyjpaqAED_kL668N6yyzRg;@Adam-qs5ir;"Although everyone can take pictures with their cell phones...that doesn&#39;t mean the pictures vs real cameras are better";2024-03-03T21:58:10Z;0;;Although everyone can take pictures with their cell phones...that does not mean the pictures vs real cameras are better;everyone take picture cell phone not mean picture vs real camera well;-0.289000004529953;Negative
UCCyjpaqAED_kL668N6yyzRg;@Adam-qs5ir;"So...anybody may be able to program in the future...but a programmer will know how to put out good product, even if they&#39;re using ai";2024-03-03T21:58:59Z;0;UCCyjpaqAED_kL668N6yyzRg;So...anybody may be able to program in the future...but a programmer will know how to put out good product, even if they re using AI;anybody able program future programmer know put good product even use ai;0.20999999344348907;Negative
UCZaZz49xRYanqqrMAuiN_BQ;@carldavies6132;Long but very interesting;2024-03-03T21:35:22Z;0;;Long but very interesting;long interesting;0.1509999930858612;Negative
UCA2Ih4vw0t2npRs9z-s9yGg;@bobwallace9364;Hasn’t anyone ever seen blade runner? I swear we can’t take a hint when it smacks us right across our stupid faces from directly in front of us. For all our intelligence and all our creativity we are absolute morons.;2024-03-03T19:25:20Z;0;;Hasn't anyone ever seen Blade Runner? I swear we can not take a hint when it smacks us right across our stupid faces from directly in front of us. For all our intelligence and all our creativity we are absolute morons.;n't anyone ever see blade runner swear not take hint smack right stupid face directly front intelligence creativity absolute moron;-0.5899999737739563;Negative
UCA2Ih4vw0t2npRs9z-s9yGg;@bobwallace9364;Government is lagging behind so far because they are more concerned with their power grabbing games that they are about addressing real issues. If the regulation of AI technology depends on government then we’re all already doomed. The general consensus is that people accept that government’s job is to play political games and rarely fix problems or address looming issues. Everyone just accepts that.;2024-03-03T19:19:29Z;0;;Government is lagging behind. Far because they are more concerned with their power grabbing games that they are about addressing real issues. If the regulation of AI technology depends on government then we are all already doomed. The consensus is that people accept that government .job is to play political games and rarely fix problems or address looming issues. Everyone just accepts that.;government lag far concerned power grab game address real issue regulation ai technology depend government already doom consensus people accept government .job play political game rarely fix problem address loom issue everyone accept;-0.6349999904632568;Negative
UCA2Ih4vw0t2npRs9z-s9yGg;@bobwallace9364;Here it comes… humanity’s descent into madness. AI won’t destroy us. We’ll destroy each other BECAUSE of AI.;2024-03-03T18:50:43Z;0;;Here it comes humanity.descent into madness. AI will not destroy us. We will destroy each other BECAUSE of AI.;come humanity.descent madness ai not destroy destroy ai;-0.18000000715255737;Negative
UC9Mbstrb1s-2hYmfR3zFEeA;@zufdhig;"What did he mean with &quot;the Tom Hanks and the NBA made it real&quot;?";2024-03-02T22:55:24Z;0;;What did he mean with the Tom Hanks and the NBA made it real ?;mean tom hank nba make real;-0.003000000026077032;Negative
UCVtEFTQsQuQ9TOI7cxgHFOQ;@Stephenzaffarano;"Huge concern:  how will the criminally minded utilize AI to achieve their agendas?  Even if the majority of people were expected to use AI for benefit and profit, what&#39;s to stop criminals from using AI to lure children, launder money, steal digitized currency, etc. and what would that then &#39;teach&#39; the AI, that it might adapt for it&#39;s own agenda?";2024-03-02T16:16:46Z;0;;Huge concern how will the criminally minded utilize AI to achieve their agendas? Even if the majority of people were expected to use AI for benefit and profit, what .to stop criminals from using AI to lure children, launder money, steal digitized currency, etc. and what would that then teach the AI, that it might adapt for it .own agenda?;huge concern criminally mind utilize ai achieve agenda even majority people expect use ai benefit profit .to stop criminal use ai lure child launder money steal digitized currency teach ai adapt .own agenda;-0.5920000076293945;Negative
UCVtEFTQsQuQ9TOI7cxgHFOQ;@Stephenzaffarano;10.5 million incarcerated criminals, btw....world wide.;2024-03-02T16:17:56Z;0;UCVtEFTQsQuQ9TOI7cxgHFOQ;10.5 million incarcerated criminals, by the way....worldwide.;incarcerated criminal way .... worldwide;-0.3070000112056732;Negative
UCkHWKwaJNxXZyqXSKDtA2OA;@Sonieta03.;Overpopulation is a huge mistake in some countries that still have the old system of having children to have workers;2024-03-02T13:08:58Z;0;;Overpopulation is a huge mistake in some countries that still have the old system of having children to have workers;overpopulation huge mistake country still old system child worker;-0.9150000214576721;Negative
UCXYS1zcQtYBoKccao4i2PKw;@djmclencio;Well... This guy is a total joke... I really recommend you all to watch what Yuval Noah Harari  says...;2024-03-01T21:44:01Z;0;;Well... This guy is a total joke... I really recommend you all to watch what Yuval Noah Harari says...;well guy total joke really recommend watch yuval noah harari say;-0.004999999888241291;Negative
UCQdsG2-bjRLoXZrKMZKgQTw;@premsontakke2298;He has small hands;2024-03-01T15:51:41Z;0;;He has small hands;small hand;-0.14100000262260437;Negative
UCZioKwztH6jXc5C_rd8SOlw;@Douchebagus;But 5 times your intelligence;2024-03-01T20:56:54Z;0;UCQdsG2-bjRLoXZrKMZKgQTw;But 5 times your intelligence;time intelligence;0.4350000023841858;Negative
UCQdsG2-bjRLoXZrKMZKgQTw;@premsontakke2298;​@@Douchebagus 5 times...ok....but still infinitely more than you;2024-03-02T18:25:21Z;0;UCQdsG2-bjRLoXZrKMZKgQTw;5 times...ok....but still infinitely more than you;time ok .... still infinitely;0.17800000309944153;Negative
UC5AgDGbP9JPIpgf7vQoJhtg;;"AI art will never be art, because it is not an expression of human mind. But the point still valid, the big industrie doesn&#39;t care about art.";2024-03-01T11:41:08Z;0;;AI art will never be art, because it is not an expression of human mind. But the point still valid, the big industries does not care about art.;ai art never art not expression human mind point still valid big industry not care art;-0.875;Negative
UCC7_4auXZtCUIp1vZK12leQ;@pstubeing;What chat gpt 4 app should I use?;2024-02-29T18:50:15Z;0;;What ChatGPT 4 apps should I use?;chatgpt apps use;0.00800000037997961;Negative
UCMr2AkIoM0L0qhrw--M4qxw;@palnagok1720;Since the govt prints money, why are we paying tax ?;2024-02-29T10:06:28Z;0;;Since the govt prints money, why are we paying tax ?;govt print money pay tax;-0.7760000228881836;Negative
UCkhCrbQkU8hWjJawkwShMQg;@user-cy3td2tg3i;One day;2024-02-29T03:53:15Z;0;;One day;day;0.01899999938905239;Negative
UCcDox40Bu5M3honp8umYZwA;@ililoiyfhjjiiilllgenfjf2015;PLEASE YOUR HUMAN OVER LORD ??????????????????WTF;2024-02-29T03:09:14Z;0;;PLEASE YOUR HUMAN OVER LORD ??????????????????what the fuck;please human lord fuck;-0.652999997138977;Negative
UCcDox40Bu5M3honp8umYZwA;@ililoiyfhjjiiilllgenfjf2015;Alein 100%;2024-02-29T02:38:50Z;0;;Alan 100;alan;0.012000000104308128;Negative
UCUy_-MMZ4DcpiIj6k9Q6Vew;@Tranquil_Hobby;guy thinks blockchain can solve these problems 😂😂😂;2024-02-29T01:52:57Z;0;;Guy thinks blockchain can solve these problems;guy think blockchain solve problem;0.5289999842643738;Positive
UCmfT_b5mnlLfenfOabj000Q;@CloudEconomicsUS;"The centrifuge didn&#39;t explode. Instead it wore out to the point where it was no longer usable.";2024-02-28T23:53:38Z;0;;The centrifuge did not explode. Instead, it wore out to the point where it was no longer usable.;centrifuge not explode instead wear point no longer usable;-0.24300000071525574;Negative
UCrq36J_9yKHFY7LBsKgL3_A;@Pingsmingu;Wow now they are saying 3 years;2024-02-27T00:35:44Z;0;;Wow, now they are saying 3 years;wow say year;-0.5370000004768372;Negative
UCkfVRx84M6zwJm9cYBoTaVw;@rogermortimer111;😂😂😂 So EVERYONE hated GOT8. 😂😂😂 love it.;2024-02-26T14:52:56Z;0;;So EVERYONE hated GOT8. Love it.;everyone hat get love;0.014000000432133675;Negative
