id;name;text;time;likes;reply;CleanedText;ProcessText;SentimentScore;ActualLabel
UC4X8W1tI8hy23xC_3M4U5Ag;@flickwtchr;"Surprise surprise, DW pushes another propagandist for the 1% who are mostly sociopaths, and who couldn&#39;t give less than a flying __ck how many of the &quot;little people&quot; lose their jobs is pushing this utterly baseless claim that a bunch of jobs will be created to replace those lost, with just a few % points difference.  I despise these super wealthy jerks.";2023-05-04T08:56:09Z;1;;Surprise, DW pushes another propagandist for the 1 who are mostly sociopaths, and who could not give less than a flying __ck how many of the little people lose their jobs is pushing this utterly baseless claim that a bunch of jobs will be created to replace those lost, with just a few points difference. I despise these super wealthy jerks.;surprise dw push propagandist mostly sociopaths not give less fly __ck many little people lose job push utterly baseless claim bunch job create replace lose point difference despise super wealthy jerk;-0.906000018119812;Negative
UCLMC9AI6sjr2wW_F9MoTK_A;@JPD147;Didnt it say in the same article that AI will create 97 million new jobs?;2023-05-05T08:55:07Z;1;UCReO3ahc_ZLIO-d8slh34MQ;Didn't it says in the our article that AI will create 97 million new jobs?;n't say article ai create new job;0.11800000071525574;Negative
UCbf3TOm2TTYDMQC2sc7BVYA;@A-M4;@@JPD147 69 million.;2023-05-07T15:23:59Z;1;UCReO3ahc_ZLIO-d8slh34MQ;69 million.;;0.008999999612569809;Negative
UCIwKbqWH48vHf-QvRqmyx0Q;@josephvanname3377;All you crackpots are still completely oblivious to reversible computing!;2023-05-03T19:24:32Z;1;;All you crackpots are still completely oblivious to reversible computing!;crackpot still completely oblivious reversible computing;-0.8619999885559082;Negative
UCbnjIgMg90Ipi_8SXwdaAnQ;@benwindbag;"First: millions of jobs will disappear.<br>Second: later, millions of Humans will disappear.<br>Simple, isn&#39;t it?";2023-05-03T17:40:40Z;1;;First millions of jobs will disappear. Second later, millions of Humans will disappear. Simple, is not it?;first million job disappear second later million human disappear simple not;-0.5759999752044678;Negative
UClCGUqrbVtRaO1B3ViB_kLg;@kikiryki;"Every ex-employee will carry food with his back just to survive. No retirement, no pension plan, nothing. <br>Economic UBER_isation for most of us, that&#39;s the future.";2023-05-03T16:03:11Z;1;;Every ex employee will carry food with his back just to survive. No retirement, no pension plan, nothing. Economic UBER_station for most of us, that .the future.;ex employee carry food back survive retirement pension plan nothing economic uber_station .the future;-0.28700000047683716;Negative
UC1Lv9PZiV49hAWflvqGb-3Q;@Recuper8;If your job is a job you will be replaced by advanced technology.;2023-05-08T04:34:27Z;1;UCNp8BNh-ysg83-wCbn0qc1Q;If your job is a job you will be replaced by advanced technology.;job job replace advanced technology;-0.3490000069141388;Negative
UCDd9Z1IZG1XPRlcRWyTFCoQ;@bobdavis3357;To be more realistic, 300 million jobs will vanish because of AI;2023-05-03T14:12:39Z;1;;To be more realistic, 300 million jobs will vanish because of AI;realistic job vanish ai;-0.902999997138977;Negative
UCgKWXZPZeREVrXF_Rdywb2w;@lyndakorner2383;Anyone who uses the technological unemployment of the past to predict the future job market in a world with artificial intelligence is an utter fool.;2023-05-03T14:10:52Z;1;;Anyone who uses the technological unemployment of the past to predict the future job market in a world with artificial intelligence is an utter fool.;anyone use technological unemployment past predict future job market world artificial intelligence utter fool;-0.8980000019073486;Negative
UCgKWXZPZeREVrXF_Rdywb2w;@lyndakorner2383;Machines have been able to supplant many low-skill workers in the past, but an artificial intelligence can now perform as well, if not better, than a human in many intellectual and creative tasks.;2023-05-03T14:12:44Z;1;UCgKWXZPZeREVrXF_Rdywb2w;Machines have been able to supplant many low skill workers in the past, but an artificial intelligence can now perform as well, if not better, than a human in many intellectual and creative tasks.;machine able supplant many low skill worker past artificial intelligence perform well not well human many intellectual creative task;0.7599999904632568;Positive
UCzk5RZb2HLYyBWkHZVSIjZw;@ericc.3464;Women choosing to quit jobs and tend to home life isn’t “losing more” necessarily, right?<br><br>It could even be a wise and privileged choice for some.<br><br>At least in the US, it’s seems to all be voluntary so far.;2023-05-03T04:03:26Z;1;;Women choosing to quit jobs and tend to home life is not losing more necessarily, right? It could even be a wise and privileged choice for some. At least in the US, it.seems to all be voluntary. Far.;woman choose quit job tend home life not lose necessarily right even wise privileged choice least it.seems voluntary far;0.2540000081062317;Negative
UC5uKFokB4H2xFCC-aqg-EbQ;@faribakayyod8761;🕊Not millions, but  billions 🕊;2023-05-03T00:53:19Z;1;;Not millions, but billions;not million billion;0.04100000113248825;Negative
UCrhyzOQIdk29-Yy7ZA96I0A;@gunasekaran7290;You nailed it... Same thoughts for me too;2023-05-03T06:27:48Z;1;UCHZ31JdkCuX2jZXdn3evkzA;You nailed it... Same thoughts for me too;nail thought;0.453000009059906;Positive
UCSEWzpQLf_KSMNgU_xmie7w;@specialagentzeus;There may come a point where humans must possess a high level of intelligence in order to compete in various job sectors. This could potentially lead to the enactment of a law that requires gene enhancement to occur during the in vitro stage of human development.;2023-05-02T22:26:09Z;1;;There may come a point where humans must possess a high level of intelligence in order to compete in various job sectors. This could potentially lead to the enactment of a law that requires gene enhancement to occur during the in vitro stage of human development.;come point human possess high level intelligence order compete various job sector potentially lead enactment law require gene enhancement occur vitro stage human development;-0.15399999916553497;Negative
UChal8O9w3Rn55Zx5lp2K5xg;@yuglesstube;This is not a net positive.  Absurd to suggest it.;2023-05-02T21:39:42Z;1;;This is not a net positive. Absurd to suggest it.;not net positive absurd suggest;-0.7839999794960022;Negative
UCAnU5T4LpKOdeGMtrfVpTIw;@stopthink9000;"I can&#39;t wait until TV presenters and AI analysts are replaced.";2023-05-02T21:10:27Z;1;;I can not wait until TV presenters and AI analysts are replaced.;not wait tv presenter ai analyst replace;-0.8370000123977661;Negative
UCRNSatN4xNz1yy77DzdCv9A;@JoeSmith-ie3cx;I hope.;2024-04-08T09:45:04Z;0;;I hope.;hope;0.6769999861717224;Positive
UCoGiRVv56DBa77mRHbE9fEw;@ChristineCircelli-go2yw;Thank you.;2024-04-06T00:17:05Z;0;;Thank you.;thank;0.9610000252723694;Positive
UC1sGcqquwa4qxdt7b7dA48A;@Riu-bw4bl;Ok so if we are going to cut the job market in haft especially traditionally well paying jobs something had got to change about the way we run our society. After hearing about the AI that can code it made me realize this will be a huge wealth transfer and people are going to be competing for even fewer jobs. Something will have to change;2024-03-17T18:48:09Z;0;;Ok. If we are going to cut the job market in haft especially traditionally well paying jobs something had got to change about the way we run our society. After hearing about the AI that can code it made me realize this will be a huge wealth transfer and people are going to be competing for even fewer jobs. Something will have to change;ok. go cut job market haft especially traditionally well pay job something get change way run society hear ai code make realize huge wealth transfer people go compete even job something change;-0.5950000286102295;Negative
UCULXPi4OroiN1ZxsSv32sTA;@gregvanpaassen;Before AI: desk job = high skill, manual job = low skill.<br><br>After AI: desk job = low skill, manual job = high skill.;2024-03-14T03:16:13Z;0;;Before AI desk job high skill, manual job low skill. After AI desk job low skill, manual job high skill.;ai desk job high skill manual job low skill ai desk job low skill manual job high skill;0.004000000189989805;Negative
UCnguJpIMgHyoTq8PES85dwQ;@Robert-3691;"This content is absolutely incredible. I recently read a similar book, and it left me in awe. &quot;Game Theory and the Pursuit of Algorithmic Fairness&quot; by Jack Frostwell";2024-02-18T01:03:14Z;0;;This content is absolutely incredible. I recently read a similar book, and it left me in awe. Game Theory and the Pursuit of Algorithmic Fairness by Jack Frost well;content absolutely incredible recently read similar book leave awe game theory pursuit algorithmic fairness jack frost well;0.8379999995231628;Positive
UCNurtgHtRdWP-jwAOp1rwTg;@chrisbarry9345;The WEF is pure evil;2024-02-04T17:47:21Z;0;;The WEF is pure evil;wef pure evil;-0.9729999899864197;Negative
UCNurtgHtRdWP-jwAOp1rwTg;@chrisbarry9345;Every reputable institution is saying that AI will end labor as we know it within the handful of years. People see the deeply flawed interface now and failed to recognize what it can do with just better integration;2024-02-04T17:45:46Z;0;;Every reputable institution is saying that AI will end labor as we know it within the handful of years. People see the deeply flawed interface now and failed to recognize what it can do with just better integration;reputable institution say ai end labor know handful year people see deeply flaw interface fail recognize good integration;-0.4230000078678131;Negative
UCZ-5ZetFyj4N3iIJ6KsAbsA;@liamodriscoll3739;SCARY STUFF 😱;2024-01-15T19:15:10Z;0;;SCARY STUFF;scary stuff;-0.8529999852180481;Negative
UCuDXVGQysqC8TXIjwCfScqQ;@simple80ish;"Will AI &quot; entities&quot;  get paid for doing these jobs?...Can I own &quot;them&quot;  and get paid?.. Are we exploiting AI?";2023-12-28T15:41:24Z;0;;Will AI entities get paid for doing these jobs?... Can I own them and get paid?.. Are we exploiting AI?;ai entity get pay job get pay .. exploit ai;-0.19200000166893005;Negative
UCEM2FMjq74Gbl_2busyMRxg;@JoTokutora;Naive wonan;2023-12-26T08:25:37Z;0;;Naive woman;naive woman;-0.6349999904632568;Negative
UCsplSzNhhNsNV1qy8h8k1qw;@jcd3869;The comments are the best part of this video. So many good and honest ideas. Stay tuned here as there are not many books out there telling the truth.;2023-12-19T22:07:19Z;0;;The comments are the best part of this video. So many good and honest ideas. Stay tuned here as there are not many books out there telling the truth.;comment best part video many good honest idea stay tune not many book tell truth;0.8759999871253967;Positive
UCbT_g7EL445EPTkUVo2g6MQ;@ThomasMullaly-do9lz;I worked for Glencore. AI is nothing new.. The spice must flow. Humans will still war over resources;2023-12-19T18:48:40Z;0;;I worked for Glencoe. AI is nothing new. The spice must flow. Humans will still war over resources;work glencoe ai nothing new spice flow human still war resource;-0.20100000500679016;Negative
UClFx4GGVx0ata-Qwg6RM5Dw;@anthonyazzopardi273;You mentioned one or two millions of jobs cteated because of AI, but you said nothing about the tens of millions that will be lost, as usual, techno marketing language.;2023-12-19T12:33:28Z;0;;You mentioned one or two million jobs created because of AI, but you said nothing about the tens of millions that will be lost, as usual, techno marketing language.;mention job create ai say nothing ten million lose usual techno marketing language;-0.8330000042915344;Negative
UCFlKbNWQEohVTDB--wTRjSQ;@greedyelites;Good🤖;2023-11-05T12:26:26Z;0;;Good;good;0.9309999942779541;Positive
UC4wvjHGKnzCMSQpD2W17_HA;@emptyhad2571;Farming;2023-11-05T03:24:43Z;0;UCGnHz1XXFKQErAsYeIz-Fog;Farming;farm;0.03400000184774399;Negative
UC_CbhFtStSPd7pYpnQ1FHfA;@rbaleksandar;"According to statistics, women work less tech and heavy duty jobs than men. This includes software development, mechanical and electrical engineering, automation, construction work, search and rescue, police, military and so on.<br><br>All of this begs the question: where is this lady getting her information that AI is mostly affecting women&#39;s job market? Last time I checked, we don&#39;t have robo-nannies, nurses, school teachers and so on (at least not yet). While some types of jobs are affected, where women dominate in terms of numbers (HR and marketing are a great example for that), such bold claim without any proper data to back it up is utter nonsense.<br><br>And yes, AI is and will continue to disrupt the global job market.";2023-10-27T08:35:37Z;0;;According to statistics, women work less tech and heavy duty jobs than men. This includes software development, mechanical and electrical engineering, automation, construction work, search and rescue, police, military and. On. All of this begs the question where is this lady getting her information that AI is mostly affecting women .job market? Last time I checked, we do not have robot nannies, nurses, school teachers and. On at least not yet . While some types of jobs are affected, where women dominate in terms of numbers HR and marketing are a great example for that , such bold claim without any proper data to back it up is utter nonsense. And yes, AI is and will continue to disrupt the global job market.;accord statistic woman work less tech heavy duty job men include software development mechanical electrical engineering automation construction work search rescue police military beg question lady get information ai mostly affect woman .job market last time check not robot nanny nurse school teacher least not yet type job affect woman dominate term number hr marketing great example bold claim proper data back utter nonsense ai continue disrupt global job market;-0.3100000023841858;Negative
UCOIhxeUgE3YQZGjD6aLXJyA;@jacotromp59581;Suicide and familicide numbers are going to rise in the next 3 to 5 years.;2023-10-25T12:14:50Z;0;;Suicide and familiarize numbers are going to rise in the next 3 to 5 years.;suicide familiarize number go rise next year;-0.8650000095367432;Negative
UC9gDZlNA5JpSTWxAR7p4mVw;@jurassicthunder;bold of you to assume that politicians know anything even about their phones let alone ai;2023-11-29T23:43:21Z;0;UCgWDi8HOqxQ3fPAe_lJAC6w;Bold of you to assume that politicians know anything even about their phones let alone AI;bold assume politician know anything even phone let alone ai;-0.9039999842643738;Negative
UCytqfF4iecXXJrJXdzlXL5g;@russxdxdxd4675;also keep in mind it takes about 6 month of training ( some take few months) to master those latte art skill and coffee knowledge;2024-03-25T16:58:50Z;0;UCca8_sxVyjrXaOYlJr-P7DQ;Also keep in mind it takes about 6 months of training some take few months to master those latte art skill and coffee knowledge;also keep mind take month train take month master latte art skill coffee knowledge;-0.07400000095367432;Negative
UC6oKLtzUzTCY7RXZQ052cMQ;@ChristineSMeyer;"I&#39;ve been saying this! AI aren&#39;t an economic force. What profits are these companies really going to make if the entire work force goes AI? If nobody is making money, then nobody can spend it? Governments need to get on regulating this now or their own revenue is going to tank...they think these big companies give enough in taxes lol going to regret letting that go unchecked for as long as they did when they are the only ones with money to give.";2023-07-14T18:59:24Z;0;UCL_ro5wJ90gPHmEoElNhrNg;I ve been saying this! AI are not an economic force. What profit is are these companies really going to make if the entire work force goes AI? If nobody is making money, then nobody can spend it? Governments need to get on regulating this now or their own revenue is going to tank...they think these big companies give enough in taxes laugh out loud going to regret letting that go unchecked for as long as they did when they are the only ones with money to give.;say ai not economic force profit company really go make entire work force go ai nobody make money nobody spend government need get regulate revenue go tank think big company give enough tax loud go regret letting go unchecked long one money give;-0.45899999141693115;Negative
UCMeVupJrQOYM9npCilx936A;@eflynn8713;After the crash of the economy on purpose,then they will try to do all the digital id and money when people will be broke and hungry.I can see all this happening for sure👍.When u know the deniers of Jesus Christ are behind all this garbage 💯👍🤚;2023-05-19T15:17:22Z;0;;After the crash of the economy on purpose, then they will try to do all the digital ID and money when people will be broke and hungry. I can see all this happening for sure. When you know the deniers of Jesus Christ are behind all this garbage;crash economy purpose try digital id money people broke hungry see happen sure know denier jesus christ garbage;-0.6190000176429749;Negative
UC5D9VgLnzwdOcLf70WNNj9A;@garyrogers1035;We will all be on the dole soon with no money to spend to improve the bleak economy;2023-05-19T11:12:59Z;0;;We will all be on the dole soon with no money to spend to improve the bleak economy;dole soon money spend improve bleak economy;-0.953000009059906;Negative
UCZIf-hjaL5IxqPgJnAJCQ5A;@sambistabeauty;"Wherever profit is priority, and as usual life on the planet is in conflict with business &amp; industry, &quot;concerns,&quot; is a nice way of saying destruction, not to mention many species are going extinct. No thinking about the big signs? If there are no birds and bees, you will not be here either.";2023-05-18T17:14:24Z;0;;Wherever profit is priority, and as usual life on the planet is in conflict with business industry, concerns, is a nice way of saying destruction, not to mention many species are going extinct. No thinking about the big signs? If there are no birds and bees, you will not be here either.;wherever profit priority usual life planet conflict business industry concern nice way say destruction not mention many specie go extinct think big sign bird bee not;-0.675000011920929;Negative
UC9-u43UBXi5h9EZAhPyEmcg;@PeterSodhi;So long as the people at DW are replaced with their artificial non intelligence I am good;2023-05-17T21:17:52Z;0;;So long as the people at DW are replaced with their artificial non intelligence I am good;long people dw replace artificial non intelligence good;-0.18700000643730164;Negative
UCM3MKBqTlxKF_ySCUYyHZLQ;@andygriffin7846;Resistance will be the best job;2023-05-17T19:22:33Z;0;;Resistance will be the best job;resistance best job;0.8130000233650208;Positive
UCTUoXsJbCHVmG-EAloKGlBg;@SalesforceSS;"It&#39;s a simple answer. if there are too many unemployed people they will come after the AI infrastructure and destroy it and the people supporting it. It will be a civil war.";2023-05-17T02:42:07Z;0;;It .a simple answer. If there are too many unemployed people they will come after the AI infrastructure and destroy it and the people supporting it. It will be a civil war.;.a simple answer many unemployed people come ai infrastructure destroy people support civil war;-0.4059999883174896;Negative
UCTVRDUAYATN5vl6RuDFL0Lw;@GroundedGame;When the earth collapses because AI then people will remember how good communism was 😂😂😂;2023-05-16T20:04:01Z;0;;When the earth collapses because AI then people will remember how good communism was;earth collapse ai people remember good communism;-0.7860000133514404;Negative
UCcdINEplwS0gGK6zODXFfdw;@lawless7156;🙄 💩;2023-05-15T23:18:11Z;0;;;;0.0;Negative
UCWCfYD8n4PPee2IQptLzntg;@P2Feener305;Finally McDonald’s will stop getting my order wrong.;2023-05-15T12:57:14Z;0;;Finally, McDonald .will stop getting my order wrong.;finally mcdonald .will stop get order wrong;0.7599999904632568;Positive
UC26QUKEv2gIw-KZH9ifZzyA;@AdeAde0224;Great point.;2023-07-22T12:26:26Z;0;UCVbZ5NWM-fJunEmA-EeNe2Q;Great point.;great point;0.6340000033378601;Positive
UC_U0mTGvuLVu1xWC7UU6B0w;@andrealimoli7588;Agree, but you can perhaps imagine that we will not need the entire human race being a mechanical/programmer. And consider the fact that the maintenance at that level/context will probably never be done by humans, but from machines that are able to repair other machines and viceversa. If you take in consideration a full integration of this scenario, we will do almost nothing.;2023-11-14T19:48:25Z;0;UCVbZ5NWM-fJunEmA-EeNe2Q;Agree, but you can perhaps imagine that we will not need the entire human race being a mechanical programmer. And consider the fact that the maintenance at that level context will probably never be done by humans, but from machines that are able to repair other machines and vice versa. If you take in consideration a full integration of this scenario, we will do almost nothing.;agree perhaps imagine not need entire human race mechanical programmer consider fact maintenance level context probably never human machine able repair machine vice versa take consideration full integration scenario almost nothing;-0.29100000858306885;Negative
UCVBkOv-WNKAuwpPgASiOkZg;@CMDRScotty;Where did they get the numbers for agricultural jobs?  In the first world that represents less then one percent of the first world work force and will continue ro decline.;2023-05-14T03:44:21Z;0;;Where did they get the numbers for agricultural jobs? In the first world that represents less than one percent of the first world work force and will continue RO decline.;get number agricultural job first world represent less percent first world work force continue ro decline;-0.39100000262260437;Negative
UCY3rIkUAdilHd-pgMIhyaKQ;@abhisekgupta3822;Computer cannot takeover human there are errors;2023-05-13T03:42:57Z;0;;Computer can not take over human there are errors;computer not take human error;-0.7620000243186951;Negative
UCfDNksSpc7SGipp6DZdI_XA;@snowpuddle9622;crime will rise;2023-05-12T23:06:47Z;0;;Crime will rise;crime rise;-0.9210000038146973;Negative
UCmYxZDTHzkczL3V-kAJkfTA;@robertedmond6596;"Oh no! I won&#39;t be able to work 8-6 everyday! How will I survive? 😂😂😂";2023-05-12T12:14:23Z;0;;Oh, no! I will not be able to work 8 6 every day! How will I survive?;not able work day;-0.7279999852180481;Negative
UC7qovKVo6u5TDsnqqDEg0Fg;@vancityred1;she is completely clueless, her Job is gone first!;2023-05-12T03:06:51Z;0;;She is completely clueless, her Job is gone first!;completely clueless job go first;-0.8650000095367432;Negative
UCI_e2Toha8LafCoKHiHINAg;@AndreiKovalev1;More accurate than most realize.;2023-05-12T22:08:42Z;0;UCngTd-ekNdaQxemhboVYF_g;More accurate than most realize.;accurate realize;0.9399999976158142;Positive
UCh9jSk3iav4Pmw_9MtyLvig;@Hiltonliveparanormalnews79;"No more college that path has not paid it&#39;s worth no no no";2023-05-10T01:12:47Z;0;;No more college that path has not paid it .worth no, no no;college path not pay .worth;-0.8980000019073486;Negative
UCqLowY1XQKtXhFkDdzmv9JA;@edwardduda4222;I don’t necessarily see it as a bad thing. It’s going to be necessary with life expectancy rising and birth rates falling. Eventually there will be more people who are retired than working. People are going the same quality of goods and services no matter how many are available to work those jobs.;2023-05-09T21:16:39Z;0;;I do not necessarily see it as a bad thing. It.going to be necessary with life expectancy rising and birth rates falling. Eventually there will be more people who are retired than working. People are going the our quality of goods and services no matter how many are available to work those jobs.;not necessarily see bad thing it.going necessary life expectancy rise birth rate fall eventually people retire work people go quality good service matter many available work job;-0.007000000216066837;Negative
UCEdr6q6ar28L1bXdRH4a7NA;@urimtefiki226;new jobs, old jobs,;2023-05-09T14:02:38Z;0;;New jobs, old jobs,;new job old job;0.5410000085830688;Positive
UCTnHpasJHQKkfIi3G8DB68w;@augurcybernaut4785;Lies;2023-05-09T10:16:58Z;0;;Lies;lie;-0.7250000238418579;Negative
UCO4iAqC7RchwDX7hkMQ_OJg;@user-ys9rp7ms3h;ha ha ha ha John Jeffrey Bias is Lex Luthor;2023-05-09T04:17:38Z;0;;Ha ha ha ha John Jeffrey Bias is Lex Luthor;ha ha ha ha john jeffrey bias lex luthor;0.5;Positive
UC7pVDyLLMMPrzAlguO4gVPA;@hobin_rude;World Ecofascist Fraud! She should be the first to lose her job;2023-05-09T03:18:30Z;0;;World Eco fascist Fraud! She should be the first to lose her job;world eco fascist fraud first lose job;-0.906000018119812;Negative
UC5WeGRZkitYti3HuU7995WA;@thinkbetter5286;This.;2023-05-11T19:05:24Z;0;UCkdMffnZEuh_n6DzslLi_Vw;This.;;0.029999999329447746;Negative
UCTK_7n8hcfXzG37m8Z_8o1Q;@neshanu;These kids are fools.  Jobs Gone...Lawyers, Doctors, Programmers, Accountants, Engineers, ETC......;2023-05-08T15:01:21Z;0;;These kids are fools. Jobs Gone... Lawyers, Doctors, Programmers, Accountants, Engineers, ETC......;kid fool job go lawyer doctor programmer accountant engineer ......;-0.5929999947547913;Negative
UCsCpG6J2z3zoOS24mi0aVyg;@jimmcneal5292;"Just to note: &quot;green&quot; power sources are not green, they are just a subsidized industry made by mineral excavation companies. When governments will actually decide lower CO2 emissions, you&#39;ll know it(mostly by nuclear power station that will be built near you)";2023-05-08T12:18:39Z;0;;Just to note green power sources are not green, they are just a subsidized industry made by mineral excavation companies. When governments will actually decide lower CO2 emissions, you ll know it mostly by nuclear power station that will be built near you;note green power source not green subsidized industry make mineral excavation company government actually decide low co emission know mostly nuclear power station build;-0.26899999380111694;Negative
