id;name;text;time;likes;reply;CleanedText;ProcessText;SentimentScore;ActualLabel
UC-uNBVEIbOpeIkSyE_pq6nA;@godmisfortunatechild;Ai is inherently pointed at removing jobs. We need to think about the permanent loss of jobs and how to redustribute wealth and benefits accumumated from AI when working class humans become unemployable.;2024-02-18T20:25:38Z;66;;Ai is inherently pointed at removing jobs. We need to think about the permanent loss of jobs and how to redistribute wealth and benefit is accumulated from AI when working class humans become unemployable.;ai inherently point remove job need think permanent loss job redistribute wealth benefit accumulate ai work class human become unemployable;-0.7850000262260437;Negative
UC2lx5_aUD9h4z4ENHv8FCWA;@budo4;Some technologies do create far more jobs than they eliminate but I think AI is a different beast. I am seeing more negatives than positives when it comes to the job market.;2024-02-29T02:57:59Z;63;;Some technologies do create far more jobs than they eliminate, but I think AI is a different beast. I am seeing more negatives than positives when it comes to the job market.;technology create far job eliminate think ai different beast see negative positive come job market;-0.4320000112056732;Negative
UCLy2VaueOJoTuc4t-IEFBCA;@wege8409;"I have a lot of respect for Andrew Ng, but I&#39;ve been seeing a lot of doublespeak from people in the field recently, with the phrasing of &quot;it can replace humans in certain kinds of work&quot; swapped with &quot;it just does tasks&quot;. It sounds more diplomatic. Lots of AI people don&#39;t want to outright say that they would think it would make everyone happier in the long run if we replaced almost the whole shebang. I mean I think we would be happier.";2024-02-28T17:37:13Z;49;;I have a lot of respect for Andrew Ng, but I ve been seeing a lot of doublespeak from people in the field recently, with the phrasing of it can replace humans in certain kinds of work swapped with it just does task . It sounds more diplomatic. Lots of AI people do not want to outright say that they would think it would make everyone happier in the long run if we replaced almost the whole shebang. I mean I think we would be happier.;lot respect andrew ng see lot doublespeak people field recently phrasing replace human certain kind work swap task sound diplomatic lot ai people not want outright say think make everyone happier long run replace almost whole shebang mean think happy;-0.03099999949336052;Negative
UCBYrLL7E7PJXq9OmWOhTMww;@JohnnyHoO111;(content loudness -22.7dB)  please normalize the audio volume to closer to 0 db;2024-02-25T23:15:29Z;42;;content loudness 22.7dB please normalize the audio volume to closer to 0 db;content loudness .db please normalize audio volume closer db;-0.7549999952316284;Negative
UC3NkbL3apSREKGnMR4_B_ng;@geaca3222;(parttime) jobs that many women do (f.e. admin, receptionist, customer service, call center jobs) are at risk of being completely replaced by AI soon.;2024-02-23T23:11:14Z;30;;Part time jobs that many women do f.e. admin, receptionist, customer service, call center jobs are at risk of being completely replaced by AI soon.;part time job many woman f.e admin receptionist customer service call center job risk completely replace ai soon;-0.7950000166893005;Negative
UCJNHRJVL_qFy4ZjF33NRGwA;@_obdo_;Brilliant as always. Ng is one of the giants of ML.<br><br>It’s true that ML researchers don’t know how to build superhuman AI. Today. But Ng sees no end in sight to the stacked S curves of innovation ahead. It’s not unreasonable to wonder if we could land in a dangerous place within 5-20 years.  The eye rolling is beneath this great man.;2024-02-18T12:43:14Z;20;;Brilliant as always. NG is one of the giants of ML. It .true that ML researchers do not know how to build superhuman AI. Today. But NG sees no end in sight to the stacked S curves of innovation ahead. It .not unreasonable to wonder if we could land in a dangerous place within 5 20 years. The eye rolling is beneath this great man.;brilliant always giant ml .true ml researcher not know build superhuman ai today ng see end sight stack curve innovation ahead .not unreasonable wonder land dangerous place year eye rolling great man;0.20999999344348907;Negative
UChWNLw7UQeqh5-x8hpXZlrw;@ACK333;When will AI start to pay tax ?;2024-02-21T12:43:21Z;18;;When will AI start to pay tax ?;ai start pay tax;-0.12300000339746475;Negative
UCeS24jWm1oxCe2xFSXe0MKQ;@BrianMosleyUK;"Very pacifying, but I think in reality we will see new companies spring up in each sector which completely obliterate &#39;human heavy&#39; conventional businesses.<br><br>For example, a handful of film makers using AI will bring out blockbuster quality films which overnight send Disney out of business. Not entirely an exaggeration.";2024-02-20T11:23:53Z;18;;Very pacifying, but I think in reality we will see new companies spring up in each sector which completely obliterate human heavy conventional businesses. For example, a handful of filmmakers using AI will bring out blockbuster quality films which overnight send Disney out of business. Not entirely an exaggeration.;pacifying think reality see new company spring sector completely obliterate human heavy conventional business example handful filmmaker use ai bring blockbuster quality film overnight send disney business not entirely exaggeration;0.17100000381469727;Negative
UCG3DOg6J5_a35UO70fuW1VQ;@CelestialSci;To say it will not be significant job loss is dishonest.;2024-02-19T00:49:54Z;17;;To say it will not be significant job loss is dishonest.;say not significant job loss dishonest;-0.8799999952316284;Negative
UCRGaGBcltAb0MO5ZMs8Q0UQ;@rodi4850;new technology will always make us more productive, create jobs, destroy others - but I think the no. of jobs lost will outnumber the no. of jobs created.;2024-02-18T22:39:02Z;16;;New technology will always make us more productive, create jobs, destroy others but I think the no. of jobs lost will outnumber the no. of jobs created.;new technology always make productive create job destroy others think job lose outnumber job create;0.0729999989271164;Negative
UCiKvIUMWYv1U0GWpdGqv3iw;@kosofamily;“People that use AI will replace others that don’t.”;2024-02-26T03:54:36Z;10;;People that use AI will replace others that do not .;people use ai replace others not;0.03500000014901161;Negative
UCRyGNGsBIt_jxDEmQiEbcmg;@luyaoma;I hope that’s not the only thing you get from his speech.;2024-02-27T04:12:53Z;10;UCjL3-MX4ZW_qMz5iYtJO99g;I hope that .not the only thing you get from his speech.;hope .not thing get speech;0.37599998712539673;Negative
UC6cTZ7X6KLPDxhaNH_0dAMQ;@fanban2926;"@@dibbidydoo4318 That&#39;s not necessary, if you use your brain you&#39;ll see it before that data comes through.";2024-02-19T13:30:11Z;9;UC-uNBVEIbOpeIkSyE_pq6nA;That .not necessary, if you use your brain you ll see it before that data comes through.;.not necessary use brain see data come;-0.09799999743700027;Negative
UC8Trfgg0vi7e87uElFdYoVg;@miladkhademinori2709;"&quot;Safety&quot;";2024-02-18T21:40:11Z;8;;Safety;safety;0.17299999296665192;Negative
UC0daPxXAhwCRii1KIY2jMuA;@fersuvious;Not interested in those who are bullish on AI explaining how it won’t effect regular people. Their interests are not our interests.;2024-02-29T22:25:29Z;7;;Not interested in those who are bullish on AI explaining how it will not effect regular people. Their interests are not our interests.;not interested bullish ai explain not effect regular people interest not interest;-0.8889999985694885;Negative
UCg_oBYOKUJhtxKUf-XP_wWg;@ychickshateme11;It would make these AI scientists rich while widen inequality overall, hence the doublespeak, as always :);2024-03-02T01:34:14Z;7;UCLy2VaueOJoTuc4t-IEFBCA;It would make these AI scientists rich while widen inequality overall, hence the doublespeak, as always;make ai scientist rich widen inequality overall hence doublespeak always;-0.8820000290870667;Negative
UCV117UTCKEjbuqd5ib5byAw;@ericandbeethoven;"@@bsgvlog5640 societal productivity gains don&#39;t put groceries on the table for the single mom in Akron though.";2024-03-03T15:26:41Z;7;UCLy2VaueOJoTuc4t-IEFBCA;Societal productivity gains do not put groceries on the table for the single mom in Akron though.;societal productivity gain not put grocery table single mom akron;-0.5120000243186951;Negative
UCYJ2e8jqol8mSWg4Spj3Mfg;@zabrak999;He explicitly stated that it can be harmful;2024-02-27T01:18:45Z;7;UCjL3-MX4ZW_qMz5iYtJO99g;He explicitly stated that it can be harmful;explicitly state harmful;-0.8479999899864197;Negative
UCFIZ-fmVSoJaCQ3sVGa-0Ew;@robertafelice7687;Brilliant man, always inspiring!;2024-02-24T19:32:23Z;7;;Brilliant man, always inspiring!;brilliant man always inspire;0.9409999847412109;Positive
UCoY_Y8qc9YhRnBtVPOZyQvw;@vicchris3943;Job is collection of tasks;2024-02-20T02:16:18Z;6;;Job is collection of tasks;job collection task;0.007000000216066837;Negative
UC6cTZ7X6KLPDxhaNH_0dAMQ;@fanban2926;Yes;2024-02-19T00:50:31Z;6;UC-uNBVEIbOpeIkSyE_pq6nA;Yes;yes;0.3790000081062317;Negative
UCAyr4rN6oZREZatOFUdeIGg;@bobmishima3295;"&quot;efficiency&quot; and &quot;productivity&quot; are just the gentle terms management uses to justify layoffs";2024-03-09T17:49:00Z;5;;Efficiency and productivity are just the gentle terms management uses to justify layoffs;efficiency productivity gentle term management use justify layoff;-0.7279999852180481;Negative
UC-u21man8otyAm2krPbMPIw;@user-xedwsg;No. A.i. will replace every job eventually. my friend, AGI is not a joke...;2024-03-04T12:29:41Z;5;UCiKvIUMWYv1U0GWpdGqv3iw;No. A.i. will replace every job eventually. My friend, AGI is not a joke...;a.i replace job eventually friend agi not joke;-0.11400000005960464;Negative
UCwgsvgFkLrcs6sd6bJpon2A;@DTR89;This Ng smart;2024-03-03T02:01:03Z;4;;This NG smart;ng smart;0.8050000071525574;Positive
UC9lIMBX3zyipa5iHHsHMcoQ;@ScottTeresi;Oh yeah, this guy is a totally impartial, objective source. LOL;2024-02-29T19:33:09Z;4;;Oh yeah, this guy is a totally impartial, objective source. LOL;guy totally impartial objective source lol;0.7179999947547913;Positive
UCbNeTwQ1v3tcY_A8NefCDig;@AB-dd4jz;"the issue most people in the AI and economic sector don&#39;t see or don&#39;t want to acknowledge is that the destructive creation of Schumpeter is working only as long as the tech created is able to be used by the average man, that&#39;s not the case at all with AI, only the smartest people can use it and it will delete on a large scale jobs that were done by the average man and even a little over the average which will create a destructive imbalance in soociety I think.";2024-03-04T20:38:37Z;4;UC2lx5_aUD9h4z4ENHv8FCWA;The issue most people in the AI and economic sector do not see or do not want to acknowledge is that the destructive creation of Schumpeter is working only as long as the tech created is able to be used by the average man, that .not the case at all with AI, only the smartest people can use it, and it will delete on a large scale jobs that were done by the average man and even a little over the average which will create a destructive imbalance in society I think.;issue people ai economic sector not see not want acknowledge destructive creation schumpeter work long tech create able use average man .not case ai smart people use delete large scale job average man even little average create destructive imbalance society think;-0.902999997138977;Negative
UC34y3uIpZFw6uJ2wWNrNSSQ;@ElGUACHE-xo5dt;This retraining plan better come with a lot of coffee.;2024-02-28T09:54:48Z;4;;This retraining plan better come with a lot of coffee.;retraining plan well come lot coffee;-0.5960000157356262;Negative
UCuczc34WnofJSK3HzMnmzVQ;@AtomicSlugg;"sadly the future is unemployment for most, but AI salesmen and employers can&#39;t just come out and say it.<br>if you&#39;re a working class individual, wake up. you are the horse, they&#39;re the car, and if you don&#39;t speak up.<br> look at history, looks at what happens to those who become &quot;useless&quot;, don&#39;t wait till there is no bargaining power in your hands.";2024-02-27T22:44:16Z;4;;Sadly the future is unemployment for most, but AI salesmen and employers can not just come out and say it. If you re a working class individual, wake up. You are the horse, they re the car, and if you do not speak up. Look at history, looks at what happens to those who become useless , do not wait till there is no bargaining power in your hands.;sadly future unemployment ai salesman employer not come say working class individual wake horse car not speak look history look happen become useless not wait till bargain power hand;-0.7149999737739563;Negative
UC-u21man8otyAm2krPbMPIw;@user-xedwsg;Yup...Its crazy what we are witnessing;2024-03-04T12:29:16Z;4;UC3NkbL3apSREKGnMR4_B_ng;Yup... It is crazy what we are witnessing;yup crazy witness;-0.28700000047683716;Negative
UC86QngB2wzzEoI57eYAHS2Q;@Alice8000;great questions. amazing answers. 👏;2024-02-23T07:35:04Z;4;;Great questions. Amazing answers.;great question amazing answer;0.8579999804496765;Positive
UCQ3dUp2F8nTocfaKxsKykiw;@lucacarey9366;I think we’re seeing a massive (often accidental) gaslighting campaign. You can’t automate all the jobs yet, and until that becomes possible companies want as many potential workers are possible, as always. In order for those workers and potential workers to keep throwing themselves into the grind, they need to believe there’s a future to their job and that the current paradigm is indefinite;2024-02-20T01:46:21Z;4;UCqU0xjk2em11BvXROHZHuqQ;I think we are seeing a massive often accidental gaslighting campaign. You can not automate all the jobs yet, and until that becomes possible companies want as many potential workers are possible, as always. In order for those workers and potential workers to keep throwing themselves into the grind, they need to believe there.a future to their job and that the current paradigm is indefinite;think see massive often accidental gaslighting campaign not automate job yet become possible company want many potential worker possible always order worker potential worker keep throw grind need believe there.a future job current paradigm indefinite;-0.34299999475479126;Negative
UCxMewW1N6CdySvUrHkfZUDA;@dibbidydoo4318;"we have no evidence of that. The BLS labor studies for 2023 hasn&#39;t really seen big changes that might lead to significant job loss.";2024-02-19T03:18:02Z;4;UCG3DOg6J5_a35UO70fuW1VQ;We have no evidence of that. The BLS labor studies for 2023 has not really seen big changes that might lead to significant job loss.;evidence bls labor study not really see big change lead significant job loss;-0.19900000095367432;Negative
UCBlB47H2ANh3EivsW19cBdA;@Corey4Jesus;"&quot;AI is not going to replace people, people using AI is going to replace people&quot; ❤";2024-03-26T20:57:26Z;3;;AI is not going to replace people, people using AI is going to replace people;ai not go replace people people use ai go replace people;-0.1589999943971634;Negative
UCrm__JIHzBCDaq3FCoEitEQ;@danm7254;I couldn’t agree more with your assessment.  This is case and point why we need to head towards UBI;2024-03-07T16:08:44Z;3;UCtV5Qe8WIobN--OATq0cEhA;I could not agree more with your assessment. This is case in point why we need to head towards FBI;not agree assessment case point need head towards fbi;0.010999999940395355;Negative
UCb8hh9ec5aGg54oHDE0aIOQ;@bradleyhasse5220;UBI is coming ALSO..;2024-03-03T22:05:25Z;3;;FBI is coming ALSO.;fbi come also;-0.5490000247955322;Negative
UCgKOo3RINYIpJhGOtpUclRA;@lupelu3146;"Bet this guy doesn&#39;t do his own grocery shopping.";2024-02-28T09:54:50Z;3;;Bet this guy does not do his own grocery shopping.;bet guy not grocery shopping;-0.8059999942779541;Negative
UCT4QdcSKeAN5p7qHSw41SwQ;@TheManinBlack9054;"It&#39;s not unreasonable to be afraid of being the second smartest species.";2024-02-19T06:11:50Z;3;UCYEq-G9hGZeSP7k4raSP8Jw;It .not unreasonable to be afraid of being the second smartest species.;.not unreasonable afraid second smartest specie;-0.2540000081062317;Negative
UCWzHpZjLQNrgEVXRNpTmF5w;@danny5534;this assessment is so true. we keep hearing that AI will create new jobs. yes it will, but its clear to anyone who is paying attention it can destroy many more jobs than the new ones it creates.<br><br>its honestly extremely hard to even imagine what common people and even people with moderately above average IQs will do in a world where an AI agent is vastly superior at doing any task.;2024-03-14T15:56:35Z;2;UCtV5Qe8WIobN--OATq0cEhA;This assessment is. True. We keep hearing that AI will create new jobs. Yes it will, but it is clear to anyone who is paying attention it can destroy many more jobs than the new ones it creates. It is honestly extremely hard to even imagine what common people and even people with moderately above average IQs will do in a world where an AI agent is vastly superior at doing any task.;assessment true keep hear ai create new job yes clear anyone pay attention destroy many job new one create honestly extremely hard even imagine common people even people moderately average iq world ai agent vastly superior task;-0.22699999809265137;Negative
UC2TsOqVlidu4nLgIGL_pi2w;@SickPrid3;"&quot;AI will not replace people, people using AI will replace other people&quot; so AI will replace people 🙄";2024-03-05T12:11:12Z;2;;AI will not replace people, people using AI will replace other people . AI will replace people;ai not replace people people use ai replace people ai replace people;-0.1459999978542328;Negative
UC3cyZ1QkJNKRC19CtvpW8fA;@crawfordviolin;I am an a tech consultant at at fortune 100 and I can tell you that the management is uninterested in my ideas to utilize AI throughout the business. I’m not sure how exactly you become an “AI consultant”, but I do wonder if there is much demand for it.;2024-02-29T18:44:35Z;2;;I am an tech consultant at fortune 100, and I can tell you that the management is uninterested in my ideas to utilize AI throughout the business. I am not sure how exactly you become an AI consultant, but I do wonder if there is much demand for it.;tech consultant fortune tell management uninterested idea utilize ai business not sure exactly become ai consultant wonder much demand;-0.6389999985694885;Negative
UCW6odqZrxAjemLDPihVyIVQ;@LeonardoLuna-tr7js;Good luck with that!;2024-02-28T09:50:42Z;2;;Good luck with that!;good luck;0.7910000085830688;Positive
UCZIZPcTLHoXYQe3Kl53vdSg;@yoli6373;I would say at least half of white collar jobs will disappear.;2024-02-26T18:51:35Z;2;;I would say at least half of white collar jobs will disappear.;say least half white collar job disappear;-0.9110000133514404;Negative
UCfRmrPXV4PZwV3-XBobUA5Q;@fai8t;Andrew Ngr;2024-02-24T01:50:01Z;2;;Andrew Ng;andrew ng;-0.004000000189989805;Negative
UCRvbK0LzKuWRvB58T1HV0Zg;@joelalain;"exactly. there will be millions of 1-person business with 100 ai &quot;employees&quot;. the issue is they won&#39;t hire people. and lots of people don&#39;t have the bandwidth or drive or knowledge or intelligence or willpower to create a business. they will definitely have no job";2024-02-26T00:42:47Z;2;UCeS24jWm1oxCe2xFSXe0MKQ;Exactly. There will be millions of 1 person business with 100 AI employees . The issue is they will not hire people. And lots of people do not have the bandwidth or drive or knowledge or intelligence or willpower to create a business. They will definitely have no job;exactly million person business ai employee issue not hire people lot people not bandwidth drive knowledge intelligence willpower create business definitely job;-0.5080000162124634;Negative
UC9rnF1gNcJPKLJQbbq81xMQ;@prasvasu4217;Unfortunately, the case is exactly the opposite... Big companies with their huge leverage and capital power will buy large data centres (think NVidia data factories) and large amounts of energy for cheaper due to economies of scale to run their vision and LLM models at a massive scale for a fraction of the cost.;2024-03-04T03:22:59Z;2;UCeS24jWm1oxCe2xFSXe0MKQ;Unfortunately, the case is exactly the opposite... Big companies with their huge leverage and capital power will buy large data centers think NVIDIA data factories and large amounts of energy for cheaper due to economies of scale to run their vision and LLM models at a massive scale for a fraction of the cost.;unfortunately case exactly opposite big company huge leverage capital power buy large data center think data factory large amount energy cheap due economy scale run vision llm model massive scale fraction cost;-0.22599999606609344;Negative
UCI05jVpN9JJEiZv_z3LTg9g;@billdsafdsad;There has rarely been an invention or discovery which has significantly increased the human race’s ability to achieve greater convenience, productivity or performance, which has not also eventually led to detrimental consequences;2024-03-08T00:22:54Z;1;;There has rarely been an invention or discovery which has significantly increased the human race.ability to achieve greater convenience, productivity or performance, which has not also eventually led to detrimental consequences;rarely invention discovery significantly increase human race.ability achieve great convenience productivity performance not also eventually lead detrimental consequence;0.27300000190734863;Negative
UCOd70NKWaBmtU5MkB7kQCeA;@edp2506;"LOL we&#39;re screwed!";2024-03-07T03:48:16Z;1;;LOL we re screwed!;lol screw;-0.8960000276565552;Negative
UCzR8v1fEOGrq7vdZUvjT5qA;@Zegeebwah;AI generated images have already destroyed my stock footage portfolio that I spent years building. AI will give corporations the tools to finally get rid of anyone not in the C suite.;2024-03-04T14:10:41Z;1;;AI generated images have already destroyed my stock footage portfolio that I spent years building. AI will give corporations the tools to finally get rid of anyone not in the C suite.;ai generate image already destroy stock footage portfolio spend year build ai give corporation tool finally get rid anyone not c suite;-0.7210000157356262;Negative
UCjC6MZb4Gd9WX0cCVxSawLg;@itconsgenio;“Task” = 1 Drink;2024-03-04T07:30:02Z;1;;Task 1 Drink;task drink;0.007000000216066837;Negative
UCRn4vyW7-1m6hGl9kmo9mcQ;@fraudexposed5486;Companies are already using AI to replace thousands and thousands of employees. This guy is nothing more than a con artist or PR agent for Big Tech;2024-03-02T11:18:55Z;1;;Companies are already using AI to replace thousands and thousands of employees. This guy is nothing more than a con artist or PR agent for Big Tech;company already use ai replace thousand thousand employee guy nothing con artist pr agent big tech;-0.38100001215934753;Negative
UCyJvIAgcERh8FqkLxwqlTYw;@mahtabsoin7239;"They will wake up soon. But they don&#39;t admit they were wrong. It is what it is";2024-03-04T23:15:21Z;1;UC3cyZ1QkJNKRC19CtvpW8fA;They will wake up soon. But they do not admit they were wrong. It is what it is;wake soon not admit wrong;-0.2939999997615814;Negative
UC3EmoeNaoRbr08Ajaz0kOAg;@jameslai6879;Is this AI generated =);2024-03-08T07:11:35Z;1;UCebegopR_cGi19AsnVJtjWQ;Is this AI generated;ai generate;-0.017000000923871994;Negative
UCCPD9RSTIrGW14z073UylWg;@ThizOne;My thoughts exactly;2024-02-26T16:11:47Z;1;UCBYrLL7E7PJXq9OmWOhTMww;My thoughts exactly;thought exactly;0.09799999743700027;Negative
UCtYgCNwj-u1UI4agd3PP-IQ;@nsshing;I thought it was my problem lol;2024-03-02T06:55:41Z;1;UCBYrLL7E7PJXq9OmWOhTMww;I thought it was my problem laugh out loud;think problem loud;0.5920000076293945;Positive
UCru6ttNA2xXzsiQdHCcB3dg;@KenFehling;"Why can&#39;t YouTube automate this after all these years?";2024-04-29T03:03:27Z;1;UCBYrLL7E7PJXq9OmWOhTMww;Why can not YouTube automate this after all these years?;not youtube automate year;-0.8360000252723694;Negative
UCZ2x_Z6RaRxH3tjbi6i1kRg;@bsgvlog5640;@@sussysaullarge scale change IS normal, look at the internet revolution over the last 30 years.;2024-03-02T16:05:26Z;1;UCvKRFNawVcuz4b9ihUTApCg;Scale change IS normal, look at the internet revolution over the last 30 years.;scale change normal look internet revolution last year;0.019999999552965164;Negative
UC-u21man8otyAm2krPbMPIw;@user-xedwsg;yes, but that took 30 years. A.I. development is moving extremly fast. we might have AGI within the next 5 years, thats if we dont have it already...(you familiar with the speculation around Q-star?)<br>@@bsgvlog5640;2024-03-04T12:31:23Z;1;UCvKRFNawVcuz4b9ihUTApCg;Yes, but that took 30 years. A.I. development is moving extremely fast. We might have AGI within the next 5 years, that is if we do not have it already... you familiar with the speculation around Q star?;take year a.i development move extremely fast agi next year not already familiar speculation q star;0.18299999833106995;Negative
UCjL3-MX4ZW_qMz5iYtJO99g;@sonicwave02;​@@takyon97his perspective is very useful but can only be considered alongside a diverse group of experts;2024-02-28T00:08:28Z;1;UCjL3-MX4ZW_qMz5iYtJO99g;Perspective is very useful but can only be considered alongside a diverse group of experts;perspective useful consider diverse group expert;0.07500000298023224;Negative
UCjL3-MX4ZW_qMz5iYtJO99g;@sonicwave02;"​@@zabrak999do you have the time when he said that? He may have said that but I didn&#39;t have that takeaway after listening to it in entirety";2024-02-28T00:09:41Z;1;UCjL3-MX4ZW_qMz5iYtJO99g;You have the time when he said that? He may have said that but I did not have that takeaway after listening to it in entirety;time say say not takeaway listen entirety;-0.11400000005960464;Negative
