id;name;text;time;likes;reply;CleanedText;ProcessText;SentimentScore;ActualLabel
UCfk5tQR40L82DGtYs-yLmLw;@totoroben;"It would be great to embrace AI with the intention of making a more equitable socialist society in which everyone isn&#39;t required to work to survive, but this isn&#39;t going to be popular with our oligarchy overlords.";2024-01-13T13:47:32Z;1;;It would be great to embrace AI with the intention of making a more equitable socialist society in which everyone is not required to work to survive, but this is not going to be popular with our oligarchy overlords.;great embrace ai intention make equitable socialist society everyone not require work survive not go popular oligarchy overlord;-0.656000018119812;Negative
UC43sRL7IF7QJo1c2KArJ2eg;@tutacat;"Artificial intelligence programs are a type of technology, not a single technology, or an entity.<br>OpenAI fired ethicists. Neural models can&#39;t generate ethics yet.";2023-09-17T10:36:45Z;1;;Artificial intelligence programs are a type of technology, not a single technology, or an entity. OpenAI fired ethicists. Neural models can not generate ethics yet.;artificial intelligence program type technology not single technology entity openai fire ethicist neural model not generate ethic yet;-0.44600000977516174;Negative
UCYZulWCgN9e5JnOj2iUS9AA;@Flash23ATM;POND (people of Neanderthal decent ) need to remove affirmative action from the military if they remove it from scholarly institutions, a lot of hypocrisy, to recognise its strength in certain fields (military ) and remove it from another.;2023-09-06T10:40:33Z;1;;POND people of Neanderthal decent need to remove affirmative action from the military if they remove it from scholarly institutions, a lot of hypocrisy, to recognize it is strength in certain fields military and remove it from another.;pond people neanderthal decent need remove affirmative action military remove scholarly institution lot hypocrisy recognize strength certain field military remove;-0.7210000157356262;Negative
UCtHuYzLnwJsrbDEQWttWvNw;@carlbowles1808;Ai is going to make many college degrees worthless.;2023-08-24T03:34:27Z;1;;Ai is going to make many college degrees worthless.;ai go make many college degree worthless;-0.8880000114440918;Negative
UCbiN2ygeLeU6N290gS8EXWA;@sommmeguy;"How do i know that the only job AI won&#39;t replace is CEO and Board Member.";2023-08-17T15:24:25Z;1;;How do I know that the only job AI will not replace is CEO and Board Member.;know job ai not replace ceo board member;-0.05000000074505806;Negative
UCWBvzVtr2sCCJAIXA1WyjzQ;@eljaguar4789;They took er jerbs;2023-08-12T04:25:47Z;1;;They took her verbs;take verb;-0.08900000154972076;Negative
UCNzIDo4wPqr8KBm2-ef25fg;@spaceexplorationtechnology;AI is become popular;2023-07-29T15:20:42Z;1;;AI is become popular;ai become popular;0.1379999965429306;Negative
UCXxbKBT22ReQVjKaGl19jGg;@Mrhellslayerz;"It&#39;d be nice if that passion for progress was directed to a more compatible and stable economy. That way this wouldn&#39;t be so much of an issue for everybody.";2023-08-13T23:41:54Z;1;UC-_eZ4uYbS7yE0NXKSkWK1A;It d be nice if that passion for progress was directed to a more compatible and stable economy. That way this would not be. Much of an issue for everybody.;nice passion progress direct compatible stable economy way not much issue everybody;-0.421999990940094;Negative
UC-_eZ4uYbS7yE0NXKSkWK1A;@KJ-xc6qs;Studio Heads have never been nice or charitable.@@Mrhellslayerz;2023-08-14T00:56:49Z;1;UC-_eZ4uYbS7yE0NXKSkWK1A;Studio Heads have never been nice or charitable.;studio head never nice charitable;-0.8880000114440918;Negative
UCXxbKBT22ReQVjKaGl19jGg;@Mrhellslayerz;@@KJ-xc6qs A stable economy that can work with AI is considered charity now? Did you stop reading my comment after the third word?;2023-08-14T01:16:21Z;1;UC-_eZ4uYbS7yE0NXKSkWK1A;A stable economy that can work with AI is considered charity now? Did you stop reading my comment after the third word?;stable economy work ai consider charity stop read comment third word;-0.4300000071525574;Negative
UCv8fFkTOp8DSIMWigogD4Hw;@kevinday193;AI can replace pretty much all tasks and soon can replace mankind and make the earth whole again.;2023-07-14T17:57:51Z;1;;AI can replace pretty much all tasks and soon can replace mankind and make the earth whole again.;ai replace pretty much task soon replace mankind make earth whole;0.8830000162124634;Positive
UCTMO3A9_P-PgRAr1oU2twdQ;@hle144;You mean Skynet…;2023-07-18T04:31:52Z;1;UCgJ19001fs5W3SHNgvMQZPg;You mean Skynet;mean skynet;-0.020999999716877937;Negative
UCRxMnwtT4BJ_AATcnDaRV5Q;@marsyu5816;禁止套娃😂;2023-07-24T00:26:50Z;1;UCgJ19001fs5W3SHNgvMQZPg;;;0.0;Negative
UCYGLWzS3pjP69Y0R-qtdvzg;@whymeeee;AI wont replace your job an human with the help of AI WILL;2023-07-10T11:47:38Z;1;;AI will not replace your job a human with the help of AI WILL;ai not replace job human help ai;0.14300000667572021;Negative
UCAwsU7CvSDeCVVS05nbSmyQ;@demodiums7216;"doesn&#39;t really make much of a difference frankly";2023-08-17T16:26:52Z;1;UCYGLWzS3pjP69Y0R-qtdvzg;does not really make much of a difference frankly;not really make much difference frankly;-0.6800000071525574;Negative
UCWTmkdY4i98Bd8apcjLtHLw;@jdzzz7;"yes but don&#39;t you think people that work repetitively on a certain task classified as something or the current AI can replace?";2023-07-15T07:18:29Z;1;UCywowJiDxQtNMhJHaHgAERQ;Yes but do not you think people that work repetitively on a certain task classified as something or the current AI can replace?;yes not think people work repetitively certain task classify something current ai replace;-0.15600000321865082;Negative
UCz1wAUEMBmgvs9u_0avLwGw;@galaxy1234;You are underestimating. AI is rapidly improving;2023-12-28T17:36:47Z;1;UCywowJiDxQtNMhJHaHgAERQ;You are . AI is rapidly improving;ai rapidly improve;0.5090000033378601;Positive
UCSShYvR24nG_vOP9lmSIDZA;@jezza4193;AI to run anti money laundering programs at HSBC? What a joke. HSBC is where dirty money gets laundered.;2023-07-09T21:51:06Z;1;;AI to run anti money laundering programs at HSBC? What a joke. HSBC is where dirty money gets laundered.;ai run anti money laundering program hsbc joke hsbc dirty money get launder;-0.6140000224113464;Negative
UCQWKJg4EK_cBrO7EignO9aQ;@LWRC;"We need AI to replace the college age cashiers at restaurants who don&#39;t know how to give correct change without the computer register telling them the correct number!!!";2023-07-09T10:17:39Z;1;;We need AI to replace the college age cashiers at restaurants who do not know how to give correct change without the computer register telling them the correct number!!!;need ai replace college age cashier restaurant not know give correct change computer register tell correct number;-0.8610000014305115;Negative
UCO7ujq7MKbF7vQjhe37bH8g;@jackmorrow-zhang9106;Yes. There will always be a need for human intelligence to solve complex problems. New jobs will arise in the future.;2023-07-10T10:39:26Z;1;UCX8AaRyFciTPHUvNEXsnAEg;Yes. There will always be a need for human intelligence to solve complex problems. New jobs will arise in the future.;yes always need human intelligence solve complex problem new job arise future;0.4410000145435333;Negative
UCBPe0hiIRs_oCZN46EKSarg;@antorsaha4771;wow;2023-07-07T16:22:12Z;1;;wow;wow;0.9390000104904175;Positive
UCFg58l_S0f59A2i16sN-U9A;@-schattenpflanze-3755;@@gilian2587 it really hasnt, capitalism is a 19th century thing. Currently we are Latestagecapitalism. Which means it shouldnt take long for something to happen that finishes capitalism off in most countries or globally althogether as an economic system.;2023-07-08T13:16:55Z;1;UCQGzBiGrluMiJ5iwzAHtUag;It really has not , capitalism is a 19th century thing. Currently, we are . Which means it shouldn't take long for something to happen that finishes capitalism off in most countries or globally altogether as an economic system.;really not capitalism th century thing currently mean n't take long something happen finish capitalism country globally altogether economic system;-0.48899999260902405;Negative
UC8TSFYKS9zruGz0siIflKFw;@vinaykumar-ld3yi;Only Stupid middle class people think of having children even after seeing this video and Automation.;2023-07-07T02:41:07Z;1;;Only Stupid middle class people think of having children even after seeing this video and Automation.;stupid middle class people think child even see video automation;-0.9200000166893005;Negative
UCrCVf0JjPEozxt6WzxBIfyQ;@g0d182;oh my;2023-07-07T01:34:54Z;1;;oh, my;;0.22300000488758087;Negative
UCYKCxTd_asmLphF1WmPss4A;@rhemy1;Cutting out human error, but still keeping the usual racism. Lol.;2023-07-06T12:59:41Z;1;;Cutting out human error, but still keeping the usual racism. laughing out loud.;cut human error still keep usual racism laugh loud;0.27399998903274536;Negative
UCumzktl6xF3LlwFTnxvsOqg;@ArnoldVeeman;"@@channeling764 me too ;-)";2023-07-13T11:38:10Z;1;UCumzktl6xF3LlwFTnxvsOqg;Me too;;0.04800000041723251;Negative
UC4Fmb7O0lF_dvU1ODOu1kWw;@spazzmaticus1542;Should have written better scripts for the past decade lol. No one is weeping for you.;2023-07-05T17:04:40Z;1;;Should have written better scripts for the past decade laugh out loud. No one is weeping for you.;write well script past decade laugh loud one weep;-0.6869999766349792;Negative
UCpU-tESX5PLt_2XdQ8lWxdg;@user-hz6mc6yd9i;"Humanity should not solely dependent on AI&#39;s assistance. AIs could be utilized in a particular field/sector/service only. AIs could be used in space appliances to move faster towards other planets or its moons and make it habitable to settle there and create alien life.<br>...@dvparab";2023-07-05T11:48:03Z;1;;Humanity should not solely dependent on AI .assistance. AIs could be utilized in a particular field sector service only. AIs could be used in space appliances to move faster towards other planets, or it is moons and make it habitable to settle there and create alien life. ...;humanity not solely dependent ai .assistance ai utilize particular field sector service ai use space appliance move faster planet moon make habitable settle create alien life;0.04800000041723251;Negative
UCj_pVlyfGk3vSBvoHJnzbig;@PraetorianAU;"LOL I&#39;m sorry but with your crazy ultra capitalistic economy, the battle has already been lost. The laws have been twisted most worker protections eroded away over decades. Good luck getting them back when it&#39;s you against the billions of dollars given to lobbyists to keep the status quo.";2023-07-05T02:26:47Z;1;;LOL I m sorry but with your crazy ultra capitalistic economy, the battle has already been lost. The laws have been twisted most worker protections eroded away over decades. Good luck getting them back when it .you against the billions of dollars given to lobbyists to keep the status quo.;lol sorry crazy ultra capitalistic economy battle already lose law twist worker protection erode away decade good luck get back .you billion dollar give lobbyist keep status quo;-0.8960000276565552;Negative
UChSvrPDNjI33AaObx5CE3yQ;@extremelynice;You can ask it whatever you want, the AI is written by people and does only what people had put in it. Stupid people write stupid algorithms and then stupid people are adopting those stupid algorithms. Do you see the pattern? Should I even continue? How about you stop being stupid for starters?;2023-07-05T04:44:56Z;1;UC7tNP4viHH86sDUwUxDgzUQ;You can ask it whatever you want, the AI is written by people and does only what people had put in it. Stupid people write stupid algorithms and then stupid people are adopting those stupid algorithms. Do you see the pattern? Should I even continue? How about you stop being stupid for starters?;ask want ai write people people put stupid people write stupid algorithm stupid people adopt stupid algorithm see pattern even continue stop stupid starter;-0.46700000762939453;Negative
UCytaKijEMQkTMI84YwUsgUQ;@gilian2587;"Here&#39;s two people thinking with their noggins!";2023-07-07T18:25:17Z;1;UCjpomXWmd6-I5i6n2vjCYtA;Here .two people thinking with their noggins!;.two people think noggin;0.08900000154972076;Negative
UCK897dt3AQPRgiqlHq_623w;@aiblackmirror;"It is gonna replace lot&#39;s of people  , I am not a professional I am just having fun with AI and it&#39;s already can make so much...";2023-07-04T16:03:30Z;1;;It is going to replace lot .of people , I am not a professional I am just having fun with AI and it .already can make. Much...;go replace lot .of people not professional fun ai .already make much;0.19200000166893005;Negative
UCpVRah3MU4WbdA_IXJ0Jhlw;@donaldbowler4514;"no, they would literally just work on different engineering problems. That&#39;s not how ai or the current chatgpt works.";2023-07-06T14:05:57Z;1;UCgsBdHncBSvVTuqt266cyNg;No, they would literally just work on different engineering problems. That .not how AI or the current ChatGPT works.;literally work different engineering problem .not ai current chatgpt work;-0.027000000700354576;Negative
UChSvrPDNjI33AaObx5CE3yQ;@extremelynice;There are no programs that have such capabilities. And never will be...;2023-07-04T14:26:28Z;1;UCgnEEV2-yeUwRDANn0u0JBQ;There are no programs that have such capabilities. And never will be...;program capability never;0.03700000047683716;Negative
UChSvrPDNjI33AaObx5CE3yQ;@extremelynice;"It&#39;s unimaginably worse, to be honest. AI is just completely useless for anybody involved.";2023-07-04T14:51:59Z;1;UC6fMDIAljI8JT5nprWHKUVw;It .unimaginably worse, to be honest. AI is just completely useless for anybody involved.;.unimaginably worse honest ai completely useless anybody involve;-0.5920000076293945;Negative
UCytaKijEMQkTMI84YwUsgUQ;@gilian2587;Maybe... you can still rely on people to make a mess of their own internal systems.;2023-07-07T18:27:38Z;1;UCTQz-noXbrgUxi24bxilcfQ;Maybe... you can still rely on people to make a mess of their own internal systems.;maybe still rely people make mess internal system;-0.9610000252723694;Negative
UCoqyfZYQDEMb2HGMa06Nunw;@leeanucha;AI is destroying creativity of new generations. Soon ppl won’t even know how to think. The population will be 90% with monkey brains;2023-07-04T10:30:20Z;1;;AI is destroying creativity of new generations. Soon people will not even know how to think. The population will be 90 with monkey brains;ai destroy creativity new generation soon people not even know think population monkey brain;-0.8259999752044678;Negative
UCOKvIDOu6SC9zS1z_aNIpbA;@ARTIFICIALINTELLIGENCE373;Very good video.;2023-07-04T07:55:42Z;1;;Very good video.;good video;0.9390000104904175;Positive
UCLWjptpHf4G7R7G62pK-JRw;@rameshg2717;Reducing cost means, reducing salaries and lost jobs. Technology companies are digging their own grave. Their entire business model is based on booming economy. How will economy work without humans in jobs?? Communism was created because of exploitation of workers. I guess it will rise again.;2023-07-04T06:12:30Z;1;;Reducing cost means, reducing salaries and lost jobs. Technology companies are digging their own grave. Their entire business model is based on booming economy. How will economy work without humans in jobs?? Communism was created because of exploitation of workers. I guess it will rise again.;reduce cost mean reduce salary lose job technology company dig grave entire business model base boom economy economy work human job communism create exploitation worker guess rise;-0.36800000071525574;Negative
UCEOtj3OctAlDsPPl_1ZrDnw;@BoRerunn;Jobs in the future will require Doctorate or Masters degree...... But here comes socialism;2023-07-04T02:18:51Z;1;;Jobs in the future will require Doctorate or Master s degree...... But here comes socialism;job future require doctorate master .degree ...... come socialism;-0.9409999847412109;Negative
UChSvrPDNjI33AaObx5CE3yQ;@extremelynice;"That&#39;s a long way from doing 0% of useful work as for now, and creating an infinite amount of problems.";2023-07-04T14:42:22Z;1;UCdOvggdQSQFyW73VgGD3Tcg;That .a long way from doing 0 of useful work as for now, and creating an infinite amount of problems.;.a long way useful work create infinite amount problem;-0.4309999942779541;Negative
UCn1KSEN_xRN1yFCFaeD2z8g;@winzyl9546;Yes we can, just google it youll know the weather tomorrow.;2023-07-04T11:37:47Z;1;UCgAdkXaTTPlr-wJjx4xcH9w;Yes we can, just google it you will know the weather tomorrow.;google know weather tomorrow;0.07900000363588333;Negative
UCZggO1tBsWHl4t-gA0F-Lbw;@manonamission2000;Consultants should be concerned;2023-07-03T22:34:31Z;1;;Consultants should be concerned;consultant concern;-0.8140000104904175;Negative
UCytaKijEMQkTMI84YwUsgUQ;@gilian2587;"He&#39;s getting kinda aged these days, isn&#39;t he?";2023-07-07T18:26:17Z;1;UC9ZBrlGS4t4hXHykYmFqTww;He .getting kind of aged these days, is not he?;.getting kind age day not;-0.2619999945163727;Negative
UC9ZBrlGS4t4hXHykYmFqTww;@lambertois11;@@gilian2587 <br>Contrary to good wines that are getting better with age, this old man is getting BITTER with age !;2023-07-07T23:37:43Z;1;UC9ZBrlGS4t4hXHykYmFqTww;Contrary to good wines that are getting better with age, this old man is getting BITTER with age !;contrary good wine get well age old man get bitter age;-0.7630000114440918;Negative
UCG4dLvYvM4NKT3AUYNaaXtw;@demman8081;"@@windingstars I was gonna say the same thing. They already gave corporations the right to act as humans in some cases, so why won&#39;t the people who pulled that off be able to pull off the same for A.I. Not that I am saying that would be a good thing but...";2023-07-04T06:20:05Z;1;UC_H7NIVPEkw2Or_uMw2glow;I was going to say the our thing. They already gave corporations the right to act as humans in some cases, Why will not the people who pulled that off be able to pull off the our for A.I. Not that I am saying that would be a good thing but...;go say thing already give corporation right act human case not people pull able pull a.i not say good thing;-0.4399999976158142;Negative
UChSvrPDNjI33AaObx5CE3yQ;@extremelynice;The works themselves are useless. Why do you need copyrights for useless works?;2023-07-04T14:34:43Z;1;UC_H7NIVPEkw2Or_uMw2glow;The works themselves are useless. Why do you need copyrights for useless works?;work useless need copyright useless work;-0.8759999871253967;Negative
UChSvrPDNjI33AaObx5CE3yQ;@extremelynice;"Because AI doesn&#39;t work... Otherwise yes, they would totally do that.";2023-07-04T14:50:24Z;1;UCcKH96svgUOVy4l_Ltno7IQ;Because AI does not work... Otherwise, yes, they would totally do that.;ai not work otherwise totally;-0.35100001096725464;Negative
UCs9_encJXkHHSMQKo3U6XoA;@auro1986;artificial intelligence does not need shirt to check what is colour of collar;2023-07-03T16:49:36Z;1;;Artificial intelligence does not need shirt to check what is color of collar;artificial intelligence not need shirt check color collar;0.08100000023841858;Negative
UCn1KSEN_xRN1yFCFaeD2z8g;@winzyl9546;​@@MrNote-lz7lhyou want ai to make law? Who decides what data will the law ai be trained on? Can we include mein kampf?;2023-07-04T11:36:57Z;1;UCWimxwamgJ6L7Ld2ICXP7Tg;Want AI to make law? Who decides what data will the law AI be trained on? Can we include Mein Kampf?;want ai make law decide data law ai train include mein kampf;-0.03400000184774399;Negative
UC2wwY7Ll-FAWFxRyUjmddZg;@Hindu_Ram121;@@ChadHutsebautfilms housing crisis can be averted by simply closing the borders and stopping immigration. Infact many current crisis can be stopped.;2023-07-04T08:27:49Z;1;UCHRKfEI2H5aI5K-1aVR4kNQ;Housing crisis can be averted by simply closing the borders and stopping immigration. In fact many current crises can be stopped.;housing crisis avert simply close border stop immigration fact many current crisis stop;0.01600000075995922;Negative
UCqpXF2Il3NTn9kvbczswa5A;@Matt-rw9py;Smart but what if AI has neo-nazi and environmentalist political views and would decide to exterminate 99% of the population?;2023-07-03T21:26:43Z;1;UCOqYFxugh1fVMpJubC8mqVQ;Smart but what if AI has neo Nazi and  political views and would decide to exterminate 99 of the population?;smart ai neo nazi political view decide exterminate population;-0.5180000066757202;Negative
UCZZl1I6p_VuCgt0ugfpDL7A;@superandreanintendo;"And still many won&#39;t get it now";2023-07-03T20:44:44Z;1;UCANuNFF8d-505_3KIB7PLIw;And still many will not get it now;still many not get;-0.8870000243186951;Negative
UCJNIrXmCRLNE6A-Pis7Mg6A;@Mr.Anugraha;😂 yeah;2023-07-03T15:36:37Z;1;UCgFEtnLSNFEbHUqYmKIwXbQ;Yeah;yeah;0.08500000089406967;Negative
UChSvrPDNjI33AaObx5CE3yQ;@extremelynice;Emm... Do you even have some basic human intelligence? I mean you’re writing total nonsense here.;2023-07-04T17:53:11Z;1;UCErvxxslh89XI4I94IUL8fg;EMM... Do you even have some basic human intelligence? I mean you are writing total nonsense here.;emm even basic human intelligence mean write total nonsense;-0.6200000047683716;Negative
UC9E_tsUzWITHQBOBTDFsTSw;@lolcatjunior;AI today is not intellegent its just a series of very fast mathematical calculations/algorithms.;2023-07-06T00:56:51Z;1;UCErvxxslh89XI4I94IUL8fg;AI today is not intelligent it is just a series of very fast mathematical calculations algorithms.;ai today not intelligent series fast mathematical calculation algorithms;-0.6159999966621399;Negative
UCIL0vs8Rgo6pORpHOSAUyuQ;@fintech1378;Yes, but extremely huge amount of workers will be made redundant in the short and medium term, only in the long term things will reach new equilibrium;2023-07-03T19:43:03Z;1;UCrFwpHFNs4ASednR8YAV5-w;Yes, but extremely huge amount of workers will be made redundant in the short and medium term, only in the long term things will reach new equilibrium;extremely huge amount worker make redundant short medium term long term thing reach new equilibrium;-0.8550000190734863;Negative
UChSvrPDNjI33AaObx5CE3yQ;@extremelynice;"Because AI doesn&#39;t work.";2023-07-04T15:57:27Z;1;UCrFwpHFNs4ASednR8YAV5-w;Because AI does not work.;ai not work;-0.9110000133514404;Negative
UChSvrPDNjI33AaObx5CE3yQ;@extremelynice;@@oldhollywoodbriar Your pitiful fears are almost as damaging as the false hopes about AI. And all hopes for AI are false, as much as all the fears around it are pitiful.;2023-07-05T04:54:29Z;1;UCrFwpHFNs4ASednR8YAV5-w;Your pitiful fears are almost as damaging as the false hopes about AI. And all hopes for AI are false, as much as all the surrounding fears are pitiful.;pitiful fear almost damaging false hop ai hope ai false much surround fear pitiful;-0.9139999747276306;Negative
UCv_n1I4nhaRdvP2MXBohdxA;@maddmaxwiththefacts601;Ai can’t do appliance repair so I’m safe lol 😂;2024-04-17T02:27:49Z;0;;Ai can not do appliance repair. I am safe laugh out loud;ai not appliance repair safe laugh loud;0.05999999865889549;Negative
UCv-jHU9MLlEnEmlax1YfVPg;@sanujitroy6830;only quality candidates and not quantity;2024-04-01T16:21:44Z;0;;Only quality candidates and not quantity;quality candidate not quantity;-0.027000000700354576;Negative
UC3n5nSbibMaIxA6HUsr05Lw;@jeffrosati2570;"&quot;When Chuck Schumer speaks, no one listens.&quot;";2024-02-25T04:00:06Z;0;;When Chuck Schumer speaks, no one listens.;chuck schumer speaks one listen;-0.8899999856948853;Negative
UCI-ypqLur4iqSEd6W_RcFzQ;@maureenparisi5808;To remove business decision workers who work independently outside of systems and subsystems and internally within enterprise utilizing public facing and corporate admins to identify weakness <del>retrain</del> and recovery any/ all cash.;2024-01-29T06:35:20Z;0;;To remove business decision workers who work independently outside of systems and subsystems and internally within enterprise utilizing public facing and corporate admins to identify weakness retrain del and recovery any all cash.;remove business decision worker work independently system subsystem internally enterprise utilize public facing corporate admins identify weakness retrain del recovery cash;0.008999999612569809;Negative
UCkA9d8sTpEciX8QCo0mknjw;@davidecappelli9961;I’m just concerned. Very few rich will get richer, the rest will get catastrophically poorer and miserable.;2023-11-29T00:53:12Z;0;;I am just concerned. Very few riches will get richer, the rest will get  poorer and miserable.;concern rich get richer rest get poor miserable;-0.7870000004768372;Negative
UCvhhyU8c6x337Ge9sls10vw;@MikaJarvi86;bla bla bla;2023-11-10T19:32:19Z;0;;Bla BLA BLA;bla bla bla;-0.828000009059906;Negative
