id;name;text;time;likes;reply;CleanedText;ProcessText;SentimentScore;ActualLabel
UCXDXr0Y9pKAfSci8S241kGg;@JohnPatersonAu;"I didn&#39;t know Jon Stewart was back! (I&#39;m in Australia) This is awesome! He is the funniest guy ever! 👍👍👍👍👍👍";2024-04-26T10:22:47Z;5;;I did not know Jon Stewart was back! I m in Australia This is awesome! He is the funniest guy ever!;not know jon stewart back australia awesome funny guy ever;0.8479999899864197;Positive
UC9WodL6yA1rEaIVSFVLfDyg;@karolinawww6834;"I lost my job last week because of AI. I&#39;m a translator and my bosses decided that it&#39;s better to have AI doing an ok job than an actual human even correcting it. It was never my dream job but still, a bit surreal";2024-04-22T07:49:04Z;2;;I lost my job last week because of AI. I m a translator and my bosses decided that it .better to have AI doing an ok job than an actual human even correcting it. It was never my dream job but still, a bit surreal;lose job last week ai translator boss decide .better ai ok job actual human even correct never dream job still bit surreal;-0.25600001215934753;Negative
UCk0KG_t3q7MundAgukvWwUA;@AlexW1495;So now you have 2 restaurants with half the clientele, and, in your fantasy, even with lower prices. Do you not see the absurdity of your idea?;2024-04-21T00:35:37Z;2;UCMTP8mZmgTEZ2ImR2v2r6yg;So now you have 2 restaurants with half the clientele, and, in your fantasy, even with lower prices. Do you not see the absurdity of your idea?;restaurant clientele fantasy even low price not see absurdity idea;-0.7979999780654907;Negative
UCVu7uZiEdE-7r4TaTtw3vKg;@Shevock;AI is merely the theft of intellectual property. As a person who does research in my field and publishes, I say I refuse to cooperate with the theft of my intellectual property without reference to me every time. And yet it still steals. It is designed to steal in the same way translation apps stole from language scholars. Lots of labor not being referenced.;2024-04-20T09:05:01Z;2;;AI is merely the theft of intellectual property. As a person who does research in my field and publishes, I say I refuse to cooperate with the theft of my intellectual property without reference to me every time. And yet it still steals. It is designed to steal in the our way translation apps stole from language scholars. Lots of labor not being referenced.;ai merely theft intellectual property person research field publishes say refuse cooperate theft intellectual property reference time yet still steal design steal way translation apps stole language scholar lot labor not reference;-0.8980000019073486;Negative
UCGgkHyFTAW28Y4U_B2I0cDA;@edwardbrennan3963;And when AI starts spitting out bad data without enough people to check the work, they will blame the remaining workers for not spotting it;2024-05-07T18:43:37Z;1;;And when AI starts spitting out bad data without enough people to check the work, they will blame the remaining workers for not spotting it;ai start spit bad data enough people check work blame remain worker not spot;-0.902999997138977;Negative
UC8RkjoWtXm313kTqIK7LXbw;@thedude7319;these people are just religious zealots but for ai;2024-04-23T13:15:25Z;1;;These people are just religious zealots but for AI;people religious zealot ai;-0.8190000057220459;Negative
UC4WdMBzfMIbKHXw3_VCwWiQ;@nwlk9262;AI = All Indian + Mark Zuckerberg;2024-04-23T07:20:13Z;1;;AI All Indian Mark Zuckerberg;ai indian mark zuckerberg;0.024000000208616257;Negative
UC3kNatlvEY8MIAmH7Wm5y-g;@jensboettiger5286;"&quot;AI&quot; is just Clippy with a bigger database. Useless and annoying";2024-04-21T16:04:36Z;1;;AI is just Clippy with a bigger database. Useless and annoying;ai clippy big database useless annoy;-0.8019999861717224;Negative
UCk0KG_t3q7MundAgukvWwUA;@AlexW1495;Stop it by any and all means? Being a defeatist traitor helps no one.;2024-04-21T00:36:03Z;1;UCULfHhqw4pGNHn0AhWuAloA;Stop it by any and all means? Being a defeatist traitor helps no one.;stop mean defeatist traitor help one;-0.6990000009536743;Negative
UCmj1qc7v7M-Tc7Td9qtbojA;@LordSlag;Sometimes, I come back here and listen to this just to drink Luddite tears.  Evolve...or go extinct.;2024-04-20T05:44:50Z;1;;Sometimes, I come back here and listen to this just to drink Luddite tears. Evolve...or go extinct.;sometimes come back listen drink luddite tear evolve go extinct;0.08900000154972076;Negative
UC4vK6EFGLz6qUPmZ-dBPYSw;@cherubin7th;So far AI turned into just better google, better stock photos, and better lsp for coding.;2024-04-19T20:22:21Z;1;;So far AI turned into just better google, better stock photos, and better LSP for coding.;far ai turn good google good stock photo good lsp cod;0.8930000066757202;Positive
UCClQ8BbZQVt2Zq8Y71eMb2A;@fredygump5578;"AI&#39;s potential to relay the contents of Wikipedia to us....  Wake me up when we &quot;actually&quot; invent AI.";2024-04-18T22:30:21Z;1;;AI .potential to relay the contents of Wikipedia to us.... Wake me up when we actually invent AI.;ai .potential relay content wikipedia .... wake actually invent ai;0.10100000351667404;Negative
UCLoYCOP7ViQ91O8M_t8xM6Q;@_Kaurus;Just maybe, Ai will make this show funny.  I nearly laughed at the Biden joke...almost had me.;2024-04-17T17:38:29Z;1;;Just maybe, Ai will make this show funny. I nearly laughed at the Biden joke...almost had me.;maybe ai make show funny nearly laugh biden joke almost;0.36500000953674316;Negative
UC--smPGvgpcxHcc0OegOz5Q;@lamaistul;Jon Stewart is the voice of reason.;2024-04-16T15:21:06Z;1;;Jon Stewart is the voice of reason.;jon stewart voice reason;0.7580000162124634;Positive
UCEPs6J8y8aE8KBXZGZbbbRQ;@drewb6107;"The only thing left on the planet will be corporations and CEOs. They will pay their prompt engineers just enough to eat and live in a box while the majority of profits and revenue will go towards company &#39;growth&#39; and the small group of people that are arrogant enough to think they can decide what&#39;s best for everyone. Oh and they will never cure anything that will hurt the pharmaceutical business so don&#39;t worry, cancer, heart disease and anything that is expensive to treat is here to stay. <br><br>A.I. is More important than fire and electricity? Does A.I. run on magic? What the f are we even doing? This is WRONG. America has lost it&#39;s way and we are lulled into a sense of security by the very thing that is going to destroy us and it&#39;s pedaled by the dubious creators who designed it SPECIFICALLY TO ELIMINATE THE NEED TO PAY PEOPLE A HONEST LIVING WAGE. <br><br>COVID proved americans do not have the spine to stand up and question things. This is the beginning of the end.";2024-04-15T17:43:37Z;1;;The only thing left on the planet will be corporations and CEOs. They will pay their prompt engineers just enough to eat and live in a box while the majority of profit is and revenue will go towards company growth and the small group of people that are arrogant enough to think they can decide what .best for everyone. Oh, and they will never cure anything that will hurt the pharmaceutical business. do not worry, cancer, heart disease and anything that is expensive to treat is here to stay. A.I. is More important than fire and electricity? Does A.I. run on magic? What the f are we even doing? This is WRONG. America has lost it .way, and we are lulled into a sense of security by the very thing that is going to destroy us and it .pedaled by the dubious creators who designed it SPECIFICALLY TO ELIMINATE THE NEED TO PAY PEOPLE A HONEST LIVING WAGE. COVID proved Americans do not have the spine to stand up and question things. This is the beginning of the end.;thing leave planet corporation ceo pay prompt engineer enough eat live box majority profit revenue go towards company growth small group people arrogant enough think decide .best everyone never cure anything hurt pharmaceutical business not worry cancer heart disease anything expensive treat stay a.i important fire electricity a.i run magic f even wrong america lose .way lull sense security thing go destroy .pedaled dubious creator design specifically eliminate need pay people honest living wage covid prove american not spine stand question thing beginning end;-0.597000002861023;Negative
UCLK8zbt1wiYh0kJrA5zAtrw;@stuartkosh9179;Funny... this is basically Ted Kazinskis manifesto;2024-04-15T17:27:29Z;1;;Funny... this is basically Ted Kaczynski manifesto;funny basically ted kaczynski manifesto;0.2590000033378601;Negative
UCML9sCXwr2f8hUI6JD3Mg0w;@876_FIRE;Anyone that can throw coal into a furnace can vote an AI ignoramus out.;2024-04-15T17:11:34Z;1;;Anyone that can throw coal into a furnace can vote an AI ignoramus out.;anyone throw coal furnace vote ai ignoramus;-0.7639999985694885;Negative
UCQfxrW0_BPCHXm6m2T9CFtw;@halfwall;"The point should be that AI can achieve its utopian potential IF its in the hands of the people and/or workers, and is open and transparent for all to use. In the hands of Microsoft et al it&#39;ll just replace jobs and generate profit.";2024-05-07T18:21:39Z;0;;The point should be that AI can achieve it is utopian potential IF it is in the hands of the people and or workers, and is open and transparent for all to use. In the hands of Microsoft et al. it ll just replace jobs and generate profit.;point ai achieve utopian potential hand people worker open transparent use hand microsoft al replace job generate profit;-0.2280000001192093;Negative
UCtODpHHsBm4tTRuxBqzV-oQ;@DELPHIIII;"I mean he&#39;s wrong on everything, but he&#39;s still funny lol";2024-05-07T17:14:59Z;0;;I mean he .wrong on everything, but he .still funny laugh out loud;mean .wrong everything .still funny loud;0.2199999988079071;Negative
UCHWKrIrhejWiH6kdOsDdoTQ;@user-cb5iy9cf9p;Are they using cultural differences to avoid stereotypes...waooo;2024-05-06T13:59:48Z;0;;Are they using cultural differences to avoid stereotypes...wazoo;use cultural difference avoid stereotype wazoo;-0.2770000100135803;Negative
UCQ68NMbtZvE4oyCWjDFyzmA;@scottdavis4439;"This show is garbage, same for his protege&#39;s show. Leftist trash all around.";2024-05-06T11:41:32Z;0;;This show is garbage, our for his protégé .show. Leftist trash all around.;show garbage protégé .show leftist trash;-0.5920000076293945;Negative
UC73cMPJr6SQUcHEiKIkJ4HQ;@nomadiccellar9532;"Love you Jon, but you are so far off here it&#39;s ridiculous. Start getting your head around the idea of Post Labor Economics...Most jobs are going to disappear, simple as that.";2024-05-06T09:36:24Z;0;;Love you Jon, but you are. Far off here it .ridiculous. Start getting your head around the idea of Post Labor Economics... Most jobs are going to disappear, simple as that.;love jon far .ridiculous start get head idea post labor economics job go disappear simple;-0.30399999022483826;Negative
UC1zFbjGUSvVV9gqscWqGNFQ;@mk91-vz1oj;Can he give any historical examples of when technology made life worse?;2024-05-06T06:29:20Z;0;;Can he give any historical examples of when technology made life worse?;give historical example technology make life worse;-0.7200000286102295;Negative
UC1zFbjGUSvVV9gqscWqGNFQ;@mk91-vz1oj;"So uninformed it&#39;s embarrassing";2024-05-06T06:28:11Z;0;;So uninformed it .embarrassing;uninformed .embarrassing;-0.44200000166893005;Negative
UCV0mjsjbtCxCWR0uurxyaSg;@k.c.simonsen2;"Yeah I&#39;ve spent a lot of time researching AI and how it will effect our world and let me tell ya... it&#39;s more frightening that it sounds. And the experts know very little about what&#39;s gonna come which is.. comforting.";2024-05-06T04:31:17Z;0;;Yeah, I ve spent a lot of time researching AI and how it will affect our world and let me tell ya... it .more frightening that it sounds. And the experts know very little about what .going to come which is. Comforting.;yeah spend lot time research ai affect world let tell .more frighten sound expert know little .going come comfort;-0.12099999934434891;Negative
UC3w0QvZYkmQSk52Dkd5wVzQ;@timothyjholloway;"Jon Stewart isn&#39;t funny anymore.";2024-05-06T02:46:51Z;0;;Jon Stewart is not funny anymore.;jon stewart not funny anymore;-0.8880000114440918;Negative
UCFR-zISDjUff5HueubqWU4A;@pennyserenade192;"I don&#39;t agree with everything that Jon says, but he&#39;s amazing and funny as sh**. But I feel cheated bc I thought he was coming back for real but it was just on certain days of the week. Or, one day per week or month or something...😢";2024-05-05T19:44:10Z;0;;I do not agree with everything that Jon says, but he .amazing and funny as. . But I feel cheated bc I thought he was coming back for real, but it was just on certain days of the week. Or, one day per week or month or something...;not agree everything jon say .amazing funny feel cheat bc think come back real certain day week day week month something;-0.027000000700354576;Negative
UCGlcug9JXtuPF3G7SdBjKUQ;@alexandershvets6381;John Steward for presidnt 2025;2024-05-05T05:31:25Z;0;;John Steward for president 2025;john steward president;0.2070000022649765;Negative
UCwTKEE4g0Dw-y0ijmR0BFZw;@ItsMrMetaverse;John Stewart does not understand ai or what it is, not even close.;2024-05-04T19:00:09Z;0;;John Stewart does not understand AI or what it is, not even close.;john stewart not understand ai not even close;-0.906000018119812;Negative
UCJajasQKEIAAkKBUOz5aEdQ;@alannaramone3821;Ai will be the end of us all. Fiction is truth on this one!;2024-05-04T17:43:29Z;0;;Ai will be the end of us all. Fiction is truth on this one!;ai end fiction truth;-0.03200000151991844;Negative
UCpwr040trLfMM6r_qfoyODw;@theghostofalsimmons5737;"You couple this with growing population and a steady increase in inflation and the future is looking bleak for the average American. More people, less jobs and higher cost of living. That&#39;s a winning recipe right there. Revolution loading.....or maybe not we&#39;ll see 🤷🏾‍♂️";2024-05-04T13:43:23Z;0;;You couple this with growing population and a steady increase in inflation and the future is looking bleak for the average American. More people, fewer jobs and higher cost of living. That .a winning recipe right there. Revolution loading.....or maybe not we ll see;couple grow population steady increase inflation future look bleak average american people job high cost living .a win recipe right revolution load maybe not see;-0.24500000476837158;Negative
UCOE_j3GnG3_pLzQ0MIMW2PA;@BEACHDUDE71;This country is doomed 😂;2024-05-04T04:36:34Z;0;;This country is doomed;country doom;-0.9380000233650208;Negative
UCJR27qGU1qUE9HdIosySVGQ;@nicholasdegarmo2415;Jon! Your so amazing! Thank you for coming back! We need you brotha!!;2024-05-04T02:52:08Z;0;;Jon! Your. Amazing! Thank you for coming back! We need you broth!!;jon amazing thank come back need broth;0.5989999771118164;Positive
UCxAPqVYBiE5hBkNeT0dimbg;@JohnJayAveryIII;Jon Stewart is only funnier that Noah Whattisname. Not saying much.;2024-05-03T19:48:41Z;0;;Jon Stewart is only funnier that Noah Whatshisname. Not saying much.;jon stewart funny noah whatshisname not say much;0.27300000190734863;Negative
UCDZ9tMCL4PP68FmCsU6vYRQ;@OfficialKepler62Experiment;100% correct;2024-05-03T18:02:55Z;0;;100 correct;correct;0.6520000100135803;Positive
UCjxgPUWRGcHSvxxadGIBpEw;@DigitalBrooke;You actually have to use AI to beat  hiring systems now. Yes. To GET a job you have to use it.;2024-05-03T13:24:03Z;0;;You actually have to use AI to beat hiring systems now. Yes. To GET a job you have to use it.;actually use ai beat hire system get job use;0.09099999815225601;Negative
UCXuAxg5Xnh2D3nEtVFCOGVw;@nicosnewman6402;😂😂;2024-05-03T07:50:26Z;0;;;;0.0;Negative
UCDAv6I32RYTeWXmvKZ-1tkA;@reallyWyrd;Ty for making this video.;2024-05-03T00:35:05Z;0;;Ty for making this video.;ty make video;0.9549999833106995;Positive
UCUHD7TIVZ5Ay4TPHTPeb8dg;@yeshaya24;"He&#39;s back !";2024-05-02T22:15:31Z;0;;He .back !;.back;0.3409999907016754;Negative
UCpuwrzNFoCKoP4vM3beWytQ;@mike_palms;He’s amazing;2024-05-02T19:59:48Z;0;;He.amazing;he.amazing;0.4749999940395355;Positive
UCAkdtpWOBT-D3Y2mnEHwnxQ;@chromaticfrog7407;Those tech fraudsters are the same people who thought that renaming a taxi dispatch service into “Uber” was an innovation.;2024-05-02T16:40:19Z;0;;Those tech fraudsters are the our people who thought that renaming a taxi dispatch service into Uber was an innovation.;tech fraudsters people think rename taxi dispatch service uber innovation;-0.9340000152587891;Negative
UCs_O3HK4Vw3s8UfuYlgFtVA;@alferro3149;"If Silicone Valley didn&#39;t exist, we would live in a much better world.";2024-05-02T09:36:05Z;0;;If Silicone Valley did not exist, we would live in a much better world.;silicone valley not exist live much good world;0.8500000238418579;Positive
UCXhSI5XUMThKY3277kPD5AQ;@SR-fx5sm;Sam Altman got that crazy Elizabeth Holmes vibe;2024-05-02T01:33:48Z;0;;Sam Altman got that crazy Elizabeth Holmes vibe;sam altman get crazy holmes vibe;-0.4580000042915344;Negative
UC2KF2AyyCB5R02_AUNT1-ag;@Babblesnonstop;"Toast🤣 We&#39;ve got this";2024-05-02T01:17:05Z;0;;Toast We ve got this;toast get;0.22100000083446503;Negative
UCtTaaYX9Jo-a7TIJKKLx6EA;@Matchboxsign39;Brilliant;2024-05-01T17:44:51Z;0;;Brilliant;brilliant;0.9399999976158142;Positive
UCQCQ-eRhSI5ftVhlznoOs4w;@progressmuzenda2530;Jon Stewart is the best;2024-05-01T13:12:20Z;0;;Jon Stewart is the best;jon stewart best;0.9390000104904175;Positive
UC7l7tmt774d2WZs-sXzqpnA;@thomasstecyk792;If you think AI is going to need people to defend it. Eventually AI will be comming for your jobs too. When is the last time P. Biden shoveled coal?;2024-04-30T19:58:40Z;0;;If you think AI is going to need people to defend it. Eventually AI will be coming for your jobs too. When is the last time P. Biden shoveled coal?;think go need people defend eventually ai come job last time p. biden shovel coal;-0.30300000309944153;Negative
UCQAh6ZzM1pHeob-CTDG8noQ;@theoutdoorsinist;"Capitalism&#39;s story ends with two computers on a barren rock sending increasingly large numbers to each other, forever.";2024-04-30T17:16:12Z;0;;Capitalism .story ends with two computers on a barren rock sending increasingly large numbers to each other, forever.;capitalism .story end computer barren rock send increasingly large number forever;-0.07100000232458115;Negative
UCIZN51eD6pXDKXoFct58Agg;@lastagony;So glad this man is back.;2024-04-30T14:51:57Z;0;;So glad this man is back.;glad man back;0.9380000233650208;Positive
UCue_P7v72yycTAGDBFi1fGw;@jay429429;this wont age well :/;2024-04-29T19:48:38Z;0;;This will not age well;not age well;-0.9160000085830688;Negative
UCAk1ik4e43Hd1Q5SnTSEVMA;@ciaojeffitalia;Laughing ourselves into instiction.;2024-04-29T18:59:49Z;0;;Laughing ourselves into institution.;laugh institution;-0.12999999523162842;Negative
UCR4CvmkyRABJv_YAjqKXVJA;@TheGandorX;As many of you are aware, this man is a raging hypocrite. Bye Bye Jon.;2024-04-29T16:56:30Z;0;;As many of you are aware, this man is a raging hypocrite. Bye Bye Jon.;many aware man rag hypocrite bye bye jon;-0.4490000009536743;Negative
UCzmk8kvyh7ZYK5nP0zm6byA;@SamAndrew27;"Although quite recently, AI Agents do <b>already</b> exist. They are the digital equivalent of &quot;prompt engineer.&quot;";2024-04-29T15:31:30Z;0;;Although quite recently, AI Agents do already exist. They are the digital equivalent of prompt engineer.;quite recently ai agent already exist digital equivalent prompt engineer;0.16599999368190765;Negative
UCRAvH6ua_WCS3pCkTlrgEtQ;@goutteoceanique;"I&#39;m happy Jon came back :)";2024-04-29T04:07:33Z;0;;I m happy Jon came back;happy jon come back;0.9430000185966492;Positive
UCRAvH6ua_WCS3pCkTlrgEtQ;@goutteoceanique;“solving climate change” 🙄🤣🤣🤣🤣;2024-04-29T04:02:00Z;0;;Solving climate change;solve climate change;0.3009999990463257;Negative
UCM9V-ZHrADxcc83DfynCj6w;@Jaimes_Bond;"The last 2 minutes of this should be telling to so many Americans,  but it isn&#39;t.";2024-04-29T02:32:12Z;0;;The last 2 minutes of this should be telling to. Many Americans, but it is not .;last minute tell many american not;-0.10700000077486038;Negative
UCfxAOuH8C5Lk5z-b_WM5vLw;@troygarza5720;"The only thing AI will be used for is to subversively enslave humans... That&#39;s literally it";2024-04-28T20:20:20Z;0;;The only thing AI will be used for is to subversively enslave humans... That .literally it;thing ai use subversively enslave human .literally;-0.3070000112056732;Negative
UC9m8GcVr8ohdZ3GDPFfUkvw;@ryanauker1144;The outrage over the Biden decal is amazing;2024-04-28T17:53:42Z;0;;The outrage over the Biden decal is amazing;outrage biden decal amaze;-0.4090000092983246;Negative
UCn4FQcUUtNYQdutsPuMlCng;@igoromelchenko3482;First of all we need to substitute white collar workers and politicians.;2024-04-28T06:31:53Z;0;;First we need to substitute white collar workers and politicians.;first need substitute white collar worker politician;-0.4830000102519989;Negative
UCn4FQcUUtNYQdutsPuMlCng;@igoromelchenko3482;Absolutely, AI will improve the quality of life... buuut, not for everyone. :);2024-04-28T06:22:53Z;0;;Absolutely, AI will improve the quality of life... but, not for everyone.;absolutely ai improve quality life not everyone;0.26600000262260437;Negative
UCBH3w5mstZXRHFZ0Umtd1YQ;@markmanning6542;"John Leibowitz. THEY DON&#39;T WANT THE REALIZATION OF TOTAL HEGEMONY AND SUPREMACY. THE WORLD JEWISH CONGRESS 501 MADISON AVENUE NYC WITH HEADQUARTERS IN 92 COUNTRIES. 1897 THE 1ST WORLD ZIONIST CONGRESS.";2024-04-28T05:26:52Z;0;;John Leibowitz. THEY DON'T WANT THE REALIZATION OF TOTAL HEGEMONY AND SUPREMACY. THE WORLD JEWISH CONGRESS 501 MADISON AVENUE NYC WITH HEADQUARTERS IN 92 COUNTRIES. 1897 THE 1ST WORLD ZIONIST CONGRESS.;john leibowitz n't want realization total hegemony supremacy world jewish congress madison avenue nyc headquarters country st world zionist congress;-0.20600000023841858;Negative
UCJHNg9xPTFWDxKM0AJh4BUA;@robertschworm6036;Jon,<br>Be careful what you wish for - - -you just may get it!!!!!!<br>Bob;2024-04-27T23:09:47Z;0;;Jon, Be careful what you wish for you just may get it!!!!!! Bob;jon careful wish get bob;-0.1080000028014183;Negative
UCtrx2U4h9Fs0y-MkdeNkJ1g;@wizzerdsuntzu;Politicians Without a clue! Whe are F**ked!;2024-04-27T21:35:53Z;0;;Politicians Without a clue! The are F KED!;politician clue f ked;-0.20399999618530273;Negative
UCV54duLeHqELffL0_qGUILQ;@MWhaleK;Ai, giving us all the time in the world while no longer having any money to do anything.;2024-04-27T16:03:35Z;0;;Ai, giving us all the time in the world while no longer having any money to do anything.;ai give time world longer money anything;-0.20900000631809235;Negative
UCV54duLeHqELffL0_qGUILQ;@MWhaleK;UBI anyone?;2024-04-27T16:00:13Z;0;;FBI anyone?;fbi anyone;-0.24500000476837158;Negative
UCP_3aBtvAFydiY-jYoe61SA;@aburnette156;"All Americans are ignorant because we eat this b.S that they&#39;re feeding us";2024-04-27T14:39:07Z;0;;All Americans are ignorant because we eat this b. S that they re feeding us;american ignorant eat b. feed;0.15700000524520874;Negative
UCP_3aBtvAFydiY-jYoe61SA;@aburnette156;Maybe the homeless might have something to say about that elimination of jobs;2024-04-27T14:33:34Z;0;;Maybe the homeless might have something to say about that elimination of jobs;maybe homeless something say elimination job;-0.7179999947547913;Negative
UCP_3aBtvAFydiY-jYoe61SA;@aburnette156;"If you think about it this commentary between Biden. And Trump are somewhat a joke of our natiand the political and a special interest groups are destroying.<br> This country and the Constitution of America.  And that everything&#39;s one big joke";2024-04-27T14:27:00Z;0;;If you think about it this commentary between Biden. And Trump is somewhat a joke of our nation the political and a special interest groups are destroying. This country and the Constitution of America. And that everything .one big joke;think commentary biden trump somewhat joke nation political special interest group destroy country constitution america everything big joke;-0.3269999921321869;Negative
UCEZjURUP6wS068PnSv8JC_g;@williamgoss4691;Just Excellent !!;2024-04-27T08:28:25Z;0;;Just Excellent !!;excellent;0.9380000233650208;Positive
UCyRj7f2eqIlfnZX9nsALImA;@ArtemSichnevyj;th3 is n0 a1;2024-04-27T03:42:56Z;0;;th3 is n0 a1;th n;-0.6010000109672546;Negative
UCFRTxZsaVWxHgsItGAtyjFg;@scotthuffman3462;"Well the whole idea with technology is the reduce the amount of work we have to do, duh.<br>It was inevitable that technology would progress to a point where capitalism isn&#39;t a viable option to maintain society.";2024-04-27T00:28:50Z;0;;Well the whole idea with technology is to reduce the amount of work we have to do, duh. It was inevitable that technology would progress to a point where capitalism is not a viable option to maintain society.;well whole idea technology reduce amount work duh inevitable technology progress point capitalism not viable option maintain society;-0.28200000524520874;Negative
UCu58fVKHGutRwdY-FWyVm_Q;@amd8365;It would be nice if the media would stop calling generative algorithms, AI. They are fundamentally different.;2024-04-26T23:54:51Z;0;;It would be nice if the media would stop calling generative algorithms, AI. They are fundamentally different.;nice medium stop call generative algorithm ai fundamentally different;-0.3619999885559082;Negative
UCs_yN1iOE_xI6xbRhxm3IKw;@LSxEnergetic;Funny propaganda and minor truths;2024-04-26T22:09:59Z;0;;Funny propaganda and minor truths;funny propaganda minor truth;-0.14300000667572021;Negative
UCzDReDhbFEbFxDpJw8CgIzg;@PenguinWithAGuitar;OK Boomer;2024-04-26T18:01:37Z;0;;OK Boomer;ok boomer;-0.5320000052452087;Negative
