id;name;text;time;likes;reply;CleanedText;ProcessText;SentimentScore;ActualLabel
UCdsg4EqM7hZWQwip9O2gx1g;@BoiledKoolaid;Automation replaces labor. Not consumption. As long as human beings drive demand, they will not be replaceable in the economy. Only redefined within it.;2024-03-16T16:42:38Z;3;;Automation replaces labor. Not consumption. As long as human beings drive demand, they will not be replaceable in the economy. Only redefined within it.;automation replaces labor not consumption long human drive demand not replaceable economy redefine;-0.007000000216066837;Negative
UCepsN-O4btK9XG8nSKGIciA;@RufusBurns;"Really wild times we are living in!  We humans still struggle to grasp the concept of exponential growth in a tangible way.  It literally could go from &quot;waiting for the current technology not to suck&quot; to it being &quot;smarter than you will ever be&quot; within 1 or 2  system updates lol. I don&#39;t blame people for having a hard time facing that type of existential  dilemma.  It  really is a lot to deal with cognitively.";2024-03-16T01:14:29Z;3;;Really wild times we are living in! We humans still struggle to grasp the concept of exponential growth in a tangible way. It literally could go from waiting for the current technology not to suck to it being smarter than you will ever be within 1 or 2 system updates laugh out loud. I do not blame people for having a hard time facing that type of existential dilemma. It really is a lot to deal with cognitively.;really wild time live human still struggle grasp concept exponential growth tangible way literally go wait current technology not suck smarter ever system update loud not blame people hard time face type existential dilemma really lot deal cognitively;-0.4359999895095825;Negative
UCYfPJ2drrNfDzB45UzfoMsQ;@EddieThe;Just wait.;2024-03-15T13:50:03Z;3;UCkuJdZhO7N6ZMJPW-CWeX2g;Just wait.;wait;0.028999999165534973;Negative
UCEFK5FP_ZyGO2UpTRYl7Gsw;@johndank2209;thats what you think, until someone from higher up does the math.;2024-03-16T02:49:32Z;3;UCkuJdZhO7N6ZMJPW-CWeX2g;that is what you think, until someone from higher up does the math.;think someone high math;-0.12300000339746475;Negative
UCfzVacv9t_4t_Wcslt7jS7Q;@CausallyExplained;not for long, robots will be building robots and you would never be able to match the cost.;2024-03-16T10:26:35Z;3;UCkuJdZhO7N6ZMJPW-CWeX2g;Not for long, robots will be building robots, and you would never be able to match the cost.;not long robot build robot never able match cost;-0.5070000290870667;Negative
UCN86jMkhebNBm9UoI_yoTnA;@Ausnapify;I hope it takes my job i hate data entry;2024-03-13T10:27:45Z;3;;I hope it takes my job I hate data entry;hope take job hate data entry;-0.7250000238418579;Negative
UCdwxCgoq8JhN5hLqJPMaQFQ;@luisgrod0;"A.I. is a tool for all humans to be more<br>productive, generative &amp; influential.";2024-03-12T21:11:43Z;3;;A.I. is a tool for all humans to be more productive, generative influential.;a.i tool human productive generative influential;0.925000011920929;Positive
UCzUF_iKixBYdAYAtU-LVOuw;@T_Dot94;Modern monetary theory is one of the best ways to push forward the cause of ubi;2024-03-11T02:09:06Z;3;;Modern monetary theory is one of the best ways to push forward the cause of FBI;modern monetary theory best way push forward cause fbi;0.9200000166893005;Positive
UC0va-M5osCUIysW958j-vRw;@jimbojimbo6873;I really hope this becomes a reality;2024-03-09T14:47:38Z;3;;I really hope this becomes a reality;really hope become reality;0.9399999976158142;Positive
UC3EcerKe7dJgTlyQIq1wFeQ;@Ryhamz;120+ IQ programmers retraining into liberal arts will be taking over, not current history major grads, if any of this even happens.<br>A lot of people doing software engineering right now could do many many other things. their focus is just on tech at this moment in time.;2024-03-13T23:26:48Z;3;UCjhfUDqem1h-8F6Y1QPnlQQ;120 IQ programmers retraining into liberal arts will be taking over, not current history major grads, if any of this even happens. A lot of people doing software engineering right now could do many other things. Their focus is just on tech at this moment in time.;iq programmer retrain liberal art take not current history major grad even happen lot people software engineering right many thing focus tech moment time;-0.3630000054836273;Negative
UCk_UtbzKULrjF-vZBlvbAhA;@paulholsters7932;in the mean time on the streets....;2024-03-11T21:43:24Z;3;UCdwmjCADfa6jBoDVGw9eLBw;in the meantime on the streets....;meantime street ....;-0.6349999904632568;Negative
UCAT9FrpdVj21av8LWNAsmDA;@danielbeaird6264;"CEO&#39;S are about to be out of a job, that&#39;s probably the simplest job to replace with AI, but the skilled tradesmen is much more difficult, not only do you need the AI but you also need the robotics. When you can replace the guy lying in a ditch with a ft of mud and water welding out a pipeline with just inches of space to move around in then it might be capable of replacing skilled trades but then again just one of these machines and the AI to go with it would be insanely expensive probably multi billions of dollars... but chat gpt can replace a ceo now for a few bucks";2024-03-22T17:44:25Z;2;;CEO S are about to be out of a job, that .probably the simplest job to replace with AI, but the skilled tradesmen are much more difficult, not only do you need the AI, but you also need the robotics. When you can replace the guy lying in a ditch with a ft of mud and water welding out a pipeline with just inches of space to move around in then it might be capable of replacing skilled trades but then again just one of these machines and the AI to go with it would be insanely expensive probably multi billions of dollars... but ChatGPT can replace a CEO now for a few bucks;ceo job .probably simple job replace ai skilled tradesman much difficult not need ai also need robotics replace guy lie ditch ft mud water weld pipeline inch space move around capable replace skilled trade machine ai go insanely expensive probably multi billion dollar chatgpt replace ceo buck;-0.2630000114440918;Negative
UCEEij0TWriFHRYyo0uY2MZQ;@chetsenior7253;And capitalism will finally implode. Hilarious.;2024-03-21T20:10:46Z;2;;And capitalism will finally implode. Hilarious.;capitalism finally implode hilarious;-0.01600000075995922;Negative
UCJgIMOjGp7puHlWsFOEborA;@tammied1858;"Everyone is entitled to their Opinion. Time will tell. There are other jobs being created to help fill the gaps in AI. I&#39;ll be impressed when AI can spit out a cure a disease.";2024-03-21T03:23:18Z;2;;Everyone is entitled to their Opinion. Time will tell. There are other jobs being created to help fill the gaps in AI. I ll be impressed when AI can spit out a cure a disease.;everyone entitle opinion time tell job create help fill gap ai impress ai spit cure disease;0.3319999873638153;Negative
UCpZYifgdvrmgm3bLSogRLaA;@arefmoin814;"&#39;Automation of Automation&#39; - how will you debug when the automated automation delivers hallucinations?";2024-03-19T17:20:55Z;2;;Automation of Automation how will you debug when the automated automation delivers hallucinations?;automation automation debug automate automation delivers hallucination;-0.49300000071525574;Negative
UCw1aWr9jmQNQaRTgrZzH7vQ;@dertuman;"What makes you think robots can&#39;t be maintained by robots?";2024-03-18T15:19:21Z;2;UCUICQeEBy3iiv-XcDPYJ5Pg;What makes you think robots can not be maintained by robots?;make think robot not maintain robot;-0.05900000035762787;Negative
UCbONIBXq1bO0sgtCS8H9PKw;@mr_smilegaming8842;Andrew Yang has been saying this for a long time! Now the idea of universal basic income can become a serious discussion when millionssssss of people do not have work.;2024-03-16T08:01:54Z;2;;Andrew Yang has been saying this for a long time! Now the idea of universal basic income can become a serious discussion when millionssssss of people do not have work.;andrew yang say long time idea universal basic income become serious discussion million people not work;0.004999999888241291;Negative
UCX7g7Mr3PXZct3hjCNI8NNA;@ericsanjuan4901;Tax robot work at 98% revenue;2024-03-15T01:59:31Z;2;;Tax robot work at 98 revenue;tax robot work revenue;0.03700000047683716;Negative
UCdaR3ovy6BnoNiEtWILWp7w;@chrischris9157;Proves that he was wrong saying in 5-10 years all these layoffs would happen;2024-03-15T14:15:55Z;2;UC-4Rck7aGbLWY0W2ZM9XkKQ;Proves that he was wrong saying in 5 10 years all these layoffs would happen;prof wrong say year layoff happen;-0.8709999918937683;Negative
UCPXyBATCYDUDA5RPEIAq5Og;@corpingtons;Yea;2024-03-15T02:30:11Z;2;UCMDAIUclg-YtBHV4EgBWuZA;Yea;yea;0.27300000190734863;Negative
UCd4RcaS23-fwJmlw9A4T7ng;@OperculumAudio;Creaky Chair;2024-03-14T04:52:42Z;2;;Creaky Chair;creaky chair;-0.7020000219345093;Negative
UCgOXLoP0CR39F0Zv4ApzmCA;@GeorgeFitness-yo8bl;Mark shut UP  and go away. NVDA allowed me to retire early! Long NVDA!;2024-03-13T19:08:34Z;2;;Mark shut UP and go away. NDA allowed me to retire early! Long NDA!;mark shut go away nda allow retire early long nda;-0.24899999797344208;Negative
UCTF9mupNoNyTzwUcl4KBvBQ;@peterbedford2610;"AI , the first wave, will be very deflationary. Huge debtors won&#39;t like this.....";2024-03-13T16:46:57Z;2;;AI, the first wave, will be very deflationary. Huge debtors will not like this.....;ai first wave deflationary huge debtor not like .....;-0.656000018119812;Negative
UCI9FP9dSzlrjdjwiZQ49VSA;@shivasuresh5957;"Cuban is right about many things in this piece but I don&#39;t agree with the part about the English and Liberal Arts major coming back into vogue.";2024-03-13T13:03:22Z;2;;Cuban is right about many things in this piece, but I do not agree with the part about the English and Liberal Arts major coming back into vogue.;cuban right many thing piece not agree part english liberal art major come back vogue;-0.052000001072883606;Negative
UCrteujRBkBSzUwdivDwcE1w;@kingmo565;"That interviewer is a perfect example of someone replaceable RIGHT NOW! Doesn&#39;t even think for himself or use logic, just regurgitates canned questions and manners of speech to make himself sound like a good interviewer. &quot;Don&#39;t say umm and ahs... just say nonsense that sounds like you&#39;re saying something intelligent&quot;. AI can replace this fool right now.";2024-03-12T20:26:11Z;2;;That interviewer is a perfect example of someone replaceable RIGHT NOW! Doesn't even think for himself or use logic, just regurgitates canned questions and manners of speech to make himself sound like a good interviewer. do not say umm and AHS... just say nonsense that sounds like you re saying something intelligent . AI can replace this fool right now.;interviewer perfect example someone replaceable right n't even think use logic regurgitates question manner speech make sound good interviewer not say umm ahs say nonsense sound say something intelligent ai replace fool right;-0.8479999899864197;Negative
UCssM1AaRNM31sQN4pw0dhgQ;@JorgeMartinez-ez1jl;"Exactly! They better figure it out or it&#39;s 1789 France";2024-03-13T18:59:01Z;2;UC_GYiKR-ks25qfWHpyqLU3w;Exactly! They better figure it out or it .1789 France;exactly good figure france;-0.1809999942779541;Negative
UCW9wwtJBlaQF1GXS00MhLWg;@godblessCL;He is wrong about software. It is not that easy;2024-03-11T02:02:46Z;2;;He is wrong about software. It is not that easy;wrong software not easy;-0.765999972820282;Negative
UCZlgmMqvLlARhhBag7gMCWQ;@socialtraffichq5067;"You&#39;ve already been fired";2024-03-12T02:55:08Z;2;UCW9wwtJBlaQF1GXS00MhLWg;You ve already been fired;already fire;-0.8330000042915344;Negative
UC3HRRUOQY-idoMunkyMuD2w;@NandiOweka;Is that what Yang was saying?;2024-03-11T15:43:50Z;2;UCzevwQuhNMlV3PVzjK9wI-g;Is that what Yang was saying?;yang say;-0.012000000104308128;Negative
UCzTnFNlfTNAyttOvW7ys6Yw;@kubanaid5960;"As a software engineer myself   i see the largest amount of layoffs in the  IT  industry. So Cuban isn&#39;t far from the truth.";2024-03-12T01:45:31Z;2;UCd-bOw449_5XzDqszv9JbIw;As a software engineer myself I see the largest amount of layoffs in the IT industry. So Cuban is not far from the truth.;software engineer see large amount layoff industry cuban not far truth;-0.32199999690055847;Negative
UC6LEaxFxFZ836UoDKwKpKEA;@martymcfly6411;"I wish you all would stop saying &quot;basic income and start replacing it with &quot;universal high income&quot; whenever you get excited over &quot;basic income&quot; it makes you look so weak. Have a back bone people.";2024-04-06T18:36:23Z;1;;I wish you all would stop saying basic income and start replacing it with universal high income whenever you get excited over basic income it makes you look. Weak. Have a backbone people.;wish stop say basic income start replace universal high income get excite basic income make look weak backbone people;-0.8059999942779541;Negative
UCZK6FzetpdVNdijPcl1_RkQ;@joen8529;We should be allowed to vote on this Ai bs, not forced to all live with the whims of the few nuts.;2024-04-05T01:54:58Z;1;;We should be allowed to vote on this Ai bull shit, not forced to all live with the whims of the few nuts.;allow vote ai bull shit not force live whim nut;-0.9210000038146973;Negative
UCfINICrp4h30l8ce2JH2ZLg;@Wh0NeedsFr1ends;If 5 million people have their jobs disrupted.....what are we going to do with them?<br><br>Put them on Universal Basic Income equating to roughly the same level of support as welfare, then tell them they can earn additional income by becoming content creators on social media platforms, payable by subscribership/engagement metrics and by marketing services and products on behalf of commercial interests.;2024-03-28T21:54:34Z;1;;If 5 million people have their jobs disrupted.....what are we going to do with them? Put them on Universal Basic Income equating to roughly the our level of support as welfare, then tell them they can earn additional income by becoming content creators on social media platforms, payable by subscribership engagement metrics and by marketing services and products on behalf of commercial interests.;people job disrupt go put universal basic income equate roughly level support welfare tell earn additional income become content creator social medium platform payable subscribership engagement metric market service product behalf commercial interest;-0.38499999046325684;Negative
UCMqrt-55uLWbVIfFX7p43ew;@Seanpfree;The wealthy elites are not ready for the coming unrest. 90% of wealth creation is happening with the top 2%.;2024-03-27T01:13:48Z;1;;The wealthy elites are not ready for the coming unrest. 90 of wealth creation is happening with the top 2 .;wealthy elite not ready come unrest wealth creation happen top;-0.5350000262260437;Negative
UCXWcYt53JUto1-amoRF1Oww;@RestlessAmbitions;Sounds like they want a world made for billionaires, millionaires only, just killing everybody else.;2024-03-25T23:48:07Z;1;;Sounds like they want a world made for billionaires, millionaires only, just killing everybody else.;sound want world make billionaire millionaires kill everybody else;-0.9670000076293945;Negative
UCQ4-ZICb5u8UKdda-ymsTrg;@reabbotted;"For what it&#39;s worth, I think he&#39;s wrong. This is always a concern with new tech. It&#39;ll take the jobs and we can&#39;t see anything to replace them with. But we do find more. The new tech just opens new doors that weren&#39;t open previously.";2024-03-24T03:49:14Z;1;;For what it .worth, I think he .wrong. This is always a concern with new tech. It ll take the jobs, and we can not see anything to replace them with. But we do find more. The new tech just opens new doors that were not open previously.;.worth think .wrong always concern new tech take job not see anything replace find new tech open new door not open previously;0.15399999916553497;Negative
UCbbtM3cFSW7p2akTTF_42NQ;@DavidPat;There are more jobs in 2024 than 1924. The same will be true 100 years from now. Technology creates jobs.;2024-03-22T18:50:58Z;1;;There are more jobs in 2024 than 1924. The our will be true 100 years from now. Technology creates jobs.;job true year technology create job;0.5870000123977661;Positive
UC8h81LoqXPgP2JcS83CjrIw;@user-nq8vm2iv9v;FEMA Camps.;2024-03-22T05:30:36Z;1;;FEMA Camps.;fema camp;-0.07000000029802322;Negative
UC2r90f__eqBjOLMGBwSgA7Q;@charlespennie631;Mark Cuban is a Turd with lips.;2024-03-21T21:48:54Z;1;;Mark Cuban is a Turd with lips.;mark cuban turd lip;-0.9190000295639038;Negative
UCybBJntbX5deXXYvJ0Ta1Qg;@induction7895;"The point is not to build the entire infrastructure. 1 developer doesn&#39;t build the entire infrastructure as well. The point is to introduce AI to different stages of development, each specializing in certain tasks. And AI to monitor the entire system. You drastically reduce the number of people required.";2024-03-29T16:14:43Z;1;UCSr2n-WkcRE-KJrhXpbk01Q;The point is not to build the entire infrastructure. 1 developer does not build the entire infrastructure as well. The point is to introduce AI to different stages of development, each specializing in certain tasks. And AI to monitor the entire system. You drastically reduce the number of people required.;point not build entire infrastructure developer not build entire infrastructure well point introduce ai different stage development specialize certain task ai monitor entire system drastically reduce number people require;0.0;Negative
UC8LI-PCX7dajY9IyVc1SLTA;@n0ghri;Old men dying their hair is cringe.;2024-03-21T12:18:51Z;1;;Old men dying their hair is cringe.;old men die hair cringe;-0.878000020980835;Negative
UCA3bU0I_rGzuOuA-LpKWLYA;@alrizo1115;"Bro, we&#39;re going to &quot;socialismish&quot;. If not, world will crumble.";2024-03-21T08:09:37Z;1;;Bro, we re going to socialism . If not, world will crumble.;bro go socialism not world crumble;-0.44999998807907104;Negative
UC-2xSnX5z2I_vd8fXz7uuHQ;@scringe1;"Throw in millions of people crossing the border and you have a catastrophic ending. Imagine goups of people walking around doing nothing everywhere.The timing couldn&#39;t be worse. I wish Mark was wrong but, I think he nailed it. A robot can work 24/7.";2024-03-21T05:45:13Z;1;;Throw in millions of people crossing the border and you have a catastrophic ending. Imagine groups of people walking around doing nothing everywhere. The timing could not be worse. I wish Mark was wrong but, I think he nailed it. A robot can work 24 7.;throw million people cross border catastrophic end imagine group people walk nothing everywhere timing not bad wish mark wrong think nail robot work;-0.4259999990463257;Negative
UCUoj1FNnspoj0o77VpL8qtA;@hbmai3945;Cut the cord on AI now. Please.;2024-03-20T03:54:26Z;1;;Cut the cord on AI now. Please.;cut cord ai please;-0.39800000190734863;Negative
UCQ5WHEaOyqh1or89sDX2vUQ;@jaspercaelan4998;Manual labor will be screwed near the same time too as desk job people try to move into that field making it more competitive and lowering the pay further. The next 5-10 years is going to be rough, the governments as usual will be dragging their feet and the billionaires will be trying to prevent schemes such as UBI.;2024-03-20T10:51:36Z;1;UCUoj1FNnspoj0o77VpL8qtA;Manual labor will be screwed near the our time too as desk job people try to move into that field making it more competitive and lowering the pay further. The next 5 10 years is going to be rough, the governments as usual will be dragging their feet and the billionaires will be trying to prevent schemes such as FBI.;manual labor screw time desk job people try move field make competitive lower pay far next year go rough government usual drag foot billionaire try prevent scheme fbi;-0.9419999718666077;Negative
UCLr6fPe9MBfJVOapY-YPhPA;@user-or5lb6rl3s;This is all overblown. People in the 1920s thought all jobs would be done with machines by the 1970s. Some doors close and others open.;2024-03-21T16:48:24Z;1;UCUoj1FNnspoj0o77VpL8qtA;This is all overblown. People in the 1920s thought all jobs would be done with machines by the 1970s. Some doors close and others open.;overblown people .thought job machine door close others open;-0.2809999883174896;Negative
UCIfAQGW4c6Ten68mfUKgkZw;@ThEDyLnCaLi;"The copium in this comment section is real. AI won&#39;t replace your job right now, but it will and sooner than you expect.<br>This is the worst AI is ever going to be. Look how fast Sora improved. I&#39;m not saying go panic. I&#39;m saying be prepared.";2024-03-19T02:59:22Z;1;;The opium in this comment section is real. AI will not replace your job right now, but it will and sooner than you expect. This is the worst AI is ever going to be. Look how fast Sort improved. I m not saying go panic. I m saying is prepared.;opium comment section real ai not replace job right sooner expect bad ai ever go look fast sort improve not say go panic say prepare;-0.02500000037252903;Negative
UCB_LSwJMAzI9FpPhlKi64Wg;@garygarcia3142;"And this why I haven&#39;t quit my job because everything is gonna replace little by little";2024-03-18T15:17:26Z;1;;And this why I have not quit my job because everything is going to replace little by little;not quit job everything go replace little little;0.10499999672174454;Negative
UC4gm72LsC8upVU9RjWLDWog;@Zerschnitzler77;im a chemist? no AI is gonna come and take samples and analyze them;2024-03-18T10:23:28Z;1;;I am a chemist? No AI is going to come and take samples and analyze them;chemist ai go come take sample analyze;-0.2939999997615814;Negative
UCSy6lHVQex1yBHB0ihgbTdw;@CrazyLinguiniLegs;If AI does my job, can I still keep the paycheck?;2024-03-17T16:51:41Z;1;;If AI does my job, can I still keep the paycheck?;ai job still keep paycheck;0.03200000151991844;Negative
UCIWU2pBa9r8bQlq7yuXSiew;@justkevin4641;creaky ass chair;2024-03-17T15:13:07Z;1;;Creaky ass chair;creaky chair;-0.878000020980835;Negative
UCWY_wt00xKGTNTBWzsJCuPA;@JoshAronoff;I could see a French protest worker type situation here in the US at some point.;2024-03-17T08:22:16Z;1;;I could see a French protest worker type situation here in the US at some point.;see french protest worker type situation point;-0.8740000128746033;Negative
UCt7HtHgokYUnCKgu9zcHDUQ;@montymonto6430;This interview is from 7 years ago around 2016. There was no AI in its current form then and what Mark is talking about is provably big data things like that.  His prediction though is very correct.;2024-03-17T04:50:23Z;1;;This interview is from 7 years ago around 2016. There was no AI in it is current form then and what Mark is talking about is provably big data things like that. His prediction though is very correct.;interview year ago around ai current form mark talk provably big data thing prediction correct;0.25999999046325684;Negative
UC9k0PM9l-1WjNJ7eJ6BETCQ;@nds687;"Job descriptions are changing &amp; IT employees have been used to it ( they tend to always reinvent themselves ) Practical skills  in certain roles might get  replaced with AI but the intelligence will always remain with employees...";2024-03-17T04:30:21Z;1;;Job descriptions are changing IT employees have been used to it they tend to always reinvent themselves Practical skills in certain roles might get replaced with AI, but the intelligence will always remain with employees...;job description change employee use tend always reinvent practical skill certain role get replace ai intelligence always remain employee;0.25699999928474426;Negative
UCeKxWjICId3CYuIWiG3vZFQ;@cameronline3780;No one knows, and why is mark cuban even voicing an opinion on this lol;2024-03-17T03:16:19Z;1;;No one knows, and why is Mark Cuban even voicing an opinion on this laugh out loud;one know mark cuban even voice opinion laugh loud;-0.8289999961853027;Negative
UCr05zwZC9ws9t-4v492axhw;@tokyoknight6676;Yeah bro good luck getting AI to understand stakeholders bahaha;2024-03-17T02:38:17Z;1;;Yeah, bro good luck getting AI to understand stakeholders Bahama;yeah bro good luck get ai understand stakeholder bahama;-0.43700000643730164;Negative
UCvlZImvPEISSavAZx8XyKLg;@zach464;Been telling people this for over ten years.  Almost no one listening.  Now everyone is panicking.  We should have been having this conversation as a society years ago.;2024-03-16T22:16:26Z;1;;Been telling people this for over ten years. Almost no one listening. Now everyone is panicking. We should have been having this conversation as a society years ago.;tell people ten year almost one listening everyone panic conversation society year ago;-0.5730000138282776;Negative
UCckPU7GoG5V0YAMxLFT1FbA;@8MunchenBayern8;"self cleaning autonomous vacuums barely work correctly, responding to self-help bots are useless, self driving cars have been a disaster. As you said it&#39;ll happen but the way people say it like its right around the corner is all for media hype and to get as much click bait as possible.";2024-03-29T04:24:36Z;1;UCkcJMa01z0_GDtN_Ph3UTmQ;self cleaning autonomous vacuums barely work correctly, responding to self help bots are useless, self driving cars have been a disaster. As you said it ll happen, but the way people say it like it is right around the corner is all for media hype and to get as much clickbait as possible.;self clean autonomous vacuum barely work correctly respond self help bot useless self drive car disaster say happen way people say right corner medium hype get much clickbait possible;-0.8259999752044678;Negative
UCU22LJe9NiViyW_8Xvn3kBw;@butwhytharum;These billionaires are already crying interest rates are causing no one to buy anything (buy anything off of them). Sooo when no one has a job plus no fucking money whos gonna buy anything?;2024-03-16T12:39:16Z;1;;These billionaires are already crying interest rates are causing no one to buy anything buy anything off of them . Soon when no one has a job plus no fucking money who is going to buy anything?;billionaire already cry interest rate cause one buy anything buy anything soon one job fucking money go buy anything;-0.9340000152587891;Negative
