id;name;text;time;likes;reply;CleanedText;ProcessText;SentimentScore;ActualLabel
UC2UHfamt-z0RIsq8whxPZdg;@momoneyinvesting;"I bet Chat GPT cost a lot of writers their jobs already. Good companies that care about quality won&#39;t fire their writers and compliance people but most companies just look at short term profits";2023-05-14T18:47:59Z;0;UCx50wgYwT4F4QLPJbCKIrKA;I bet ChatGPT cost a lot of writers their jobs already. Good companies that care about quality will not fire their writers and compliance people, but most companies just look at short term profit is;bet chatgpt cost lot writer job already good company care quality not fire writer compliance people company look short term profit;-0.6480000019073486;Negative
UCi3LhQca_f2b9RwtuHwCesA;@vincentquattrocchi7924;"Just look at Boston Dynamics there&#39;s your future.... Don&#39;t listen to this pin head lady... Humanity will end.";2023-05-08T01:10:11Z;0;;Just look at Boston Dynamics there .your future.... do not listen to this pin head lady... Humanity will end.;look boston dynamic .your future .... not listen pin head lady humanity end;-0.5789999961853027;Negative
UCOh2ZhaWPO8EL4oVcf7eEDA;@lashlarue7924;"calm down, you are hallucinating even worse than ChatGPT.  Obla-di obla-da, the sky isn&#39;t falling.";2023-09-17T13:00:30Z;0;UCNCxeeh9DkR3rjp1u7QOTTA;Calm down, you are hallucinating even worse than ChatGPT. Blade blade, the sky is not falling.;calm hallucinate even bad chatgpt blade blade sky not fall;-0.4269999861717224;Negative
UCwwn4SLfbUet2Ypx-Fht_oA;@nedskyn;Race to zero!;2023-05-07T18:18:38Z;0;;Race to zero!;race;0.0010000000474974513;Negative
UCUQl1NW-Tz9nbrZOpQLdbbQ;@shutinalley;Ai creates new jobs but eliminates more than it creates under capitalism. How many people running around this place now?;2023-05-07T17:50:05Z;0;;Ai creates new jobs but eliminates more than it creates under capitalism. How many people running around this place now?;ai create new job eliminate create capitalism many people run around place;-0.19900000095367432;Negative
UCQieaySTTqmB5zXVrTp86sg;@David-gy6fv;3rd world war being triggered in Ukraina, China vs Taiwan and Iran vs Israel to kill billions and replace them with AI.;2023-05-07T09:57:06Z;0;;3rd world war being triggered in Ukraine, China vs Taiwan and Iran vs Israel to kill billions and replace them with AI.;rd world war trigger ukraine china v taiwan iran v israel kill billion replace ai;-0.9079999923706055;Negative
UCl7JZLfAksUA_DJPAmST_-Q;@hidetsu7249;...And millions of others will be created as always.;2023-05-07T08:26:10Z;0;;... And millions of others will be created as always.;million others create always;0.023000000044703484;Negative
UCSWHd75xCs8Qp5Kv0oaMhJw;@florete2310;I sense the Butlerian Jihad coming up soon. But will we evolve from that into something better? Nope...🤷‍♂;2023-05-07T05:49:57Z;0;;I sense the Hutterian Jihad coming up soon. But will we evolve from that into something better? Nope...;sense hutterian jihad come soon evolve something well nope;-0.367000013589859;Negative
UCwAE35D6AVWaTfL2wI7wKYA;@ajay2471;"😅let&#39;s see";2023-05-25T19:30:12Z;0;UCVmyoDbwlZ4db9E5K1dak_w;Let .see;let .see;-0.03500000014901161;Negative
UCuEORzQ7xM6hQyk2iQZNjig;@j.a.3138;Finance and accountants will be the first one to go. So say good bye to balance sheets, budget, etc.;2023-06-12T04:13:52Z;0;UCVmyoDbwlZ4db9E5K1dak_w;Finance and accountants will be the first one to go. So say goodbye to balance sheets, budget, etc.;finance accountant first one go say goodbye balance sheet budget;0.0820000022649765;Negative
UCnwKuSmERVeSUJ65dUZjmfw;@mathew3267;"AI is just electricity and metal, nothing a good ax can&#39;t take care of.";2023-05-07T00:52:30Z;0;;AI is just electricity and metal, nothing a good ax can not take care of.;ai electricity metal nothing good ax not take care;0.04600000008940697;Negative
UCrUTwUk2W37W7PrOX1Wz6xA;@personsurename3332;"​@@jr-yn4lkyeah nobody&#39;s forced to work its just that if you don&#39;t you&#39;ll starve to death and probably get a bunch of diseases on the way..";2023-11-16T22:02:20Z;0;UCAtvGNoGBzKW37MDwff9r3A;Nobody .forced to work it is just that if you do not you ll starve to death and probably get a bunch of diseases on the way.;nobody .forced work not starve death probably get bunch disease way;-0.5270000100135803;Negative
UCFAQAR9yz5BZm_k5ON1nl4w;@LynnColorado;The WEF loves AI, hates people.;2023-05-06T15:44:22Z;0;;The WEF loves AI, hates people.;wef love ai hat people;-0.7649999856948853;Negative
UCRrAMTeM5McO6mKLRWnfV9g;@ChrisStewart2;Please stop ignorant fear mongering.;2023-05-06T15:13:43Z;0;;Please stop ignorant fearmongering.;please stop ignorant fearmongering;-0.9210000038146973;Negative
UC4AzFEAoS2iDYLr1Pw-A7DQ;@mSherjeelr;Service industry will decline as AI gets more advanced;2023-05-06T12:38:23Z;0;;Service industry will decline as AI gets more advanced;service industry decline ai get advanced;-0.8510000109672546;Negative
UC45wHM1DeeR9it_WdgWtD8A;@anotheryoutubeaccount5259;"No one cares about those countries. Everyone&#39;s on meds there";2023-05-11T13:44:58Z;0;UCrtG2W9NRzDdlRJvFFio_Nw;No one cares about those countries. Everyone .on meds there;one care country everyone .on med;-0.2370000034570694;Negative
UCFLrB6-F-7BsavSj7Dz2hWg;@KendjiDimitri;"We adjust faster instead of burning down our capitals (french) when the government rise our pension age, We trust our systems more, it&#39;s not perfect but trust go a long way.";2023-05-14T10:26:38Z;0;UCrtG2W9NRzDdlRJvFFio_Nw;We adjust faster instead of burning down our capitals french when the government rises our pension age, We trust our systems more, it .not perfect, but trust go a long way.;adjust faster instead burn capital french government rise pension age trust system .not perfect trust go long way;0.597000002861023;Positive
UC45wHM1DeeR9it_WdgWtD8A;@anotheryoutubeaccount5259;"@@KendjiDimitri Ok, that&#39;s a smart comment, I&#39;ll give you that";2023-05-14T10:32:05Z;0;UCrtG2W9NRzDdlRJvFFio_Nw;Ok, that .a smart comment, I ll give you that;ok .a smart comment give;0.45100000500679016;Positive
UCeQECKE0BiWUu4VQr0XIdPw;@rigelb9025;If A.I. is coming for my job, I will just have a go at it with my water gun. (As of now, still no permit is required to carry one).;2023-05-06T02:31:27Z;0;;If A.I. is coming for my job, I will just have a go at it with my water gun. As of now, still no permit is required to carry one .;a.i come job go water gun still permit require carry;0.1379999965429306;Negative
