id;name;text;time;likes;reply;CleanedText;ProcessText;SentimentScore;ActualLabel
UC8-glGlG-33M4PPyR3gT9Rg;@zweer13;Why do we develop these technologies to get pain in the a**;2024-02-25T04:32:48Z;0;;Why do we develop these technologies to get pain in the;develop technology get pain;-0.9309999942779541;Negative
UCXxw5DAvM41M_q567W3YABg;@craigenputtock;"Can&#39;t wait for the first popular AI movie star to arrive on the scene.";2024-02-25T04:02:51Z;0;;Can't wait for the first popular AI movie star to arrive on the scene.;n't wait first popular ai movie star arrive scene;0.9290000200271606;Positive
UCQh1B0CZldaJGZRMh1tsZtQ;@asowers1;As a senior software engineer, I think AI will reduce some of the entry level coding jobs, but more often than not the people we are coding for don’t know what it is that they want to be coded nor how to integrate it into all of the existing code that already exists. Yes, the AI of today is great at solving one-off small coding problems, but it has a difficult time integrating that code into a distributed codebase. That’s not to say it won’t get better, but it will have to get a lot better at inferring what’s being asked of it and how to integrate it correctly.;2024-02-24T23:58:25Z;0;;As a senior software engineer, I think AI will reduce some of the entry level coding jobs, but more often than not the people we are coding for do not know what it is that they want to be coded nor how to integrate it into all the existing code that already exists. Yes, the AI of today is great at solving one off small coding problems, but it has a difficult time integrating that code into a distributed codebase. That .not to say it will not get better, but it will have to get a lot better at inferring what.being asked of it and how to integrate it correctly.;senior software engineer think ai reduce entry level cod job often not people cod not know want cod integrate exist code already exist ai today great solve small coding problem difficult time integrate code distributed codebase .not say not get well get lot good infer what.being ask integrate correctly;-0.16599999368190765;Negative
UC48vJIyVT2nUGSoGmTNSw8w;@wayne00k;This is a friendly comment... did you start your career as an industry expert or as an entry level professional?<br>... we are now taking our final breaths before the extinction event.;2024-02-25T16:31:33Z;0;UCQh1B0CZldaJGZRMh1tsZtQ;This is a friendly comment... did you start your career as an industry expert or as an entry level professional? ... we are now taking our final breaths before the extinction event.;friendly comment start career industry expert entry level professional take final breath extinction event;-0.010999999940395355;Negative
UCQh1B0CZldaJGZRMh1tsZtQ;@asowers1;@wayne00k, I started my career with some experience. I was able to do this by starting my own business developing apps and websites while I was in university and used that experience to secure a higher paying W2 job after school.<br><br>edit: typo;2024-02-26T16:26:48Z;0;UCQh1B0CZldaJGZRMh1tsZtQ;I started my career with some experience. I was able to do this by starting my own business developing apps and websites while I was in university and used that experience to secure a higher paying W2 job after school. Edit typo;start career experience able start business develop apps website university use experience secure high pay w job school edit typo;0.2669999897480011;Negative
UC48vJIyVT2nUGSoGmTNSw8w;@wayne00k;"@@asowers1 thank you for your reply. I wouldn&#39;t expect your experience to be common - but rather exceptional. <br>My concern (in agreement with your original post) is that, as you suggest,  if entry level positions would become rare - then who exactly will become the leading innovators and will those innovations be meaningful? <br>I&#39;ve assumed that most of the unexplored questions come from those with the fewest answers  - and my fear is that the reduction/elimination of those entry level positions will have a leveling effect on a multitude of potential advancements  - and a far narrower distribution of advancement opportunities.";2024-02-26T16:42:03Z;0;UCQh1B0CZldaJGZRMh1tsZtQ;Thank you for your reply. I would not expect your experience to be common but rather exceptional. My concern in agreement with your original post is that, as you suggest, if entry level positions would become rare then who exactly will become the leading innovators, and will those innovations be meaningful? I ve assumed that most of the unexplored questions come from those with the fewest answers and my fear is that the reduction elimination of those entry level positions will have a leveling effect on a multitude of potential advancements and a far narrower distribution of advancement opportunities.;thank reply not expect experience common rather exceptional concern agreement original post suggest entry level position become rare exactly become leading innovator innovation meaningful assume unexplored question come answer fear reduction elimination entry level position leveling effect multitude potential advancement far narrow distribution advancement opportunity;-0.04699999839067459;Negative
UChW4PgB5AY6ZHX0GcALcQVQ;@OceanPatriot777;"Don&#39;t worry...your government will find a use for you";2024-02-24T23:40:03Z;0;;do not worry...your government will find a use for you;not worry government find use;0.20399999618530273;Negative
UC94GXnpLb-y8kYjlDW3hpCA;@dancerjim;How can you protect yourself from being replaced by AI when any alternative work you may consider is also being replaced by AI?;2024-02-24T23:25:59Z;0;;How can you protect yourself from being replaced by AI when any alternative work you may consider is also being replaced by AI?;protect replace ai alternative work consider also replace ai;-0.4699999988079071;Negative
UCYuzCxqFEXjOH3Y2u5Qkrrw;@mikegallegos7;Well, if the lower level jobs are muted, then maybe I can start as a CEO, or a company Owner since there are no lower level jobs anymore: how will people get the lower level experiences needed for growth in any industry. Maybe you can jump right in trading stocks, but operating CNC machines or commencing work as a corporate lawyer is more demanding.;2024-02-24T22:55:54Z;0;;Well, if the lower level jobs are muted, then maybe I can start as a CEO, or a company Owner since there are no lower level jobs anymore how will people get the lower level experiences needed for growth in any industry. Maybe you can jump right in trading stocks, but operating CNC machines or commencing work as a corporate lawyer is more demanding.;well low level job mute maybe start ceo company owner low level job anymore people get low level experience need growth industry maybe jump right trade stock operate cnc machine commence work corporate lawyer demanding;-0.4620000123977661;Negative
UC9FXZL6D6UKy-5bOLth72MA;@Longtack55;Drive a tractor for 12 hours a day, six days a week, then think.;2024-02-24T22:49:21Z;0;;Drive a tractor for 12 hours a day, six days a week, then think.;drive tractor hour day day week think;-0.12700000405311584;Negative
UCz8Ju2ZXRBPDQNSREFxrhwg;@LilyGazou;It is definitely getting rid of catalog modeling as a career.;2024-02-24T22:39:20Z;0;;It is definitely getting rid of catalog modeling as a career.;definitely get rid catalog modeling career;-0.6809999942779541;Negative
UCV4QMcClG_Xgy6IgWoWj3NA;@ronaldwilson6295;The first thought that came to mind was how can AI replace a mortician? But then a second thought came right behind it: Soylent Green. 💀;2024-02-24T22:31:03Z;0;;The first thought that came to mind was how can AI replace a mortician? But then a second thought came right behind it Soy lent Green.;first thought come mind ai replace mortician second thought come right soy lent green;0.0;Negative
UCovZsuww3dgh_rWOzmFDAWQ;@mwj5368;"What about County Human Services Social Workers? I called my Social Worker to leave a voicemail and his recording was he returns calls within 25 days. Nothing ever happened. I called about 10 days ago and now his recording sends callers in a circle and makes it impossible to leave a voice mail. It was a major effort as city bus lines due to my location are not a good connection to get to the County offices so I go by bicycle and delivered a tangible message that I also think will never be answered. Are Social Workers jobs going to be in serious danger with AI in any way? Even with the way things are for their workload I hope that doesn&#39;t happen. Any input is much appreciated. Thanks for your very informative video, a magnanimous deed!";2024-02-24T21:26:01Z;0;;What about County Human Services Social Workers? I called my Social Worker to leave a voicemail and his recording was he returns calls within 25 days. Nothing ever happened. I called about 10 days ago and now his recording sends callers in a circle and makes it impossible to leave a voice mail. It was a major effort as city bus lines due to my location are not a good connection to get to the County offices. I go by bicycle and delivered a tangible message that I also think will never be answered. Are Social Workers jobs going to be in serious danger with AI in any way? Even with the way things are for their workload I hope that does not happen. Any input is much appreciated. Thanks for your very informative video, a magnanimous deed!;county human service social worker call social worker leave voicemail recording return call day nothing ever happen call day ago record sends caller circle make impossible leave voice mail major effort city bus line due location not good connection get county office go bicycle deliver tangible message also think never answer social worker job go serious danger ai way even way thing workload hope not happen input much appreciate thanks informative video magnanimous deed;-0.40700000524520874;Negative
UCwc6eOFpUPNPwoy1v222scA;@mmoya1135;I work in tech and I’ve tried using chatGPT. It is helpful but it’s not to the point that it will replace me. It’s nice for easy stuff you don’t want to waste time coding up but it doesn’t understand complicated nuanced systems. It’s not going to stand up a distributed system for you, it’s okay at terraform but it’s not going to stand up your infrastructure,etc. One could argue it might replace low level SWEs but even that’s a stretch. I’d rather ramp someone up to take on those tasks than rely on chatGPT. I normally watch your content but this is definitely fear mongering during a time that a lot of people in tech have been laid off, not cool;2024-02-24T21:07:59Z;0;;I work in tech and I have tried using ChatGPT. It is helpful but it .not to the point that it will replace me. It .nice for easy stuff you do not want to waste time coding up but it does not understand complicated nuanced systems. Furthermore, it .not going to stand up a distributed system for you, it .okay at terraform but it .not going to stand up your infrastructure, etc. One could argue it might replace low level Sees but even that.a stretch. I would rather ramp someone up to take on those tasks than rely on ChatGPT. I normally watch your content, but this is definitely fearmongering during a time that a lot of people in tech have been laid off, not cool;work tech try use chatgpt helpful .not point replace .nice easy stuff not want waste time cod not understand complicate nuanced system furthermore .not go stand distributed system .okay terraform .not go stand infrastructure argue replace low level see even that.a stretch rather ramp someone take task rely chatgpt normally watch content definitely fearmongering time lot people tech lay not cool;-0.24899999797344208;Negative
UCr_z6-rx-ldWFibtv68vJ1g;@casekocsk;"It&#39;s funny that from time to time, we still meet people on internet insisting that we will not lose jobs because of AI.";2024-02-24T20:34:54Z;0;;It .funny that from time to time, we still meet people on internet insisting that we will not lose jobs because of AI.;.funny time time still meet people internet insist not lose job ai;-0.35600000619888306;Negative
UCWTWRddmNaqPigmSvW5yqug;@MungeParty;"I&#39;ve heard of Chad GPT, I&#39;ve never heard about this &quot;chat beepy deepy deee&quot; this guy keeps mentioning.";2024-02-24T20:16:15Z;0;;I ve heard of Chad GPT, I ve never heard about this chat beep deep DEEE this guy keeps mentioning.;heard chad gpt never hear chat beep deep deee guy keep mention;-0.3490000069141388;Negative
UCRX1QrNpBnZiuLcKGcVznNg;@jgrab1;"Judging by the advertising copy I&#39;ve seen in the last 15 or so years, I&#39;d say AI has been generating it already.";2024-02-24T19:37:35Z;0;;Judging by the advertising copy I ve seen in the last 15 or. Years, I d say AI has been generating it already.;judging advertising copy see last year say ai generate already;0.0020000000949949026;Negative
UCWu9D0w_07Q5ZjIv2GZurIA;@patriciaegan7244;How do we humans compete!  Interesting video, but need help to navigate it all!;2024-02-24T17:53:01Z;0;;How do we humans compete! Interesting video, but need help to navigate it all!;human compete interesting video need help navigate;0.04699999839067459;Negative
UC8vE-KYtQLcvmg_WvcIBnWw;@m.s.1421;"AI can replace workers but it cannot replace customers. If millions of people loose their jobs because of AI, who will the CEOs sell their products and services to? Without thinking about the social disorder. AI is just a tool, the problem is always the same: an economici system based on making the biggest profit every single year using any legal (often also illegal) instrument. If anybody else here were a CEO, they would behave in the same way because a CEO&#39;s job is to maximize the profit.";2024-02-24T12:03:44Z;0;;AI can replace workers but it can not replace customers. If millions of people lose their jobs because of AI, who will the CEOs sell their products and services to? Without thinking about the social disorder. AI is just a tool, the problem is always the our an economic system based on making the biggest profit every single year using any legal often also illegal instrument. If anybody else here were a CEO, they would behave in the our way because a CEO .job is to maximize the profit.;ai replace worker not replace customer million people lose job ai ceo sell product service think social disorder ai tool problem always economic system base make big profit single year use legal often also illegal instrument anybody else ceo behave way ceo .job maximize profit;-0.5929999947547913;Negative
UCOyQJj7mNm9Tdkz6xgp7AJA;@Dusttnuts304;Buy NVDA!;2024-02-24T09:36:40Z;0;;Buy NDA!;buy nda;0.34700000286102295;Negative
UCiUO5fyLvCGcfpaCk4njPeQ;@paulowen3934;Open the pod doors Hal......;2024-02-24T08:20:29Z;0;;Open the pod doors Hal......;open pod door hal ......;-0.023000000044703484;Negative
UCLoRLj2F84jL9LaqUoSnKSg;@scottatkins4489;"Twlight Zone episode in the 60&#39;s,  &quot;you are obsolete&quot;";2024-02-24T00:19:16Z;0;;Twilight Zone episode in the 60 , you are obsolete;twilight zone episode obsolete;-0.8100000023841858;Negative
UC8K8hZZIE8pWH6hUDd7FqHg;@AY-dw4om;The problem with what you present is your are not a computer science educated, so your assumption about what CHAT GPT can and cannot do are wrong. It is a tool, can do may things, can improve a production process for a human using it and save a lot of time, BUT, it cannot think for it self what so ever. that is a mile stone we will reach in a very distant future, not now, not close.;2024-02-23T21:25:06Z;0;;The problem with what you present is you are not a computer science educated, Your assumption about what ChatGPT can and can not do are wrong. It is a tool, can do many things, can improve a production process for a human using it and save a lot of time, BUT, it can not think for itself what. Ever. That is a milestone we will reach in a very distant future, not now, not close.;problem present not computer science educate assumption chatgpt not wrong tool many thing improve production process human use save lot time not think ever milestone reach distant future not not close;-0.25200000405311584;Negative
UCk52qSNJjjo9ftWT4LKrsZA;@ALifeAfterLayoff;Where did I say it could think for itself?;2024-02-23T22:00:19Z;0;UC8K8hZZIE8pWH6hUDd7FqHg;Where did I say it could think for it itself?;say think;-0.39100000262260437;Negative
