id;name;text;time;likes;reply;CleanedText;ProcessText;SentimentScore;ActualLabel
UCH5rT6dVrsJ2HxaNmzp4wzQ;@hdcomputerkeith;NO jobs are safe;2024-01-31T04:14:37Z;0;;NO jobs are safe;job safe;-0.875;Negative
UCqbKUUBBa7ruYGZ-yi1Tlbg;@mr.googleuser6764;pick up a trade now boyssss;2024-01-12T16:17:46Z;0;;Pick up a trade now bosses;pick trade boss;-0.003000000026077032;Negative
UCwXsQ2q9j2KHhW0Ej9HHgvQ;@victorinborsciov6817;None! It is just a matter of time.;2023-12-31T07:11:24Z;0;;None! It is just a matter of time.;none matter time;-0.039000000804662704;Negative
UCiWvbYwQdih01crog4C1iFw;@AllRequired;"As <i>Survivor</i> and <i>Big Brother</i> air on this network, we&#39;ve borne witness to how inexpensive and incredibly efficient reality television has grown to become.  Nice to not have to put up with an actor&#39;s temper tantrums or a pop star&#39;s vanity.  If you want to understand just how valuable AI <i>will</i> be in and for entertainment, just look at <i>The Bugs Bunny / Road Runner Show</i> (the #1 Saturday morning cartoon for years on end in its day).<br><br>It&#39;s time for today&#39;s actors and actresses to start looking for work.  Small businesses would be thrilled to get the extra help.";2023-12-30T23:11:46Z;0;;As Survivor and Big Brother air on this network, we ve borne witness to how inexpensive and incredibly efficient reality television has grown to become. Nice to not have to put up with an actor .temper tantrums or a pop star .vanity. If you want to understand just how valuable AI will be in and for entertainment, just look at The Bugs Bunny Road Runner Show the 1 Saturday morning cartoon for years on end in it is day . It .time for today .actors and actresses to start looking for work. Small businesses would be thrilled to get the extra help.;survivor big brother air network borne witness inexpensive incredibly efficient reality television grow become nice not put actor .temper tantrum pop star .vanity want understand valuable ai entertainment look bug bunny road runner show saturday morning cartoon year end day .time today .actors actress start look work small business thrill get extra help;0.14800000190734863;Negative
UCMZNERy0a1GwZXhvalyyS7Q;@jaimebacolod3858;How about Restaurant Job?;2023-12-29T20:37:45Z;0;;How about Restaurant Job?;restaurant job;-0.0020000000949949026;Negative
UCcdv7fT-jVPH8uG2Ina-CGA;@kiwiadventures3773;News presenters.;2023-11-27T13:30:32Z;0;;News presenters.;news presenter;0.008999999612569809;Negative
UCbsz3pQPvA8erOVTzDjo0eg;@topofthegreen;we are putting too much faith in AI.;2023-11-26T01:05:00Z;0;;We are putting too much faith in AI.;put much faith ai;-0.8240000009536743;Negative
UCWfZjKt2yVxz_GBbRdz7vkg;@derekrequiem4359;Seriously, WebMD is far cheaper than paying a physician a 6 figure salary just to tell someone what disease they have.;2023-12-12T01:05:28Z;0;UCj6MwK1mMxiSFTqR_MsITZw;Seriously, WebMD is far cheaper than paying a physician a 6 figure salary just to tell someone what disease they have.;seriously webmd far cheap pay physician figure salary tell someone disease;0.5230000019073486;Positive
UC66xvO1U9XnXNMNhSrOqZ3w;@stevierico5934;No job will be safe from AI when they implement the Great Reset and the New World Order in a global cashless society with microchip implants! 2030 is the year they have targeted.;2023-09-26T02:15:01Z;0;;No job will be safe from AI when they implement the Great Reset and the New World Order in a global cashless society with microchip implants! 2030 is the year they have targeted.;job safe ai implement great reset new world order global cashless society microchip implant year target;-0.4050000011920929;Negative
UCzJwvgoC9HwvF5tGpF6bt2g;@snowflakemelter7171;Nope. We need apprenticeships. Universities are useless now.;2023-09-11T01:19:31Z;0;UCr9tL38NTSbJwWYzwpQK7hA;Nope. We need . Universities are useless now.;nope need university useless;-0.2800000011920929;Negative
UCXICqbD9q3GFRhDmygYYcyQ;@netrimo589;"it must be super annoying to be interviewed by someone who isn&#39;t listening to what you&#39;re saying.";2023-08-02T18:22:51Z;0;;It must be super annoying to be interviewed by someone who is not listening to what you re saying.;super annoy interview someone not listen say;-0.8840000033378601;Negative
UC5M4leghhO0r5TXh_StiLgQ;@andrewbryan9363;This is one of the reasons the brilliant minds like Elon Musk have stated on record that A.I. advancements will take over so many industries that a universal basic income for all humans will be needed or move to Mars.;2024-03-09T00:54:11Z;0;UCOk0DTfCWFfguz99Tq0hVFg;This is one of the reasons the brilliant minds like Elon Musk have stated on record that A.I. advancements will take over. Many industries that a universal basic income for all humans will be needed or move to Mars.;reason brilliant mind elon musk state record a.i advancement take many industry universal basic income human need move mar;0.2669999897480011;Negative
UCG1Jhl9FbsaSxHUyxekJ9rw;@NameMcNamename;"&quot;Racist&quot; robots";2023-07-31T21:42:57Z;0;UCoFaQWhBVwcEErCtMSzNlrA;Racist robots;racist robot;0.09700000286102295;Negative
UCgWDi8HOqxQ3fPAe_lJAC6w;@Patrickstarrrrr69;@@kevine9474 wishful thinking;2023-10-22T11:59:07Z;0;UCxQ0nZKYr6ufgGMP0GAswQg;Wishful thinking;wishful thinking;-0.6470000147819519;Negative
UC0Ocgo55P1hzURFm_SarJsA;@gilgamesh6590;@@hassansyed6087for now ai advances pretty fast so that problem will be solved within the next few years;2023-07-29T18:10:36Z;0;UCaV-0YOAXY03jTtsHw5bXFQ;Now AI advances pretty fast. That problem will be solved within the next few years;ai advance pretty fast problem solve next year;0.6890000104904175;Positive
UCZrPA9kqIouvovIm_JM6p9A;@Daisika;@@hassansyed6087for now;2023-07-30T19:23:06Z;0;UCaV-0YOAXY03jTtsHw5bXFQ;Now;;0.020999999716877937;Negative
UCL3zI3pFaEKNVDEZpH9BPog;@judigemini178;Meanwhile, tech job layoffs are at an all time high...good luck kid.;2024-02-03T16:10:00Z;0;UCwWPUGE7fJoZv14jKfl2vJw;Meanwhile, tech job layoffs are at an all time high...good luck kid.;meanwhile tech job layoff time high good luck kid;-0.023000000044703484;Negative
UCGaaC4NNHQsh_Vm6Pk9T9EA;@emberson7850;Just create another startup, and you will be ok, kiddo. Someone might even buy you, too.;2024-03-30T17:19:35Z;0;UCwWPUGE7fJoZv14jKfl2vJw;Just create another startup, and you will be ok, kiddo. Someone might even buy you, too.;create startup ok kiddo someone even buy;0.703000009059906;Positive
UColxNwulgVd1t2qBj-iSxkg;@sayan-nj1mr;My question do you understand ai ?;2024-01-08T02:18:15Z;0;UC0bTh1kxKq8326pm_3xdryg;My question do you understand AI ?;question understand ai;-0.006000000052154064;Negative
UC7nMsKUOJcrysoxNk_141UA;@petere8612;"AI is different and very dangerous as it&#39;s self learning at an exponential level. Combine that with blind human greed. Before he died Stephen hawking warned that AI could be humanity&#39;s last invention. I fear he might have been right.";2023-06-20T09:51:57Z;0;UCaK2F76cHmG0Us9ZFNku-RA;AI is different and very dangerous as it .self learning at an exponential level. Combine that with blind human greed. Before he died Stephen Hawking warned that AI could be humanity .last invention. I fear he might have been right.;ai different dangerous .self learn exponential level combine blind human greed die stephen hawking warn ai humanity .last invention fear right;-0.25600001215934753;Negative
UCyP5bVQ5-UQ_rdXd0P-0DvQ;@nah131;either we become wage slaves or AI will do it for us plus UBI will be there for everybody;2023-06-06T14:46:23Z;0;UC61eUxiCdhCfrbPVy266cQw;Either we become wage slaves or AI will do it for us plus FBI will be there for everybody;become wage slave ai fbi everybody;-0.9580000042915344;Negative
UCrwG7s5mtVcMB18bnZrf1jg;@illbeback3150;@@brianholguin6338 Damn its not her fault. They have limited time and she must ask all the questions that her media prepared.;2024-04-28T13:20:35Z;0;UCrERDkzy9EJbzpPsOeD3cVg;Damn it is not her fault. They have limited time, and she must ask all the questions that her media prepared.;damn not fault limit time ask question medium prepare;-0.4300000071525574;Negative
UCYW3LGfde2cCyY1fZebqJVA;@cesruhf2605;@@drakedrones Welder;2024-03-25T00:12:13Z;0;UC3In6vQ8k3kp6i8gs3hqf8Q;Welder;welder;0.023000000044703484;Negative
UCG5eyfUBEuDLCPpKffkekyg;@MrPolandball;Well what stops you from giving an idea to dominion?;2023-06-12T06:52:45Z;0;UC8GSzEAjTdFdieOqy0ROJtA;Well what stops you from giving an idea to dominion?;well stop give idea dominion;0.01899999938905239;Negative
UCVOgeERhcF35zMiu3u8jHCA;@takenote7085;It will be;2023-08-08T18:15:44Z;0;UC8GSzEAjTdFdieOqy0ROJtA;It will be;;0.04600000008940697;Negative
UCybiIyffB_ItcziNBs_-QJA;@cryptojonny6837;For now, but Tesla is already making robots for hands and feet.;2023-09-01T18:34:45Z;0;UCHw2qvO8mOA8N0eo32UfS9Q;For now, but Tesla is already making robots for hands and feet.;tesla already make robot hand foot;0.40700000524520874;Negative
