id;name;text;time;likes;reply;CleanedText;ProcessText;SentimentScore;ActualLabel
UCkcJMa01z0_GDtN_Ph3UTmQ;@MrGriff305;"It&#39;ll happen, but it&#39;ll take longer than expected. For example, where&#39;s my autonomous vehicle that was supposed to be commonplace three years ago?";2024-03-16T13:12:23Z;9;;It ll happen, but it ll take longer than expected. For example, where .my autonomous vehicle that was supposed to be commonplace three years ago?;happen take long expect example .my autonomous vehicle suppose commonplace year ago;-0.43700000643730164;Negative
UCo2Enf9dkHceccToYQ4yQcQ;@longestvideoever;Instead of ubi what about free housing like finland does.;2024-03-14T12:25:30Z;9;UCZfyR9uSm94_pJpbyXeuk5Q;Instead of FBI what about free housing like Finland does.;instead fbi free housing finland;-0.0010000000474974513;Negative
UCMvDpWiBXks47O0Yd7ED4Ig;@StockPursuit;"He&#39;s talking about 3 years from now after OpenAI, Anthropic or Meta start selling AGI LLMs. Basically an average employee replacement. Listen to Sam Altman on his goals. He thinks AGI will replace most corporate jobs.";2024-03-09T09:52:48Z;9;UCjhfUDqem1h-8F6Y1QPnlQQ;He .talking about 3 years from now after OpenAI, Anthropic or Meta start selling AGI LLMs. Basically an average employee replacement. Listen to Sam Altman on his goals. He thinks AGI will replace most corporate jobs.;.talking year openai anthropic meta start sell agi llm basically average employee replacement listen sam altman goal think agi replace corporate job;-0.05299999937415123;Negative
UCKL3lf3Jvb1-XyLTC8dqJsw;@user-qm5eg3fg8c;naa we know its coming. maybe not in 5 years but 5-15 looks quite likely.;2024-03-17T19:14:58Z;8;UC_FQukqvdpms5Kr0QH7mR2A;Naa we know it is coming. Maybe not in 5 years but 5 15 looks quite likely.;know come maybe not year look quite likely;0.2029999941587448;Negative
UCobv5IU4Th_9jexGutcUujw;@Gunrun808;"That&#39;s what I&#39;m counting on<br><br>Edit: finance and software engineering were his suggestions? This person does not know where the market is going. Mark is on point.";2024-03-12T00:00:12Z;8;;That .what I m counting on Edit finance and software engineering were his suggestions? This person does not know where the market is going. Mark is on point.;count edit finance software engineering suggestion person not know market go mark point;0.004000000189989805;Negative
UCvJBtRhgQ9sUh5n-5jLI_Sg;@Yinyang1277;Fortunately, for people simply put when it comes to entertainment we will always prefer humans (it also fascinates us to see what our talent and capabilities are with hard physical work, especially the Olympics), but even if ai generated basketball took over tomorrow... ok.. he still owns an entire stadium worth hundreds of millions if not more. He has heavily diversified his assets and businesses. He will not sweat a drop lol at this point he is just living life to build the biggest legacy possible for his family, which sadly most Americans fail to do. The ones that do focus on legacies will be the ones that thrive as assets will be kind. Corps are buying every bit of commercial real estate property possible to then lease them or sell for astronomical prices for elites only. Corps like Blackrock are buying every bit of real estate to force rent. House owners are being greedier than ever before so you can either succeed and understand how to adapt or you fall behind. People like Mark succeeded lol he is going to be A ok;2024-03-19T18:09:56Z;7;UCIQ8wBZgSBB2F21xlfpCmtA;Fortunately, for people simply put when it comes to entertainment we will always prefer humans it also fascinates us to see what our talent and capabilities are with hard physical work, especially the Olympics , but even if AI generated basketball took over tomorrow... ok. He still owns an entire stadium worth hundreds of millions if not more. He has heavily diversified his assets and businesses. He will not sweat a drop laugh out loud at this point he is just living life to build the biggest legacy possible for his family, which sadly most Americans fail to do. The ones that do focus on legacies will be the ones that thrive as assets will be kind. Corps are buying every bit of commercial real estate property possible to then lease them or sell for astronomical prices for elites only. Corps like BlackRock are buying every bit of real estate to force rent. House owners are being greedier than ever before. You can either succeed and understand how to adapt or you fall behind. People like Mark succeeded laugh out loud he is going to be A OK;fortunately people simply put come entertainment always prefer human also fascinate see talent capability hard physical work especially olympics even ai generate basketball take tomorrow ok. still entire stadium worth hundred million not heavily diversify asset business not sweat drop laugh loud point live life build big legacy possible family sadly american fail one focus legacy one thrive asset kind corp buy bit commercial real estate property possible lease sell astronomical price elite corp blackrock buy bit real estate force rent house owner greedy ever either succeed understand adapt fall behind people mark succeed loud go ok;0.18799999356269836;Negative
UCjdLHnVVxMtT2ZLRWryT1Zg;@S5000Krad;"Since I don&#39;t have a job, robots can&#39;t really take it from me.<br><br>Today I saw a robot cleaner in a grocery store. And I live in a 3rd world country. So it is pretty much already here.";2024-03-13T21:52:23Z;7;;Since I do not have a job, robots can not really take it from me. Today I saw a robot cleaner in a grocery store. And I live in a 3rd world country. So it is pretty much already here.;not job robot not really take today saw robot cleaner grocery store live rd world country pretty much already;-0.057999998331069946;Negative
UCuTg3_hSmLN1328x5luFavQ;@stevegwizzle3560;"Ai ain&#39;t taking my job. I got a hands on/ technical job that requires travel...not happening";2024-03-13T12:07:27Z;7;;Ai ain't taking my job. I got a hand on technical job that requires travel...not happening;ai ai n't take job get hand technical job require travel not happen;-0.8610000014305115;Negative
UCeOR7Xw2fJKA311M6Tr31Jw;@ryandelatte3294;Move to Texas or Louisiana and go to trade school. Look at becoming an electrician or Instrumentation Tech, Im a coatings Quality Control tech and i believe this is the best position for me once all the office positions like the estimators and HR people are gone. It will take some pretty advanced robotics to replace high dexterity jobs like welders, electricians, painters, scaffold builders, etc;2024-03-16T18:22:15Z;7;UCGJqe-o1y3JglVtSoupmjmQ;Move to Texas or Louisiana and go to trade school. Look at becoming an electrician or  Tech, I am a coatings Quality Control tech and I believe this is the best position for me once all the office positions like the estimators and HR people are gone. It will take some pretty advanced robotics to replace high dexterity jobs like welders, electricians, painters, scaffold builders, etc;move texas louisiana go trade school look become electrician tech coatings quality control tech believe best position office position estimator hr people go take pretty advanced robotics replace high dexterity job welder electrician painter scaffold builder;0.1459999978542328;Negative
UCQcUYGEuxYPlkR0GZ8EiXgA;@seventyfive7597;"The only mistake he made was talking about Liberal Arts majors, because they are now the first to be replaced.  Not surprising as &quot;creativity&quot; is the original combination of life experiences and inspirations, which is naturally best done by an objective machine that was trained on the internet.";2024-03-09T16:54:20Z;7;;The only mistake he made was talking about Liberal Arts majors, because they are now the first to be replaced. Not surprising as creativity is the original combination of life experiences and inspirations, which is naturally best done by an objective machine that was trained on the internet.;mistake make talk liberal art major first replace not surprising creativity original combination life experience inspiration naturally best objective machine train internet;-0.367000013589859;Negative
UC3Z4EEWbsziOJt_QPJ6brGg;@BradSteeg;"This Bloomberg interview is seven years old. Cuban gave the interview before generative AI (e.g. Chat GPT). Generative AIs are one-to-many not many-to-one or even one-to-one. They are the opposite of what Cuban envisioned seven years ago. It will be impossible for a small number of corporations to chase all the ideas generative AIs will help people create. It&#39;s a Cambrian explosion not an extinction.<br><br>As a quick example, use a text to photo creation service. One text prompt generates four photos; one input creates four unique outputs.";2024-03-15T20:19:13Z;6;;This Bloomberg interview is seven years old. Cuban gave the interview before generative AI e.g. ChatGPT . Generative AIs are one to many not many to one or even one to one. They are the opposite of what Cuban envisioned seven years ago. It will be impossible for a few corporations to chase all the ideas generative AIs will help people create. It .a Cambrian explosion not an extinction. As a quick example, use a text to photo creation service. One text prompt generates four photos one input creates four unique outputs.;bloomberg interview year old cuban give interview generative ai e.g chatgpt generative ai many not many even opposite cuban envision year ago impossible corporation chase idea generative ai help people create .a cambrian explosion not extinction quick example use text photo creation service text prompt generate photo input create unique output;-0.017999999225139618;Negative
UCqZB2D42zSaCmuz0QGMVvuQ;@Vartazian360;"And just 3 days later: Devin AI software developer proves you 100% wrong. Its only gonna get more and more intelligent as time goes on. Its already free lancing. They have &quot;Hire Devin&quot; as their slogan";2024-03-14T16:36:32Z;6;UC0SbUi4WNPt5dcfneRNEBHw;And just 3 days later Devin AI software developer proves you 100 wrong. It is only going to get more and more intelligent as time goes on. It is already freelancing. They have Hire Devin as their slogan;day later devin ai software developer prove wrong go get intelligent time go already freelance hire devin slogan;0.34299999475479126;Negative
UC5l_ifv4EdWob1bdFcIUkhw;@kevinandrewrea123;Thank Jesus. UBI will help humanity in an invaluable way.;2024-03-08T19:55:40Z;6;;Thank Jesus. FBI will help humanity in an invaluable way.;thank jesus fbi help humanity invaluable way;0.9300000071525574;Positive
UC7l6zo7w2jSQdY8_jDTXGpw;@GastonMoulin;"Bitcoin is on its way to breaking records, getting closer to hitting new high prices, showing that it&#39;s gaining more value and could go even higher than we&#39;ve seen before. This could mean great things for people looking to invest, suggesting now might be a good time to get involved before it jumps even higher. It&#39;s an exciting moment that could change the game in general...managed to grow a nest egg of around 2.1Blitcoin to a decent 11.4Biitcoin. At the heart of this evolution is Queridafx , whose deep understanding of both cryptocurrency and traditional trading has been instrumental. Her holistic approach to investment and commitment to staying abreast of market trends make her an invaluable ally in navigating this new era in cryptocurrency investment";2024-03-19T02:38:24Z;5;;Bitcoin is on it is way too breaking records, getting closer to hitting new high prices, showing that it .gaining more value and could go even higher than we ve seen before. This could mean great things for people looking to invest, suggesting now might be a good time to get involved before it jumps even higher. It .an exciting moment that could change the game in general...managed to grow a nest egg of around 2.1Blitcoin to a decent 11.4Biitcoin. At the heart of this evolution is Queridafx, whose deep understanding of both cryptocurrency and traditional trading has been instrumental. Her holistic approach to investment and commitment to staying abreast of market trends make her an invaluable ally in navigating this new era in cryptocurrency investment;bitcoin way breaking record get close hit new high price show .gaining value go even high see mean great thing people look invest suggest good time get involve jump even high .an excite moment change game general manage grow nest egg .blitcoin decent .biitcoin heart evolution queridafx deep understanding cryptocurrency traditional trading instrumental holistic approach investment commitment stay abreast market trend make invaluable ally navigate new era cryptocurrency investment;0.7870000004768372;Positive
UC2ORcx6T7bFBX72aHOvX7Xg;@abhishekpandey5528;ubi may be;2024-03-17T09:39:03Z;5;UCO71963CwkoR7Mhu2PWN-lw;Ubi may be;ubi;-0.15600000321865082;Negative
UCUICQeEBy3iiv-XcDPYJ5Pg;@Soooooooooooonicable;I think one job that will be in high demand in the coming decades is robot maintenance.;2024-03-16T18:30:03Z;5;;I think one job that will be in high demand in the coming decades is robot maintenance.;think job high demand come decade robot maintenance;0.13500000536441803;Negative
UC4cRYLaPTj2BXF32qoUT5Fw;@etcetc3800;That would require new laws and raising taxes on the mega corps. They need to monitor company sales and profits as well as payroll and AI usage and if they see lots of layoffs and revenue rising then start increasing taxes;2024-03-15T01:22:31Z;5;UCZfyR9uSm94_pJpbyXeuk5Q;That would require new laws and raising taxes on the mega corps. They need to monitor company sales and profit is as well as payroll and AI usage and if they see lots of layoffs and revenue rising then start increasing taxes;require new law raise tax mega corp need monitor company sale profit well payroll ai usage see lot layoff revenue rise start increase tax;-0.5849999785423279;Negative
UCwmDJZVq27_s3befsOT-uVg;@sd5919;"Yeah, people are going to be running away from the downsizing. Everyone discusses this as if the replacement of labor is a binary when it&#39;s a process. Labor will slowly get squeezed sector by sector.";2024-03-16T14:32:37Z;5;UCGJqe-o1y3JglVtSoupmjmQ;Yeah, people are going to be running away from the downsizing. Everyone discusses this as if the replacement of labor is a binary when it .a process. Labor will slowly get squeezed sector by sector.;people go run away downsizing everyone discuss replacement labor binary .a process labor slowly get squeeze sector sector;-0.5320000052452087;Negative
UCedrFKmI6YQg0sqIWGylLxw;@nursegilbey;"I don&#39;t think he&#39;s completely on point but he definitely knows what he&#39;s talking about he&#39;s probably predicting that his own workforce is going to be disappearing because he won&#39;t need them.";2024-03-13T12:38:20Z;5;UC81cFUxuM7RqM490VEOisbQ;I do not think he .completely on point, but he definitely knows what he .talking about he .probably predicting that his own workforce is going to be disappearing because he will not need them.;not think .completely point definitely know .talking .probably predict workforce go disappear not need;-0.061000000685453415;Negative
UCKoVZK2VkY_3zZBNl_-gFQg;@dilpickles5928;"Except in this instance Mr. Cuban isn&#39;t wrong. The future is now and it&#39;s already too late.";2024-03-10T06:21:10Z;5;UCd-bOw449_5XzDqszv9JbIw;Except in this instance Mr. Cuban is not wrong. The future is now and it .already too late.;instance mr. cuban not wrong future .already late;0.03400000184774399;Negative
UCoaCMjZI8SiIbo_P2kvn5uQ;@cameronsmithers368;Take yer jerbs!;2024-03-13T22:43:48Z;5;UCFMGElIY5Lyu8qoyNgAMGeQ;Take yer verbs!;take yer verb;-0.8199999928474426;Negative
UCbnJb_W2B2tcKl9IG0A_HRQ;@greyman6662;Ubi is gonna happen in the next 15 or 30 years;2024-03-09T11:33:03Z;5;UCK82mZkiiCYbLHhF-QarTOQ;FBI is going to happen in the next 15 or 30 years;fbi go happen next year;-0.17299999296665192;Negative
UCXjYHxxrvX-BvYj8QUvC8XA;@daczito;In a dream scenario, in the pretty distant future, perhaps. But as of now, who do you think is gonna own all the AI ??;2024-03-13T11:58:33Z;5;UCxm4vXz5ayazFY9XMQYkcdQ;In a dream scenario, in the pretty distant future, perhaps. But as of now, who do you think is going to own all the AI ??;dream scenario pretty distant future perhaps think go ai;0.23000000417232513;Negative
UCSr2n-WkcRE-KJrhXpbk01Q;@pavello9231;"If AI becomes advanced enough for me to say to it, &quot;Create an application for me like Amazon, Netflix or Facebook with the entire project infrastructure, architecture, expandable and scalable, then deploy it in the cloud, maintain near-continuous availability, and develop it according to my constantly and fast changing requirements without introducing any bugs, then we won&#39;t need programmers or IT specialists anymore. However, at that point, we probably won&#39;t need anyone other than physical workers either.";2024-03-21T14:53:42Z;4;;If AI becomes advanced enough for me to say to it, Create an application for me like Amazon, Netflix or Facebook with the entire project infrastructure, architecture, expandable and scalable, then deploy it in the cloud, maintain near continuous availability, and develop it according to my constantly and fast changing requirements without introducing any bugs, then we will not need programmers or IT specialists anymore. However, at that point, we probably will not need anyone other than physical workers either.;ai becomes advance enough say create application amazon netflix facebook entire project infrastructure architecture expandable scalable deploy cloud maintain continuous availability develop accord constantly fast changing requirement introduce bug not need programmer specialist anymore however point probably not need anyone physical worker;0.37400001287460327;Negative
UC5ZVMTBj3JYl3oOjka1v47A;@ThePOLYLIKE;Take my fuckin barista job pls;2024-03-16T23:07:57Z;4;;Take my fucking barista job please;take fuck barista job please;-0.9160000085830688;Negative
UCETydiYY8jhdQE0bg0V5-hg;@tamalchakraborty5346;Introduce AI tax. Introduce AI tax. Introduce AI tax.;2024-03-16T21:34:59Z;4;;Introduce AI tax. Introduce AI tax. Introduce AI tax.;introduce ai tax introduce ai tax introduce ai tax;-0.1979999989271164;Negative
UC_iyIsHlLjhHHoFo-3edLMA;@gbw28;Yep, trade school beckons not college.;2024-03-21T01:24:57Z;4;UCoJXIFV3qymvdyrlPz3smWw;Yep, trade school beckons not college.;yep trade school beckons not college;0.017000000923871994;Negative
UCChKwTcCr0wFpLfy6UYsLFw;@artvsmachine3703;Foreign language majors are toast. There will be instantaneous translations to any language, and a choice of hundreds of voices, and altered to be more polite or casual etc...;2024-03-15T10:24:41Z;4;;Foreign language majors are toast. There will be instantaneous translations to any language, and a choice of hundreds of voices, and altered to be more polite or casual etc...;foreign language major toast instantaneous translation language choice hundred voice alter polite casual etc;0.04800000041723251;Negative
UCzQXhvdANLER7E--PAaeEqg;@diegoaespitia;"LOL this fucking interviewer &quot;you gotta go back for education to learn.... whatever it takes&quot; guy, a robot can do those things 10000 times better than  a college student";2024-03-14T20:29:18Z;4;;LOL this fucking interviewer you have to go back for education to learn.... whatever it takes guy, a robot can do those things 10000 times better than a college student;lol fuck interviewer go back education learn .... take guy robot thing time well college student;-0.703000009059906;Negative
UCoNhleacDtlbF6ivWnw4T9g;@christopherjones1915;Capitalism is on its way out. Time for society to come up with post labor economics. I believe there will be a period of dystopia as we figure this out. Then a beautiful future.;2024-03-13T19:38:15Z;4;;Capitalism is on it is way out. Time for society to come up with post labor economics. I believe there will be a period of dystopia as we figure this out. Then a beautiful future.;capitalism way time society come post labor economics believe period dystopia figure beautiful future;-0.257999986410141;Negative
UC0XgqUOkOvhBhqUt4p4E0Uw;@davidhudson4230;Nobody will be able to afford to go out with no jobs.  EVERYBODY WILL BE SCREWED;2024-03-14T18:50:16Z;4;UCnZWL7tRMOw6Xpho8kDI7Cw;Nobody will be able to afford to go out with no jobs. EVERYBODY WILL BE SCREWED;nobody able afford go job everybody screw;-0.8500000238418579;Negative
UCFrgdqnuTnhnu_llgF6AtcQ;@CompetitionSportsNetwork;"Blah,  Blah, Blah, Gemini can&#39;t even work right and it went woke, Sorry, but A.I is not taking over anything anytime soon. Mark just loves to make predictions that he has no clue about.";2024-03-13T16:21:08Z;4;;Blah, Blah, Blah, Gemini can not even work right, and it went woke, Sorry, but A.I. am not taking over anything anytime soon. Mark just loves to make predictions that he has no clue about.;blah blah blah gemini not even work right go woke sorry a.i not take anything anytime soon mark love make prediction clue;-0.6660000085830688;Negative
UCjWmn076zSfOXlcoIiztULQ;@sooraj1104;And one solar flare will bring world back to stone age.;2024-03-13T06:07:10Z;4;;And one solar flare will bring world back to Stone Age.;solar flare bring world back stone age;-0.4860000014305115;Negative
UC1Tyv4oKjcJQVrjvAr6uWZg;@dontbanmebrodontbanme5403;"As a programmer less than a decade away from retirement, I&#39;ve long drawn the conclusion that if I were starting today, I&#39;d be screwed. I don&#39;t know what to tell young kids today in terms of where to focus. There are very, VERY few jobs that can&#39;t be disrupted by AI.<br><br>* pilot - 90% of a flight is already automated and the only reason why planes aren&#39;t 100% flown by computer is because pilot unions fought to make sure that didn&#39;t happen, for obvious reasons<br><br>* doctor - computers already pick up things in MRI images that doctors miss. Robots already perform man surgeries. Heck, if you&#39;re a pharmacist, you&#39;re just dispensing drugs. That can so easily be replaced by a drug dispensing ATM machine<br><br>* even jobs like teacher can be replaced. Imagine one teacher broadcasting a math lesson and students log in to watch it. Better still, the teacher records the lessons and students can replay them whenever they want. Better still, get AI to record the lesson, eliminating all teachers<br><br>* truck drivers/taxis - it&#39;s only a matter of time<br><br>As of now, the only jobs that can&#39;t be replaced (yet) are plumbers and electricians. You need a physical person there to do the work, so if there&#39;s any job I don&#39;t see being replaced anytime soon, it&#39;s those two jobs. But I&#39;d tell anyway to save, save, SAVE your money, because the day will come that your only form of income will be the interest from your savings. It&#39;s too hard to figure out what skills you should learn to keep your head above water.";2024-03-29T13:54:44Z;3;;As a programmer less than a decade away from retirement, I ve long drawn the conclusion that if I were starting today, I d be screwed. I do not know what to tell young kids today in terms of where to focus. There are very, VERY few jobs that can not be disrupted by AI. pilot 90 of a flight is already automated and the only reason why planes are not 100 flown by computer is because pilot unions fought to make sure that did not happen, for obvious reasons doctor computers already pick up things in MRI images that doctors miss. Robots already perform man surgeries. Heck, if you re a pharmacist, you re just dispensing drugs. That can. Easily be replaced by a drug dispensing ATM even jobs like teacher can be replaced. Imagine one teacher broadcasting a math lesson and students log in to watch it. Better still, the teacher records the lessons and students can replay them whenever they want. Better still, get AI to record the lesson, eliminating all teachers truck drivers taxis it .only a matter of time As of now, the only jobs that can not be replaced yet are plumbers and electricians. You need a physical person there to do the work, If there .any job I do not see being replaced anytime soon, it .those two jobs. But I d tell anyway to save, save, SAVE your money, because the day will come that your only form of income will be the interest from your savings. It .too hard to figure out what skills you should learn to keep your head above water.;programmer less decade away retirement long draw conclusion start today screw not know tell young kid today term focus job not disrupt ai pilot flight already automate reason plane not fly computer pilot union fight make sure not happen obvious reason doctor computer already pick thing mri image doctor miss robot already perform man surgery heck pharmacist dispense drug easily replace drug dispense atm even job teacher replace imagine teacher broadcast math lesson student log watch well still teacher record lesson student replay want good still get ai record lesson eliminate teacher truck driver taxis .only matter time job not replace yet plumber electrician need physical person work .any job not see replace anytime soon .those job tell anyway save save save money day come form income interest saving .too hard figure skills learn keep head water;-0.07000000029802322;Negative
UCmv2oPIZorkOIB0H_9LFXRQ;@jamesyear9860;"Why is it that the only perspective we&#39;re getting on this issue is from only the people that will benefit from it?";2024-03-18T06:04:31Z;3;;Why is it that the only perspective we re getting on this issue is from only the people that will benefit from it?;perspective get issue people benefit;-0.8989999890327454;Negative
UCHWfa2jFBcKm84hLIPpLjwg;@dasaavawarsuploads1143;They need workers. But they will pay them less.;2024-03-19T04:25:21Z;3;UCO71963CwkoR7Mhu2PWN-lw;They need workers. But they will pay them less.;need worker pay less;-0.41999998688697815;Negative
