id;name;text;time;likes;reply;CleanedText;ProcessText;SentimentScore;ActualLabel
UCnWtLwl4ENJyYTX7fC-CI5w;@NikoKun;"The thing about AI, that makes it different from past forms of automation, is this time we&#39;re automating human cognition, rather than merely strength or speed.. At some point, it&#39;s intelligence, capabilities and value to businesses, will outweigh that of humans who used to work those jobs. While a few new jobs may be created, they&#39;ll be a for a small minority, NOT the masses who&#39;ll be displaced by AI! There simply won&#39;t be enough jobs to go around for everyone, and we need to start redesigning our society, to remove jobs from the justifications for how we distribute basic resources to people. Plus, AI took years of data and content from everyone, to train it, so it should benefit everyone. If it takes away jobs, it should pay taxes to provide an AI Dividend to all of us!";2024-01-04T18:46:37Z;325;;The thing about AI, that makes it different from past forms of automation, is this time we re automating human cognition, rather than merely strength or speed. At some point, it .intelligence, capabilities and value to businesses, will outweigh that of humans who used to work those jobs. While a few new jobs may be created, they ll be a for a small minority, NOT the masses who ll be displaced by AI! There simply will not be enough jobs to go around for everyone, and we need to start redesigning our society, to remove jobs from the justifications for how we distribute basic resources to people. Plus, AI took years of data and content from everyone, to train it, It should benefit everyone. If it takes away jobs, it should pay taxes to provide an AI Dividend to all of us!;thing ai make different past form automation time automate human cognition rather merely strength speed point .intelligence capability value business outweigh human use work job new job create small minority not mass displace ai simply not enough job go around everyone need start redesign society remove job justification distribute basic resource people ai take year data content everyone train benefit everyone take away job pay tax provide ai dividend;-0.12999999523162842;Negative
UCMpmZIK92SKPDYTSO4STwSQ;@marcusmoonstein242;"The problem with predictive AI is that it bases its predictions on past patterns in the data. This means it&#39;s almost useless at spotting black swan events or predicting the performance of anything truly original.";2024-01-05T05:31:52Z;71;;The problem with predictive AI is that it bases it is predictions on past patterns in the data. This means it .almost useless at spotting black swan events or predicting the performance of anything truly original.;problem predictive ai base prediction past pattern data mean .almost useless spot black swan event predict performance anything truly original;-0.43700000643730164;Negative
UCA56fd6EFqvPnrrPzECPXfQ;@joshualobo5337;"I think the problem started way before generative idea. The idea of &#39;content&#39; for views and advertisement encouraged artists, filmmakers, practitioners of real artforms to become ambiguous &#39;creators&#39;. Take this video for example, stock clips and images are inserted to fill in the gaps between real and archival footage. They are unrelated, repetitive, yet we tolerate it because of the illusion of continuity the medium of video has. At some point it doesn&#39;t matter what we&#39;re listening to or watching, it becomes distilled to pure attention.";2024-01-08T08:16:32Z;64;;I think the problem started way before generative idea. The idea of content for views and advertisement encouraged artists, filmmakers, practitioners of real art forms to become ambiguous creators . Take this video for example, stock clips and images are inserted to fill in the gaps between real and archival footage. They are unrelated, repetitive, yet we tolerate it because of the illusion of continuity the medium of video has. At some point it does not matter what we re listening to or watching, it becomes distilled to pure attention.;think problem start way generative idea idea content view advertisement encouraged artist filmmaker practitioner real art form become ambiguous creator take video example stock clip image insert fill gap real archival footage unrelated repetitive yet tolerate illusion continuity medium video point not matter listen watch become distil pure attention;-0.2840000092983246;Negative
UCDvPyn2VPvJ3rOw0Vz21HGw;@leonardccto;Tom Cruise can now be the lead actor in action movies for another 50 years.;2024-01-06T05:06:44Z;64;;Tom Cruise can now be the lead actor in action movies for another 50 years.;tom cruise lead actor action movie year;0.9210000038146973;Positive
UC7sdTkESvNO5vOHKcCmvcJA;@ruebenjesse;Seems like AI will just make everything generic and appeal to the lowest common denominator;2024-01-05T16:04:28Z;50;;Seems like AI will just make everything generic and appeal to the lowest common denominator;seem ai make everything generic appeal low common denominator;-0.9490000009536743;Negative
UCXyd8G-xqE37wlQOklKqfdg;@OverlandExposure;So are humans though.;2024-01-05T06:15:55Z;48;UCMpmZIK92SKPDYTSO4STwSQ;So are humans though.;human;-0.0020000000949949026;Negative
UCz-Iqmnh75i7Z4kLKxbsOBg;@ModernAmplification;"&quot;musicians get paid per play&quot; is a myth.";2024-01-04T16:04:16Z;37;;Musicians get paid per play is a myth.;musician get pay play myth;-0.6740000247955322;Negative
UCSjM8KQarRAF-_INXR74kXg;@Anders01;Yes, AI will become huge in game development, I even believe that AI soon (within a few years) will be able to automatically generate a whole video game from a single prompt, all the way from coding to storyboarding and art design.;2024-01-06T09:00:16Z;33;;Yes, AI will become huge in game development, I even believe that AI soon within a few years will be able to automatically generate a whole video game from a single prompt, all the way from coding to story boarding and art design.;ai become huge game development even believe ai soon year able automatically generate whole video game single prompt way cod story boarding art design;0.7360000014305115;Positive
UCa8_1Gu61gGsTtUW1c88ZTg;@pentapox9665;"Ok, everyone, we are concerned about jobs...but shouldn&#39;t we also be concerned about the quality of art and its effect on culture?  There has been a noticeable decline in the quality of film, video, and music.  Are these tools enhancing the quality of art, or are they just making the processes easier and faster?  What does an easier, faster process mean in terms of art quality?  If the present is any indication, then we will be assaulted with tons of low effort, low quality junk.  Not better, just more and worse.";2024-01-04T15:57:05Z;32;;Ok, everyone, we are concerned about jobs...but shouldn't we also be concerned about the quality of art, and it is effect on culture? There has been a noticeable decline in the quality of film, video, and music. Are these tools enhancing the quality of art, or are they just making the processes easier and faster? What does an easier, faster process mean in terms of art quality? If the present is any indication, then we will be assaulted with tons of low effort, low quality junk. Not better, just more and worse.;ok everyone concern job n't also concern quality art effect culture noticeable decline quality film video music tool enhance quality art make process easy faster easy fast process mean term art quality present indication assault ton low effort low quality junk not well bad;-0.46000000834465027;Negative
UCBejynvw0EeTUBHh6FybRgQ;@tomshackell;"To me this is exactly the right question. Automation marches on just as it has for the last 200 years, every year more things are automated that previously had to be done by a person. In my mind this tide is inevitable, trying to hold it back is a waste of time. However, your question is the right one: how will we share the spoils? AI could be something that leads to a life of luxury &amp; leisure for all. Or it could impoverish most and enrich just a tiny minority. The real question here is how we can make sure it benefits everyone.";2024-01-04T21:45:01Z;28;UCnWtLwl4ENJyYTX7fC-CI5w;To me this is exactly the right question. Automation marches on just as it has for the last 200 years, every year more things are automated that previously had to be done by a person. In my mind this tide is inevitable, trying to hold it back is a waste of time. However, your question is the right one how will we share the spoils? AI could be something that leads to a life of luxury leisure for all. Or it could impoverish most and enrich just a tiny minority. The real question here is how we can make sure it benefit is everyone.;exactly right question automation march last year year thing automate previously person mind tide inevitable try hold back waste time however question right share spoil ai something lead life luxury leisure impoverish enrich tiny minority real question make sure benefit everyone;0.1120000034570694;Negative
UCUobMFpKy_-M6SgRXLVSfUQ;@CalsAdventures;Well, at least nature documentaries can forever be narrated by Sir David Attenborough. That is a genuine weight off my mind.;2024-01-04T22:06:57Z;25;;Well, at least nature documentaries can forever be narrated by Sir David Attenborough. That is a genuine weight off my mind.;well least nature documentary forever narrate sir david attenborough genuine weight mind;0.8510000109672546;Positive
UCkGSfFb7KTR5lyEFOusEnWQ;@Mitaka-Asa;My company tried to use AI for my job. but it failed because no customer wants to talk to AI generated speech;2024-01-05T23:59:40Z;23;;My company tried to use AI for my job. But it failed because no customer wants to talk to AI generated speech;company try use ai job fail customer want talk ai generated speech;-0.4580000042915344;Negative
UCnSh-JMBW7iSEik8JOrce_Q;@LizardManFromTheEarthCore;"Generative AI: steals from human artists to fill it&#39;s databanks and spills it back, like it&#39;s something new, without paying a single penny to real artists. Theft and greed.";2024-01-05T03:51:59Z;19;;Generative AI steals from human artists to fill it .data banks and spills it back, like it .something new, without paying a single penny to real artists. Theft and greed.;generative ai steal human artist fill .data bank spill back .something new pay single penny real artist theft greed;-0.6830000281333923;Negative
UCz2_VZsgApr6CE91yaEV2mA;@gwenaellepage;What a sad time when scripts are written to please people instead of making people discover something they might not have thought.  Human imagination is being replaced by predictable stories to guarantee profits at the box office;2024-01-04T21:08:49Z;19;;What a sad time when scripts are written to please people instead of making people discover something they might not have thought. Human imagination is being replaced by predictable stories to guarantee profit is at the box office;sad time script write please people instead make people discover something not think human imagination replace predictable story guarantee profit box office;-0.8100000023841858;Negative
UCg-7wBun3xJIw3NsC2vxzjw;@Yutappy99;If you take away the ability to create then you take away the soul of humanity. Being able to dream and create is what defines us as a species.;2024-01-07T12:50:11Z;16;;If you take away the ability to create then you take away the soul of humanity. Being able to dream and create is what defines us as a species.;take away ability create take away soul humanity able dream create define specie;0.12700000405311584;Negative
UCidD9U1oANDAYD8bMLQo8Kg;@LarsRichterMedia;"@@tomshackell That is one of the right questions to ask. Another one, though, that most people don&#39;t seem to think about is energy. Will we have enough clean energy to power all of the stuff we still need to electrify (like steel making etc.) and then add AI and robotics on top of it? There are significant doubts regarding this. People seem to believe energy will only ever get cheaper and more abundant. The opposite could become a reality fairly soon as well.";2024-01-04T22:59:16Z;16;UCnWtLwl4ENJyYTX7fC-CI5w;That is one of the right questions to ask. Another one, though, that most people do not seem to think about is energy. Will we have enough clean energy to power all the stuff we still need to electrify like steel making etc. and then add AI and robotics on top of it? There are significant doubts regarding this. People seem to believe energy will only ever get cheaper and more abundant. The opposite could become a reality fairly soon as well.;right question ask though people not seem think energy enough clean energy power stuff still need electrify steel make etc add ai robotics top significant doubt regard people seem believe energy ever get cheap abundant opposite become reality fairly soon well;-0.1809999942779541;Negative
UCCCbEP3NibYdNQ75YbCTaNw;@skimmingstone3energyrecords;So many jobs will be lost to Ai...we need a universal income..so folks can live.;2024-01-04T15:19:22Z;16;;So many jobs will be lost to Ai...we need a universal income... folks can live.;many job lose ai need universal income folk live;-0.20200000703334808;Negative
UC5xSswOq7bcKVNML8AQhrUQ;@jackcloud8547;"What a great documentary! One of my friends who&#39;s just graduated high school is trying to pursue an arts degree in Animation, and I still didn&#39;t have the courage to tell her the threats of AI cuz she&#39;s so nice and innocent.";2024-01-08T14:15:10Z;14;;What a great documentary! One of my friends who .just graduated from high school is trying to pursue an arts degree in Animation, and I still did not have the courage to tell her the threats of AI because she . Nice and innocent.;great documentary friend .just graduate high school try pursue art degree animation still not courage tell threat ai nice innocent;0.3199999928474426;Negative
UCqQWmLAn_t_03tgjtW4GEJg;@WizPatrus;"There will still be room for humans in the proofing/editing roles. AI can certainly make people more productive by removing a lot of the more repetitive tasks, but it&#39;ll still require some human judgement along the way. No denying that jobs will face demand destruction, though.";2024-01-04T15:29:54Z;13;;There will still be room for humans in the proofing editing roles. AI can certainly make people more productive by removing a lot of the more repetitive tasks, but it ll still require some human judgement along the way. No denying that jobs will face demand destruction, though.;still room human proofing edit role ai certainly make people productive remove lot repetitive task still require human judgement way deny job face demand destruction though;-0.17399999499320984;Negative
UCaBjHHSf0fx-GQm4REy7DBg;@hansbleuer3346;"There are two problems:<br>- The virtual is not the real world.<br>- Stealing data from the internet (violating copyright law) is not a sustainable business model.<br>I&#39;m author of 3 books in the field of leadership; Open AI has violated my copyrigths.";2024-01-06T10:59:51Z;12;;There are two problems The virtual is not the real world. Stealing data from the internet violating copyright law is not a sustainable business model. I m author of 3 books in the field of leadership Open AI has violated my copyrights.;problem virtual not real world steal data internet violate copyright law not sustainable business model author book field leadership open ai violate copyright;-0.8799999952316284;Negative
UCkgy8GUxsRYvXMP_pNzUTsg;@antixdevelopment1416;I think the real question that people want answered is.. when will AI be able to generate better content than hollywood currently does? I mean come on.. holylwood set the bar pretty low these days!;2024-01-06T09:20:57Z;12;;I think the real question that people want answered is. When will AI be able to generate better content than Hollywood currently does? I mean come on. Holylwood set the bar pretty low these days!;think real question people want answer ai able generate well content hollywood currently mean come holylwood set bar pretty low day;-0.35100001096725464;Negative
UCzAVWM2LYr-XkZVZsuTWiRg;@morjer5263;The first 10 minutes are basically propaganda while the last 10 minutes barely scratch the surface of the dangers of AI and all the highly unethical problems behind the tech.;2024-01-05T12:17:09Z;12;;The first 10 minutes are basically propaganda while the last 10 minutes barely scratch the surface of the dangers of AI and all the highly unethical problems behind the tech.;first minute basically propaganda last minute barely scratch surface danger ai highly unethical problem tech;-0.8240000009536743;Negative
UCu1-WI4w6_w0XPpaivLbxYQ;@parthasarathyvenkatadri;"That is precisely why they are black swan events even human beings can&#39;t predict them occuring ..";2024-01-05T10:58:14Z;12;UCMpmZIK92SKPDYTSO4STwSQ;That is precisely why they are black swan events even human beings can not predict them occurring .;precisely black swan event even human not predict occur;-0.013000000268220901;Negative
UCoGZsxcDz4k6aLOrKhW33CQ;@caterpillar4153;The output of LLMs is getting worse and worse. Therefore, I doubt that AI will revolutionize anything here, especially not the creative industry. And the plagiarism that text and image generators are increasingly producing, the lawsuits will also increase. By the way - Warner Bros has already announced that it will not use AI.;2024-01-04T20:35:11Z;11;;The output of LLMs is getting worse and worse. Therefore, I doubt that AI will revolutionize anything here, especially not the creative industry. And the plagiarism that text and image generators are increasingly producing, the lawsuit is will also increase. By the way Warner Bros has already announced that it will not use AI.;output llm get bad bad therefore doubt ai revolutionize anything especially not creative industry plagiarism text image generator increasingly produce lawsuit also increase way warner bros already announce not use ai;-0.6769999861717224;Negative
UCosTL1bEFWnfjWt2R9r66LA;@michelnielsen2855;I suspect that a lot of music and art generated by AI will start to feel very generic after a few years;2024-01-05T16:41:41Z;10;;I suspect that a lot of music and art generated by AI will start to feel very generic after a few years;suspect lot music art generate ai start feel generic year;-0.9380000233650208;Negative
UC_m6vvK8TsO9ZNptSFJxCmg;@wrailee;There should be voice ownership trademark/copywrite trademark per person and should provide  royalty from whom it was copied.;2024-01-05T07:41:49Z;10;;There should be voice ownership trademark copywriter trademark per person and should provide royalty from whom it was copied.;voice ownership trademark copywriter trademark person provide royalty copy;-0.07800000160932541;Negative
UC8OrRKMxlUuIwoDP2jCgPbw;@All4thaCash;"Lol. Netflix is the WORST platform for finding me content I want. They should fire that department. Opening netflix means wasting 2 hours looking for something and 30 minutes watching something I didn&#39;t really enjoy.";2024-01-05T09:57:41Z;8;;laughing out loud. Netflix is the WORST platform for finding me content I want. They should fire that department. Opening Netflix means wasting 2 hours looking for something and 30 minutes watching something I did not really enjoy.;laugh loud netflix bad platform find content want fire department open netflix mean waste hour look something minute watch something not really enjoy;-0.4129999876022339;Negative
UCK1cjQmoWVzxw_g1m9GPiUA;@matteovlorusso2541;Whe AGI will be achieved and deployed the loss of jobs in the entertainment will be our last problem.;2024-01-05T01:11:48Z;8;;The AGI will be achieved and deployed the loss of jobs in the entertainment will be our last problem.;agi achieve deploy loss job entertainment last problem;-0.40700000524520874;Negative
UCkMqrLqXHCNBZD0UC5BGQOw;@reza2kn;"You&#39;re using the wrong LLMs if your responses are getting &quot;worse and worse&quot; bud.";2024-01-05T00:00:06Z;8;UCoGZsxcDz4k6aLOrKhW33CQ;You re using the wrong LLMs if your responses are getting worse and worse bud.;use wrong llm response get bad bad bud;-0.8849999904632568;Negative
UCQ9Eom8mUoE6DslctKj3X2g;@therealOXOC;"Not only in movies. He can be your personal assistant in VR if you like. People still think everything will stay the same for the next 50 years. They&#39;re in for a ride.";2024-01-06T08:08:46Z;7;UCDvPyn2VPvJ3rOw0Vz21HGw;Not only in movies. He can be your personal assistant in VR if you like. People still think everything will stay the our for the next 50 years. They re in for a ride.;not movie personal assistant vr like people still think everything stay next year ride;0.04100000113248825;Negative
UCftfref9dHiAApMFsG-ccFA;@huhulalammm;"this is why art and multimillion company shouldn&#39;t merge. the truth is, no one knows why something touches so many people and something does not. that&#39;s why Shakespeare is Shakespeare and who ever wrote 50 shades of grey is who ever. i mean AI can easily predict that 50 shades of grey may be a success from all the thirst stories that are being sold in Amazon or Amazon kindle. but who even remembers how many women Christian Grey winked at? but i can still tell the summary of Hamlet with some tears in my eyes. when art becomes commodity, companies have to compete to win a profit. that means they will never take a look at the Hamlets in the world because their data will tell them to go for 50 shades of grey. our already broken society will become even more broken because the art of the world will be so commodified rather than reflecting on human emotions.";2024-01-04T16:34:51Z;7;;This is why art and multimillion company shouldn't merge. The truth is, no one knows why something touches. Many people and something does not. That .why Shakespeare is Shakespeare and who ever wrote 50 shades of gray is who ever. I mean AI can easily predict that 50 shades of gray may be a success from all the thirst stories that are being sold in Amazon or Amazon Kindle. But who even remembers how many women Christian Grey winked at? But I can still tell the summary of Hamlet with some tears in my eyes. When art becomes commodity, companies have to compete to win a profit. That means they will never take a look at the Hamlets in the world because their data will tell them to go for 50 shades of gray. Our already broken society will become even more broken because the art of the world will be. Commodified rather than reflecting on human emotions.;art multimillion company n't merge truth one know something touch many people something not .why shakespeare shakespeare ever write shade gray ever mean ai easily predict shade gray success thirst story sell amazon amazon kindle even remember many woman christian grey wink still tell summary hamlet tear eye art become commodity company compete win profit mean never take look hamlet world data tell go shade gray already break society become even broken art world commodified rather reflect human emotion;-0.25200000405311584;Negative
UCzJwvgoC9HwvF5tGpF6bt2g;@snowflakemelter7171;Quality over quantity should always be the goal.;2024-01-04T22:41:07Z;7;UCa8_1Gu61gGsTtUW1c88ZTg;Quality over quantity should always be the goal.;quality quantity always goal;0.14900000393390656;Negative
UCDqQgV3SZF15Vfuig7vyg_w;@phil20_20;"Exactly right. Yang was right all along. We won&#39;t have much choice pretty soon. People will be forced to stop being antisocial, because it woll happen to them too. This is what usually happens in disaster scenarios.";2024-01-04T15:29:57Z;7;UCCCbEP3NibYdNQ75YbCTaNw;Exactly right. Yang was right all along. We will not have much choice pretty soon. People will be forced to stop being antisocial, because it well happen to them too. This is what usually happens in disaster scenarios.;exactly right yang right along not much choice pretty soon people force stop antisocial well happen usually happen disaster scenario;-0.3499999940395355;Negative
UCKxYgh6mt_G1L-xdNeIB3Mw;@love_cook;"It just will have no value. There will be minory who will be into AI robots playing, singing music but the majority will require &quot;human touch to it&quot;";2024-01-06T11:30:49Z;6;UCosTL1bEFWnfjWt2R9r66LA;It just will have no value. There will be minor who will be into AI robots playing, singing music, but the majority will require human touch to it;value minor ai robot play sing music majority require human touch;-0.4230000078678131;Negative
UCdP4O1R3Cp2MY8VASRpBkfg;@smarteveryday1606;future is weird, producer is Ai and consumer is also Ai;2024-01-05T13:01:38Z;6;;Future is weird, producer is Ai and consumer is also Ai;future weird producer ai consumer also ai;-0.4020000100135803;Negative
UC6plI-Foo-ikkg_iYBbPW1Q;@OBDPVCR;We desperatly need a technological Supreme Court to regulate emerging tech that challenges the societal order;2024-01-05T09:20:47Z;6;;We desperately need a technological Supreme Court to regulate emerging tech that challenges the societal order;desperately need technological supreme court regulate emerge tech challenge societal order;-0.7110000252723694;Negative
UCNwEWWXoqOMYUXpeXDeL7jA;@lystic9392;Will we finally see movies that are well written again?;2024-01-05T06:41:04Z;6;;Will we finally see movies that are well written again?;finally see movie well write;0.13600000739097595;Negative
UCBOjUxdpWVtuOedkHTHLlXg;@Subaru2_1;Using AI to design posters and posts blows my mind with more than expected images, it frees my creativity from technical things that significantly save my time.;2024-01-05T02:45:04Z;6;;Using AI to design posters and posts blows my mind with more than expected images, it frees my creativity from technical things that significantly save my time.;use ai design poster post blow mind expect image free creativity technical thing significantly save time;0.9390000104904175;Positive
