id;name;text;time;likes;reply;CleanedText;ProcessText;SentimentScore;ActualLabel
UCF5Ml9rtgNvG9pEJNWHfK0Q;@ahenkilgezdi4092;"Amazon&#39;s AMZP33X might just be the answer to a problem we didn&#39;t know we had.";2023-11-30T22:01:23Z;1;;Amazon .AMZP33X might just be the answer to a problem we did not know we had.;amazon .amzpx answer problem not know;0.4519999921321869;Positive
UCMBWByypKWKvVX5eiWR3Mcw;@Havinnhlm;"Heard through the grapevine that Amazon&#39;s AMZP33X will be part of an upcoming major event. Any truth to that?";2023-11-30T22:01:23Z;1;;Heard through the grapevine that Amazon .AMZP33X will be part of an upcoming major event. Any truth to that?;heard grapevine amazon .amzpx part upcoming major event truth;0.09399999678134918;Negative
UCR-LMC5jQqoZVbe8IOCKO_w;@adinahaycock6300;Make a bet, is the next video you watch commenting about Amazons AMZP33X or not? it is everywhere lol;2023-11-30T22:01:23Z;1;;Make a bet, is the next video you watch commenting about Amazons AMZP33X or not? It is everywhere laugh out loud;make bet next video watch comment amazon amzpx not everywhere laugh loud;0.4580000042915344;Positive
UCRzMJDR3c3QXlFJzmwYSc6Q;@TORPACl3674;"Heard a rumor that Amazon&#39;s AMZP33X is going to be integrated into everyday tech. Can anyone confirm?";2023-11-30T22:01:23Z;1;;Heard a rumor that Amazon .AMZP33X is going to be integrated into everyday tech. Can anyone confirm?;hear rumor amazon .amzpx go integrate everyday tech anyone confirm;0.25699999928474426;Negative
UCS10wj3ywyPiLNyN1GxpNaA;@aynurokuyan8883;"I&#39;ve been hearing whispers about Amazon&#39;s AMZP33X in tech circles, but I&#39;m still trying to wrap my head around the concept.";2023-11-30T22:01:23Z;1;;I ve been hearing whispers about Amazon .AMZP33X in tech circles, but I m still trying to wrap my head around the concept.;hear whisper amazon .amzpx tech circle still try wrap head concept;-0.04399999976158142;Negative
UCbkJXvsd3VV3do2ZGZBwacA;@elifesat6925;"Amazon&#39;s AMZP33X seems to be this secret sauce everyone&#39;s talking about, yet no one really knows the recipe.";2023-11-30T22:01:23Z;1;;Amazon .AMZP33X seems to be this secret sauce everyone .talking about, yet no one really knows the recipe.;amazon .amzpx seem secret sauce everyone .talking yet one really know recipe;0.11599999666213989;Negative
UCocU6316YK7obGBqzLPPT3w;@daycindy5088;"Humans will never have peace but we can live a life where we don&#39;t need to be concerned about all the downfall, Amazons AMZP33X is a solid first step, right?";2023-11-30T22:01:23Z;1;;Humans will never have peace, but we can live a life where we do not need to be concerned about all the downfall, Amazons AMZP33X is a solid first step, right?;human never peace live life not need concern downfall amazon amzpx solid first step right;0.7319999933242798;Positive
UCMnomSgZfkbTU9e-sk7He5A;@paulmullaney3089;What could go wrong if Amazons AMZP33X conquers the world? Take the time to inform yourself on the matter it will be worth it;2023-11-30T22:01:23Z;1;;What could go wrong if Amazons AMZP33X conquers the world? Take the time to inform yourself on the matter it will be worth it;go wrong amazon amzpx conquers world take time inform matter;0.7940000295639038;Positive
UCYXIgVjKXx1H8V9zptaD4YA;@NormanLor;PERHAPS WE CAN GET THIS THING TO REVEAL HOW THE EGYPTIANS CREATED ALL THOSE MARVELS!!;2024-04-19T09:04:16Z;0;;PERHAPS WE CAN GET THIS THING TO REVEAL HOW THE EGYPTIANS CREATED ALL THOSE MARVELS!!;perhaps get thing reveal egyptian create marvel;0.6759999990463257;Positive
UCW86TMTg8Lp-96Y1_wzD2Dw;@joecater894;"we always assumed aliens if they are buzzing around the galaxy are so smart because they evolved more ; in reality..  maybe their technology did..  and then carried on evolving and enhancing them.  maybe we&#39;re on the brink of that.";2024-03-23T13:25:06Z;0;;We always assumed aliens if they are buzzing around the galaxy are. Smart because they evolved more in reality. Maybe their technology did. And then carried on evolving and enhancing them. Maybe we re on the brink of that.;always assume alien buzz galaxy smart evolve reality maybe technology carry evolve enhance maybe brink;0.16200000047683716;Negative
UC1sGcqquwa4qxdt7b7dA48A;@Riu-bw4bl;Ok so if we are going to cut the job market in haft especially traditionally well paying jobs something had got to change about the way we run our society. After hearing about the AI that can code it made me realize this will be a huge wealth transfer and people are going to be competing for even fewer jobs. Something will have to change. I almost think this is all by designer;2024-03-17T18:51:21Z;0;;Ok. If we are going to cut the job market in haft especially traditionally well paying jobs something had got to change about the way we run our society. After hearing about the AI that can code it made me realize this will be a huge wealth transfer and people are going to be competing for even fewer jobs. Something will have to change. I almost think this is all by designer;ok. go cut job market haft especially traditionally well pay job something get change way run society hear ai code make realize huge wealth transfer people go compete even job something change almost think designer;-0.47600001096725464;Negative
UC_xgkKnEmGZaEh79xnq2PkQ;@user-qd2hl9lu3h;"People keep saying that there will inevitably be an UBI brought in as a replacement for wages. That won&#39;t happen. Our governments&#39; would rather have national workfare schemes in place for people to do pointless work so that everyone would still be kept in their place. Especially in the UK with their anti-welfare attitudes.";2024-03-13T13:46:19Z;0;;People keep saying that there will inevitably be an FBI brought in as a replacement for wages. That will not happen. Our governments would rather have national workfare schemes in place for people to do pointless work. That everyone would still be kept in their place. Especially in the UK with their anti welfare attitudes.;people keep say inevitably fbi brought replacement wage not happen government rather national workfare scheme place people pointless work everyone still keep place especially uk anti welfare attitude;-0.5809999704360962;Negative
UCLozmZI-Tv2J_tlnWoyu4jQ;@tcos918;Safe office jobs = lazy slobs at work that contribute nothing<br><br>You will be replaced, not by AI directly, but by your more competent coworkers that know how to leverage AI to increase their productivity.;2024-03-03T22:24:19Z;0;;Safe office jobs lazy slobs at work that contribute nothing You will be replaced, not by AI directly, but by your more competent coworkers that know how to leverage AI to increase their productivity.;safe office job lazy slob work contribute nothing replace not ai directly competent coworkers know leverage ai increase productivity;-0.1720000058412552;Negative
UCR5fUcgatDDH31gLLOL1lSA;@louminati4318;No need for useless humans any more. Are they bumping us off already?;2024-02-27T08:09:59Z;0;;No need for useless humans anymore. Are they bumping us off already?;need useless human anymore bump already;-0.8450000286102295;Negative
UC2ysK7WbbEY71DZ6xwtocaA;@nickchkheidze9189;most jobs suck anyway;2023-12-27T08:52:54Z;0;;Most jobs suck anyway;job suck anyway;-0.8870000243186951;Negative
UC3wup_-Z1J3yEB2bMR2sM7Q;@neroetal;Well articulated interview;2023-12-25T12:32:50Z;0;;Well articulated interview;well articulate interview;0.9390000104904175;Positive
UChu_r1_zaB-iC40Uh_447Ew;@joshismyhandle;British audio;2023-12-21T05:39:50Z;0;;British audio;british audio;0.04500000178813934;Negative
UCrPO0LffHBhWb-Ks84duU2g;@lawrencebishton9071;why would any 1 put sum 1 in a Cab,i,net;2023-12-20T17:26:46Z;0;;Why would any 1 put sum 1 in a Cab, i,net;put sum cab net;-0.8659999966621399;Negative
UCAiWkl35kIiOpjd1NTHaejw;@chocmilk4388;AI could have created better audio;2023-12-20T13:26:39Z;0;;AI could have created better audio;ai create well audio;-0.9129999876022339;Negative
UCqzpYkTwhUj3oidpFjuMe5g;@4mb127;"Why the hell should there be compensation? Is there compensation for me as a private business owner when someone creates a better product? The whole concept is absurd. Also another solution: higher taxes? That&#39;s stupid beyond belief.";2023-12-20T12:59:32Z;0;;Why the he will should there be compensation? Is there compensation for me as a private business owner when someone creates a better product? The whole concept is absurd. Also, another solution higher taxes? That .stupid beyond belief.;compensation compensation private business owner someone create good product whole concept absurd also solution high tax .stupid belief;-0.5199999809265137;Negative
UCtUsxyS8olSNnWwHOEW-A8g;@ericastones1052;There will be no jobs expect politician and AI will be asking humans look for jobs already taken by AI and we get no income.;2023-12-19T17:36:24Z;0;;There will be no jobs expect politician and AI will be asking humans look for jobs already taken by AI, and we get no income.;job expect politician ai ask human look job already take ai get income;-0.9160000085830688;Negative
UClFx4GGVx0ata-Qwg6RM5Dw;@anthonyazzopardi273;"Be careful dude, you want be telling the news, soon you&#39;ll be replaced by a dumb robot without the sarcastic comments, unless it will be programmed to do so also.";2023-12-19T10:34:55Z;0;;Be careful dude, you will not be telling the news, soon you ll be replaced by a dumb robot without the sarcastic comments, unless it will be programmed to do. Also.;careful dude not tell news soon replace dumb robot sarcastic comment program also;-0.45899999141693115;Negative
UCEohfpVG3qbVnjKSdUVmDQw;@GregtheGrey6969;We will make great pets;2023-12-18T13:02:09Z;0;;We will make great pets;make great pet;0.9120000004768372;Positive
UC3DPNJYqL39HToq2pjrfw-Q;@gamingthunderbolt1621;New jobs are gonna come seriously then tell me which new jobs are gonna come i will prepare for that this woman just lacks common sense;2023-12-17T06:35:59Z;0;;New jobs are going to come seriously then tell me which new jobs are going to come I will prepare for that this woman just lacks common sense;new job go come seriously tell new job go come prepare woman lack common sense;-0.9210000038146973;Negative
UCSZ0yKHx8sgrZ_gKOZIWB_Q;@extraincomesuz;"I work online with e-commerce running a English learning website.  It used to take me 3 days to create a video and another day to create a lesson plan/script and worksheet download.  Now I can get one completed in a day with AI.  This has freed up a lot of time so I can concentrate on SEO and marketing. I love it. I think it will free us up and people shouldn&#39;t be expected to take on more, but use the freed time to do other good work for their company.";2023-12-14T00:16:11Z;0;;I work online with e commerce running an English learning website. It used to take me 3 days to create a video and another day to create a lesson plan script and worksheet download. Now I can get one completed in a day with AI. This has freed up a lot of time. I can concentrate on SEO and marketing. I love it. Furthermore, I think it will free us up and people shouldn't be expected to take on more, but use the freed time to do other good work for their company.;work online e commerce run english learning website use take day create video day create lesson plan script worksheet download get complete day ai free lot time concentrate seo marketing love furthermore think free people n't expect take use freed time good work company;0.6010000109672546;Positive
UCTwRLaPs-tWkn_FHOsnc0uw;@markmuller7962;People wasting time and energy protesting against progress instead of advocating for a decent welfare for everyone;2023-12-13T20:17:48Z;0;;People wasting time and energy protesting against progress instead of advocating for a decent welfare for everyone;people waste time energy protesting progress instead advocate decent welfare everyone;-0.8289999961853027;Negative
UCqompUkuO1h1WC_S_ueiDaA;@AlexanderBukh;yuck;2023-12-13T11:37:11Z;0;;yuck;yuck;-0.8220000267028809;Negative
UCNxgdCCpERmbYA6AI1_ympw;@williamparrish2436;How can you do it without a plan? Its called the free market and the Invisible Hand for a reason! The market left to its own devices will balance this out. People will be motivated to retrain for their own sakes.;2023-12-13T02:35:20Z;0;;How can you do it without a plan? It is called the free market and the Invisible Hand for a reason! The market left to it it is own devices will balance this out. People will be motivated to retrain for their own sakes.;plan call free market invisible hand reason market leave device balance people motivate retrain sake;0.32899999618530273;Negative
UC8AoDuzJeH1YerX_wzmv77A;@procrastinateXrok;Excited to advance AI and create opportunities!;2023-12-13T02:34:17Z;0;;Excited to advance AI and create opportunities!;excite advance ai create opportunity;0.9679999947547913;Positive
UCr0B54-8lSJGcr5wI6Rmj-w;@rajivjowaheer9882;As usual BBC;2023-12-12T08:06:06Z;0;;As usual BBC;usual bbc;0.5770000219345093;Positive
UCT-ehaYAFfj6zRe1QlbQjaA;@ttrev007;hopefully it just increases the productivity of peoples jobs. Like computers did for office work.;2023-12-12T03:27:24Z;0;;Hopefully it just increases the productivity of peoples jobs. Like computers did for office work.;hopefully increase productivity people job computer office work;0.4860000014305115;Positive
UCDwfycCtRdb4pQ79ssf4rkA;@user-nm4sb7ju6z;Okay thanks al international and community and all security my family all brothers and sisters my family all also and all international and community and all security and all airlines and all food policies and gas and oil and hospital and school and building and bank and electricity and water and internet and all border and immigration and hotel and school and trucks and cars and all airlines and freedom and Democratic policies and companies and all Humanity my family all brothers and sisters my family all palatine the my government my family all west bank and Gaza all genocide in stop Israel OK international law and human and UN and AMF and who and all Gaza and companies and all Humanity my family all brothers and sisters my family all also and all Gaza and colonialism and all palatine all colonialism and African all colonialism and history and all also and human beings and all my family all brothers and sisters my family all peace OK thanks;2023-12-11T13:49:40Z;0;;Okay thanks all international and community and all security my family all brothers and sisters my family all also and all international and community and all security and all airlines and all food policies and gas and oil and hospital and school and building and bank and electricity and water and internet and all border and immigration and hotel and school and trucks and cars and all airlines and freedom and Democratic policies and companies and all Humanity my family all brothers and sisters my family all palatine the government my family all west bank and Gaza all genocide in stop Israel OK international law and human and UN and AMF and who and all Gaza and companies and all Humanity my family all brothers and sisters my family all also and all Gaza and colonialism and all palatine all colonialism and African all colonialism and history and all also and human beings and all my family all brothers and sisters my family all peace OK thanks;okay thanks international community security family brother sister family also international community security airline food policy gas oil hospital school building bank electricity water internet border immigration hotel school truck car airline freedom democratic policy company humanity family brother sister family palatine government family west bank gaza genocide stop israel ok international law human un amf gaza company humanity family brother sister family also gaza colonialism palatine colonialism african colonialism history also human family brother sister family peace ok thanks;0.5130000114440918;Positive
UCdtPnk4ObNacbfHjr0EJKsA;@lukejones1600;AI should replace whomever is doing the audio at the BBC. It could probably replace the presenter and the talking head too.;2023-12-11T02:42:29Z;0;;AI should replace whoever is doing the audio at the BBC. It could probably replace the presenter and the talking head too.;ai replace audio bbc probably replace presenter talk head;-0.4129999876022339;Negative
UCeZWAKJgvQQWFuq5lEPDBoA;@folkengames;Perhaps you should have asked chat gpt how to mic your guests.;2023-12-10T15:19:42Z;0;;Perhaps you should have asked ChatGPT how to mic your guests.;perhaps ask chatgpt mic guest;-0.39800000190734863;Negative
UCwo4MFTpwrT3nDGo41pnzbA;@speedgoat7496;Disappointing how as a country we cant lead in anything anymore. Folk too focused on causing division.;2023-12-10T13:11:41Z;0;;Disappointing how as a country we can not lead in anything anymore. Folk too focused on causing division.;disappoint country not lead anything anymore folk focus cause division;-0.9390000104904175;Negative
UCqPI5LicY49y9ZswsK87_fw;@seamust1181;She is good, very broad knowledge;2023-12-10T11:02:51Z;0;;She is good, very broad knowledge;good broad knowledge;0.9399999976158142;Positive
UC7V0YDs1zkpDL4AMKD571pw;@theRosaryMerchant;CHAT;2023-12-09T11:57:21Z;0;;CHAT;chat;-0.08900000154972076;Negative
UCbEyL8pLElDEW1Y7NRyU7nA;@pepitalinda5964;if we dont introduce regulations then be prepared to see the reaction of the masses displaced by AI which I am sure will be ugly;2023-12-09T02:39:21Z;0;;If we do not introduce regulations then be prepared to see the reaction of the masses displaced by AI which I am sure will be ugly;not introduce regulation prepare see reaction mass displace ai sure ugly;-0.9629999995231628;Negative
UCQ5V98AFHZfRLfs4QWXtUzQ;@johnnysomebodyjohnny;Maybe sound person was replaced with AI,;2023-12-08T23:42:07Z;0;;Maybe sound person was replaced with AI,;maybe sound person replace ai;-0.2590000033378601;Negative
UCWdE-t93iUUWybaYaMmdMKA;@derickshalo384;No employer wants you innovating! It goes against preferred and tested processes. You are employed to implement the process, not reinvent the process.;2023-12-08T18:29:21Z;0;;No employer wants you innovating! It goes against preferred and tested processes. You are employed to implement the process, not reinvent the process.;employer want innovate go prefer test process employ implement process not reinvent process;-0.7070000171661377;Negative
UChHmSi9x2fAgNhoic6SIjNw;@xerasion;"The so-called &quot;A.I. expert&quot; is still in denial while feeding us the faith-based corporate line of &quot;more jobs will be magically created than destroyed when A.I. is doing all the work.&quot; Hang on a minute, if someone can 100X their production, then what happens to the other 99 workers? Are we going to shorten the work week to a hundredth of 40 hours? That would make the work week 0.4 hours = 24 minutes per week to keep everyone employed. If we are not going to shorten the work week, then where will all that productivity go? Certainly not to the unemployed workers. Will Jobs suddenly pay 100X more or will the aristocracy just get astronomically more wealthy like always. We need to base human worth on something other than labor today! UBI NOW!";2023-12-08T13:34:57Z;0;;The. called A.I. expert is still in denial while feeding us the faith based corporate line of more jobs will be magically created than destroyed when A.I. is doing all the work. Hang on a minute, if someone can 100X their production, then what happens to the other 99 workers? Are we going to shorten the work week to a hundredth of 40 hours? That would make the work week 0.4 hours 24 minutes per week to keep everyone employed. If we are not going to shorten the work week, then where will all that productivity go? Certainly not to the unemployed workers. Will Jobs suddenly pay 100X more or will the aristocracy just get astronomically more wealthy like always. We need to base human worth on something other than labor today! FBI NOW!;call a.i expert still denial feed faith base corporate line job magically create destroy a.i work hang minute someone x production happen worker go shorten work week hundredth hour make work week hour minute week keep everyone employ not go shorten work week productivity go certainly not unemployed worker job suddenly pay aristocracy get astronomically wealthy always need base human worth something labor today fbi;-0.4749999940395355;Negative
UCvDctXqicGmOaR-wFfgFyGw;@ForAnAngel;Nobody cared when factory workers lost their jobs to robots so why should we care about well-off office workers?;2023-12-08T01:31:51Z;0;;Nobody cared when factory workers lost their jobs to robots. Why should we care about well off office workers?;nobody care factory worker lose job robot care well office worker;-0.8560000061988831;Negative
UCJdA9juzNxx6hL10YwSGhqg;@martynhaggerty2294;"Humans are becoming obsolete. Even a revolution will be pointless.  You can&#39;t pitchfork a data centre.";2023-12-07T21:30:17Z;0;;Humans are becoming obsolete. Even a revolution will be pointless. You can not pitchfork a data center.;human become obsolete even revolution pointless not pitchfork data center;-0.8489999771118164;Negative
UCr7A6t_rzSIxODbMlgPP3WA;@antdx316;A great reset is near. Be ready.;2023-12-07T18:25:13Z;0;;A great reset is near. Be ready.;great reset ready;0.5;Positive
UCf_JyeeWa0MnbUFyxv8sdMA;@manoobahar;"she is dumb as a ... Ai isn&#39;t a bloody calculator... it thinks by it self and can make decisions.... why bring someone as incompetent as her for interview regards Ai???   bbc is a joke";2023-12-07T16:50:06Z;0;;She is dumb as a ... Ai is not a bloody calculator... it thinks by itself and can make decisions.... why bring someone as incompetent as her for interview regards Ai??? Bbc is a joke;dumb ai not bloody calculator think make decision .... bring someone incompetent interview regard ai bbc joke;-0.8740000128746033;Negative
UCyDlSAB_Nu0q67CgYUaJLxA;@78grafikal;All Hail A.I;2023-12-07T13:22:31Z;0;;All Hail A.I.;hail a.i;0.8240000009536743;Positive
UCWRRBRfMSyUJsc329e1NnSg;@flocore;Audio engineer was on his lunch break during this interview...;2023-12-07T10:35:12Z;0;;Audio engineer was on his lunch break during this interview...;audio engineer lunch break interview;0.013000000268220901;Negative
UCZuNpoCDgw1J4lSe5zcR5_g;@aceyage;Equal wealth distribution, not UBI. UBI is just feudalism.;2023-12-16T16:26:13Z;0;UCsTKC5B4UlY4rJfc5LAw-OQ;Equal wealth distribution, not FBI. FBI is just feudalism.;equal wealth distribution not fbi fbi feudalism;-0.5479999780654907;Negative
UCOJkfApUnx1XAA4GV7DANgw;@OzGoober;"Pretty sure almost everyone that&#39;s found the wonder of coding has wished for AGI to fix societies ills. This has literally been the point.";2023-12-07T08:34:28Z;0;;Pretty sure almost everyone that .found the wonder of coding has wished for AGI to fix societies ills. This has literally been the point.;pretty sure almost everyone .found wonder coding wish agi fix society ills literally point;0.23100000619888306;Negative
UCll-ynletJj_3oe6OZPaimQ;@stassoad2546;"Yeah, let&#39;s give access to all these crazy people so they can finally destroy everything";2023-12-13T13:09:36Z;0;UCBUCIHuRrWxPOwkh2oO-Hww;Yeah, let .give access to all these crazy people. They can finally destroy everything;let .give access crazy people finally destroy everything;-0.2639999985694885;Negative
UCnRc29s-8diibFWQuUVOEaQ;@antoniobortoni;IA is nothing we expect, the best lawey, medical, vet, worker, the best cheapest worker is now IA and it get better and better, so its time for socialism, there is a limit to new jobs, and th limit es here, 2023, there is no more new jobs, all the opposite, and a good human robots will end capitalism, so its the time for technological socialism, subsidice technology and countries and society, pay them for study, doing sports, arts, pay for living good.... <br>Dont just give up money, give money for something good only.;2023-12-06T20:48:51Z;0;;IA is nothing we expect, the best lava, medical, vet, worker, the best cheapest worker is now IA, and it gets better and better, It is time for socialism, there is a limit to new jobs, and the limit ES here, 2023, there is no more new jobs, all the opposite, and a good human robot will end capitalism, It is the time for technological socialism, subsidize technology and countries and society, pay them for study, doing sports, arts, pay for living good.... do not just give up money, give money for something good only.;ia nothing expect best lava medical vet worker best cheapest worker ia get well good time socialism limit new job limit e new job opposite good human robot end capitalism time technological socialism subsidize technology country society pay study sport art pay live good .... not give money give money something good;0.15199999511241913;Negative
UCcewKjUVpX7TVjg9vlYePaQ;@mikedodger7898;What a joke. How long will it be for these talking heads to be replaced? How will they adapt?;2023-12-06T06:20:18Z;0;;What a joke. How long will it be for these talking heads to be replaced? How will they adapt?;joke long talk head replace adapt;-0.6290000081062317;Negative
UCodmlPiSGxi4axCUbFpAIig;@sandponics;Yippee, no more work. I want a robot to do the gardening, cook my food, clean and paint the house, wash my clothes, change my nappy and scratch by back etc. I am a 77 years old educator, highly experienced, and young people have not got a clue about what is happening in the world.;2023-12-06T04:25:21Z;0;;Yippee, no more work. I want a robot to do the gardening, cook my food, clean and paint the house, wash my clothes, change my nappy and scratch by back etc. I am a 77 years old educator, highly experienced, and young people have not got a clue about what is happening in the world.;yippee work want robot gardening cook food clean paint house wash clothes change nappy scratch back etc year old educator highly experience young people not get clue happen world;0.054999999701976776;Negative
