id;name;text;time;likes;reply;CleanedText;ProcessText;SentimentScore;ActualLabel
UCLxUBqQliT2dIMWDDcqjPcw;@ScorpioMami415;"Applicant tracking systems in human resources are the reason why people aren&#39;t getting jobs today. Selected and not selected or we decided to go with other candidates 😂😂😂sickening just sickening. Or we decided to go with other candidates who had a better match. Al is destroying lives and wiping out our jobs. AI is destroying humanity!!!!";2024-04-30T16:04:05Z;0;;Applicant tracking systems in human resources are the reason why people are not getting jobs today. Selected and not selected, or we decided to go with other candidates sickening just sickening. Or we decided to go with other candidates who had a better match. Al is destroying lives and wiping out our jobs. AI is destroying humanity!!!!;applicant track system human resource reason people not get job today select not select decide go candidate sicken sicken decide go candidate good match al destroy life wipe job ai destroy humanity;-0.8109999895095825;Negative
UCO7inrxuhePK-G4wnmmtPVA;@905JimRaynor;"i&#39;m an AI programmer.   I&#39;m a contractor//consultant that rescues failing AI projects.  thing is, AI and functional programming are harder than declarative language programming.  That is the elephant in the room.  Not every coder has the math background and natural talent to pull off sophisticated AI.";2024-04-29T18:24:44Z;0;;I am an AI programmer. I m a contractor consultant that rescues failing AI projects. Thing is, AI and functional programming are harder than declarative language programming. That is the elephant in the room. Not every coder has the math background and natural talent to pull off sophisticated AI.;ai programmer contractor consultant rescue fail ai project thing ai functional programming hard declarative language programming elephant room not coder math background natural talent pull sophisticated ai;-0.19499999284744263;Negative
UCAxd69dT35cZSaYipCGREkg;@vasthepirate5673;"I&#39;ll admit I was hoping my job was getting replaced by AI so I wouldn&#39;t have to do this dumbass job anymore...";2024-04-29T17:23:22Z;0;;I ll admit I was hoping my job was getting replaced by AI. I would not have to do this dumbass job anymore...;admit hop job get replace ai not dumbass job anymore;-0.8840000033378601;Negative
UCVGzHWP6XySjPxy6Ma9wxwg;@Drakelis;Law is a decade behind on this stuff. How are we all supposed to have well paying jobs if so many of these are replaced by AI to save money for the top?;2024-04-29T16:38:59Z;0;;Law is a decade behind on this stuff. How are we all supposed to have well paying jobs if. Many of these are replaced by AI to save money for the top?;law decade stuff suppose well pay job many replace ai save money top;-0.6520000100135803;Negative
UC-SG-iDKOH_68J9aeptA0SQ;@user-bl3si3kq6x;The only jobs left will be performances.<br><br>Comedian, singer, fighter, surgeon<br><br>Even cam girls will disappear;2024-04-28T22:55:42Z;0;;The only jobs left will be performances. Comedian, singer, fighter, surgeon Even cam girls will disappear;job leave performance comedian singer fighter surgeon even cam girl disappear;-0.20999999344348907;Negative
UCI1J6YH1BQtU2vkpzNsyFLQ;@ErikS22;Strange that A.I is being pushed so hard after the mass global jab rollout.;2024-04-27T21:23:06Z;0;;Strange that A.I. am being pushed. Hard after the mass global jab rollout.;strange a.i push hard mass global jab rollout;-0.5830000042915344;Negative
UC6tSuqJP_M_47rv72vDrjIQ;@stratuspei9405;AI replacing many lawyers seems to be a good change.;2024-04-25T16:40:16Z;0;;AI replacing many lawyers seems to be a good change.;ai replace many lawyer seem good change;0.9350000023841858;Positive
UCKpRITCc9RrFxpOuW7I76bg;@JW-um5pg;UBI. Come on.;2024-04-24T20:03:24Z;0;;FBI. Come on.;fbi come;-0.14100000262260437;Negative
UCncG9r7I5gqP3nBp6YUEl3g;@HerrenGamingNews;I can see 90% of office jobs being eliminated. Time to get a real job and work with your hands.;2024-04-23T16:05:31Z;0;;I can see 90 of office jobs being eliminated. Time to get a real job and work with your hands.;see office job eliminate time get real job work hand;-0.8610000014305115;Negative
UCQjaNLx-QbLGfY2oXcdObYA;@SB-mg1wy;But can we all switch to manual labor, blue collar work?;2024-04-22T17:06:23Z;0;;But can we all switch to manual labor, blue collar work?;switch manual labor blue collar work;-0.1899999976158142;Negative
UCffkhW-j-iZp4Yv-Y22nfqA;@dave24-73;First department I would axe is HR they do very little to contribute to the company overall, and often support bullying cultures. The worse thing to happen to companies is without a doubt HR.;2024-04-22T01:03:30Z;0;;First department I would axe is HR they do very little to contribute to the company overall, and often support bullying cultures. The worse thing to happen to companies is without a doubt HR.;first department axe hr little contribute company overall often support bully culture bad thing happen company doubt hr;-0.8880000114440918;Negative
UC6pYfvZ6S8PxU5zeh1SgGOg;@mfisher1952;"I think I&#39;m glad I&#39;m retired.";2024-04-21T23:22:38Z;0;;I think I m glad I m retired.;think glad retire;0.699999988079071;Positive
UCIq1fSm6gmuswlFFwyjHdVQ;@duikmans;"Helpdesks are being replaced en masse by AI. We don&#39;t really notice as most of them are based in India (anyway).";2024-04-21T21:54:21Z;0;;Helpdesks are being replaced en masse by AI. We do not really notice as most of them are based in India anyway .;helpdesk replace masse ai not really notice base india anyway;-0.08100000023841858;Negative
UCjgJxi2JrH2pYKTq9bvUeFQ;@-VIGILANTALWAYS;🤨🌐 But...WHO WILL PROTECT THE MERCHANDISE OF THESE GREEDY 🤑 AI TECH FACTORIES ESPECIALLY IN COMMERCE...⁉️💲💲💲💲💲💲💲💲💲;2024-04-21T19:08:09Z;0;;But...WHO WILL PROTECT THE MERCHANDISE OF THESE GREEDY AI TECH FACTORIES ESPECIALLY IN COMMERCE...;protect merchandise greedy ai tech factory especially commerce;-0.578000009059906;Negative
UCuQA6XPfngm8QUly1ALku-Q;@jaysphilosophy1951;"This was a long time coming...We know A.I will eventually replace surgeons, pharmicists, truck drivers, and so on.   I&#39;ve known about this since 2014 after reading Jaron Lanier&#39;s book &quot;you are not a gadget&quot;.";2024-04-20T11:12:19Z;0;;This was a long time coming... We know A.I. will eventually replace surgeons, pharmacists, truck drivers, and. On. I ve known about this since 2014 after reading Jaron Lanier .book you are not a gadget .;long time come know a.i eventually replace surgeon pharmacist truck driver know read jaron lanier .book not gadget;0.08500000089406967;Negative
UCrOQ3-f6eUyKn1KKK_oygZg;@galaxyfrog7983;"I was a translator, then I was a marketer, now im a designer. Tech keeps coming for my jobs. I dont know how I&#39;m gonna live now";2024-04-19T00:45:36Z;0;;I was a translator, then I was a marketer, now I am a designer. Tech keeps coming for my jobs. I do not know how I m going to live now;translator marketer designer tech keep come job not know go live;0.10999999940395355;Negative
UC9v83Ft0unalbQRudM5_meA;@ChilsonTV;"pop quiz: which of these two quotes was said by Henry Ford?<br>&quot;you gotta pay the employee enough to afford the car&quot;<br>&quot;AI is cheaper and better and the employee can go die&quot;";2024-04-19T00:44:59Z;0;;Pop quiz which of these two ES was said by Henry Ford? You have to pay the employee enough to afford the car AI is cheaper and better and the employee can go die;pop quiz e say henry ford pay employee enough afford car ai cheap good employee go die;-0.4490000009536743;Negative
UCj7LSjiSOTKH86-tiOH0nsQ;@darrell20741;I am a human that came up with the idea to reply to this video. Who is behind AI? I would bet humans are. Want a new job, find an AI you can tell what to do, for you.;2024-04-13T22:47:31Z;0;;I am a human that came up with the idea to reply to this video. Who is behind AI? I would bet humans are. Want a new job, find an AI you can tell what to do, for you.;human come idea reply video ai bet human want new job find ai tell;-0.05700000002980232;Negative
UCSWH2JfdlLHhCqywgfiDiFQ;@squealerpig8451;Welfare;2024-04-22T13:48:05Z;0;UCAn7usY8Rgi1H64EXZOBYuA;Welfare;welfare;0.009999999776482582;Negative
UCYXIgVjKXx1H8V9zptaD4YA;@NormanLor;"DO CEOS AND THE ACTUAL COMPANY OWNERS THINK THEY&#39;RE IMMUNE FROM GETTING AI&#39;S BOOT??!!";2024-04-12T19:01:37Z;0;;DO CEOs AND THE ACTUAL COMPANY OWNERS THINK THEY RE IMMUNE FROM GETTING AI S BOOT??!!;ceo actual company owner think immune get ai boot;-0.9020000100135803;Negative
UCrP6zrnHB3hkln-aOZ6-QQA;@meowmrrrp;"The only thing that will protect your working future is workers organizing and demanding their rights to be respected, we shouldn&#39;t tolerate this dystopian future when it objectively worsens our standards of living.";2024-04-12T00:49:32Z;0;;The only thing that will protect your working future is workers organizing and demanding their rights to be respected, we shouldn't tolerate this dystopian future when it objectively worsens our standards of living.;thing protect work future worker organize demand right respect n't tolerate dystopian future objectively worsen standard living;-0.75;Negative
UCwkqGan35nBbWeZ2wjNcZEA;@metylen;"&quot;...And she said:<br>Do you come from a land down under, Where women glow and men plunder<br>Can&#39;t you hear, can&#39;t you hear the thunder, You better run, you better take cover.&quot;";2024-04-11T17:22:55Z;0;;... And she said Do you come from a land down under, Where women glow and men plunder Can't you hear, can not you hear the thunder, You better run, you better take cover.;say come land woman glow men plunder n't hear not hear thunder good run good take cover;-0.3400000035762787;Negative
UCiN56yrZscO1UZouj2KUXeQ;@ushapedcurve3831;"<a href=""https://www.youtube.com/watch?v=4qQUCQHCTu8&amp;t=611"">10:11</a> Tech jobs and coding.";2024-04-09T05:35:51Z;0;;a ref Tech jobs and coding.;ref tech job coding;0.017999999225139618;Negative
UCiZ6Dvc-stuIgGdaMUT7daA;@pl6935;This will push people out of complacency which is good in a way;2024-04-07T22:00:07Z;0;;This will push people out of complacency which is good in a way;push people complacency good way;0.8370000123977661;Positive
UCuHjQdOrLfoPlq--A004A2w;@gigiartstudiowithartistvir3919;How are our kids supposed to know what to study in college? What will the point of college even be in an AI world?;2024-04-07T00:19:56Z;0;;How are our kids supposed to know what to study in college? What will the point of college even be in an AI world?;kid suppose know study college point college even ai world;-0.5699999928474426;Negative
UCSWH2JfdlLHhCqywgfiDiFQ;@squealerpig8451;No point, just get on welfare and enjoy your couch;2024-04-22T13:48:47Z;0;UCuHjQdOrLfoPlq--A004A2w;No point, just get on welfare and enjoy your couch;point get welfare enjoy couch;-0.9290000200271606;Negative
UCmU2PBFBSbrOk8umYClEjUA;@frankprit3320;"even if AI is writing code. You still have to know how coding works and what you want the AI to even do.<br>I could see this as a powerful tool for senior programmers. As a junior programmer, you will probably need a lot more &quot;skill sets&quot; just to survive. <br>Some of these skills might be just &quot;life hacks&quot; in order to bring your cost of living down to compensate for lower wages.";2024-04-06T13:52:31Z;0;;Even if AI is writing code. You still have to know how coding works and what you want the AI to even do. I could see this as a powerful tool for senior programmers. As a junior programmer, you will probably need a lot more skill sets just to survive. Some of these skills might be just life hacks in order to bring your cost of living down to compensate for lower wages.;even ai write code still know coding work want ai even see powerful tool senior programmer junior programmer probably need lot skill set survive skill life hack order bring cost live compensate low wage;0.03099999949336052;Negative
UCdpk7Xea7Xt9au-M8nZjHuA;@amaduddin1995;A lot of office jobs will be eliminated by AI;2024-04-06T12:36:25Z;0;;A lot of office jobs will be eliminated by AI;lot office job eliminate ai;-0.43700000643730164;Negative
UCqSKQmDEMYeWz7kPt24YNTA;@AnthonyRusso93;"The technology has not be realized to the point it can satisfactorily replace humans without hand holding so sayith the AI experts what AI experts don&#39;t understand is that they are doing it anyway";2024-04-05T17:33:20Z;0;;The technology has not been realized to the point it can satisfactorily replace humans without hand holding. Sayith the AI experts what AI experts do not understand is that they are doing it anyway;technology not realize point satisfactorily replace human hand hold sayith ai expert ai expert not understand anyway;-0.3569999933242798;Negative
UCg33MZkt2btqVIg7sXezxgA;@Greyalien587;When the tractors and machines came it weren’t a big need for horses and riders. But it was okay. Due to the more productivity there were need for people to load and unload, do accounting, some drove the tractor, some went into repairs. <br><br>This replaces the horse , the tractor, the driver, the loaders, the accountant, the shopkeeper, and soon the repairmen. <br><br>That’s okay you think, the worker will just go into town and find a new job. When he is there he notices that machines are making burgers, the receptionist at the hotel is artificial, the bank teller is a screen, the taxis drives themselves. <br><br>This is a different beast. We are outsourcing the only thing that makes most of us valueable in modern society- intelligence;2024-04-04T18:14:35Z;0;;When the tractors and machines came it were not a big need for horses and riders. But it was okay. Due to the more productivity there were need for people to load and unload, do accounting, some drove the tractor, some went into repairs. This replaces the horse, the tractor, the driver, the loaders, the accountant, the shopkeeper, and soon the repairmen. That .okay you think, the worker will just go into town and find a new job. When he is there he notices that machines are making burgers, the receptionist at the hotel is artificial, the bank teller is a screen, the taxis drives themselves. This is a different beast. We are outsourcing the only thing that makes most of us valuable in modern society intelligence;tractor machine come not big need horse rider okay due productivity need people load unload accounting drive tractor go repair replace horse tractor driver loader accountant shopkeeper soon repairman .okay think worker go town find new job notice machine make burger receptionist hotel artificial bank teller screen taxis drive different beast outsource thing make valuable modern society intelligence;-0.20800000429153442;Negative
UC_IsNqFc9i_ozXv_mEULZvg;@amineaiffa;Lol @ HR;2024-03-31T20:14:28Z;0;;laughing out loud HR;laugh loud hr;0.8759999871253967;Positive
UCCgyaVctFTdLJp4eg0mv4LA;@item6931;"<a href=""https://www.youtube.com/watch?v=4qQUCQHCTu8&amp;t=335"">5:35</a> I&#39;m a product engineer, meaning I have to be creative to keep product life cycles going as long as possible and also help develop new products to hit the market when the older ones have hit EOL.  I&#39;ll admit that the only AI I&#39;ve used to assist me is ChatGPT, but if the other AI &quot;creatives&quot; resemble it in any way then &quot;creative work&quot; is very safe indeed.";2024-03-31T07:51:42Z;0;;a ref I m a product engineer, meaning I have to be creative to keep product life cycles going as long as possible and also help develop new products to hit the market when the older ones have hit EOL. I ll admit that the only AI I ve used to assist me is ChatGPT, but if the other AI creatives resemble it in any way then creative work is very safe indeed.;ref product engineer mean creative keep product life cycle go long possible also help develop new product hit market old one hit eol admit ai use assist chatgpt ai creatives resemble way creative work safe indeed;0.6620000004768372;Positive
UC4ksXQ4PhvD0RPM1NNVX_Qg;@ScottBeck79;Davos and Klaus Schwab - You will own nothing and be happy.  Not sinister at all....;2024-03-30T19:02:06Z;0;;Davos and Klaus Schwab You will own nothing and be happy. Not sinister at all....;davos klaus schwab nothing happy not sinister ....;0.2840000092983246;Negative
UC8VSbPpgYENW8zWHvPFPSLw;@Peter-tk6rm;"In Australia H.R is called<br>People &amp; Culture.<br>Bolshevik Yidds have hijacked <br>and subverted even the dullest<br>of occupations.";2024-03-29T06:32:19Z;0;;In Australia H. R is called People Culture. Bolshevik Yids have hijacked and subverted even the dullest of occupations.;australia h. r call people culture bolshevik yid hijack subvert even dull occupation;-0.3140000104904175;Negative
UC8VSbPpgYENW8zWHvPFPSLw;@Peter-tk6rm;Love the Yiddish word Salad <br> these sellout<br>C.E.O use.<br>Sold out Americas intellectual property<br>to the highest bidder.;2024-03-29T06:29:57Z;0;;Love the Yiddish word Salad these sellout C.E.O use. Sold out Americas intellectual property to the highest bidder.;love yiddish word salad c.e.o use sell americas intellectual property high bidder;-0.5429999828338623;Negative
UCcla14Ymah59DSKWn_6G4tg;@ashleypello7532;"&quot;Higher value work&quot;=layoff coming soon";2024-03-29T06:26:42Z;0;;Higher value work layoff coming soon;high value work layoff come soon;-0.8870000243186951;Negative
UCMLm_fcuSWcgf-k8KPbVgoA;@Shaheer7X;Would graphic design be a good field to go into given everything currently going on with AI? Plan to study graphic design in university this year so;2024-03-27T01:28:30Z;0;;Would graphic design be a good field to go into given everything currently going on with AI? Plan to study graphic design in university this year.;graphic design good field go give everything currently go ai plan study graphic design university year;0.06400000303983688;Negative
UCrCVf0JjPEozxt6WzxBIfyQ;@g0d182;indeed;2024-03-25T13:06:40Z;0;;indeed;indeed;0.2540000081062317;Negative
UC3mU6Zj3gS8gQ30HN1Qv52Q;@rvscript;A.I. in coding has its limitations. People are constantly making changes and or have needs that require extending applications. A.I. cannot, yet, predict all changes and definitely cannot adjust to those changes.;2024-03-23T12:57:16Z;0;;A.I. in coding has it is limitations. People are constantly making changes and or have needs that require extending applications. A.I. can not , yet, predict all changes and definitely can not adjust to those changes.;a.i coding limitation people constantly make change need require extend application a.i not yet predict change definitely not adjust change;-0.33399999141693115;Negative
UC2TmL6A_kGMP7fiBfcTWVww;@BenjaminBjornsen;Not yet, but next month, next year?;2024-03-26T08:21:53Z;0;UC3mU6Zj3gS8gQ30HN1Qv52Q;Not yet, but next month, next year?;not yet next month next year;0.024000000208616257;Negative
UCkPGJyQ8WAbaaYxJcmbzWIw;@lot828;I guess AI will be purchasing the goods and services.;2024-03-23T00:01:27Z;0;;I guess AI will be purchasing the goods and services.;guess ai purchase good service;0.06700000166893005;Negative
UCOgn9WWBymBlWEha3Fu3OQw;@abajaj1510;Soon we will have an economy where AI produces and AI avatars purchase and consume. Humans will own nothing and be happy.;2024-03-22T13:37:29Z;0;;Soon we will have an economy where AI produces and AI avatars purchase and consume. Humans will own nothing and be happy.;soon economy ai produce ai avatar purchase consume human nothing happy;0.35100001096725464;Negative
UCIqUWPHgSKyzQAklmYd2TOw;@mikes7446;As by design;2024-03-22T04:46:52Z;0;;As by design;design;0.06400000303983688;Negative
UCFj-dG9VG_PjbXgaF3ZlEWQ;@pawpkitty;I will never be a traitor and use AI on the back of stolen data and stolen art. Never.;2024-03-21T21:53:11Z;0;;I will never be a traitor and use AI on the back of stolen data and stolen art. Never.;never traitor use ai back steal data steal art never;-0.5220000147819519;Negative
UC2TmL6A_kGMP7fiBfcTWVww;@BenjaminBjornsen;Ok, then you will lose;2024-03-26T08:24:17Z;0;UCFj-dG9VG_PjbXgaF3ZlEWQ;Ok, then you will lose;ok lose;-0.828000009059906;Negative
UCFj-dG9VG_PjbXgaF3ZlEWQ;@pawpkitty;"@@BenjaminBjornsen We will all lose very soon. Doesn&#39;t even matter";2024-03-26T10:58:54Z;0;UCFj-dG9VG_PjbXgaF3ZlEWQ;We will all lose very soon. Doesn't even matter;lose soon n't even matter;-0.6909999847412109;Negative
UC80000lWxK7PyuDm1Xds7_A;@dwcola;AGI Is going to Explode in the next 24 months.  Open AI is supposedly releasing Chat GPT5 very soon (possibly today March 19th.  Apparently its going to be a leap forward yet again.  There are 2.91 million customer service jobs in America alone.  Here is the point.  For every % increase in productivity through AI, that is a direct 1% increase in unemployment.  You only need a 10% productivity gain to create massive disruption and unemployment.;2024-03-19T15:25:39Z;0;;AGI Is going to Explode in the next 24 months. Open AI is supposedly releasing Chat GPT5 very soon possibly today March 19th. Apparently it is going to be a leap forward yet again. There are 2.91 million customer service jobs in America alone. Here is the point. For every increase in productivity through AI, that is a direct 1 increase in unemployment. You only need a 10 productivity gain to create massive disruption and unemployment.;agi go explode next month open ai supposedly release gpt soon possibly today march th apparently go leap forward yet customer service job america alone point increase productivity ai direct increase unemployment need productivity gain create massive disruption unemployment;0.0;Negative
UCRTg7u8_xqQwhUP_2Wi3V5Q;@MrRapp-yz4hu;If they really want to save money replace the CEO with an AI that hundreds of millions saved right there.;2024-03-19T00:21:11Z;0;;If they really want to save money replace the CEO with an AI that hundreds of millions saved right there.;really want save money replace ceo ai hundred million save right;-0.5699999928474426;Negative
UCdMGhtnPk4zQbPXNCXf_PZw;@Secular-Serenity;Nice set!  Thx for the interesting video.;2024-03-18T22:22:07Z;0;;Nice set! Thanks for the interesting video.;nice set thanks interesting video;0.9449999928474426;Positive
UCE-GJlMHFw0CmINcPBy_gfA;@samgriess438;we must end AI before AI ends us;2024-03-18T03:11:31Z;0;;We must end AI before AI ends us;end ai ai end;-0.7620000243186951;Negative
UC7ss5a7LbcjeWUOud6IxNnA;@Disneyfamiglia;What could go wrong?;2024-03-16T01:00:07Z;0;;What could go wrong?;go wrong;0.5210000276565552;Positive
UChhrxG3Imqhc37zGPppA9Sg;@rosvelad4758;This is truly terrifying.;2024-03-15T07:26:21Z;0;;This is truly terrifying.;truly terrifying;-0.9240000247955322;Negative
UC9ywT3MPI3nJo0fu8tuXi5A;@BriandairUrzuacerrillo;Where will all the displaced workers go?;2024-03-15T07:26:16Z;0;;Where will all the displaced workers go?;displaced worker go;-0.7919999957084656;Negative
UCJjCdeB8HvBsWznjcJjmD2Q;@Pepe-utigVxg47;"It&#39;s about time someone addressed this.";2024-03-15T07:26:12Z;0;;It .about time someone addressed this.;.about time someone address;-0.2240000069141388;Negative
UCF8j3JQxuZolVTayPl0xQPQ;@MarioReyes-ib7ju;Time to go back to school.;2024-03-15T07:25:17Z;0;;Time to go back to school.;time go back school;0.06499999761581421;Negative
UC5SsQyiY4wC0wfw5lyWdB8w;@tylerharris4392;"I&#39;m just going to say your channel is is not going to be useful when recruiting goes full AI";2024-03-13T23:34:43Z;0;;I m just going to say your channel is not going to be useful when recruiting goes full AI;go say channel not go useful recruiting go full ai;-0.8799999952316284;Negative
UCjjgfO6KnPHTkcOwc7cEHEw;@MichaelHalsell;The next significant step after harvesting all this A.I data will be quantum computing. The most significant operational cost is human labor (direct/indirect expenses).;2024-03-13T18:06:15Z;0;;The next significant step after harvesting all this A.I. data will be quantum computing. The most significant operational cost is human labor direct indirect expenses .;next significant step harvest a.i data quantum compute significant operational cost human labor direct indirect expense;0.032999999821186066;Negative
UCJQC-V3H_lhB2XdrlmTSFVg;@odynith9356;Big brain;2024-04-18T14:40:03Z;0;UCRR6El9hGFzAxFYhV5lwccg;Big brain;big brain;0.847000002861023;Positive
UCdcrugeJcQjnBy6KpxJQxaQ;@cyrusvile6622;"True brother. I can&#39;t find work for 1 year";2024-05-02T16:31:14Z;0;UCjeS-sFON5BuenQ9L38h3uA;True brother. I can not find work for 1 year;true brother not find work year;-0.2630000114440918;Negative
UCTjbcOS35IxXIzuZ5aXE8Gg;@wondersoftheworld41;They took our jobs;2024-03-12T21:45:19Z;0;;They took our jobs;take job;-0.9120000004768372;Negative
UC2TmL6A_kGMP7fiBfcTWVww;@BenjaminBjornsen;carpenter, plumber, electrician. Its two years in school, 2 years as a paid intern. (Norway);2024-03-26T08:37:01Z;0;UCIW3QmMtKnGehZj7E8rhC-w;Carpenter, plumber, electrician. It is two years in school, 2 years as a paid intern. Norway;carpenter plumber electrician year school year paid intern norway;0.007000000216066837;Negative
UCUQKkFlYUUtOPVkgwYKqg2w;@pollypockets508;Id love to see chat gpt try to discipline a room full of children;2024-03-11T16:37:49Z;0;;I would love to see ChatGPT try to discipline a room full of children;love see chatgpt try discipline room full child;-0.7369999885559082;Negative
UCiTRedEMAa_-noF5okvC3cQ;@svc2461;"I&#39;ve heard other youtubers too say &quot;upgrade your skills&quot;. I don&#39;t think someone saying this understands  AI yet.";2024-03-11T14:22:15Z;0;;I ve heard other YouTubers to say upgrade your skills . I do not think someone saying this understands AI yet.;heard youtubers say upgrade skill not think someone say understand ai yet;-0.4020000100135803;Negative
