id;name;text;time;likes;reply;CleanedText;ProcessText;SentimentScore;ActualLabel
UC1hQtzTWlq-6YT1SjGUwl_A;@abebautista2972;This may allow us to explore levels of creativity no possible before, with abundant access to intelligence;2024-01-07T20:48:59Z;5;UCg-7wBun3xJIw3NsC2vxzjw;This may allow us to explore levels of creativity no possible before, with abundant access to intelligence;allow explore level creativity possible abundant access intelligence;0.9449999928474426;Positive
UCKu--3lvZQjFEcs5B30aZmA;@i_jetlag;"Who would play it? I don&#39;t even play the video games, but I time to time but a game and play it after I hear the development story behind it. Humans together strong.";2024-01-06T17:42:24Z;5;UCSjM8KQarRAF-_INXR74kXg;Who would play it? I do not even play the video games, but I time to time but a game and play it after I hear the development story behind it. Humans together strong.;play not even play video game time time game play hear development story humans together strong;0.2199999988079071;Negative
UC15fHDEndAG8lqUjTZcDA8w;@JohnPhrey;How can people sustain gaming when they have no jobs?;2024-01-07T01:01:15Z;5;UCSjM8KQarRAF-_INXR74kXg;How can people sustain gaming when they have no jobs?;people sustain game job;-0.5720000267028809;Negative
UCShIWFAgZ0o4jKO_Bsa96nQ;@3DLL.;Throughout human history, we have been dependent on machines to survive. Fate, it seems, is not without a sense of irony.;2024-01-05T17:38:25Z;5;;Throughout human history, we have been dependent on machines to survive. Fate, it seems, is not without a sense of irony.;human history dependent machine survive fate seem not sense irony;-0.11500000208616257;Negative
UC9zUIDtScJwL7S6Bll5qkZw;@amitabhgautam8503;Threat to jobs is real.;2024-01-05T01:28:06Z;5;;Threat to jobs is real.;threat job real;-0.9430000185966492;Negative
UCxSt49VS3kUnHhoeSffTEtA;@unkind6070;"&quot;There will still be room for humans &quot; for now";2024-01-04T21:05:11Z;5;UCqQWmLAn_t_03tgjtW4GEJg;There will still be room for humans for now;still room human;0.09300000220537186;Negative
UCqONlkVXl0fjjD__9Gi_xnA;@77batering;Agreed so much. This video is indicative of poor production quality that already exists before AI lol. All AI will do is allow this type of low brow content to be published more widely.;2024-01-10T19:44:36Z;4;UCA56fd6EFqvPnrrPzECPXfQ;Agreed. Much. This video is indicative of poor production quality that already exists before AI laugh out loud. All AIs will do is allow this type of low brow content to be published more widely.;agree much video indicative poor production quality already exist ai loud ai allow type low brow content publish widely;-0.41499999165534973;Negative
UC3-qXLUkzfGuJuv5pCNcY8Q;@GamingWithBlitzThunder;"I will expect AI Golden Age around 2040&#39;s (for business) or 2050&#39;s (for consumer) since Quantum Computer will significantly boost AI capabilities. 4th computer from there will start to decline, since quantum computer have 100x more processing power than 4th generation computers. It&#39;s scary, yet we can&#39;t avoid it.";2024-01-07T12:12:29Z;4;;I will expect AI Golden Age around 2040 for business or 2050 for consumer since Quantum Computer will significantly boost AI capabilities. 4th computer from there will start to decline, since quantum computer have 100x more processing power than 4th generation computers. It .scary, yet we can not avoid it.;expect ai golden age around business consumer quantum computer significantly boost ai capability th computer start decline quantum computer x processing power th generation computer .scary yet not avoid;0.10300000011920929;Negative
UCOzZdvVkpZeDZG_9oa7TlTQ;@zangarkhan;"Pandora&#39;s Box is already wide open. There are 100s of open source AI models, no way to regulate training. Its akin to Limewire and P2P again. Even the lawyers will run out of time before the laws catch up to the speed of the tech. We are already seeing multimodal multi model AI&#39;s where its hard to even pinpoint which models were used let alone what they are trained on. People can run their own models locally if they have a high performance PC or laptop.";2024-01-06T08:23:53Z;4;;Pandora . Box is already wide open. There are 100s of open source AI models, no way to regulate training. It is akin to LimeWire and P2P again. Even the lawyers will run out of time before the laws catch up to the speed of the tech. We are already seeing multimodal multimodel AI .where it is hard to even pinpoint which models were used let alone what they are trained on. People can run their own models locally if they have a high performance PC or laptop.;pandora box already wide open .of open source ai model way regulate training akin limewire pp even lawyer run time law catch speed tech already see multimodal multimodel ai hard even pinpoint model use let alone train people run model locally high performance pc laptop;-0.2770000100135803;Negative
UC4h6OYd_s9qRHEIrhzK9GxA;@aurathedraak7909;"AI really needs to stop. We didn&#39;t ask for it and we dont want it in our phones and we dont want it runing our lives";2024-01-05T15:06:08Z;4;;AI really needs to stop. We did not ask for it and we do not want it in our phones and we do not want it running our lives;ai really need stop not ask not want phone not want run life;-0.9330000281333923;Negative
UCiA7hfoaGniqi2hpbekTqJw;@AIex_Kidd;there is no turning back.;2024-01-05T08:31:13Z;4;;There is no turning back.;turn back;-0.3540000021457672;Negative
UCQ8hNo6SvXss5Mh1w2DY2hw;@NebMotion;a dumb sad take...;2024-01-04T23:13:37Z;4;UCSIU_0lv7fU8ASN7vnibKJw;A dumb sad take...;dumb sad take;-0.9010000228881836;Negative
UCRvWWgKCwxPx4EcG6GL7qHw;@grimaffiliations3671;"Or a jobs guarantee where people can take jobs that help society but aren&#39;t tied to profit";2024-01-04T15:48:50Z;4;UCCCbEP3NibYdNQ75YbCTaNw;Or a job guarantee where people can take jobs that help society but are not tied to profit;job guarantee people take job help society not tie profit;0.2160000056028366;Negative
UCiCbCpKe6pxkuiJIr08DH_Q;@aliquraishi3525;AI should replace doctors dentists, politicians, businessmen, etc. rather than waiters, cooks, dishwashers, etc. They just want to replace poor paying jobs with AI.;2024-01-09T23:53:39Z;3;;AI should replace doctors dentists, politicians, businessmen, etc. rather than waiters, cooks, dishwashers, etc. They just want to replace poor paying jobs with AI.;ai replace doctor dentist politician businessmen rather waiter cook dishwasher want replace poor pay job ai;-0.3580000102519989;Negative
UCalF-Vtqs9OQj8L5Drb6epA;@LeePierre;If AI takes my tax payment, then sure;2024-01-06T22:30:02Z;3;;If AI takes my tax payment, then sure;ai take tax payment sure;-0.3160000145435333;Negative
UCvDctXqicGmOaR-wFfgFyGw;@ForAnAngel;Andrew Yang tried to warn all of us about this 5 years ago and everyone laughed at him.;2024-01-06T00:45:17Z;3;;Andrew Yang tried to warn all of us about this 5 years ago and everyone laughed at him.;andrew yang try warn year ago everyone laugh;-0.9010000228881836;Negative
UC__j1EsAvrGxW7V5w-GGgJw;@ZBeansUncut;"The worst part is that all of this ripping of data has happened without our permission. We still don&#39;t have opt-out which in itself is BS as all of this tech that relies on our data should be opt-in.";2024-01-05T21:02:20Z;3;;The worst part is that all of this ripping of data has happened without our permission. We still do not have opt out which in it itself is bull shit as all of this tech that relies on our data should be opt in.;bad part ripping data happen permission still not opt bull shit tech rely data opt;-0.9290000200271606;Negative
UCo4-M_3MdIVnCfOOZsFj4sA;@joannot6706;"Once they make AI as smart and then smarter than humans aka AGI and ASI, which is the goal of many of the most preeminent AI companies,<br>what job can&#39;t be replaced?";2024-01-05T19:44:47Z;3;UCZ0EaUgxqa-fhpzasqd8sNQ;Once they make AI as smart and then smarter than humans aka AGI and ASI, which is the goal of many of the most preeminent AI companies, what job can not be replaced?;make ai smart smart human aka agi asi goal many preeminent ai company job not replace;0.19599999487400055;Negative
UCGDvxetcs5kE9Y0MYSwhPZg;@bhupindertube;"AI will replace the thing makes humans unique and that&#39;s intelligence. Imagine AI as a person with a billion plus heads of Einstein 2.0. Only physical works that&#39;s not done by robots will be left for us. Congratulations.";2024-01-05T16:21:42Z;3;;AI will replace the thing makes humans unique and that .intelligence. Imagine AI as a person with a billion plus heads of Einstein 2.0. Only physical works that .not done by robots will be left for us. .;ai replace thing make human unique .intelligence imagine ai person head einstein .. physical work .not robot leave;0.164000004529953;Negative
UCbRfaOERILFJBONaiEdplyw;@rossawilson01;"AI taking over art and entertainment is what happens after the bar has been so thoroughly lowered for years by finance companies calling the shots with their own algorithms. Those &#39;artists&#39; losing their jobs were really overhyped and often very privileged, crafts people. Im not sad about that. Real art will always breakthrough and it won&#39;t be made by what is essentially a calculator.";2024-01-05T12:57:09Z;3;;AI taking over art and entertainment is what happens after the bar has been. Thoroughly lowered for years by finance companies calling the shots with their own algorithms. Those artists losing their jobs were really overhyped and often very privileged, crafts people. I am not sad about that. Real art will always break through, and it will not be made by what is essentially a calculator.;ai take art entertainment happen bar thoroughly lower year finance company call shot algorithm artist lose job really overhyped often privileged crafts people not sad real art always break not make essentially calculator;-0.36899998784065247;Negative
UCn4FQcUUtNYQdutsPuMlCng;@igoromelchenko3482;That is not a problem for creators, that is the reason for consumers to start questioning their uniqueness :));2024-01-05T07:34:16Z;3;;That is not a problem for creators, that is the reason for consumers to start questioning their uniqueness;not problem creator reason consumer start question uniqueness;-0.22200000286102295;Negative
UCykOYb_7XPXZ8CXJwspoMnw;@Siranoxz;Just wait until generated AI synthetic actors are becoming a thing.;2024-01-05T06:39:02Z;3;;Just wait until generated AI synthetic actors are becoming a thing.;wait generate ai synthetic actor become thing;-0.0820000022649765;Negative
UCgY_Yo4Nxdh7ZaLEePqU6GQ;@indianrunner666;Snake oil all over the place;2024-01-04T21:39:24Z;3;;Snake oil all over the place;snake oil place;-0.9390000104904175;Negative
UCNKLHX7Zr1A2MSMiM5ZvfqQ;@gmenezesdea;Imagine taking one of the most fun and wholesome parts of being human - art - and deciding computers should make it from now on, not humans.;2024-01-05T00:14:20Z;3;UCfnKsbgDCOKxhYtVLy6wn9g;Imagine taking one of the most fun and wholesome parts of being human art and deciding computers should make it from now on, not humans.;imagine take fun wholesome part human art decide computer make not human;-0.7129999995231628;Negative
UCdt5AppiRONXo8IoOBu04Xw;@crsmth;"Meh, not particularly insightful. Entertainment is a slither of global GDP, and workforce. Think a more encompassing view of knowledge work as a whole, and perspectives on different futures would be more insightful - that&#39;s where the uncertainty is.";2024-01-04T20:50:06Z;3;;Meh, not particularly insightful. Entertainment is a slither of global GDP, and workforce. Think a more encompassing view of knowledge work as a whole, and perspectives on different futures would be more insightful that .where the uncertainty is.;meh not particularly insightful entertainment slither global gdp workforce think encompassing view knowledge work whole perspective different future insightful .where uncertainty;-0.39800000190734863;Negative
UCSIU_0lv7fU8ASN7vnibKJw;@DMC-ss4cm;Oh no people in the creative arts will have to get real useful jobs. How will we cope with high quality music and movies for cheaper?;2024-01-04T17:28:14Z;3;;Oh, no people in the creative arts will have to get real useful jobs. How will we cope with high quality music and movies for cheaper?;people creative art get real useful job cope high quality music movie cheap;-0.4090000092983246;Negative
UC11KcaIkhrecOfRyO2t2YRQ;@AlchemyAles;Right now, AI will help those like Marcus Hutton who can become way more efficient at their work. He is right that others will lose and regulation is needed. Unless it is plagiarism, books, and other works should stay in the training data since that is just how we use that type of information for creation. AI is still just software.;2024-01-04T16:57:17Z;3;;Right now, AI will help those like Marcus Hutton who can become way more efficient at their work. He is right that others will lose and regulation is needed. Unless it is plagiarism, books, and other works should stay in the training data since that is just how we use that type of information for creation. AI is still just software.;right ai help like hutton become way efficient work right others lose regulation need plagiarism book work stay training data use type information creation ai still software;0.05400000140070915;Negative
UCMREILmruYma932LpOjxr8w;@JimmyOnEarth;Ppl who know how to leverage AI will replace ppl;2024-01-04T15:49:15Z;3;UCCCbEP3NibYdNQ75YbCTaNw;Ppl who know how to leverage AI will replace people;ppl know leverage ai replace people;0.3540000021457672;Negative
UCfIL48fY0X6BeJPsiIl_gbg;@vooteimer1234;Soooo duuuuuummmmb;2024-01-04T15:04:58Z;3;;Soon duuuuuummmmb;soon duuuuuummmmb;0.7129999995231628;Positive
UCyjQVBti07JgHdGaHtgBSxg;@franzf.cimeni7685;"Open AI&#39;s Sora says hi. haha";2024-02-22T04:26:08Z;2;;Open AI . Sora says hi. haha;open ai sora say hi haha;0.28299999237060547;Negative
UCQH94IuSFESG_QoesI-VD5A;@colintys9603;The rise of Ai has also been seen with online content creation and streaming. Ai vtubers like neuro-sama can play games, interact with audiences and so on. Recently it finished a subathon and got 30k subs and became the most watched streamer for a week. While it is scary to think content creators are being replaced. They are not. the ai needs alot of monitoring by its developer vedal who has to regular update features and fix bugs. So to conclude. Make an ai do your job for you.;2024-01-08T15:01:05Z;2;;The rise of Ai has also been seen with online content creation and streaming. Ai tubers like neuroma can play games, interact with audiences and. On. Recently it finished a station and got 30k subs and became the most watched streamer for a week. While it is scary to think content creators are being replaced. They are not. The AI needs a lot of monitoring by it is developer medal who has to regularly update features and fix bugs. So to conclude. Make an AI do your job for you.;rise ai also see online content creation streaming ai tuber neuroma play game interact audience recently finish station get k sub become watched streamer week scary think content creator replace not ai need lot monitoring developer medal regularly update feature fix bug conclude make ai job;-0.0020000000949949026;Negative
UCjH1HuEg3XzGfXFAVHgQFCA;@gaminglikeapro2104;Tell her that an unknown source advices her to pursue her dream of Animation, AI is a tool and it will help her greatly. Tell her to think whether she wants to do a  degree or go directly to work on Animation. Both have a great future especially the second option as she can get started now. Ignore threath gossip and fear-mongering about A.I. The same happened with cameras, computers, Internet....and any future technology. That was free advice.;2024-01-10T13:53:59Z;2;UC5xSswOq7bcKVNML8AQhrUQ;Tell her that an unknown source advices her to pursue her dream of Animation, AI is a tool, and it will help her greatly. Tell her to think whether she wants to do a degree or go directly to work on Animation. Both have a great future especially the second option as she can get started now. Ignore threat gossip and fearmongering about A.I. The our happened with cameras, computers, Internet....and any future technology. That was free advice.;tell unknown source advices pursue dream animation ai tool help greatly tell think want degree go directly work animation great future especially second option get start ignore threat gossip fearmongering a.i happen camera computer internet .... future technology free advice;0.35899999737739563;Negative
UCaH4swQCMSLvGjKmpbFirTQ;@robwashers;"Original thought and creativity no longer needed here...In a world where the market dictates the outcomes, why would the &#39;Gate Keepers&#39; bother with untested thought.";2024-01-07T16:25:55Z;2;;Original thought and creativity no longer needed here... In a world where the market dictates the outcomes, why would thegatekeepers bother with untested thought.;original thought creativity no longer need world market dictate outcome thegatekeepers bother untested thought;-0.8460000157356262;Negative
UCBwqGMCvThr7AibxsRl0H3g;@PauliusTautvydas;"In 20 years this will be like all of those early tv reports about the internet from 1995, where some kid proudly demonstrates his geocities webpage on &quot;the information super highway&quot; through his beige crt monitor. Followed by back to studio shot of an smuggy news anchor shaking her head &quot;kid fads these days&quot; style";2024-01-07T01:59:54Z;2;;In 20 years this will be like all of those early TV reports about the internet from 1995, where some kid proudly demonstrates his geocities webpage on the information superhighway through his beige CRT monitor. Followed by back to studio shot of a muggy news anchor shaking her head kid fads these days style;year early tv report internet kid proudly demonstrate geocities webpage information superhighway beige crt monitor follow back studio shot muggy news anchor shake head kid fads day style;-0.546999990940094;Negative
UC1tRwzKoA7iXMNufiRyicSg;@ThoughtfulAl;"I published an ai-generated video on this 4 months ago (my first youtube vid) and it has received a steady increase of views, it didn&#39;t flatline.  We live in interesting times,";2024-01-07T00:14:02Z;2;;I published an artificial intelligence generated video on this 4 months ago my first YouTube vid and it has received a steady increase of views, it did not flat line. We live in interesting times,;publish artificial intelligence generate video month first youtube vid receive steady increase view not flat line live interesting time;0.9369999766349792;Positive
UCVvHnILmW04dz4BKeztRWjg;@DigSamurai;"&quot;Discussions about AI originality often miss a key point: AI&#39;s main value lies in enhancing human creativity, not replacing it. Like spreadsheets transformed business, AI is a tool for creative exploration, offering a new perspective and sparking innovative ideas. It&#39;s about expanding, not substituting, human creativity.&quot;<br><br>PS. I wrote this comment then used AI to make it more eloquent, succinct, better.";2024-01-06T23:20:23Z;2;;Discussions about AI originality often miss a key point AI .main value lies in enhancing human creativity, not replacing it. Like spreadsheets transformed business, AI is a tool for creative exploration, offering a new perspective and sparking innovative ideas. It .about expanding, not substituting, human creativity. PS. I wrote this comment then used AI to make it more eloquent, succinct, better.;discussion ai originality often miss key point ai value lie enhance human creativity not replace spreadsheet transform business ai tool creative exploration offer new perspective spark innovative idea expand not substitute human creativity p write comment use ai make eloquent succinct well;0.4129999876022339;Negative
UCBCPXOnzaSYSK2VukjSdZvg;@DanielJunior;This is like the candle maker lobby against the electric lamp development.;2024-01-06T18:20:08Z;2;;This is like the candle maker lobby against the electric lamp development.;candle maker lobby electric lamp development;-0.5099999904632568;Negative
UC_2wikYRhQKq6IJRQvYm64A;@joey5232;Except electric lamp developers will also lose their jobs;2024-01-06T20:17:35Z;2;UCBCPXOnzaSYSK2VukjSdZvg;Except electric lamp developers will also lose their jobs;electric lamp developer also lose job;-0.9070000052452087;Negative
UCr55qPYW6HLSokh5bBrEeeQ;@ricarditoortiz1242;Uncanny Valley.;2024-01-08T02:15:11Z;2;UCkGSfFb7KTR5lyEFOusEnWQ;Uncanny Valley.;uncanny valley;-0.3240000009536743;Negative
UCAzPJCSkM5FknYFzdqBEQWQ;@magickittenz;"It lacks imagination, the creativity of a produced work has so much more potential, if it&#39;s tried to be outputted original.";2024-01-05T21:46:00Z;2;;It lacks imagination, the creativity of a produced work has. Much more potential, if it .tried to be outputted original.;lack imagination creativity produced work much potential .tried output original;-0.44999998807907104;Negative
UCZ0EaUgxqa-fhpzasqd8sNQ;@ilanay;"Interesting. I&#39;m not as concerned about AI and tend to believe that in the long run it will improve the quality of our lives and create new opportunities/ streamline jobs, rather than replacing them... I just hope that the entertainment industry doesn&#39;t turn into Luddites once again, the way that record labels did in the wake of the digital music era. You can&#39;t stop progress, only learn to adapt.";2024-01-05T18:08:43Z;2;;Interesting. I m not as concerned about AI and tend to believe that in the long run it will improve the quality of our lives and create new opportunities streamline jobs, rather than replacing them... I just hope that the entertainment industry does not turn into Luddites once again, the way that record labels did in the wake of the digital music era. You can not stop progress, only learn to adapt.;interest not concern ai tend believe long run improve quality life create new opportunity streamline job rather replace hope entertainment industry not turn luddite way record label wake digital music era not stop progress learn adapt;0.367000013589859;Negative
UCRjNuNiw5UFZ9KGicD3NNmQ;@williamkinkade2538;A Reveloution period!!;2024-01-05T14:01:01Z;2;;A Revolution period!!;revolution period;0.6990000009536743;Positive
UC9v2eQGNeuGUpr7wpEtIEAw;@wrathofgrothendieck;"I hope it does, so I don&#39;t have to work no more.";2024-01-05T11:19:10Z;2;;I hope it does, I do not have to work no more.;hope not work;0.8690000176429749;Positive
UCgb7hayIe_c8SNqOt3zUZJg;@jonathan130;Humans are basically the same;2024-01-06T11:01:27Z;2;UCMpmZIK92SKPDYTSO4STwSQ;Humans are basically the our;human basically;0.003000000026077032;Negative
UC9ziYO0UpAGnu_WMZdN8DHA;@AselflimitedcapitalisemW0mamon;Lets talk about programming the human mind w/AI :ALL FOR THE MONEY;2024-01-05T01:52:19Z;2;;Let is talk about programming the human mind withAI ALL FOR THE MONEY;let talk program human mind withai money;-0.7409999966621399;Negative
UC6N6xe7vcPx0tquPo77yfKg;@Darhan62;I vote against the Luddites, and for pushing the technology forward.  The ultimate result will be more jobs, but the job descriptions will change.;2024-01-05T01:14:03Z;2;;I vote against the Luddites, and for pushing the technology forward. The ultimate result will be more jobs, but the job descriptions will change.;vote luddite push technology forward ultimate result job job description change;0.671999990940094;Positive
UCmNVjFK7IQoL4cFKHOlu_Ug;@traviswadezinn;Very interesting, well-presented;2024-01-04T23:19:38Z;2;;Very interesting, well presented;interesting well present;0.9409999847412109;Positive
UCeRjuqUd8SUlmGaXt7307dw;@JT-Works;Anyone else notice the annoying snapping noise during the video... felt like NLP;2024-01-04T22:54:10Z;2;;Anyone else notices the annoying snapping noise during the video... felt like NLP;anyone else notice annoy snapping noise video felt nlp;-0.4300000071525574;Negative
UCT38TKv4i0EQBVKqnmkAibQ;@neanda;"yeah i&#39;ve already seen a few vids that are using Attenborough&#39;s voice, they&#39;re kinda funny because he&#39;d be narrating peoples actions out on streets, things like that.";2024-01-05T14:17:03Z;2;UCUobMFpKy_-M6SgRXLVSfUQ;yeah, i ve already seen a few vids that are using Attenborough .voice, they re kind of funny because he d be narrating peoples actions out on streets, things like that.;yeah already see vids use .voice kind funny narrating people action street thing;0.4690000116825104;Positive
UCfnKsbgDCOKxhYtVLy6wn9g;@matteobonanza6173;"Well, we will just have to invent something new that AI can&#39;t do. If an AI can do it, it ain&#39;t worth being done by human being.";2024-01-04T21:24:44Z;2;;Well, we will just have to invent something new that AI can not do. If an AI can do it, it ain't worth being done by human being.;well invent something new ai not ai ai n't worth human;-0.36399999260902405;Negative
UC4o9Xeixdddcny1Jr_pdTXQ;@gzfashions;There is nothing new under the sun. AI can only recreate or bring creativity to things that have already been done in the past.;2024-01-04T20:45:29Z;2;;There is nothing new under the sun. AI can only recreate or bring creativity to things that have already been done in the past.;nothing new sun ai recreate bring creativity thing already past;-0.6389999985694885;Negative
UCl2b5AIzO1Yr2BehC24DMaw;@geordi-gabrielrenauddumoul449;What do you use to base your affirmation?;2024-01-06T17:55:27Z;2;UCoGZsxcDz4k6aLOrKhW33CQ;What do you use to base your affirmation?;use base affirmation;0.006000000052154064;Negative
UC6Mgc5kH7Gj0UK4y7Ff2c8Q;@jzno;Less jobs are less jobs. Few jobs are created, millions will disappear...definitely.;2024-01-04T20:15:02Z;2;;Fewer jobs are fewer jobs. Few jobs are created, millions will disappear...definitely.;job job job create million disappear definitely;-0.4659999907016754;Negative
