id;name;text;time;likes;reply;CleanedText;ProcessText;SentimentScore;ActualLabel
UCzcGVqm6a86hZ1dCcjoj2Yg;@andrewc965;"I&#39;m guessing the video of the narrator is AI footage for a &quot;gotcha&quot;&quot; moment.";2024-01-04T19:31:17Z;2;;I m guessing the video of the narrator is AI footage for a gotcha moment.;guess video narrator ai footage gotcha moment;-0.17399999499320984;Negative
UC-k6ts2B5MnvYcpzzfAVVaA;@JeffSomil;Fantastic. A proliferation of absolute garbage content being produced by AI trained on complete garbage entertainment artists. Well done.;2024-01-04T17:36:28Z;2;;Fantastic. A proliferation of absolute garbage content being produced by AI trained on complete garbage entertainment artists. Well done.;fantastic proliferation absolute garbage content produce ai train complete garbage entertainment artist well;0.3160000145435333;Negative
UCRR6El9hGFzAxFYhV5lwccg;@lazarusblackwell6988;AI will completely transform the entertainment industry.<br><br>And everything else.;2024-02-27T13:19:46Z;1;;AI will completely transform the entertainment industry. And everything else.;ai completely transform entertainment industry everything else;0.4000000059604645;Negative
UCzR8v1fEOGrq7vdZUvjT5qA;@Zegeebwah;I feel nauseous. Art and entertainment is going to be homogenized into bland nothingness by this.;2024-02-16T16:19:24Z;1;;I feel nauseous. Art and entertainment is going to be homogenized into bland nothingness by this.;feel nauseous art entertainment go homogenize bland nothingness;-0.9089999794960022;Negative
UCf7acJJfY8vUaW_9Ef4CCkQ;@CodingAqyanoos;AI and machines have replaced 1000s of jobs since 100 years ago.;2024-02-14T14:53:14Z;1;;AI and machines have replaced 1000s of jobs since 100 years ago.;ai machine replace .of job year ago;-0.0820000022649765;Negative
UCGmWJ5QXtyKEVpGPjwsS1Gg;@miguelangelramirezchavarri3801;The future of artificial intelligence promises radical transformations in various spheres of human life, from technology to medicine and the way we interact with the world. As AI evolves, both challenges and opportunities emerge, shaping an ever-changing landscape.;2024-01-25T18:52:22Z;1;;The future of artificial intelligence promises radical  in various spheres of human life, from technology to medicine and the way we interact with the world. As AI evolves, both challenges and opportunities emerge, shaping an ever changing landscape.;future artificial intelligence promise radical various sphere human life technology medicine way interact world ai evolves challenge opportunity emerge shape ever change landscape;0.40400001406669617;Negative
UC55Bj7DwgbkikiAAlKgm4oA;@blkhawk661;AI will not replace humans.  Humans with AI will replace humans without AI.;2024-01-18T18:39:07Z;1;;AI will not replace humans. Humans with AI will replace humans without AI.;ai not replace human human ai replace human ai;-0.003000000026077032;Negative
UC8YhFhOkNfK6UNkVRnIXnBg;@Idontwantahandle3;We use it to generate small simple contracts at work, so we no longer have to pay the lawyer! <br>Personally I am looking forward to it replacing Politicians, I honestly think it would do a much better job.;2024-01-10T06:28:09Z;1;;We use it to generate small simple contracts at work, We no longer have to pay the lawyer! Personally I am looking forward to it replacing Politicians, I honestly think it would do a much better job.;use generate small simple contract work no longer pay lawyer personally look forward replace politician honestly think much good job;0.8939999938011169;Positive
UC49nm8wm79FGS8KtKeDfj3Q;@JLeonSarmiento;"AI are based on generalization capacity. Art in it&#39;s creative process is the opposite.";2024-01-09T10:54:25Z;1;;AI are based on generalization capacity. Art in it .creative process is the opposite.;ai base generalization capacity art .creative process opposite;0.28299999237060547;Negative
UCILtiZ7iDradBN8GMgQKVHA;@Drunken_Master;Who the f needs jobs in the entertainment industry. Do something productive for a change.;2024-01-08T18:53:30Z;1;;Who the f needs jobs in the entertainment industry. Do something productive for a change.;f need job entertainment industry something productive change;-0.2800000011920929;Negative
UCcKCe7fGKaKVVZHxGy8xRVA;@bigglyguy8429;"@@gaminglikeapro2104 The thing with AGI is it can do anything for anyone. If I want something animated I should be able to explain it to the AI every bit as easily as I can explain it to some college graduate. It can then produce what I want, regardless of the time zone, day of the week, holidays or whatever, and without getting upset when I demand tweaks and changes. So the real question is what do humans bring that the AI doesn&#39;t?";2024-01-11T15:05:27Z;1;UC5xSswOq7bcKVNML8AQhrUQ;The thing with AGI is it can do anything for anyone. If I want something animated I should be able to explain it to the AI every bit as easily as I can explain it to some college graduate. It can then produce what I want, regardless of the time zone, day of the week, holidays or whatever, and without getting upset when I demand tweaks and changes. So the real question is what do humans bring that the AI does not ?;thing agi anything anyone want something animate able explain ai bit easily explain college graduate produce want regardless time zone day week holiday whatever get upset demand tweak change real question human bring ai not;0.1080000028014183;Negative
UC6b80_ozxkSLUUD18GCA95w;@striderQED;"uugh, I am not sure what the point of this article was, but.  AI is going to allow Amazon, Apple TV, Netflix, etc.. to bypass the studios completely,  they will use AI to generate movies &quot;on demand&quot; for their customers.";2024-01-08T02:12:08Z;1;;Uugh, I am not sure what the point of this article was, but. AI is going to allow Amazon, Apple TV, Netflix, etc. To bypass the studios completely, they will use AI to generate movies on demand for their customers.;not sure point article ai go allow amazon apple tv netflix bypass studio completely use ai generate movie demand customer;-0.04899999871850014;Negative
UCPoOxEuoELXedcpDx4GaSUg;@tedallder5065;"I have my doubts that AI can replace Helene Grimaud playing Beethoven&#39;s 5th Piano Concerto, except as a player piano might play Take Me out to the Ballgame, since HG is a human being, living and breathing and playing in all of her humanity for other humans. It will be interesting to see, and I hope developers of AI and whatever it becomes remember to benefit human beings.";2024-01-07T22:36:36Z;1;;I have my doubts that AI can replace Helene Grimaldi playing Beethoven .5th Piano Concerto, except as a player piano might play Take Me out to the Ballgame, since HG is a human being, living and breathing and playing in all of her humanity for other humans. It will be interesting to see, and I hope developers of AI and whatever it becomes remember to benefit human beings.;doubt ai replace helene grimaldi play beethoven .th piano concerto player piano play take ballgame hg human live breathe play humanity human interesting see hope developer ai become remember benefit human;0.2800000011920929;Negative
UCOQ1GSRi89x5KRc_9pGrXQA;@pandoraeeris7860;"100% of &#39;legacy humans&#39; will be fully unemployed by 2030.";2024-01-07T18:48:44Z;1;;100 of legacy humans will be fully unemployed by 2030.;legacy human fully unemployed;0.0430000014603138;Negative
UCQKLKMX_nmtlSEC8QLhhhiA;@alias_tetrial;Just take it already;2024-01-07T17:35:33Z;1;;Just take it already;take already;0.3490000069141388;Negative
UC_Jqi8Xx1sq3hX8RNlFZx2Q;@nonefvnfvnjnjnjevjenjvonej3384;you will own nothing, dream nothing, create nothing, and you will like it.;2024-01-07T22:52:09Z;1;UCg-7wBun3xJIw3NsC2vxzjw;You will own nothing, dream nothing, create nothing, and you will like it.;nothing dream nothing create nothing like;-0.07599999755620956;Negative
UC-PCMyR2LTlwcXlTJ1gLc8w;@daniellivingstone7759;Romantic delusion;2024-01-09T07:46:38Z;1;UCg-7wBun3xJIw3NsC2vxzjw;Romantic delusion;romantic delusion;-0.7229999899864197;Negative
UCKUUW9QpqeKAQaqScPxtT3w;@prince181;It is fast in certain tasks not others.;2024-01-07T20:59:30Z;1;UC3-qXLUkzfGuJuv5pCNcY8Q;It is fast in certain tasks not others.;fast certain task not others;-0.003000000026077032;Negative
UCnPV5d7TXqJcqRSD1Bt2BNA;@jackjhmc820;surely different taste and culture over the generations, such that scripts that were successful in the past do not translate to success today?   e.g lots of funny racist jokes that were ok in the past no longer are acceptable today.;2024-01-07T11:06:29Z;1;;Surely different taste and culture over the generations, such that scripts that were successful in the past do not translate to success today? e.g. lots of funny racist jokes that were ok in the past no longer are acceptable today.;surely different taste culture generation script successful past not translate success today e.g lot funny racist joke ok past no longer acceptable today;-0.7739999890327454;Negative
UCQOGJnirCFOnEnozpAd9hIw;@aromaticsnail;"And the teen downloading a pirated movie is the criminal??? Please, OpenAI/MS/Google/Meta... should pay copyright holders every time data was used to train their models. AI are derivative, they can&#39;t yet create anything original without abusing other people&#39;s copyright. Using the fair use card is ingenious. Enough with the tech industry making billions from stealing and exploiting. It&#39;s been far too long these companies have exploited the World for their personal gains. At some point they will need to be equated to the tobacco or the oil industries for the harm they have done in our societies.";2024-01-07T10:04:02Z;1;;And the teen downloading a pirated movie is the criminal??? Please, OpenAI MS Google Meta... should pay copyright holders every time data was used to train their models. AI are derivative, they can not yet create anything original without abusing other people .copyright. Using the fair use card is ingenious. Enough with the tech industry making billions from stealing and exploiting. It .been far too long these companies have exploited the World for their personal gains. At some point they will need to be equated to the tobacco or the oil industries for the harm they have done in our societies.;teen download pirated movie criminal please openai google meta pay copyright holder time data use train model ai derivative not yet create anything original abuse people .copyright use fair use card ingenious enough tech industry make billion steal exploit .been far long company exploit world personal gain point need equate tobacco oil industry harm society;-0.39899998903274536;Negative
UCsFu6tIHdMd_smKReRPi5GA;@rebecca_stone;"Silly me, there I thought musicians were laying down albums based on their heart or authentic creative inspiration. No wonder we&#39;re ending up with total bubblegum as music. I&#39;m out.";2024-01-07T05:13:14Z;1;;Silly me, there I thought musicians were laying down albums based on their heart or authentic creative inspiration. No wonder we re ending up with total bubblegum as music. I m out.;silly think musician lay album base heart authentic creative inspiration wonder end total bubblegum music;-0.7089999914169312;Negative
UCEDbDyZMrV_894l-uudVW4w;@TeddyLeppard;People think their jobs are in danger of being replaced by automation... and they are. All jobs as they are today. People will adapt and change. We always do.;2024-01-07T01:26:51Z;1;;People think their jobs are in danger of being replaced by automation... and they are. All jobs as they are today. People will adapt and change. We always do.;people think job danger replace automation job today people adapt change always;-0.06800000369548798;Negative
UCgUrIxi76MlWWBGyOyA6u9A;@alejandromedina1019;hi friends from the future! this is how naive people were in 2024;2024-01-06T21:04:12Z;1;;Hi friends from the future! This is how naive people were in 2024;hi friend future naive people;-0.24400000274181366;Negative
UCmVFy8AfR2S5p6w9Jh_iNNA;@xuko6792;"&quot;I choose floof&quot;<br>on a serious note - yeah, sure, it is definitely AI, not the corpa, who deprived us worker rights, social security, affordable housing and sustainable future.";2024-01-06T16:06:03Z;1;;I choose floor on a serious note yeah, sure, it is definitely AI, not the corps, who deprived us worker rights, social security, affordable housing and sustainable future.;choose floor serious note yeah sure definitely ai not corp deprive worker right social security affordable housing sustainable future;-0.7440000176429749;Negative
UCZuNpoCDgw1J4lSe5zcR5_g;@aceyage;Will lead to further homogenization of tastes. More average garbage.;2024-01-06T12:56:46Z;1;;Will lead to further homogenization of tastes. More average garbage.;lead homogenization taste average garbage;-0.8939999938011169;Negative
UCmAfCC0IxelJgxyndo_GMcw;@AlOfNorway;We are becoming devoid of spirit. All creativity from here on will miss something we cannot put our finger on, but it will be the spirit of life that is missing. The subtly of subtleties.;2024-01-06T12:38:48Z;1;;We are becoming devoid of spirit. All creativity from here on will miss something we can not put our finger on, but it will be the spirit of life that is missing. The subtly of subtleties.;become devoid spirit creativity miss something not put finger spirit life miss subtly subtlety;-0.4620000123977661;Negative
UCZs9B6l-zt3ANPFGsvf_z1w;@the11382;"There are &quot;mini-LLMs&quot; small enough to run on a raspberry PI.";2024-01-09T10:55:42Z;1;UCOzZdvVkpZeDZG_9oa7TlTQ;There are minimums small enough to run on a Raspberry Pi.;minimum small enough run raspberry pi;0.3540000021457672;Negative
UC3wfMLG9wRrdioTO4GTHg3g;@adike5;less originality;2024-01-06T05:07:26Z;1;;Less originality;less originality;-0.8849999904632568;Negative
UCBV6R0yoJ7kkTpEla-zTg8w;@MarkCliffeIsGay;Thank you. That made me laugh.;2024-01-08T16:41:25Z;1;UCDvPyn2VPvJ3rOw0Vz21HGw;Thank you. That made me laugh.;thank make laugh;0.9330000281333923;Positive
UC4cbLa3wNvVz8iQrc1DzhaA;@robertruffo2134;"This is nonsense written by a clueless boomer who bought into the hype.  AI can&#39;t actually write anything.  All it does is predictive models - in other words a mix of copy-paste and autospell.";2024-01-06T05:05:05Z;1;;This is nonsense written by a clueless boomer who bought into the hype. AI can not actually write anything. All it does is predictive models in other words a mix of copy paste and autospell.;nonsense write clueless boomer buy hype ai not actually write anything predictive model word mix copy paste autospell;-0.8100000023841858;Negative
UC-uNBVEIbOpeIkSyE_pq6nA;@godmisfortunatechild;"It&#39;s because the tech, at least in the variation your company implemented it comes across as an AI. In short time these will be indistinguishable from any human, perhaps even better.";2024-01-24T23:23:14Z;1;UCkGSfFb7KTR5lyEFOusEnWQ;It .because the tech, at least in the variation your company implemented it comes across as an AI. In short time these will be  from any human, perhaps even better.;.because tech least variation company implement come across ai short time human perhaps even well;0.3370000123977661;Negative
UC2RS4XOuJDwv0KeTx-1Arrg;@RichOffKs;first of all, theres literally no way he gets millions of plays in asia without thousands of dollars of paid-for marketing;2024-01-05T23:18:57Z;1;;First of all, there is literally no way he gets millions of plays in Asia without thousands of dollars of paid for marketing;first literally way get million play asia thousand dollar paid marketing;-0.8960000276565552;Negative
UCKxHCBvCYSnMecwOYBPogNw;@Linda_Almighty;"I rather believe economies will need remodeling to function well for both producers/corporations and a population majority sustained primarily by UBI (Universal Basic Income).<br><br>Those who want more than the necessities + some extras, can put in hours here &amp; there, with a LOT more valued effort (multipled hourly pay).<br><br>Corporations won&#39;t be allowed to run all their production almost fully automated, and keep high profits. Some of them today think of AI and drool over the potential profits/profit margins... without realising THEY will need to contribute to the UBI funding.<br><br>There are probably more unexplored ways to tackle issues like this, but letting the world regress to some kind of corporate feudalism, run by robber barons, is NOT a viable way... only a perverse fantasy shared by some reality detached &amp; delusional billionaires/trillionaires.";2024-01-07T19:25:09Z;1;UCGDvxetcs5kE9Y0MYSwhPZg;I rather believe economies will need remodeling to function well for both producers corporations and a population majority sustained primarily by FBI Universal Basic Income . Those who want more than the necessities some extras, can put in hours here there, with a LOT more valued effort multiple hourly pay . Corporations will not be allowed to run all their production almost fully automated, and keep high profit is. Some of them today think of AI and drool over the potential profit is profit margins... without realizing THEY will need to contribute to the FBI funding. There are probably more unexplored ways to tackle issues like this, but letting the world regress to some kind of corporate feudalism, run by robber barons, is NOT a viable way... only a perverse fantasy shared by some reality detached delusional billionaires trillionaires.;rather believe economy need remodel function well producer corporation population majority sustain primarily fbi universal basic income want necessity extra put hour lot valued effort multiple hourly pay corporation not allow run production almost fully automate keep high profit today think ai drool potential profit profit margin realize need contribute fbi funding probably unexplored way tackle issue let world regress kind corporate feudalism run robber baron not viable way perverse fantasy share reality detach delusional billionaire trillionaires;-0.5519999861717224;Negative
UCY6d3MxqucDuyaEU-V_F5KQ;@RanmaSyaoranSaotome;I suspect that we will one day look back in horror at how we are living our lives. We invite Netflix into our homes to distract us, we overshare on social media to depress us and soon we will invite algorithms into our minds to decide what we see and hear.;2024-01-05T10:27:26Z;1;;I suspect that we will one day look back in horror at how we are living our lives. We invite Netflix into our homes to distract us, we overshare on social media to depress us, and soon we will invite algorithms into our minds to decide what we see and hear.;suspect day look back horror live life invite netflix home distract overshare social medium depress soon invite algorithms mind decide see hear;-0.9449999928474426;Negative
UCHol6MBgASW5oAlK0-720Lg;@rd9102;Interesting video and information.;2024-01-05T06:00:38Z;1;;Interesting video and information.;interest video information;0.925000011920929;Positive
UCwownmFwJOsq7X8m8QOUSeQ;@HonestIySam;Anyone else also freak out a little to finally see her face? lol;2024-01-05T04:26:13Z;1;;Anyone else also freak out a little to finally see her face? laughing out loud;anyone else also freak little finally see face laugh loud;0.531000018119812;Positive
UCgcZbyKCUMCWfD_mAE4Cfnw;@RobertFalconer1967;"It&#39;s theft plain and simple. As The New York Times will shortly demonstrate in court.";2024-01-06T10:37:56Z;1;UCnSh-JMBW7iSEik8JOrce_Q;It .theft plain and simple. As The New York Times will shortly demonstrate in court.;.theft plain simple new york time shortly demonstrate court;-0.3440000116825104;Negative
UC8XXcjNXqCCXlVrxFHR9K2A;@jessicaa2057;"@@morjer5263 absolutely and sadly most people don&#39;t seem to care as long as they saved a bit of time.";2024-01-06T06:07:59Z;1;UCBOjUxdpWVtuOedkHTHLlXg;Absolutely and sadly most people do not seem to care as long as they saved a bit of time.;absolutely sadly people not seem care long save bit time;-0.9100000262260437;Negative
UCLdu4HeyR3XEjeOSYDV5PSg;@naiyang888;Hurry it up.<br><br>A.I. needs to replace at least half of the b.s. jobs in world.;2024-01-05T01:57:24Z;1;;Hurry it up. A.I. needs to replace at least half of the b. Jobs in world.;hurry a.i need replace least half b. job world;-0.3179999887943268;Negative
UCLWjptpHf4G7R7G62pK-JRw;@rameshg2717;I figured out that Ai cannot predict human behaviour. Ai will fail with anything related to human behaviour prediction. Human behaviour is relative and individual behave differently.;2024-01-05T01:49:55Z;1;;I figured out that Ai can not predict human behavior. Ai will fail with anything related to human behavior prediction. Human behavior is relative and individual behave differently.;figure ai not predict human behavior ai fail anything relate human behavior prediction human behavior relative individual behave differently;-0.43799999356269836;Negative
UCATeZCmZN1fx5yDOhIzLdbw;@andersfant4997;When (if?) its impossible to say if AI or a human created content, then we are done.;2024-01-05T01:13:58Z;1;;When if? it is impossible to say if AI or a human created content, then we are done.;impossible say ai human create content;-0.3050000071525574;Negative
UCgBttBX1bCvXYSLwUpM7aUQ;@Erica-zq1wf;Who cares about how many billions of dollars AI will add to the economy when no one will have access to it except the one percent.;2024-01-05T00:23:34Z;1;;Who cares about how many billions of dollars AI will add to the economy when no one will have access to it except the one percent.;care many billion dollar ai add economy one access percent;-0.8600000143051147;Negative
UCApKxEBlDugmK9yhY-aui8A;@chrisklugh;The angle nobody wants to look at, and is the cause of most of our problems here on earth, is not acknowledging our genetic heritage.  Our hormones and why they exist.  The environments that they evolved from.  We are not making a world for the Primate, were making it for the Machine.;2024-01-05T00:22:44Z;1;;The angle nobody wants to look at, and is the cause of most of our problems here on earth, is not acknowledging our genetic heritage. Our hormones and why they exist. The environments that they evolved from. We are not making a world for the Primate, were making it for the Machine.;angle nobody want look cause problem earth not acknowledge genetic heritage hormone exist environment evolve not make world primate make machine;-0.22699999809265137;Negative
UC0SNVC3nIlcqOluTqUH-jDw;@wynetsang;Children learn that pretending is fun. Adults fake everything to entertain.;2024-01-04T22:26:23Z;1;;Children learn that pretending is fun. Adults fake everything to entertain.;child learn pretending fun adult fake everything entertain;-0.024000000208616257;Negative
UCP2lGeyFVhqhONbjioTCwhA;@nesseihtgnay9419;US companies are the biggest contributors of AI around the world. US made the biggest AI chips.;2024-01-04T22:08:02Z;1;;US companies are the biggest contributors of AI around the world. US made the biggest AI chips.;company big contributor ai world make big ai chip;0.2639999985694885;Negative
UCt4PJUx21hrMjxd8T1qbYcg;@DanielleA2023;Men in positions of power are destroying us and our world;2024-01-04T21:34:47Z;1;;Men in positions of power are destroying us and our world;men position power destroy world;-0.972000002861023;Negative
UCtcrhJDg86MGR7NwNo9tbvw;@finalfan321;too biased;2024-01-04T21:21:35Z;1;;Too biased;biased;-0.7870000004768372;Negative
UCx-WNtUGfPREhnmuDxIu3Zw;@DasAetherProduction-nc1gc;"Replacement theory is real,refocused on race but it&#39;s all the general populations,you&#39;re attentions focused away from it by making it a race issue. You can easily be you&#39;re own worst enemy by conforming to that mold that&#39;s been prepared for you like a coffin . you can look up a movement called &quot;Lights Off Manufacturing&quot;. Factories and warehouses with no humans. Once autonomous driving takes off for pick up and deliveries of materials for production and drop off at places where consumerism hubs are systematically placed to meet the requisites of 15 minute cities, it&#39;s still not game over. They been developing these systems for decades and soon, to quote a smart Sociological economist &quot; 15 minute cities are the precursor to the ghettos of the future.";2024-01-04T20:53:12Z;1;;Replacement theory is real, refocused on race but it .all the general populations,you re attentions focused away from it by making it a race issue. You can easily be you re own worst enemy by conforming to that mold that .been prepared for you like a coffin. You can look up a movement called Lights Off Manufacturing . Factories and warehouses with no humans. Once autonomous driving takes off for pickup and deliveries of materials for production and drop off at places where consumerism hubs are systematically placed to meet the requisites of 15 minute cities, it .still not game over. They have been developing these systems for decades and soon, to e a smart Sociological economist 15 minute cities are the precursor to the ghettos of the future.;replacement theory real refocus race .all general population attention focus away make race issue easily worst enemy conform mold .been prepare like coffin look movement call light manufacturing factory warehouse human autonomous drive take pickup delivery material production drop place consumerism hub systematically place meet requisite minute city .still not game develop system decade soon e smart sociological economist minute city precursor ghetto future;-0.4819999933242798;Negative
UCz8QXyqfe1M066U3o4eSL5w;@matthewdignam7381;That weird issue where chatgpt was because lazy during the holidays was wild, but I think they patched it recently;2024-01-05T00:46:41Z;1;UCoGZsxcDz4k6aLOrKhW33CQ;That weird issue where ChatGPT was because lazy during the holidays was wild, but I think they patched it recently;weird issue chatgpt lazy holiday wild think patch recently;-0.18799999356269836;Negative
