id;name;text;time;likes;reply;CleanedText;ProcessText;SentimentScore;ActualLabel
UC2EzUyfZd6LjxOkOiqUaXyg;@AxstroNetwork;AI will be taking over from whoever is in responsible for this audio quality. Shocking.;2023-11-30T23:48:50Z;206;;AI will be taking over from whoever is in responsible for this audio quality. Shocking.;ai take responsible audio quality shocking;-0.7269999980926514;Negative
UCJvtDHvslAa6Jvly8iRdrEg;@PK-999;"Your employer, beholden to its investors, will do whatever it can to reduce costs. You are one of those costs. If your job is anything that can be boiled down to a set of rules, it will be replaced by automated systems.<br><br>Although, once the investor/owner/Billionaire class realises this also applies to CEO&#39;s, CFO&#39;s etc, they will be tossed away like the rest of us........";2023-11-30T23:03:48Z;149;;Your employer, beholden to it is investors, will do whatever it can to reduce costs. You are one of those costs. If your job is anything that can be boiled down to a set of rules, it will be replaced by automated systems. Although, once the investor owner Billionaire class realizes this also applies to CEO , CFO .etc., they will be tossed away like the rest of us........;employer beholden investor whatever reduce cost cost job anything boil set rule replace automated system investor owner billionaire class realize also apply ceo cfo toss away rest ........;-0.5220000147819519;Negative
UCpxPRURdGSvqtJ-CHGttOig;@purpleowl2075;"&#39;No one feels sorry for lawyers&#39; lmao";2023-12-01T04:00:10Z;40;;No one feels sorry for lawyers LMAO;one feel sorry lawyer lmao;-0.7820000052452087;Negative
UCsTKC5B4UlY4rJfc5LAw-OQ;@AlexTourkin;"I don&#39;t think AI is the problem, I think it is our current society&#39;s adaptation mechanisms that become obsolete. Taxing AI technology and using that resource to help people to retrain, and universal basic income to ensure basic survival level (and less stress in society that is bad for everyone!!) is a way forward, I believe.";2023-12-07T09:06:38Z;26;;I do not think AI is the problem, I think it is our current society .adaptation mechanisms that become obsolete. Taxing AI technology and using that resource to help people to retrain, and universal basic income to ensure basic survival level and less stress in society that is bad for everyone!! is a way forward, I believe.;not think ai problem think current society .adaptation mechanisms become obsolete tax ai technology use resource help people retrain universal basic income ensure basic survival level less stress society bad everyone way forward believe;-0.04500000178813934;Negative
UCYLm7mko_dJaGLVJdTJ2-zA;@headofmyself5663;Countries with the highest level of automation tend to have the lowest unemployement rates. Besides, it needs a lot of effort to make AI systems work. In supervised learning for industrial image computation for example, you need expert knowledge about the processes for labeling and verification in order to improve your models. Therefore, jobs like data curators will occur imho. The skill sets will be different and i would guess that education will be the key. Mindless work will be automated but new jobs are created. Prompt engineering maybe also a good example, since it actually need skills to ask the right questions and also the ability to understand the answers to verify properly their correctness. Greetings from Germany;2023-12-01T07:59:46Z;17;;Countries with the highest level of automation tend to have the lowest unemployment rates. Besides, it needs a lot of effort to make AI systems work. In supervised learning for industrial image computation for example, you need expert knowledge about the processes for labeling and verification in order to improve your models. Therefore, jobs like data curators will occur IMHO. The skill sets will be different and I would guess that education will be the key. Mindless work will be automated, but new jobs are created. Prompt engineering maybe also a good example, since it actually needs skills to ask the right questions and also the ability to understand the answers to verify properly their correctness. Greetings from Germany;country high level automation tend low unemployment rate need lot effort make ai system work supervised learning industrial image computation example need expert knowledge process label verification order improve model therefore job data curator occur imho skill set different guess education key mindless work automate new job create prompt engineering maybe also good example actually need skill ask right question also ability understand answer verify properly correctness greeting germany;0.08100000023841858;Negative
UCkaidV7i2mn4jpx16kjKSTQ;@michaelcarr3037;"Absolutely and she kept bringing up retraining I question what jobs will they be retrained for ? And that go&#39;s for education they say everyone will have their personal ai professor to gain higher learning and for what ? why hire the student when you can have the teacher at a fraction of the cost and can work 24 7 with no complaints";2023-12-01T04:54:41Z;13;UCJvtDHvslAa6Jvly8iRdrEg;Absolutely and she kept bringing up retraining I question what jobs will they be retrained for ? And that go .for education they say everyone will have their personal AI professor to gain higher learning and for what ? Why hire the student when you can have the teacher at a fraction of the cost and can work 24 7 with no complaints;absolutely keep bring retrain question job retrain go .for education say everyone personal ai professor gain high learning hire student teacher fraction cost work complaint;-0.3019999861717224;Negative
UC6pPTonQbFeRAcL0gNQjB-w;@julia2k8;These Amazon bot comments have become a meme at this point;2023-11-30T22:21:33Z;13;;These Amazon bot comments have become a meme at this point;amazon bot comment become meme point;-0.7279999852180481;Negative
UCafkF4qTUE9v5-LrUQZKgqA;@greengoblin9567;You are wrong. When they talk about automation lowering wages, they are talking about the automation of manual labor. Ai is a different beast altogether. It is coming for everyone.;2023-12-02T09:24:00Z;10;UCYLm7mko_dJaGLVJdTJ2-zA;You are wrong. When they talk about automation lowering wages, they are talking about the automation of manual labor. Ai is a different beast altogether. It is coming for everyone.;wrong talk automation lowering wage talk automation manual labor ai different beast altogether come everyone;-0.04399999976158142;Negative
UC7a1LtOMGeLBXelUZ1SwtGw;@PaulGrayUK;The level of competence/common sense and basic initiative in offices, from a customer perspective, has seen and enabled a level of sheer and utter incompetence.  Replace them all as tired of suffering fools.;2023-12-01T06:16:58Z;9;;The level of competence common sense and basic initiative in offices, from a customer perspective, has seen and enabled a level of sheer and utter incompetence. Replace them all as tired of suffering fools.;level competence common sense basic initiative office customer perspective see enable level sheer utter incompetence replace tire suffering fool;-0.9300000071525574;Negative
UCcnf3Gqsim9xCKF-o89xHFQ;@kevinb9830;"It&#39;s going to threaten nearly every job. I&#39;m pretty convinced now that the universal basic income thing is going to happen. I can&#39;t see any way around it.";2023-12-01T01:52:09Z;9;;It .going to threaten nearly every job. I m pretty convinced now that the universal basic income thing is going to happen. I can not see any way around it.;.going threaten nearly job pretty convince universal basic income thing go happen not see way;-0.2840000092983246;Negative
UCMsU-wbmRfOuF-zEtB8AIWQ;@smkh2890;"An AI sports writer reflected: &quot;the two teams started out on an equal footing, <br>with a zero-zero goal score.&quot;";2023-12-01T20:02:23Z;7;;An AI sports writer reflected the two teams started out on an equal footing, with a zero zero goal score.;ai sport writer reflect team start equal footing zero zero goal score;-0.019999999552965164;Negative
UCotzl0iAGZapdp_LbPMkEDA;@danielwoldu1855;No doubt every journalist will lose thier  jobs because of Artificial intelligence;2023-12-01T00:11:19Z;6;;No doubt every journalist will lose their jobs because of Artificial intelligence;doubt journalist lose job artificial intelligence;-0.9330000281333923;Negative
UCg6YykBwxV3uBIb-49-i__g;@oliverrevis4190;Ikr lol;2023-12-01T05:01:28Z;6;UC2EzUyfZd6LjxOkOiqUaXyg;ICR laugh out loud;icr loud;0.925000011920929;Positive
UCaTQ5-LzDfoqc_ZntkRCNIg;@ehza;Fair, lmaooo;2023-12-01T05:54:07Z;5;UC2EzUyfZd6LjxOkOiqUaXyg;Fair, Magoo;fair magoo;0.012000000104308128;Negative
UClPvI2OFjB16Jllfq10eSRQ;@fredo1070;I await the time for AI News Readers.;2023-11-30T22:02:08Z;5;;I await the time for AI Newsreaders.;await time ai newsreader;0.5230000019073486;Positive
UCnWtLwl4ENJyYTX7fC-CI5w;@NikoKun;"This is going to be a much bigger issue than they realize, for which merely retraining people will not be enough. AI is going to displace a shocking amount of jobs, some forecasts suggest nearly a QUARTER of the workforce could be looking at being out competed by AI, by 2030! It&#39;s not going to create tons of new jobs either, as some dismissively suggest, what could it create that it couldn&#39;t also do itself? It&#39;ll create a few jobs, for a few people, but not the kinds of jobs that will re-employ all those displaced. We need to start thinking about new economic standards, and how to transition to them. We should probably tax AI as it takes over labor, and use that to fund an AI Dividend for all, or an Unconditional Basic Income tied to AI.<br>By the way, the jobs of these reporters may very well be the next thing to go, within a year or so. If the Channel1 ai promo that just came out, is any indicator.";2023-12-17T17:37:57Z;4;;This is going to be a much bigger issue than they realize, for which merely retraining people will not be enough. AI is going to displace a shocking amount of jobs, some forecasts suggest nearly a QUARTER of the workforce could be looking at being outcompeted by AI, by 2030! It .not going to create tons of new jobs either, as some dismissively suggest, what could it create that it could not also do it itself? It ll create a few jobs, for a few people, but not the kinds of jobs that will re employ all those displaced. We need to start thinking about new economic standards, and how to transition to them. We should probably tax AI as it takes over labor, and use that to fund an AI Dividend for all, or an Unconditional Basic Income tied to AI. By the way, the jobs of these reporters may very well be the next thing to go, within a year or . If the Channel1 AI promo that just came out, is any indicator.;go much big issue realize merely retrain people not enough ai go displace shocking amount job forecast suggest nearly quarter workforce look outcompeted ai .not go create ton new job either dismissively suggest create not also create job people not kind job employ displace need start think new economic standard transition probably tax ai take labor use fund ai dividend unconditional basic income tie ai way job reporter well next thing go year channel ai promo come indicator;-0.3799999952316284;Negative
UCYb6iq2vRJ_SdzyoKWHeV2w;@LemonMan91;"Clueless drivel, written by clueless conservative boomers. AI is not going to &#39;enhance&#39; anything, it&#39;s going to replace. And it should replace. Let us rest. Introduce UBI and allow human beings to do what human beings do best. We are creative creatures.";2023-12-11T08:25:03Z;4;;Clueless drivel, written by clueless conservative boomers. AI is not going to enhance anything, it .going to replace. And it should replace. Let us rest. Introduce FBI and allow human beings to do what human beings do best. We are creative creatures.;clueless drivel write clueless conservative boomer ai not go enhance anything .going replace replace let rest introduce fbi allow human human best creative creature;-0.14100000262260437;Negative
UCPaRjoTYAL9zPndTK40zL9A;@johnlock1398;It is so great that those who created it do not know how it works so they do not have any control over this, and so dynamic progres of this creation is other scary thing. It is like we had knife that thinks and makes decisions independently  of humane being;2023-12-01T17:05:48Z;4;;It is. Great that those who created it do not know how it works. They do not have any control over this, and. Dynamic progress of this creation is other scary thing. It is like we had knife that thinks and makes decisions independently of humane being;great create not know work not control dynamic progress creation scary thing knife think make decision independently humane;-0.5249999761581421;Negative
UCBDOYx75iiA4FZ1FIiwDUng;@kyliemiu;"I don&#39;t think accountants will be affected as much. You can&#39;t train AI to cook the books.";2023-12-01T12:55:12Z;4;;I do not think accountants will be affected as much. You can not train AI to cook the books.;not think accountant affect much not train ai cook book;-0.4699999988079071;Negative
UCqEkzad14LsJlAouAlrH-Xw;@intricatic;"The only jobs under threat are ones that could always easily be done by a computer. Which is about 98% of office jobs. I just read a news article that was written by AI and I wouldn&#39;t have known, except the author called the Cold War &quot;...the Chilly War.&quot; Lol";2023-12-06T11:21:09Z;3;;The only jobs under threat are ones that could always easily be done by a computer. Which is about 98 of office jobs. I just read a news article that was written by AI and I would not have known, except the author called the Cold War ...the Chilly War. laughing out loud;job threat one always easily computer office job read news article write ai not know author call cold war chilly war laugh loud;0.0860000029206276;Negative
UCwj4rsl71uLwo1pcMqaUBrA;@Stanleyknif3;AI can replace the BBC that cant come soon enough.;2023-12-02T20:38:52Z;3;;AI can replace the BBC that can not come soon enough.;ai replace bbc not come soon enough;0.6330000162124634;Positive
UCd4eHgWSJVC67myulmRKykA;@Rhade15;Brilliant interview, knowledgeable, engaging and entertaining;2023-12-01T11:11:12Z;3;;Brilliant interview, knowledgeable, engaging and entertaining;brilliant interview knowledgeable engage entertain;0.9269999861717224;Positive
UCsQkP7GChNnPF9W7aPjm5aQ;@davidgray8321;Civilization is collapsing long before AI is advanced enough to do this.;2023-12-01T10:39:13Z;3;;Civilization is collapsing long before AI is advanced enough to do this.;civilization collapse long ai advanced enough;-0.8659999966621399;Negative
UC58OsOl4c8XuTEKa0urAihA;@captainbuggernut9565;"She mentioned different professions, personally ive used it for medical diagnosis. It&#39;s better than my GP at figuring out what&#39;s, what. Thats the free version too. You can then toss those ideas back to your doctor, whose reaction is frequently thats a really good idea, or I didn&#39;t think of that.";2023-12-01T10:10:06Z;3;;She mentioned different professions, personally I have used it for medical diagnosis. It .better than my GP at figuring out what , what. That is the free version too. You can then toss those ideas back to your doctor, whose reaction is frequently that is a perfect idea, or I did not think of that.;mention different profession personally use medical diagnosis .better gp figure free version toss idea back doctor reaction frequently perfect idea not think;0.24400000274181366;Negative
UCCexm5x9UadFB13NBTFIeYw;@RepairBeyond;"Aka. you&#39;re going to need UBI sooner than you think. The foundation of modern capitalism is that there is value in work, when that&#39;s not the case anymore because AI will do any kind of work, that system ceases to function for humanity.<br><br>Of course it&#39;s going to take quite a while before <i>everything</i> can be done by AI, but depending on how AGI develops that may be way sooner than you think.";2023-12-01T08:43:14Z;3;;Aka. you re going to need FBI sooner than you think. The foundation of modern capitalism is that there is value in work, when that .not the case anymore because AI will do any kind of work, that system ceases to function for humanity. Of course, it .going to take quite a while before everything can be done by AI, but depending on how AGI develops that may be way sooner than you think.;aka go need fbi sooner think foundation modern capitalism value work .not case anymore ai kind work system cease function humanity course .going take quite everything ai depend agi develop way sooner think;-0.1899999976158142;Negative
UCjRUIASIwvYOTiFrUE4wQBA;@WillyJunior;Amen.;2023-12-01T16:04:26Z;3;UC7a1LtOMGeLBXelUZ1SwtGw;Amen.;amen;0.6480000019073486;Positive
UCbSmzkR3GrjkXR8l1iCllNg;@dimamatat5548;The developed countries already have shrinking populations. So AI may fix future labor shortages.;2023-12-01T06:06:23Z;3;;The developed countries already have shrinking populations. So AI may fix future labor shortages.;developed country already shrink population ai fix future labor shortage;0.05400000140070915;Negative
UC0Rh7l3daAPq00I6dUAHwiQ;@containedhurricane;I think AI will threaten human resource department jobs. It could also be used to replace hospitality industry workers, if we can get solar power with more efficient and cheaper methods;2023-12-01T03:42:36Z;3;;I think AI will threaten human resource department jobs. It could also be used to replace hospitality industry workers, if we can get solar power with more efficient and cheaper methods;think ai threaten human resource department job also use replace hospitality industry worker get solar power efficient cheap method;-0.07400000095367432;Negative
UCVdKDmlVJSOJqlHWKJ2dAlQ;@TheBHAitken;LOL  Just learning this now?   The truth is that if what you produce is done at a desk, you can and will be replaced by about $5000 of hardware.;2023-11-30T22:17:08Z;3;;LOL Just learning this now? The truth is that if what you produce is done at a desk, you can and will be replaced by about 5000 of hardware.;lol learn truth produce desk replace hardware;-0.06499999761581421;Negative
UCaIdK6IljlXih4Ik1S8r4gg;@micksylvestre2887;I love how she downplayed the impact AI will taken over and dispersed jobs in the same manner that Macintosh has eliminated the majority of jobs in the print and service industries in the late 80s.;2023-12-25T01:14:19Z;2;;I love how she downplayed the impact AI will take over and dispersed jobs in the our manner that Macintosh has eliminated the majority of jobs in the print and service industries in the late 80s.;love downplay impact ai take dispersed job manner macintosh eliminate majority job print service industry late;0.10100000351667404;Negative
UCCvZuqwT0h7HBNJOmeGY-Iw;@NakedSageAstrology;"Capitalism will not survive automation, it&#39;s time for something new.";2023-12-10T14:09:48Z;2;;Capitalism will not survive automation, it .time for something new.;capitalism not survive automation .time something new;-0.37599998712539673;Negative
UCzFEaj3fUpd9UQGT_T4kVSw;@canaldemais;They should have got AI to microphone her correctly;2023-12-10T11:01:31Z;2;;They should have got AI to microphone her correctly;get ai microphone correctly;-0.921999990940094;Negative
UCBNdXyjK3hYlaUZxrmg1QMA;@Gerlaffy;"Yep let&#39;s start the transition to a much more relaxing and free society.";2023-12-28T01:36:41Z;2;UCsTKC5B4UlY4rJfc5LAw-OQ;Yep let .start the transition to a much more relaxing and free society.;yep let .start transition much relaxing free society;0.6460000276565552;Positive
UCBUCIHuRrWxPOwkh2oO-Hww;@GraphicdesignforFree;AI will do a lot of good, and accelerate progress. AI should be open, so we can all access it.;2023-12-07T00:13:29Z;2;;AI will do a lot of good, and accelerate progress. AI should be open, We can all access it.;ai lot good accelerate progress ai open access;0.4449999928474426;Negative
UCZd1du37M2nJiCFoBxjm_DA;@crowmack;The audio is terrible.;2023-12-06T17:12:44Z;2;;The audio is terrible.;audio terrible;-0.8930000066757202;Negative
UCib7xcccOvgGDH5_OXyC0cA;@jr-yn4lk;"You&#39;re forgetting that AI will also greatly accelerate the pace of scientific research. The time it will take for AI to develop smart robots is just 1% of the time it would take humans to develop them. In a few years, all jobs will be automated.";2023-12-07T21:44:20Z;2;UCqEkzad14LsJlAouAlrH-Xw;You re forgetting that AI will also greatly accelerate the pace of scientific research. The time it will take for AI to develop smart robots is just 1 of the time it would take humans to develop them. In a few years, all jobs will be automated.;forget ai also greatly accelerate pace scientific research time take ai develop smart robot time take human develop year job automate;0.1720000058412552;Negative
UCDWPiOdqQdA3cn-0yveMmZQ;@PaperCoffeeTable;"First we had the mechanical automation in industries, a lot of jobs were displaced and we needed to adapt, and that was fine. Now we have software automation on the rise which people call &quot;AI&quot;, a lot of jobs will be displaced, and we need to adapt, and that&#39;s fine. People need to listen to scientists in AI instead of learning from movies for entertainment and doomsayers.";2023-12-03T11:11:52Z;2;;First we had the mechanical automation in industries, a lot of jobs were displaced, and we needed to adapt, and that was fine. Now we have software automation on the rise which people call AI , a lot of jobs will be displaced, and we need to adapt, and that .fine. People need to listen to scientists in AI instead of learning from movies for entertainment and doomsayers.;first mechanical automation industry lot job displace need adapt fine software automation rise people call ai lot job displace need adapt .fine people need listen scientist ai instead learn movie entertainment doomsayers;-0.05999999865889549;Negative
UC1-9TgYhM1VgF5a0tLsKe9w;@haroldsfishingadventures754;"Agenda 21, Agenda 2030, Pandemic Exercise 201. They always say what they&#39;re going to do before they do it";2023-12-02T18:53:43Z;2;;Agenda 21, Agenda 2030, Pandemic Exercise 201. They always say what they re going to do before they do it;agenda agenda pandemic exercise always say go;0.2280000001192093;Negative
UCq5fP9aTVX6bgtabpHD88IA;@OculusGame;"Good, wasting ~35% off your life working shouldn&#39;t be a thing. TIME is the only currency that matters now.";2023-12-01T16:07:19Z;2;;Good, wasting 35 off your life working shouldn't be a thing. TIME is the only currency that matters now.;good waste life work n't thing time currency matter;-0.3409999907016754;Negative
UCaWeyxleUhITzeGSDl0JCNg;@ikotsus2448;"Today people provide value to higher class/leadership through production, law enforcement, military etc. Once these are AI we are a button away from being exterminated. And until then monitored 24/7 because the &quot;good guys&quot; with AI would not risk somebody else developing it.";2023-12-01T13:37:13Z;2;;Today people provide value to higher class leadership through production, law enforcement, military etc. Once these are AI we are a button away from being exterminated. And until then monitored 24 7 because the good guys with AI would not risk somebody else developing it.;today people provide value high class leadership production law enforcement military etc button away exterminate monitor good guy ai not risk somebody else develop;-0.2070000022649765;Negative
UCJK4YzV_GXUS61P7c9Uw5uw;@honourthefire9182;"We can&#39;t allow this to happen.";2023-12-01T09:00:03Z;2;;We can not allow this to happen.;not allow happen;-0.8240000009536743;Negative
UCUi8XNBTOu6VMmBV5oP2lUA;@robertpodbery242;First thing the zionists that run the bbc will do is programme AI ,   to be pro israel warcrimes and misrepresent the truth every time,;2023-12-01T08:51:47Z;2;;First thing the Zionists that run the BBC will do is program AI, to be pro Israel war crimes and misrepresent the truth every time,;first thing zionist run bbc program ai pro israel war crime misrepresent truth time;-0.9359999895095825;Negative
UCzmOe8QlHHZCHrZXDuS9Xyw;@6whatnext;Or journalists;2023-12-01T04:10:31Z;2;UCpxPRURdGSvqtJ-CHGttOig;Or journalists;journalist;-0.039000000804662704;Negative
UC9dd8SLko13PRyBcEJ4ISDQ;@rey82rey82;Replace your audio team with AI;2023-12-01T00:29:52Z;2;;Replace your audio team with AI;replace audio team ai;0.30300000309944153;Negative
UCRush-ISVwWdtDCdsH2y4UA;@sonofsomerset1695;It can do us a favour and replace the lying BBC for starters.;2023-12-01T00:08:46Z;2;;It can do us a favor and replace the lying BBC for starters.;favor replace lying bbc starter;0.4000000059604645;Negative
UCWv_cPyZMoDem5hczZgbSIA;@Borsi666;Maybe it is already the AI, thats why this awful quality :D;2023-12-03T12:19:48Z;2;UC2EzUyfZd6LjxOkOiqUaXyg;Maybe it is already the AI, that is why this awful quality D;maybe already ai awful quality;-0.9100000262260437;Negative
UCz_5XZkLD_ssr429BevA2aw;@TheGreenReaper;They did say that there was a mic problem - perhaps a battery died suddenly?;2023-12-05T10:13:01Z;2;UC2EzUyfZd6LjxOkOiqUaXyg;They did say that there was a mic problem perhaps a battery died suddenly?;say mic problem perhaps battery die suddenly;-0.6740000247955322;Negative
UCT1DeW9bZxJYd6Sj2dJQNAA;@realfreedom8932;A Job by definition is following a set of rules and procedures. So most jobs will be automated. There will be a tiny percentage of jobs required to maintain the systems;2024-01-01T15:45:49Z;1;;A Job by definition is following a set of rules and procedures. So most jobs will be automated. There will be a tiny percentage of jobs required to maintain the systems;job definition follow set rule procedure job automate tiny percentage job require maintain system;-0.10499999672174454;Negative
