id;name;text;time;likes;reply;CleanedText;ProcessText;SentimentScore;ActualLabel
UCyKl4hxnirXHM5SSMjuRjQA;@inhocsignovinces8061;Creatives are the first to go, where has this commentator been the last few months?;2023-06-04T13:09:41Z;3;;Creatives are the first to go, where has this commentator been the last few months?;creatives first go commentator last month;-0.753000020980835;Negative
UCCMA1md1JjIjEZgm4oAFMZg;@JT_Hamm808;Hey skynet, remember I was polite to you when you enslave us all.;2023-06-03T12:45:12Z;3;;Hey Skynet, remember I was polite to you when you enslave us all.;hey skynet remember polite enslave;-0.7080000042915344;Negative
UCiag3dWI-XwgArPAi4m8HPw;@tomr6866;Registered Nurses;2023-06-03T06:16:56Z;3;;Registered Nurses;register nurse;-0.03200000151991844;Negative
UC7cKYANU4bAIW-d-jTj94eg;@TheWayOfRespectAndKindness;Will we be able to determine our fundamental values?;2023-06-03T03:54:26Z;3;;Will we be able to determine our fundamental values?;able determine fundamental value;0.03500000014901161;Negative
UCb1P26kEOXJE1FRV8vBCJcA;@Clickerenowwww;Onlyfans lol;2023-06-03T03:38:44Z;3;UCPmhB2WKJ9bdKwXn62NQ5XQ;OnlyFans laugh out loud;onlyfans laugh loud;0.8420000076293945;Positive
UCTXwULhyp1_LsFgBcKBD4tA;@jish55;"There are no jobs safe from robots and we need to stop deluding ourselves. Technology right now is the absolute worst it&#39;ll ever be, and it&#39;ll progress so rapidly that before we know it, robots will be doing everything humans can but better, and in a much shorter period than we initially thought. This means we need to stop fighting against the inevitable and start moving to a new method of functioning as a society where work is no longer needed.";2024-03-04T13:11:49Z;2;;There are no jobs safe from robots and we need to stop deluding ourselves. Technology right now is the absolute worst it ll ever be, and it ll progress. Rapidly that before we know it, robots will be doing everything humans can but better, and in a much shorter period than we initially thought. This means we need to stop fighting against the inevitable and start moving to a new method of functioning as a society where work is no longer needed.;job safe robot need stop delude technology right absolute worst ever progress rapidly know robot everything human good much short period initially think mean need stop fight inevitable start move new method function society work no longer need;-0.2680000066757202;Negative
UC1HISPDvYKFJFrY9StOMjCw;@clineshaunt;My question is how will ai effect the salaries of remaining jobs.  If it heavily deskills remaining jobs and you have more of a supply of potential employees than required, I think we all know what that will bring.;2024-02-02T17:33:29Z;2;;My question is how will AI effect the salaries of remaining jobs. If it heavily deskills remaining jobs, and you have more of a supply of potential employees than required, I think we all know what that will bring.;question ai effect salary remain job heavily deskills remain job supply potential employee require think know bring;-0.41999998688697815;Negative
UCHBN9hPBPi5ACySsI2r3X5g;@JoeCnNd;"Great, all the safe jobs are stuff I don&#39;t want to do.";2024-01-11T09:55:15Z;2;;Great, all the safe jobs are stuff I do not want to do.;great safe job stuff not want;-0.6439999938011169;Negative
UC-8CtffEG9BwvpRPsFvR1Aw;@stuart249;AI will impact on every job because people who lose their jobs will be retraining and trying to move into diffident industries, which will cause an oversupply of workers in the non AI jobs.;2024-01-10T00:54:40Z;2;;AI will impact on every job because people who lose their jobs will be retraining and trying to move into diffident industries, which will cause an oversupply of workers in the non AI jobs.;ai impact job people lose job retrain try move diffident industry cause oversupply worker non ai job;-0.35199999809265137;Negative
UCj6MwK1mMxiSFTqR_MsITZw;@bcuriel2010;lol a computer could do a better job than any nurse or physician at giving a diagnosis;2023-11-13T15:17:16Z;2;;laughing out loud a computer could do a better job than any nurse or physician at giving a diagnosis;laugh loud computer good job nurse physician give diagnosis;0.17299999296665192;Negative
UCoFaQWhBVwcEErCtMSzNlrA;@jockogle5250;"I&#39;m surprised they don&#39;t have ai robot lawyers yet. Very doable but what would the affects be?";2023-07-23T13:44:22Z;2;;I m surprised they do not have AI robot lawyers yet. Very doable but what would the effects be?;surprise not ai robot lawyer yet doable effect;-0.33500000834465027;Negative
UCLgcCGPIq5vXi1qb_SAuV-g;@DracoReptoidsExposed;That would be vandalism and you will face prison time;2023-07-30T01:06:08Z;2;UCidv2Yihb1V8NehmJ3WAetw;That would be vandalism and you will face prison time;vandalism face prison time;-0.8199999928474426;Negative
UCvIFkod_R8GrPP3EsvpW0Lw;@TerryTappArt;"The wealthy are using technology that humans have developed to eliminate humans. They own the world and we aren&#39;t wanted";2023-07-20T11:46:09Z;2;;The wealthy are using technology that humans have developed to eliminate humans. They own the world and we are not wanted;wealthy use technology human develop eliminate human world not want;-0.8289999961853027;Negative
UCzhhgLK93RxuqPmvVFHWA9A;@jaym9846;"Can&#39;t wait for AI to take over. Huge, huge, huuuge gains in AI stocks so far.";2023-06-05T01:18:12Z;2;;Can't wait for AI to take over. Huge, huge, huge gains in AI stocks. Far.;n't wait ai take huge huge huge gain ai stock far;0.257999986410141;Negative
UC61eUxiCdhCfrbPVy266cQw;@TheCommunicationCoach;CBS, stop the damned fear-mongering!!;2023-06-03T22:09:42Z;2;;CBS, stop the damned fearmongering!!;cbs stop damned fearmongering;-0.9390000104904175;Negative
UCaz_p-7wkhN6796h5qZU7IQ;@overshare7;A subject like this has 800 views...;2023-06-03T04:31:42Z;2;;A subject like this has 800 views...;subject view;0.05400000140070915;Negative
UCsXijYpRRcZhYkbfObJanfw;@potatomatop9326;Jobs that are safe from ai:<br>Netflix<br>Genshin<br>Star Rail<br>Rule34<br>Gelbooru;2023-06-03T03:04:48Z;2;;Jobs that are safe from AI Netflix Gen shin Star Rail Rule34 Geoboard;job safe ai netflix gen shin star rail rule geoboard;0.20900000631809235;Negative
UCuriiayl2bg7DXD9bVLXmvA;@bondjovi4595;"All I know.... Alcatel better be making a 5g flip phone. Otherwise, I&#39;m going to have to get one of those Blu flip phones. Or, be forced back to T-Mobile so I can use the Nokia brick phones.";2023-06-03T03:01:53Z;2;;All I know.... Alcatel better be making a 5g flip phone. Otherwise, I m going to have to get one of those Blu flip phones. Or, be forced back to T Mobile. I can use the Nokia brick phones.;know .... alcatel well make g flip phone otherwise go get blu flip phone force back mobile use nokia brick phone;-0.164000004529953;Negative
UCR57GpiMFcaPt8fcehAZ4nQ;@aprilcoursey4533;"What if, COVID 19 and the shut downs and hysteria were created as a testing ground to see what will happen when many are deprived of being able to work? Possible many other social experiments could&#39;ve been at play";2024-04-17T03:54:32Z;1;;What if, COVID 19 and the shut downs and hysteria were created as a testing ground to see what will happen when many are deprived of being able to work? Possible many other social experiments could ve been at play;covid shut hysteria create test ground see happen many deprive able work possible many social experiment play;-0.5659999847412109;Negative
UC5OW7lQ2UNm6ultZubaqsIQ;@MainEditor0;"I don&#39;t want to work all life and with joy would let AI and robots do it instead of me BUT I&#39;m also need food and roof above my head....";2024-03-13T12:44:33Z;1;;I do not want to work all life and with joy would let AI and robots do it instead of me BUT I m also need food and roof above my head....;not want work life joy let ai robot instead also need food roof head ....;-0.19699999690055847;Negative
UCE8GjJTb5vuD5GVuB5LvQVw;@user-cs4zb2mn8w;News media most basic to replace;2024-02-13T23:30:12Z;1;;News media most basic to replace;news medium basic replace;0.26600000262260437;Negative
UCp24OqUFyJ6L_0VbCTzbkyQ;@Eag757;If IT folks that have helped expedite AI ceeation today have been  layoff what else is there to expect??;2024-01-17T05:31:49Z;1;;If IT folks that have helped expedite AI creation today have been layoff what else is there to expect??;folks help expedite ai creation today layoff else expect;-0.8519999980926514;Negative
UCUS1vnc_wFnvVl6f6QEbw3Q;@kevine9474;Like someone said, funnily enough the last jobs to be replaced will be s*x workers;2023-10-22T11:22:50Z;1;;Like someone said, funnily enough the last jobs to be replaced will be.x workers;someone say funnily enough last job replace be.x worker;0.04100000113248825;Negative
UCa0Zmb7-3_BWUjgVaNXCBBQ;@ShondaD_;So when AI takeover all the jobs, what will ppl do for income?;2023-09-27T16:57:50Z;1;;So when AI takeover all the jobs, what will people do for income?;ai takeover job people income;-0.4950000047683716;Negative
UCIEGz4Ui3tpONyUEUmMooMg;@mauritzventer2092;Investing in AI stock;2023-11-05T03:58:22Z;1;UCa0Zmb7-3_BWUjgVaNXCBBQ;Investing in AI stock;invest ai stock;0.052000001072883606;Negative
UCEXpjckOccnYKrk_mPJp8jw;@ten10_ten10;"@@kevine9474 UBI is less likely to happen than immortality is. The whole reason an AI takeover is a real worry is because the CEOs in charge don&#39;t believe that humans deserve money, because they&#39;re &quot;too inefficient&quot; (require basic survival needs)";2023-11-08T05:36:51Z;1;UCa0Zmb7-3_BWUjgVaNXCBBQ;FBI is less likely to happen than immortality is. The whole reason an AI takeover is a real worry is that the CEOs in charge do not believe that humans deserve money, because they re too inefficient require basic survival needs;fbi less likely happen immortality whole reason ai takeover real worry ceo charge not believe human deserve money inefficient require basic survival need;-0.6140000224113464;Negative
UChdKgeCWRqAs_gxEXgJaIzQ;@troglodyte6949;"If they become advanced enough they&#39;ll even replace humans";2023-09-20T07:39:37Z;1;;If they become advanced enough they ll even replace humans;become advanced even replace human;0.3790000081062317;Negative
UCANzM5_m_tMZu36Z_13_Y5w;@violetd3487;I guess there will be less people then--people who can hardly afford anything.;2023-09-13T10:24:31Z;1;;I guess there will be fewer people then people who can hardly afford anything.;guess people people hardly afford anything;-0.5559999942779541;Negative
UCYDVLQWeFMfzKYLW5EvVfhQ;@1merkur;"The host interrupted the guest so many times. Humans can&#39;t even converse any more, it&#39;s time for AI.";2023-09-12T12:18:23Z;1;;The host interrupted the guest. Many times. Humans can not even converse anymore, it .time for AI.;host interrupt guest many time human not even converse anymore .time ai;-0.29899999499320984;Negative
UCussv8GDcNWJpdR_1gAH0pw;@Xarishher;Most physical Engineers will definitely get replaced;2023-09-02T09:29:08Z;1;;Most physical Engineers will definitely get replaced;physical engineer definitely get replace;-0.6340000033378601;Negative
UC-JEHRcEsvW75OkGfIs8X0Q;@amorylazlo9579;I just hope impressionist is not a job that survives;2023-08-22T06:28:48Z;1;;I just hope impressionist is not a job that survives;hope impressionist not job survive;-0.8510000109672546;Negative
UCss65fKZC82CRaIqSkAcRZA;@brettk9316;They took our jobs!;2023-08-14T07:51:47Z;1;;They took our jobs!;take job;-0.8610000014305115;Negative
UCr1TmGzXJsK5nGwd3NZifvQ;@reempire888;"What about service technicians that install and repair robot automation for manufacturing and medical purposes? My thought is they will need a highly advanced humanoid with fingers that are able to work with tool, which I think it will be a long time from now. When they say engineers, it&#39;s a very vague term. Tthey have collected many data during Covid on what we can replace. Those who stayed home during the pandemic has the highest risk on the chopping block. Just my thought.";2023-08-01T21:32:46Z;1;;What about service technicians that install and repair robot automation for manufacturing and medical purposes? My thought is they will need a highly advanced humanoid with fingers that are able to work with tool, which I think it will be a long time from now. When they say engineers, it .a very vague term. They have collected many data during Covid on what we can replace. Those who stayed home during the pandemic has the highest risk on the chopping block. Just my thought.;service technician install repair robot automation manufacturing medical purpose thought need highly advanced humanoid finger able work tool think long time say engineer .a vague term collect many data covid replace stay home pandemic high risk chopping block thought;-0.16599999368190765;Negative
UCjQQiROmealqhLnDn77TNyQ;@themirrorofthetruth2055;Hey, ai will steal all jobs, no exception, we will create Skynet;2023-07-21T13:47:50Z;1;;Hey, AI will steal all jobs, no exception, we will create Skynet;hey ai steal job exception create skynet;-0.7770000100135803;Negative
UCO6mei4Y_zWZc2gjIdmcO-Q;@boshkoboki1251;"Simple no room for people. Just for the rich. Global warming isn&#39;t a threat to humanity it&#39;s just a  distraction. AI is because you don&#39;t need humans.";2023-07-16T11:02:01Z;1;;Simple no room for people. Just for the rich. Global warming is not a threat to humanity it .just a distraction. AI is because you do not need humans.;simple room people rich global warming not threat humanity .just distraction ai not need human;-0.4050000011920929;Negative
UCAogIDexPyh7fSKXDkYukqA;@mrbob4104;Ok,and those controlling the AI will control the wolrd. Thanks...;2023-06-15T16:34:28Z;1;UCxQ0nZKYr6ufgGMP0GAswQg;Ok, and those controlling the AI will control the word. Thanks...;ok control ai control word thanks;0.48100000619888306;Positive
UCwWPUGE7fJoZv14jKfl2vJw;@emanuelgonzalez1743;"Luckily I&#39;m in college majoring in cs specifically for ai and ml";2023-06-10T08:58:26Z;1;;Luckily I m in college majoring in Computer Science specifically for AI and machine learning;luckily college majoring computer science specifically ai machine learning;0.36800000071525574;Negative
UCuEJ2cdpf8KPmsqwxKYY8FA;@caribbeanchild;None...not one.;2023-06-07T08:10:26Z;1;;None...not one.;none not;-0.5699999928474426;Negative
UCkMqrLqXHCNBZD0UC5BGQOw;@reza2kn;"My thoughts exactly when he said &quot;AI is only good at stuff that is repetitive and predictable&quot; I was like, yeah, no, You don&#39;t know what you&#39;re talking about! I don&#39;t think there&#39;s anything predictable with Stable Fusion :D";2023-09-18T01:15:40Z;1;UC0bTh1kxKq8326pm_3xdryg;My thoughts exactly when he said AI is only good at stuff that is repetitive and predictable I was like, yeah, no, You do not know what you re talking about! I do not think there .anything predictable with Stable Fusion D;thought exactly say ai good stuff repetitive predictable not know talk not think .anything predictable stable fusion;-0.33000001311302185;Negative
UC_xYsF2rihVgtlKqV2fFoPg;@mosthated.e.2422;Terminator skynet;2023-06-05T00:03:47Z;1;;Terminator Skynet;terminator skynet;0.0;Negative
UCjWFU9cIVClq8DnGAV1sQsw;@kami60077;"Wow! zero jobs! that&#39;s a lot of jobs ngl.";2023-07-14T01:24:53Z;1;UC1Lv9PZiV49hAWflvqGb-3Q;Wow! Zero jobs! That .a lot of jobs NFL.;wow job .a lot job nfl;0.03500000014901161;Negative
UCcny3VTq3F8n9k0JZOycsMA;@donaldpmurt2446;The AI safe jobs are anything in our corrupt government..................................;2023-06-04T02:12:04Z;1;;The AI safe jobs are anything in our corrupt government..................................;ai safe job anything corrupt government ..................................;-0.8980000019073486;Negative
UCCCGzp10uqcRICWdeok97mw;@garymartin7369;As a dumb lamprey, I am not worried about AI...<br><br><br>...in the Atlantic Ocean.;2023-06-03T21:25:16Z;1;;As a dumb lamprey, I am not worried about AI... ...in the Atlantic Ocean.;dumb lamprey not worry ai atlantic ocean;-0.32100000977516174;Negative
UCodoRwykpQL0SZvVcC2iF1g;@Learna_Hydralis;simple all top-down jobs are at risk .. all bottom-up jobs are more resistant!;2023-06-03T20:07:26Z;1;;Simple all top down jobs are at risk . All bottom up jobs are more resistant!;simple top job risk bottom job resistant;-0.3050000071525574;Negative
UCs6xVxfheBbi2VgjX-Z3BNw;@gerdaleta;There will be a great War everywhere about the question of well how am I going to feed myself Kathy I just give me food and rich people telling you know even though it obviously can;2023-06-03T13:46:05Z;1;;There will be a great War everywhere about the question of well how am I going to feed myself Kathy I just give me food and rich people telling you know even though it obviously can;great war everywhere question well go fee kathy give food rich people tell know even obviously;-0.8799999952316284;Negative
UCD5UiHYcfInMAbGj6sbWo9Q;@guineapigzed;"When Segway became conscious; it offed the owner.";2023-06-03T12:04:58Z;1;;When Segway became conscious it offed the owner.;segway become conscious owner;-0.1860000044107437;Negative
UCPfceqWvFQMH7U4xk5B4Bkg;@RickFarris;"Who were we talking to?  &quot;Goldman Sachs?&quot;";2023-06-03T08:03:44Z;1;;Who were we talking to? Goldman Sachs?;talk goldman sachs;-0.09600000083446503;Negative
UCDR65LJhxrh6jmUTElRWxUA;@tonialee3905;Except teachers -- a classroom full of kids is definitely unpredictable.;2023-07-19T21:16:14Z;1;UCPmhB2WKJ9bdKwXn62NQ5XQ;Except teachers a classroom full of kids is definitely unpredictable.;teacher classroom full kid definitely unpredictable;-0.27000001072883606;Negative
UCyZCNw4MlWrN6a8oLma199w;@RynaxAlien;They took our jobs!;2024-04-30T15:13:15Z;0;;They took our jobs!;take job;-0.8610000014305115;Negative
UCIYefFTETXfhJDUnMgVVzoQ;@Entertainment-sq6wx;"In one word if your job requires Physical labour it won&#39;t affect, but if its Information sharing then it can affect.<br><br><br>Example: Nurse physically taking care of a patient. It would take many more years to have Robots that will do physical work.";2024-04-30T01:21:21Z;0;;In one word if your job requires Physical labor it will not affect, but if it is Information sharing then it can affect. Example Nurse physically taking care of a patient. It would take many more years to have Robots that will do physical work.;word job require physical labor not affect information share affect example nurse physically take care patient take many year robot physical work;-0.052000001072883606;Negative
UCUO-p1Chp9GDSbztUSUXbzQ;@rodneyh1947;wha da phuuuuh is futurist lol;2024-04-28T22:24:52Z;0;;Wha the fourth is futurist laugh out loud;fourth futurist loud;0.8920000195503235;Positive
UCv_n1I4nhaRdvP2MXBohdxA;@maddmaxwiththefacts601;I own an appliance repair company and would easily be willing to add robot repair to my repertoire;2024-04-17T02:25:34Z;0;;I own an appliance repair company and would easily be willing to add robot repair to my repertoire;appliance repair company easily willing add robot repair repertoire;0.7789999842643738;Positive
UCacQ2aLbviZdqq8Y6Q_ZCAQ;@randommemebean686;Ah yes 33 percent of the work force eaither unemployed or trying to compete for already saturated job markets. What could go wrong? Also ai is already replacing crative jobs. News papers can be writen by bots. This is a larger isssue, and i feel like they are downplaying ai effect on our society.;2024-04-16T15:21:42Z;0;;Ah, yes 33 percent of the work force either unemployed or trying to compete for already saturated job markets. What could go wrong? Also, AI is already replacing creative jobs. Newspapers can be written by bots. This is a larger issue, and I feel like they are downplaying AI effect on our society.;ah percent work force unemployed try compete already saturate job market go wrong also ai already replace creative job newspaper write bot large issue feel downplay ai effect society;-0.42100000381469727;Negative
UCDeSKAALa7vVplmUAgbiFGg;@iancoles1349;Bailifs and undertakers.Anything that requires dexterity out in the field and not controlled work in a factory ie Electricians plumbers farmers.There arw others but hay if u dont plan now u may lose everything.And buy metals;2024-04-10T17:30:35Z;0;;Bailiff and undertakers. Anything that requires dexterity out in the field and not controlled work in a factory i.e. Electricians plumbers farmers. There ARW others but hay if you do not plan now you may lose everything. And buy metals;bailiff undertaker anything require dexterity field not control work factory i.e electricians plumber farmer arw others hay not plan lose everything buy metal;-0.14300000667572021;Negative
UCBeKp6ZUUIjEJihmvKY0_Gw;@SFgamer;"They won&#39;t &#39;take&#39; jobs.";2024-04-07T14:03:09Z;0;;They will not take jobs.;not take job;-0.8740000128746033;Negative
UCc_QqPdNGGT7OkdSznQ1VYg;@prilep5;AI can replace 80% of work from home jobs.;2024-04-04T04:22:44Z;0;;AI can replace 80 of work from home jobs.;ai replace work home job;0.1120000034570694;Negative
UCckPU7GoG5V0YAMxLFT1FbA;@8MunchenBayern8;"this is sooooo stupid. What is the point of causing mass unemployment? so CEOs and other psychos can add more billions to their additional billions?<br><br>If people can&#39;t feed themselves or keep roofs over their heads in mass there will be civil unrest and riots the likes of which we&#39;ve never seen.";2024-03-29T05:38:19Z;0;;This is suitor stupid. What is the point of causing mass unemployment? . CEOs and other psychos can add more billions to their additional billions? If people can not feed themselves or keep roofs over their heads in mass there will be civil unrest and riots the likes of which we ve never seen.;suitor stupid point cause mass unemployment ceo psycho add billion additional billion people not fee keep roof head mass civil unrest riot like never see;-0.9190000295639038;Negative
UChj2hTE9RyWNEKfibagSyDQ;@tunahelpa5433;I like to point out that a targeted AI can be designed to do one thing better than humans while being totally unable to do other things. <br><br>Human level AI is coming way before AGI is ready.  It will replace some jobs, enhance others, and accelerate the pace of everything it touches;2024-03-26T21:17:42Z;0;;I like to point out that a targeted AI can be designed to do one thing better than humans while being totally unable to do other things. Human level AI is coming way before AGI is ready. It will replace some jobs, enhance others, and accelerate the pace of everything it touches;like point targeted ai design thing good human totally unable thing human level ai come way agi ready replace job enhance others accelerate pace everything touch;0.24300000071525574;Negative
UCLO8RqJ9P4FzyI3JY4hlXmQ;@oliverstianhugaas7493;The final and last trick by the boomers, funding this before they die.;2024-03-24T12:15:57Z;0;;The final and last trick by the boomers, funding this before they die.;final last trick boomer fund die;-0.9190000295639038;Negative
UCu5wX-te51QfrG9MGvfW6LA;@gbxgbxgbx;Creatives are the ones that are alread fckd, generative Ai is already undermining graphic designers, photographers etc... Same for writers, copywriters.;2024-03-20T20:29:10Z;0;;Creatives are the ones that are already CKD, generative Ai is already undermining graphic designers, photographers etc... Same for writers, copywriters.;creatives one already ckd generative ai already undermining graphic designer photographer etc writer copywriter;-0.39500001072883606;Negative
UCXKwODdtDb-FbXUbQvKSzyQ;@kingdomross8974;"AI were in video games, and now it&#39;s coming to real life.";2024-03-13T13:36:20Z;0;;AI were in video games, and now it .coming to real life.;ai video game .coming real life;0.6060000061988831;Positive
UCrpC926eYI6uQ-nkj53ruIw;@pramodnair4322;Manual jobs will be replaced by robots for example drivers are already being replaced by automated cars;2024-03-11T03:34:14Z;0;;Manual jobs will be replaced by robots for example drivers are already being replaced by automated cars;manual job replace robot example driver already replace automated car;-0.017999999225139618;Negative
UCac0cLS685Kh4nIMLf899aw;@kiran4652;Mechanical engineers working in Merchant navy are possibly safe;2024-02-26T13:10:51Z;0;;Mechanical engineers working in Merchant navy are possibly safe;mechanical engineer work merchant navy possibly safe;0.6340000033378601;Positive
UC1cb9clxxHrD6VeTp0llzwA;@Adrians_Lost_and_Found_Visions;"Great, early retirement for everyone! :)<br><br>The sooner the AI and robots take over all of the jobs - the better.<br>Poverty will be solved. Also 40-80% of people don&#39;t like their jobs.<br><br>We all need a few Optimus robots per person and it will be the end of human labor forever.<br>Unless you want to work and create something of course. :)<br><br>The transition period - the next 15 years - that might be tough though.<br>Hope we will find a solution as fast as possible.<br>Deflation in prices of goods and services is one of the best options for starters. Things should be cheaper if humans are not making them.";2024-02-25T21:23:44Z;0;;Great, early retirement for everyone! The sooner the AI and robots take over all the jobs the better. Poverty will be solved. Also, 40 80 of people do not like their jobs. We all need a few Optimum robots per person, and it will be the end of human labor forever. Unless you want to work and create something of course. The transition period the next 15 years that might be tough though. Hope we will find a solution as fast as possible. Deflation in prices of goods and services is one of the best options for starters. Things should be cheaper if humans are not making them.;great early retirement everyone sooner ai robot take job good poverty solve also people not like job need optimum robot person end human labor forever want work create something course transition period next year tough hope find solution fast possible deflation price good service best option starter thing cheap human not make;-0.07199999690055847;Negative
