id;name;text;time;likes;reply;CleanedText;ProcessText;SentimentScore;ActualLabel
UC3CKoUk3ssDQ4mU00hTi41Q;@thaotaylor6669;Yeah and the Government is not acknowledge this, soon things will changes for every companies to safe cost.;2023-12-30T15:06:57Z;1;;Yeah, and the Government is not acknowledged this, soon things will change for every company to safe cost.;yeah government not acknowledge soon thing change company safe cost;-0.5360000133514404;Negative
UCvGfhfbCKV6QbOGEgIqacuA;@BruceWayne15325;"AI replacing jobs is a good thing. We just need to redefine our concept of currency. In the not too distant future (10-50yrs) we will see AI doing most of the work that humans currently do. A lot of jobs will be lost along the way as AI progresses. The ultimate goal with AI though is to help us evolve from a society that has to work for a living, to being a society that is essentially retired from birth, and free to pursue whatever interest we want. The concept of economy won&#39;t disappear, but it needs to be redefined in preparation for this event.";2023-12-28T17:33:26Z;1;;AI replacing jobs is a good thing. We just need to redefine our concept of currency. In the not too distant future 10 50yrs we will see AI doing most of the work that humans currently do. A lot of jobs will be lost along the way as AI progresses. The ultimate goal with AI though is to help us evolve from a society that has to work for a living, to being a society that is essentially retired from birth, and free to pursue whatever interest we want. The concept of economy will not disappear, but it needs to be redefined in preparation for this event.;ai replace job good thing need redefine concept currency not distant future yr see ai work humans currently lot job lose way ai progress ultimate goal ai though help evolve society work living society essentially retire birth free pursue interest want concept economy not disappear need redefine preparation event;0.10100000351667404;Negative
UCrp3vyJntddKB3GsrjK4HXg;@sibastien91;When it comes to the translation of ancient texts in languages that nobody speaks.. If the AI made mistakes or misunderstood nuance.. How would we know???;2023-12-27T13:12:25Z;1;;When it comes to the translation of ancient texts in languages that nobody speaks. If the AI made mistakes or misunderstood nuance. How would we know???;come translation ancient text language nobody speaks ai make mistake misunderstood nuance know;-0.2770000100135803;Negative
UClA1XHdafMTiNmG5Y_BFtEQ;@user-uo7jx6gx2t;"they are dreaming.  there will be millions of people out of work and out of income.  there needs to be a plan for how are these people going to be supported.  It&#39;s the end of capitalism so we need to plan for a replacement economy/social structure.  more like communism with equal distribution of wealth.  or, no wealth at all.";2023-12-17T02:43:50Z;1;;They are dreaming. There will be millions of people out of work and out of income. There needs to be a plan for how are these people going to be supported. It .the end of capitalism. We need to plan for a replacement economy social structure. More like communism with equal distribution of wealth. Or, no wealth at all.;dream million people work income need plan people go support .the end capitalism need plan replacement economy social structure communism equal distribution wealth wealth;-0.3100000023841858;Negative
UC8N4536bnwhNy-8PwgmJvrQ;@gethinhooper3671;Did the AI do the sound on this broadcast?;2023-12-16T18:04:15Z;1;;Did the AI do the sound on this broadcast?;ai sound broadcast;-0.03500000014901161;Negative
UCpctg3WziPkSdbmGwiTho5Q;@DaGamerTom;AI is going to cost jobs Worldwide and create massive unemployment and social dramas at the rate it is developing right now! We need to hit the brakes with this technology.;2023-12-12T16:14:24Z;1;;AI is going to cost jobs Worldwide and create massive unemployment and social dramas at the rate it is developing right now! We need to hit the brakes with this technology.;ai go cost job worldwide create massive unemployment social drama rate develop right need hit brake technology;-0.9020000100135803;Negative
UCatvus0DTqnjOprK8rfbxTA;@Indrid__Cold;Jobs that emphasize skills once deemed essential, such as communication skills, will not be entirely eliminated but will significantly lose value. For instance, MSDOS proficiency was once highly sought after, but the advent of MSWINDOWS rendered it less important. Similarly, the ability to compose a clear and actionable email will soon be regarded as a supplementary skill. Employers globally will likely reduce the value of entire categories of workers by 50% or more. Like skilled factory jobs that used to sustain a family of four, mid-level management and similar positions will face substantial devaluation. Those who become unemployed in the coming years may be startled by the reduced salaries offered in their next jobs. The socioeconomic and political consequences of this shift will be profound.;2023-12-12T15:03:15Z;1;;Jobs that emphasize skills once deemed essential, such as communication skills, will not be entirely eliminated but will significantly lose value. For instance, MS DOS proficiency was once highly sought after, but the advent of WINDOWS rendered it less important. Similarly, the ability to compose a clear and actionable email will soon be regarded as a supplementary skill. Employers globally will likely reduce the value of entire categories of workers by 50 or more. Like skilled factory jobs that used to sustain a family of four, mid level management and similar positions will face substantial devaluation. Those who become unemployed in the coming years may be startled by the reduced salaries offered in their next jobs. The socioeconomic and political consequences of this shift will be profound.;job emphasize skill deem essential communication skill not entirely eliminate significantly lose value instance proficiency highly seek advent window render less important similarly ability compose clear actionable email soon regard supplementary skill employer globally likely reduce value entire category worker skilled factory job use sustain family level management similar position face substantial devaluation become unemployed come year startle reduced salary offer next job socioeconomic political consequence shift profound;-0.5199999809265137;Negative
UCPoi2WO79RcLQ5oVia5Vw5g;@markistheone947;Did they compensate people in the typewriter industry? Or flip phone, or black and white tv, horse carriage conductors and the list goes on. Mic drop.;2023-12-11T12:43:21Z;1;;Did they compensate people in the typewriter industry? Or flip phone, or black and white TV, horse carriage conductors and the list goes on. Mic drop.;compensate people typewriter industry flip phone black white tv horse carriage conductor list go mic drop;-0.1679999977350235;Negative
UCWfKdxSFwRJYxjxhCQT89IA;@EricJohnson-lo7mj;"This report misses a much more important issue.  We currently do not own our data and content hosted by huge platforms such as Google, X, and Facebook.  The owners of these platforms use our personal data, as well as the content that we create, to make billions of dollars for themselves.  Some content creators do manage to leverage some income out of it, but not without the platforms themselves creaming a large percentage off the top.  <br><br>In the AI-powered future, we need to take ownership of our data and content to ensure that we get our just share of revenue produced from it.  We are already seeing rafts of lawsuits from copyright holders of content used to train large language models, and they should sue because huge tech corporations are stealing their livelihoods.  That level of theft is only the tip of the iceberg.  <br><br>If we don&#39;t act now, we consent to living in a dystopian hellscape ruled by data thieves who have stolen enough from us already.  <br><br>I wish us all the best of luck with that.";2023-12-09T19:01:46Z;1;;This report misses a much more important issue. We currently do not own our data and content hosted by huge platforms such as Google, X, and Facebook. The owners of these platforms use our personal data, as well as the content that we create, to make billions of dollars for themselves. Some content creators do manage to leverage some income out of it, but not without the platforms themselves creaming a large percentage off the top. In the AI powered future, we need to take ownership of our data and content to ensure that we get our just share of revenue produced from it. We are already seeing rafts of lawsuit is from copyright holders of content used to train large language models, and they should sue because huge tech corporations are stealing their livelihoods. That level of theft is only the tip of the iceberg. If we do not act now, we consent to living in a dystopian hellscape ruled by data thieves who have stolen enough from us already. I wish us all the best of luck with that.;report miss much important issue currently not data content host huge platform google x facebook owner platform use personal data well content create make billion dollar content creator manage leverage income not platform cream large percentage top ai powered future need take ownership data content ensure get share revenue produce already see raft lawsuit copyright holder content use train large language model sue huge tech corporation steal livelihood level theft tip iceberg not act consent live dystopian hellscape rule data thief steal enough already wish best luck;-0.4410000145435333;Negative
UCNS9sD_kXVeUEFpRphENmqw;@rickyho4305;"By this logic, if you take inspiration from another person&#39;s idea do you share revenue with them? Just like patent infringement, there is a line between what is infringement and what is inspiration. AI models don&#39;t work by copying a person&#39;s data, but only uses it to discover patterns (similar to how you learn things by looking at different things). If you begin monetizing every piece of data that is generated, this will quickly become unmanageable as every AI tool would be stupidly expensive to use as the tool would have to share revenue with almost every individual on the internet.";2023-12-13T09:35:46Z;1;UCWfKdxSFwRJYxjxhCQT89IA;By this logic, if you take inspiration from another person .idea do you share revenue with them? Just like patent infringement, there is a line between what is infringement and what is inspiration. AI models do not work by copying a person .data, but only uses it to discover patterns similar to how you learn things by looking at different things . If you begin monetizing every piece of data that is generated, this will quickly become unmanageable as every AI tool would be stupidly expensive to use as the tool would have to share revenue with almost every individual on the internet.;logic take inspiration person share revenue patent infringement line infringement inspiration ai model not work copy person .data use discover pattern similar learn thing look different thing begin monetize piece data generate quickly become unmanageable ai tool stupidly expensive use tool share revenue almost individual internet;-0.15399999916553497;Negative
UCSPb-aq4xCc_0CUfjGjoJhg;@retrotronics1845;"You can already generate movie scenes less cheap looking than all the &#39;blockbusters&#39; in the cinemas and streaming platforms so there&#39;s that.................";2023-12-08T21:50:25Z;1;;You can already generate movie scenes less cheap looking than all  in the cinemas and streaming platforms. There .that.................;already generate movie scene less cheap look cinema streaming platform .................;0.30300000309944153;Negative
UCMPpG7NmYABH4zCns2ZAn5g;@funkycowie;"It may, but I have been using AI as a tool to assist me for about a year, it&#39;s arduous. It needs so much guidance. I understand the fear and the speed of development is rapid but nothing will replace the human interaction needed.";2023-12-08T07:01:20Z;1;;It may, but I have been using AI as a tool to assist me for about a year, it .arduous. It needs. Much guidance. I understand the fear and the speed of development is rapid, but nothing will replace the human interaction needed.;use ai tool assist year .arduous need much guidance understand fear speed development rapid nothing replace human interaction need;0.12300000339746475;Negative
UCvOlBJdM_8KnWh_uoz57YKQ;@Dreammuncher;Sounds dangerous;2023-12-11T13:04:24Z;1;UCBUCIHuRrWxPOwkh2oO-Hww;Sounds dangerous;sound dangerous;-0.9210000038146973;Negative
UCSZ3PNVXZ849-UxBnluffVA;@dantae666;"As the office worker&#39;s said to all the other professions who lost there jobs. Shame.";2023-12-05T07:14:37Z;1;;As the office worker .said to all the other professions who lost their jobs. Shame.;office worker .said profession lose job shame;-0.699999988079071;Negative
UC29Xbp-LjyPr_6CnmNUIoVA;@aggieraz;"It could only generate extraordinary wealth if the goods and services are utilized at the same rate after automation has take a hold; you assume that some of the services being sold arent already being utilized by those who are about to get laid off; this problem is self limiting and will have a rubber banding effect when the companies adopting the AI cost savings will see a drop in revenue, because those who they used to sell to, used to work for them and are now unable to buy their services. Ofcourse, you can assume that they will increase their prices with hope of recouping the loss in volumetric revenue, but that will only work until the affluent themselves cant pay themselves with the bonuses that they received from the AI based cost cutting. Basically, you are setting the West as a whole up for an eventual  Bastille day.";2023-12-03T16:38:57Z;1;;It could only generate extraordinary wealth if the goods and services are utilized at the our rate after automation has taken a hold you assume that some of the services being sold are not already being utilized by those who are about to get laid off this problem is self limiting and will have a rubber banding effect when the companies adopting the AI cost savings will see a drop in revenue, because those who they used to sell to, used to work for them and are now unable to buy their services. Of course, you can assume that they will increase their prices with hope of recouping the loss in volumetric revenue, but that will only work until the affluent themselves can not pay themselves with the bonuses that they received from the AI based cost cutting. Basically, you are setting the West as a whole up for an eventual Bastille Day.;generate extraordinary wealth good service utilize rate automation take hold assume service sell not already utilize get lay problem self limit rubber band effect company adopt ai cost saving see drop revenue use sell use work unable buy service course assume increase price hope recoup loss volumetric revenue work affluent not pay bonus receive ai base cost cutting basically set west whole eventual bastille day;-0.6489999890327454;Negative
UCtg5XMR-NOrGykfqMOseRLg;@henrytjernlund;Software automation will accelerate in ways mechanical automation never has.;2023-12-07T09:35:43Z;1;UCDWPiOdqQdA3cn-0yveMmZQ;Software automation will accelerate in ways mechanical automation never has.;software automation accelerate way mechanical automation never;0.527999997138977;Positive
UCEAhh4zgKEbmzgnS9M8ehCg;@callumbush1;Bunch of Luddites!;2023-12-03T07:56:58Z;1;;Bunch of Luddites!;bunch luddite;-0.8270000219345093;Negative
UCHZkEXWfbhYit8eahOl6iYw;@lonelylovely1176;Maybe these 2 are ai generated who knows;2023-12-02T05:23:10Z;1;;Maybe these 2 are AI generated who knows;maybe ai generate know;-0.04600000008940697;Negative
UCYdVpyksZsCCnQNPmXgEBNQ;@julianparkinson2178;is the sound engineer on holiday?;2023-12-01T20:17:03Z;1;;Is the sound engineer on holiday?;sound engineer holiday;-0.4560000002384186;Negative
UCM5a_gztGWhQ4qQx3Ov4EwA;@charlesmasquelier6206;The sound on this video is dreadful.;2023-12-01T18:46:56Z;1;;The sound on this video is dreadful.;sound video dreadful;-0.8930000066757202;Negative
UCwWKd_3Ju7ItuATHDVd2rSA;@public.public;The billionaires biggest expense? ... The middle class.;2023-12-01T18:30:49Z;1;;The billionaires biggest expense? ... The middle class.;billionaire big expense middle class;-0.061000000685453415;Negative
UCP_xYiAKfXb29oobdthFl5g;@TomNook.;Someone give Stephanie a microphone;2023-12-01T17:17:55Z;1;;Someone give Stephanie a microphone;someone give stephanie microphone;-0.48500001430511475;Negative
UCBusJXZbUYfQ2_UUR-gipxA;@prashantabdare6479;I think she or someone at BBC forgot to attach mic to her.;2023-12-01T12:57:33Z;1;;I think she or someone at BBC forgot to attach mic to her.;think someone bbc forgot attach mic;-0.8790000081062317;Negative
UCdWONKdCOutMudH3bvFhjXg;@AX-sq5vm;Make money before AI takes over;2023-12-01T06:52:03Z;1;;Make money before AI takes over;make money ai take;-0.0820000022649765;Negative
UCJwG_MMxI4rSTbSgFcHDJAg;@spikehamer2;"Now from a office perspective sometimes we want to help the customer but there are things that are out of our control and said customer gets aggravated, it&#39;s pretty goddamn infuriating too on our end.<br><br>I do wish this kind of line of work do get automated ASAP, call centers are just the bottom of the barrel of jobs.";2023-12-07T17:44:22Z;1;UC7a1LtOMGeLBXelUZ1SwtGw;Now from an office perspective sometimes we want to help the customer, but there are things that are out of our control and said customer gets aggravated, it .pretty goddamn infuriating too on our end. I do wish this kind of line of work do get automated ASAP, call centers are just the bottom of the barrel of jobs.;office perspective sometimes want help customer thing control say customer get aggravate .pretty goddamn infuriate end wish kind line work get automate asap call center bottom barrel job;-0.8579999804496765;Negative
UCsIoqBhDp3lsO02oayRy3aQ;@SundaeExpress;...Just like office jobs threatened factory jobs... and factory jobs threatened craftsman jobs... Get over it, luddites;2023-12-01T06:05:24Z;1;;... Just like office jobs threatened factory jobs... and factory jobs threatened craftsman jobs... Get over it, Luddites;office job threaten factory job factory job threaten craftsman job get luddites;-0.4519999921321869;Negative
UClvzlOaj_s9wb0pQih_TC-g;@PremGill13;Which Companies Want to replace human with AI n Robots why do not replace them with other companies?;2023-12-01T05:32:15Z;1;;Which Companies Want to replace human with AI and Robots why do not replace them with other companies?;company want replace human ai robot not replace company;-0.5540000200271606;Negative
UCd-F7CGcTSnnwyDSGhDv3ow;@chrisstucker1813;"It will replace everyone eventually and will become cheaper to implement over time. Remember that the first computer cost millions to make, had barely any memory and filled up an entire room. Whereas right now have smartphones that are incomparably more powerful, cost a few hundred dollars to manufacture and can fit into your pocket. We managed to achieve of all this with just the human brain, so imagine what we will be able to accomplish with very intelligent AI brains helping us discover cheaper methods to produce powerful robots etc.  It&#39;s scary to think about but hopefully still a few decades away";2023-12-28T20:17:33Z;1;UC0Rh7l3daAPq00I6dUAHwiQ;It will replace everyone eventually and will become cheaper to implement over time. Remember that the first computer cost millions to make, had barely any memory and filled up an entire room. Whereas right now have smartphones that are incomparably more powerful, cost a few hundred dollars to manufacture and can fit into your pocket. We managed to achieve of all this with just the human brain, Imagine what we will be able to accomplish with very intelligent AI brains helping us discover cheaper methods to produce powerful robots etc. It .scary to think about but hopefully still a few decades away;replace everyone eventually become cheap implement time remember first computer cost million make barely memory fill entire room whereas right smartphones incomparably powerful cost dollar manufacture fit pocket manage achieve human brain imagine able accomplish intelligent ai brain help discover cheap method produce powerful robot .scary think hopefully still decade away;0.07800000160932541;Negative
UCrDw1qDozLTLvqc2t9ZpTmQ;@markcynic808;"Newsreader&#39;s will be the first to go.";2023-12-01T03:08:29Z;1;;Newsreader .will be the first to go.;newsreader .will first go;0.08500000089406967;Negative
UC5jymBbGrN6d7tZqX_4B03Q;@myselfandpesit;Will AI replace bbc too?;2023-12-01T02:34:56Z;1;;Will AI replace BBC too?;ai replace bbc;-0.026000000536441803;Negative
UCIN7SfdIq-QrFsARoiQhpjw;@blueguitar4419;But the Nordic countries are not Britain, we have to do it the British way! Austerity!;2023-12-01T01:38:08Z;1;;But the Nordic countries are not Britain, we have to do it the British way! Austerity!;nordic country not britain british way austerity;-0.4519999921321869;Negative
UCfNM2dVsBY9eOdYcA330edw;@knockedoutloaded;This is the BBC so<br>1, Its Trumps fault<br>2, its Elon Musks fault <br>3, its the far rigjts fault <br>4, its Israels fault;2023-11-30T23:26:33Z;1;;This is the BBC. 1, It is Trumps fault 2, it is Elon Musk is fault 3, it is the far rights fault 4, it is Israels fault;bbc trumps fault elon musk fault far right fault israels fault;-0.4259999990463257;Negative
UCUYPNt8Lb9vXSQAx_OCIc6Q;@ninjaweretiger4273;Seems like it.;2023-11-30T22:58:20Z;1;UC6pPTonQbFeRAcL0gNQjB-w;Seems like it.;seem;0.05000000074505806;Negative
UCZz4ZqU9o4OincK37bzwJSA;@khalilherzberg702;"There&#39;s an elegance to the way Amazon&#39;s AMZP33X is being discussed as a potential cornerstone for the next wave of digital transformation across industries.";2023-11-30T22:01:23Z;1;;There .an elegance to the way Amazon .AMZP33X is being discussed as a potential cornerstone for the next wave of digital transformation across industries.;.an elegance way amazon .amzpx discuss potential cornerstone next wave digital transformation industry;0.5019999742507935;Positive
UCswliiedPoMMGlh20knxx7Q;@dileksacmaozu6783;"I&#39;m genuinely curious about the infrastructure powering Amazon&#39;s AMZP33X. It&#39;s as if they&#39;ve constructed an unseen digital architecture that&#39;s about to become central to our existence.";2023-11-30T22:01:23Z;1;;I m genuinely curious about the infrastructure powering Amazon .AMZP33X. It .as if they ve constructed an unseen digital architecture that .about to become central to our existence.;genuinely curious infrastructure power amazon .amzpx .as construct unseen digital architecture .about become central existence;0.1550000011920929;Negative
UCpT9dDlR575ur7WhoaYlL8g;@criseldagalli5079;"The narrative around Amazon&#39;s AMZP33X is not just about the technology itself but about the potential it unlocks for future generations to build upon.";2023-11-30T22:01:23Z;1;;The narrative around Amazon .AMZP33X is not just about the technology it itself but about the potential it unlocks for future generations to build upon.;narrative amazon .amzpx not technology potential unlock future generation build upon;0.4740000069141388;Positive
UCDk5-84NCabCZNA1kLdRZdA;@user-ys3ec7mz3m;"The hype around Amazon&#39;s AMZP33X is reaching fever pitch, and I&#39;m here wondering if we&#39;re witnessing the buildup to a seismic shift in consumer technology.";2023-11-30T22:01:23Z;1;;The hype around Amazon .AMZP33X is reaching fever pitch, and I m here wondering if we re witnessing the buildup to a seismic shift in consumer technology.;hype amazon .amzpx reach fever pitch wonder witness buildup seismic shift consumer technology;0.07100000232458115;Negative
UCqUVFTTB1AAdFG-6k8CmHoA;@elmir480;"You can&#39;t swing a cat in the tech community without hitting news about Amazon&#39;s AMZP33X these days.";2023-11-30T22:01:23Z;1;;You can not swing a cat in the tech community without hitting news about Amazon .AMZP33X these days.;not swing cat tech community hit news amazon day;0.0989999994635582;Negative
UCj-AIT49238rzyCs1t7iKLQ;@abhilashtrogelioferrer6348;"They said Amazon&#39;s AMZP33X could be a milestone in tech history. I guess time will tell.";2023-11-30T22:01:23Z;1;;They said Amazon .AMZP33X could be a milestone in tech history. I guess time will tell.;say amazon .amzpx milestone tech history guess time tell;0.31299999356269836;Negative
UCLC4Iot6oodby94WbQtrffg;@keremakkaya8797;"Came across a think piece on how Amazon&#39;s AMZP33X is set to disrupt the market. Thoughts?";2023-11-30T22:01:23Z;1;;Came across a think piece on how Amazon .AMZP33X is set to disrupt the market. Thoughts?;come think piece amazon .amzpx set disrupt market thought;0.2980000078678131;Negative
UCzd5TVHUVY9Bm8LHi5qNgew;@nerissaohara7430;"The way people talk about Amazon&#39;s AMZP33X, you&#39;d think it&#39;s the second coming of tech Jesus.";2023-11-30T22:01:23Z;1;;The way people talk about Amazon .AMZP33X, you d think it .the second coming of tech Jesus.;way people talk amazon .amzpx think .the second come tech jesus;0.2370000034570694;Negative
UCdy7OdRFa2epAJ7U_scCptg;@mendozaschwebach489;"Can we all just take a moment to appreciate how Amazon&#39;s AMZP33X is flipping the script on modern tech?";2023-11-30T22:01:23Z;1;;Can we all just take a moment to appreciate how Amazon .AMZP33X is flipping the script on modern tech?;take moment appreciate amazon .amzpx flip script modern tech;0.5040000081062317;Positive
UC1uXvti87NJo-pgfaqMJZtw;@yamanerol1247;"I&#39;m all for innovation, but is Amazon&#39;s AMZP33X really the breakthrough they&#39;re making it out to be?";2023-11-30T22:01:23Z;1;;I m all for innovation, but is Amazon .AMZP33X really the breakthrough they re making it out to be?;innovation amazon .amzpx really breakthrough make;0.10400000214576721;Negative
