id;name;text;time;likes;reply;CleanedText;ProcessText;SentimentScore;ActualLabel
UCVqV6iGmou3ZZQ3H5EVeBaA;@8darktraveler8;"This is a major step towards post scarcity, the real losers will be the wealthy elite, as money loses value and services become impossibly cheaper, they lose the status that came with that wealth.  The gaze of society will begin to then look at why, certain families own everything, specifically land and buildings which will be seized by governments to lower rental prices to what the actual overhead has been reduced to.  This kind of progress is unstoppable now, the nations that don&#39;t adapt will empty out as people migrate to countries that do, I&#39;m a hardcore capitalist and a Post-humanist and we&#39;re nearing the time when communism is possible.<br><br>You can&#39;t have functioning communism without a slave class and even then corrupt rulers will destroy their economy by hoarding wealth, when we have AI government administration and AI workers, we will have a better shot at communism.";2023-11-08T10:03:54Z;0;;This is a major step towards post scarcity, the real losers will be the wealthy elite, as money loses value and services become impossibly cheaper, they lose the status that came with that wealth. The gaze of society will begin to then look at why, certain families own everything, specifically land and buildings which will be seized by governments to lower rental prices to what the actual overhead has been reduced to. This kind of progress is unstoppable now, the nations that do not adapt will empty out as people migrate to countries that do, I m a hardcore capitalist and a Post humanist and we re nearing the time when communism is possible. You can not have functioning communism without a slave class and even then corrupt rulers will destroy their economy by hoarding wealth, when we have AI government administration and AI workers, we will have a better shot at communism.;major step towards post scarcity real loser wealthy elite money lose value service become impossibly cheap lose status come wealth gaze society begin look certain family everything specifically land building seize government lower rental price actual overhead reduce kind progress unstoppable nation not adapt empty people migrate country hardcore capitalist post humanist near time communism possible not function communism slave class even corrupt ruler destroy economy hoard wealth ai government administration ai worker good shot communism;-0.6110000014305115;Negative
UCBuObb9TrA88PVfJ_QwaZ-g;@_XY_;Welcome to the machine;2023-11-02T17:18:06Z;0;;Welcome to the machine;welcome machine;0.5979999899864197;Positive
UCr9tL38NTSbJwWYzwpQK7hA;@davidhill8565;AI can make offices obsolete. AI can empty the office floors of the Empire State Building and the Chrysler Building. Some office buildings will be converted into multi-purpose, let alone, apartment buildings.;2023-09-30T15:07:10Z;0;;AI can make offices obsolete. AI can empty the office floors of the Empire State Building and the Chrysler Building. Some office buildings will be converted into multipurpose, let alone, apartment buildings.;ai make office obsolete ai empty office floor empire state building chrysler building office building convert multipurpose let alone apartment building;0.15299999713897705;Negative
UC0XiDgtbFR8ohoGlstuFgGQ;@NikosKatsikanis;you did right chum!;2023-10-24T00:21:37Z;0;UC67ukuqJW-FMig3i6JS69RQ;You did right chum!;right chum;0.9300000071525574;Positive
UCbGqZj672TTDlUV_Fz1pC_A;@FellTheSky;"I just love to see idiots complain about things they don&#39;t understand.";2023-09-22T00:54:47Z;0;;I just love to see idiots complain about things they do not understand.;love see idiots complain thing not understand;-0.7549999952316284;Negative
UCnIqF8VJcWbpLEcvOXpFN1g;@carkawalakhatulistiwa;Yes ubi;2023-08-17T09:51:15Z;0;;Yes FBI;yes fbi;0.0;Negative
UCsa7ufR_GdbBcL8QVEzIdOQ;@NTKM-om9vn;Sweatbacks Unite!!!;2023-08-15T07:08:00Z;0;;Sweat backs Unite!!!;sweat back unite;0.6230000257492065;Positive
UCI7KKA-KLV2K1dmOvho07Hw;@rangarajan9080;AI enthusiasts, how many more unemployment do you wish for?;2023-08-13T16:20:59Z;0;;AI enthusiasts, how many more unemployment do you wish for?;ai enthusiast many unemployment wish;-0.9150000214576721;Negative
UCd1U5jjQqH8Iby1qPf9tMjQ;@ayushgarg8396;if company fires majority of staff due to AI to increase profits. Then who will buy the products and services  if majority humans wont have jobs and money to use the services.;2023-08-13T09:56:15Z;0;;If company fires the majority of staff due to AI to increase profit is. Then who will buy the products and services if majority humans will not have jobs and money to use the services.;company fire majority staff due ai increase profit buy product service majority human not job money use service;-0.7730000019073486;Negative
UC6yZ0ccZeCnaYG3fd2YoRBQ;@AiLatestNews24;Changing the game! This video delves into how AI is already transforming white-collar work. Insightful and thought-provoking.;2023-08-07T12:21:58Z;0;;Changing the game! This video delves into how AI is already transforming white collar work. Insightful and thought provoking.;change game video delve ai already transform white collar work insightful think provoking;0.3100000023841858;Negative
UCyuo-N7KQRFDY_pmMw73sdg;@Pontiakos;A revolution is coming.;2023-07-31T21:13:48Z;0;;A revolution is coming.;revolution come;0.6439999938011169;Positive
UCePGbrvCCya6iCwUlec4ERw;@Chrisfeb68;People are going overboard with AI.  People use the same arguments and computers started becoming more prevalent.;2023-07-29T16:45:30Z;0;;People are going overboard with AI. People use the our arguments and computers started becoming more prevalent.;people go ai people use argument computer start become prevalent;-0.35100001096725464;Negative
UCo5yOH5o6DIz-c26WFQeyFA;@terranowa2080;We are only thousand years away from AI dangers;2023-07-29T15:32:54Z;0;;We are only thousand years away from AI dangers;year away ai danger;-0.8700000047683716;Negative
UCXxbKBT22ReQVjKaGl19jGg;@Mrhellslayerz;"@@Ilovejoebidenforever Benefiting society &#39;till doing that no longer benefits you then? Gotcha.";2023-08-25T14:16:01Z;0;UC-_eZ4uYbS7yE0NXKSkWK1A;Benefiting society till doing that no longer benefit is you then? Gotcha.;benefit society till long benefit gotcha;-0.1420000046491623;Negative
UCPtu1AvHHMlXqlgHG8n0jEA;@Eseibio__;IBM is morally incorrect;2023-07-25T06:39:56Z;0;;IBM is morally incorrect;ibm morally incorrect;-0.9200000166893005;Negative
