id;name;text;time;likes;reply;CleanedText;ProcessText;SentimentScore;ActualLabel
UCskdkRH8pza-YcZWFDiul5Q;@TonyRodriguez-Trod312;Jon you are right and making a joke out will help us digest it better Thank you;2024-04-26T15:01:25Z;0;;Jon you are right and making a joke out will help us digest it better Thank you;jon right make joke help digest good thank;0.9070000052452087;Positive
UCl7yNxX-zaMFtBi3rUWpxpQ;@uk7769;mmm yeah, those empty promises of greedy corporations. those new jobs never come.;2024-04-26T11:12:57Z;0;;Mmm yeah, those empty promises of greedy corporations. Those new jobs never come.;mmm yeah empty promise greedy corporation new job never come;-0.9259999990463257;Negative
UCX9vJ2nmhSQOd-Fqxmog9_g;@inertiaforce7846;"He&#39;s baaaaaaaaaack";2024-04-30T13:55:34Z;0;UCXDXr0Y9pKAfSci8S241kGg;He .baaaaaaaaaack;;-0.36800000071525574;Negative
UC1JDQL7PUAHJ2Z9h76TIMcA;@game_jinx;🎉🎉🎉🎉🎉;2024-04-25T23:08:01Z;0;;;;0.0;Negative
UCQR_AAmmQ_hitcIMlT-vgrA;@blazingfuryoffire1;Given the state of the entertainment industry, yeah, AI is a massive improvement in life for me.;2024-04-25T16:31:46Z;0;;Given the state of the entertainment industry, yeah, AI is a massive improvement in life for me.;give state entertainment industry massive improvement life;0.8939999938011169;Positive
UCchSnxzf2OziJworTesOEYQ;@plumpus1634;That sounds... hot;2024-05-03T04:09:20Z;0;UCYQLwYZuwZ2Fk1lObkopQqw;That sounds... hot;sound hot;0.2540000081062317;Negative
UCx9ByuL-yaCXhXb7Y6RvQHg;@TonyMontana33452;"Anyone seen the famous McDonald&#39;s scene in the Michael Douglas movie &quot;Falling Down&quot;??? <br>So why shouldn&#39;t people be replaced by AI when most have no compassion or common sense because they don&#39;t want to do the job in the first place?????";2024-04-24T21:05:38Z;0;;Anyone seen the famous McDonald .scene in the Michael Douglas movie Falling Down ??? So why shouldn't people be replaced by AI when most have no compassion or common sense because they do not want to do the job in the first place?????;anyone see famous mcdonald .scene michael douglas movie fall n't people replace ai compassion common sense not want job first place;-0.3100000023841858;Negative
UC6j6Vf4Ljw3D-8QsXEsM5Pw;@adamjmartinez1349;Way to cut through the bull!;2024-04-24T16:00:53Z;0;;Way to cut through the bull!;way cut bull;0.3630000054836273;Negative
UC_HQLB4O5HsMC2MMU-NF1QA;@christophererickson8663;Back in the 80s-90s they were making movies where AI took over the world, killing off all humanity, and now we’re inviting it into our homes;2024-04-24T15:24:30Z;0;;Back in the 80s 90s they were making movies where AI took over the world, killing off all humanity, and now we are inviting it into our homes;back .. make movie ai take world kill humanity invite home;-0.8080000281333923;Negative
UC8QMY5fWyqXy9YtcMvt3LeA;@TriggaTreDay;Oh it’s just a new way for them to hide all of those Indian workers they have been wanting to hire for so long but our government told them they had to employ more Americans. And for years I have found it quite interesting how so many of the big tech companies are taking on all Indian CEOs 🤔🤔. Asia as a whole controls big tech. And no one is paying attention to that fact. 😂. Don’t say I didn’t tell you.;2024-04-24T15:07:53Z;0;;Oh, it .just a new way for them to hide all of those Indian workers they have been wanting to hire for. Long but our government told them they had to employ more Americans. And for years I have found it quite interesting how. Many of the big tech companies are taking on all Indian CEOs . Asia as a whole controls big tech. And no one is paying attention to that fact. . do not say I did not tell you.;.just new way hide indian worker want hire long government tell employ american year find quite interesting many big tech company take indian ceo asia whole control big tech one pay attention fact not say not tell;-0.27300000190734863;Negative
UCVX7Ou9w_fQvnvOzWk16pqg;@TableForOne1976;It is disturbing because of what it reflects about the mindset of his supporters, and by sharing it, he is encouraging that mindset. See January 6th for details.;2024-04-24T10:12:58Z;0;;It is disturbing because of what it reflects about the mindset of his supporters, and by sharing it, he is encouraging that mindset. See January 6th for details.;disturb reflect mindset supporter share encourage mindset see january th detail;-0.44200000166893005;Negative
UCbB4apQpME2ok5gyUqLQzOQ;@anselmenator;clearly, we need to replace investors and executives with AI, and stop paying them entirely across all industries.;2024-04-24T01:02:57Z;0;;Clearly, we need to replace investors and executives with AI, and stop paying them entirely across all industries.;clearly need replace investor executive ai stop pay entirely industry;-0.5139999985694885;Negative
UC2ubqhuZBmekuq0IyGirXcw;@arthurkeech;Ai image generation and content generation are not remotely the same thing;2024-04-23T23:00:46Z;0;;Ai image generation and content generation are not remotely the our thing;ai image generation content generation not remotely thing;-0.6579999923706055;Negative
UCQFCMkmbiyH-S6wTNRMj4rQ;@leemorgan4773;"prompt engineer is VCs telling on themselves - literally someone that can trick the dumbest most overpriced algorithm you&#39;ve ever seen into spitting out something coherent. instead of asking a real person a straight question, the corporations will pay that person half as much to answer the same question, but defend the demotion because AI is doing most of the work (when, if anything, it&#39;s just in the way).";2024-04-23T17:14:14Z;0;;Prompt engineer is VCs telling on themselves literally someone that can trick the dumbest most overpriced algorithm you ve ever seen into spitting out something coherent. Instead of asking a real person a straight question, the corporations will pay that person half as much to answer the our question, but defend the demotion because AI is doing most of the work when, if anything, it .just in the way .;prompt engineer vcs tell literally someone trick dumb overpriced algorithm ever see spit something coherent instead ask real person straight question corporation pay person half much answer question defend demotion ai work anything .just way;-0.8450000286102295;Negative
UCsMCOaZPeW3l3ibnqFYv09Q;@Digital24xPT;"Thing is, they will build whatever brings them the biggest amount of money, which are the biggest companies in the world.<br>In the end of the day, OpenAI &amp; friends will build whatever they are asked to build by the big guys.<br>And neither I or any of the people commenting here would do otherwise.<br>Yes, it&#39;s sad, but well, that&#39;s how we humans are.<br>I mean, we still have wars after how many centuries? Or should I say, millenials?";2024-04-23T16:03:12Z;0;;Thing is, they will build whatever brings them the biggest amount of money, which are the biggest companies in the world. In the end of the day, OpenAI friends will build whatever they are asked to build by the big guys. And neither I nor any of the people commenting here would do otherwise. Yes, it .sad, but well, that .how we humans are. I mean, we still have wars after how many centuries? Or should I say, millennials?;thing build bring big amount money big company world end day openai friend build ask build big guy people comment otherwise .sad well .how human mean still war many century say millennials;-0.35600000619888306;Negative
UCB_HviHxE0-sXElPNDEHBCA;@AshurbanipalSonofAshurhaddon;With Humans out of the economical loop, to whom will these companies sell their products? Furthermore, do they really think people will just cross their arms peacefully while being pushed aside and thrown into indigence?;2024-04-23T14:18:02Z;0;;With Humans out of the economical loop, to whom will these companies sell their products? Furthermore, do they really think people will just cross their arms peacefully while being pushed aside and thrown into indigence?;human economical loop company sell product furthermore really think people cross arm peacefully push aside throw indigence;-0.9409999847412109;Negative
UC4Qj9ffuWHXMyMQsBG7MmbA;@karlklein2263;My biggest tinfoil hat theory is that the birth crisis is actually engineered to accommodate the need for a smaller workforce.;2024-04-23T11:34:55Z;0;;My biggest tinfoil hat theory is that the birth crisis is actually engineered to accommodate the need for a smaller workforce.;big tinfoil hat theory birth crisis actually engineer accommodate need small workforce;-0.8730000257492065;Negative
UCEoRhXsXfLIlfPpPI2CImiQ;@lemmontree1;The Matrix is coming.;2024-04-23T10:31:56Z;0;;The Matrix is coming.;matrix come;0.10100000351667404;Negative
UCMID5gP2Eks4XNDSqyij2vw;@davids2cents594;a.i will collapse the economy . no one will have money to pay bills buy food and spend money at stores;2024-04-23T09:02:55Z;0;;a.I will collapse the economy. No one will have money to pay bills buy food and spend money at stores;a.i collapse economy one money pay bill buy food spend money store;-0.7910000085830688;Negative
UC4LarHg3fA3bpRmm88iZCcQ;@Hector-ng2gn;Jon is the best. Love his comedy!;2024-04-23T08:31:24Z;0;;Jon is the best. Love his comedy!;jon best love comedy;0.9350000023841858;Positive
UCUIWerqxivZosx48wS7UP_A;@davidandrews5262;"Those ludites don&#39;t seem sonwrong after all.";2024-04-23T08:27:25Z;0;;Those Luddites do not seem son wrong after all.;luddite not seem son wrong;-0.4020000100135803;Negative
UCUIWerqxivZosx48wS7UP_A;@davidandrews5262;Move over chemistry. We have A.I. lol 😅 okay;2024-04-23T08:16:36Z;0;;Move over chemistry. We have A.I. laugh out loud okay;move chemistry a.i loud okay;0.3449999988079071;Negative
UCd3tzdFeV3vIipSdy4InmxQ;@InitialRelic593;what...! I cant wait for main media to be gotten rid off!;2024-04-23T05:55:51Z;0;;What...! I can not wait for main media to be gotten rid of!;not wait main medium get rid;-0.5210000276565552;Negative
UCLgNiWzmvbeT-XWuOkUIp9A;@Abbigirl316;AI is gonna make our lives better?! They said that about computers. Fool us once...;2024-04-23T00:23:44Z;0;;AI is going to make our lives better?! They said that about computers. Fool us once...;ai go make life well say computer fool;-0.3179999887943268;Negative
UCxOZUFGj75E4kog1virUvaQ;@jbridge7962;Thank you John, you have been missed;2024-04-22T20:35:22Z;0;;Thank you, John, you have been missed;thank john miss;0.6470000147819519;Positive
UC82wLFUHGS5DqK_fLDCO0gg;@deadpiratehead;"Didn&#39;t anyone else ever see the movie THE Terminator??";2024-04-22T19:31:22Z;0;;Didn't anyone else ever see the movie THE Terminator??;n't anyone else ever see movie terminator;-0.06499999761581421;Negative
UCE7mqcJeVMekp6BPoSv0dog;@belverkungol;"Wait! Are you saying I wouldn&#39;t have to work in an underpaid meaningless job, and I could instead focus on what is actually important to me? That sounds awful.";2024-04-22T17:27:31Z;0;;Wait! Are you saying I would not have to work in an underpaid meaningless job, and I could instead focus on what is actually important to me? That sounds awful.;wait say not work underpaid meaningless job instead focus actually important sound awful;-0.28600001335144043;Negative
UCOGcKFPZHIHm8ZRvcpFwTWg;@skiptoacceptancemdarlin;“Hey Jon, watch this.”<br>-a.i.;2024-04-22T14:09:59Z;0;;Hey Jon, watch this. a.i.;hey jon watch a.i;0.0560000017285347;Negative
UCnt4uoPjFUt9eSFNXq9MNtg;@rontarrant;"LOL! You tell &#39;em, Jon.";2024-04-22T13:36:42Z;0;;LOL! You tell em, Jon.;lol tell em jon;0.4339999854564667;Negative
UCheGHn3jWP8d2X7i2bJFCgw;@Shwammi;"I thought Jon Stewart was boring, uninspirational and trite 20 years ago.  Pandering to low common denominators, basically.    I&#39;m sad to see that he is still a shallow husk that is trotted out from time to time.  I expected more from him on this topic.    I will watch another recent piece by him on Iran, Israel &amp; Trump&#39;s hush money...   I sure hope he nails that..  that&#39;s a politics and events set of topics rather than radical conceptualizing of tech.  Perhaps he has developed or progressed with regards to politics and events beyond where he was so long ago.  I&#39;m not hopeful, but I&#39;ll give it chance.   Perhaps truly conceiving of A.I. just isn&#39;t his cup of tea.   The promise is so much more.  The threat is so much more.   It&#39;s truly existential.  The simplicity of Jobs has almost nothing to do with it.";2024-04-22T06:12:32Z;0;;I thought Jon Stewart was boring, inspirational and trite 20 years ago. Pandering to low common denominators, basically. I m sad to see that he is still a shallow husk that is trotted out from time to time. I expected more from him on this topic. Furthermore, I will watch another recent piece by him on Iran, Israel Trump .hush money... I sure hope he nails that. That .a politics and events set of topics rather than radical  of tech. Perhaps he has developed or progressed in regard to politics and events beyond where he was. Long ago. I m not hopeful, but I ll give it chance. Perhaps truly conceiving of A.I. just is not his cup of tea. The promise is. Much more. The threat is. Much more. It .truly existential. The simplicity of Jobs has almost nothing to do with it.;think jon stewart boring inspirational trite year ago pander low common denominator basically sad see still shallow husk trot time time expect topic furthermore watch recent piece iran israel trump .hush money sure hope nail .a politics event set topic rather radical tech perhaps develop progress regard politics event long ago not hopeful give chance perhaps truly conceive a.i not cup tea promise much threat much .truly existential simplicity job almost nothing;-0.1469999998807907;Negative
UC3YWnxaXMRLvzb_F064_TAw;@StephenWilliams-hi4ke;"I&#39;m not really worried about AI because the computer is only as smart as the person programming it. Trash in out.";2024-04-22T04:27:55Z;0;;I m not really worried about AI because the computer is only as smart as the person programming it. Trash in out.;not really worried ai computer smart person program trash;-0.052000001072883606;Negative
UCKugtbw2lfJqisNWhknNRNQ;@q-tuber7034;“Fetch me some lithium and cadmium”;2024-04-22T04:02:30Z;0;;Fetch me some lithium and cadmium;fetch lithium cadmium;-0.017999999225139618;Negative
UCWbB9jS7JokIHkDAzvUzEBQ;@rajeevdsamuel;"AI is a big scam - just watch this latest incarnation crash and burn and all these &quot;AI founders&quot; will be in jail in a few years.";2024-04-22T03:55:47Z;0;;AI is a big scam just watch this latest incarnation crash and burn and all these AI founders will be in jail in a few years.;ai big scam watch late incarnation crash burn ai founder jail year;-0.9520000219345093;Negative
UCWdCCJoBIk6ejnRRcM6SwPg;@Beezy_Crypto;Trump would feel comfortable in a black neighborhood John, because black folks are leaving the Democrat plantation in droves.;2024-04-22T01:48:24Z;0;;Trump would feel comfortable in a black neighborhood John, because black folks are leaving the Democrat plantation in droves.;trump feel comfortable black neighborhood john black folk leave democrat plantation drove;-0.8709999918937683;Negative
UC3q4V2xLuAsZLLwTqQcMugQ;@Avalonanon;labor jobs are safe its the engineers that are gonna have a tough time. If anything this is empowering labourers and taking away from those that have specialized skills, such as engineers;2024-04-21T23:59:18Z;0;;Labor jobs are safe it is the engineers that are going to have a tough time. If anything this is empowering laborers and taking away from those that have specialized skills, such as engineers;labor job safe engineer go tough time anything empower laborer take away specialize skill engineer;-0.6589999794960022;Negative
UCQpcpw0QvH1Urtz1aJnL4Bw;@dogit1840;Even if they replace the human with AI to create products and services who the truck are they going to sell them to if we are all out of a job? 💥💥🥃;2024-04-21T19:22:48Z;0;;Even if they replace the human with AI to create products and services who the truck are they going to sell them to if we are all out of a job?;even replace human ai create product service truck go sell job;-0.8299999833106995;Negative
UCbBQv_T1SkKDKSYQXHlQn1g;@Deathhead6;MEME WARS 😈👻;2024-04-21T15:10:26Z;0;;MEME WARS;meme war;-0.18700000643730164;Negative
UC83yRvVP439AmeT0Ke0piHQ;@user-vt9jd4tc5h;Presidents are picked at Bohemian Grove;2024-04-20T14:14:21Z;0;;Presidents are picked at Bohemian Grove;president pick bohemian grove;0.0020000000949949026;Negative
UCMTP8mZmgTEZ2ImR2v2r6yg;@timothylamer5537;@@AlexW1495 Why would they have half the clientele if prices are lower? The lower prices would bring in more people.;2024-04-22T16:43:39Z;0;UCMTP8mZmgTEZ2ImR2v2r6yg;Why would they have half the clientele if prices are lower? The lower prices would bring in more people.;clientele price low low price bring people;-0.023000000044703484;Negative
UC83yRvVP439AmeT0Ke0piHQ;@user-vt9jd4tc5h;AI AntiChrist International ,UN United Nicolaitans;2024-04-20T14:11:10Z;0;;AI Antichrist International, UN United Nicolai tans;ai antichrist international un united nicolai tan;-0.3610000014305115;Negative
UCULfHhqw4pGNHn0AhWuAloA;@hansmeyer1991;What is the solution here? Stop investing in AI? Not happening.;2024-04-20T14:01:38Z;0;;What is the solution here? Stop investing in AI? Not happening.;solution stop investing ai not happen;-0.4790000021457672;Negative
UCPJzM3X8LvXule8Yn-Gm6kw;@wealthychef;"JS is so talented.  Very funny when he&#39;s not being partisan, which is never funny.";2024-04-20T11:02:16Z;0;;JS is. Talented. Very funny when he .not being partisan, which is never funny.;j talented funny .not partisan never funny;0.24500000476837158;Negative
UCTcZ9UaqSAJb0ejnTooY-QQ;@dixztube;They are so silly;2024-04-20T06:20:51Z;0;;They are. Silly;silly;-0.28600001335144043;Negative
UCVFTHBHkX3VMmY46oqLQFKQ;@donaldkillian9864;Should have voted for Andrew Yang !😢;2024-04-20T04:05:03Z;0;;Should have voted for Andrew Yang !;vote andrew yang;0.19699999690055847;Negative
UCG1bsGYgYf0T92jibRHC3zg;@danwalker4064;Excellent;2024-04-20T01:07:17Z;0;;Excellent;excellent;0.9449999928474426;Positive
UCmzQTG4UGrDq23ITcJbPdCw;@TrueKoalaKnight;Yeah, my fiancee had her ceo walk into her department and ask them to come up with ideas to add so to her department.;2024-04-19T21:24:46Z;0;;Yeah, my fiancée had her CEO walk into her department and ask them to come up with ideas to add. To her department.;yeah fiancée ceo walk department ask come idea add department;0.06300000101327896;Negative
UCl7Hmpc2aQPGbW5lRPB7-IQ;@lauravillanueva2175;Id marry you Jon. <br>Easily.<br>You keep me laughing despite the Fates.” LEv ❤🎉😂;2024-04-19T21:18:15Z;0;;I would marry you Jon. Easily. You keep me laughing despite the Fates. LEV;marry jon easily keep laugh fate lev;0.5440000295639038;Positive
UCORvoZn-qOwKGXD5BwkG0EQ;@anthonyhyde7325;Anybody else’s AI spring to life when Jon asked seri a question?;2024-04-19T17:38:05Z;0;;Anybody else.AI spring to life when Jon asked semi a question?;anybody else.ai spring life jon ask question;-0.05900000035762787;Negative
UCFBGMWFAiFQpbSk1xP3NlVg;@kkinva68;wow;2024-04-19T15:35:39Z;0;;wow;wow;0.9430000185966492;Positive
UCu9vusybfRDMJgsOskMTLWw;@princeking1562;"It&#39;s an irrational fear😂";2024-04-19T12:16:12Z;0;;It .an irrational fear;.an irrational fear;-0.32899999618530273;Negative
UCjGiR9eDEUKYXlA4zmCBxlg;@ripplecutter233;"I really am thankful for AI. I&#39;m so happy that I&#39;m able to starve to death now that there are no jobs ror me to do!";2024-04-19T11:48:58Z;0;;I really am thankful for AI. I m. Happy that I m able to starve to death now that there are no jobs ROR me to do!;really thankful ai m. happy able starve death job ror;0.11299999803304672;Negative
UCi_V0AVlRHtPgV18U9AQ5Ng;@FatimahSadiq-nh5ue;Can you recommend a guide for me?;2024-04-19T09:16:20Z;0;UCBFicZgnr3xc-n1dCq2CebQ;Can you recommend a guide for me?;recommend guide;0.019999999552965164;Negative
UCfip1Nbvfz-TmQZFGyoNa8w;@PorrunSigurd;"Haven&#39;t you heard of Expert Chrissy Barymoer ?He gives excellent guide on the right stock with high dividend";2024-04-19T09:16:51Z;0;UCBFicZgnr3xc-n1dCq2CebQ;Haven't you heard of Expert Chrissy Barrymore ? He gives excellent guide on the right stock with high dividend;n't hear expert chrissy barrymore give excellent guide right stock high dividend;0.4729999899864197;Positive
UCyTFN6haNLTYOaAYMmb4EDg;@psychedelicspiderproductio201;"So thanks to AI, we&#39;ll all have plenty of time to do things make music or visual art. Oh, wait... These companies are already starting to use AI to remove the human element from that too.";2024-04-19T08:13:27Z;0;;So thanks to AI, we ll all have plenty of time to do things make music or visual art. Oh, wait... These companies are already starting to use AI to remove the human element from that too.;thanks ai plenty time thing make music visual art wait company already start use ai remove human element;0.3179999887943268;Negative
UCjdWNE_M47WPBHD41L0Ut7A;@RD-py9sv;I do so love Jon Stewart.;2024-04-19T06:55:13Z;0;;I do. Love Jon Stewart.;love jon stewart;0.4779999852180481;Positive
UCWq16uiWEnZR73LGq22X2GA;@maudiojunky;"Replacing labor is great, but our society isn&#39;t set up in a way to do it properly. In our current system, if labor is devalued then humans become devalued. As technology continues to improve productivity and replace manual labor, we need to rethink what we consider a fair and egalitarian society.";2024-04-19T03:26:02Z;0;;Replacing labor is great, but our society is not set up in a way to do it properly. In our current system, if labor is devalued then humans become devalued. As technology continues to improve productivity and replace manual labor, we need to rethink what we consider a fair and egalitarian society.;replace labor great society not set way properly current system labor devalue humans become devalued technology continue improve productivity replace manual labor need rethink consider fair egalitarian society;-0.5289999842643738;Negative
UC8EqGGhEFkRAeU5kjfa2PZw;@himurahaibara1459;"If AI replacing humans it&#39;s gonna increase unemployment, no? Why is more unemployment the dream? How the government gonna keep that much unemployed people alive and well?";2024-04-19T01:54:29Z;0;;If AI replacing humans it .going to increase unemployment, no? Why is more unemployment the dream? How the government going to keep that much unemployed people alive and well?;ai replace human .going increase unemployment unemployment dream government go keep much unemployed people alive well;-0.5540000200271606;Negative
UCvCOwxaDSrYjkf5ga5ab0ag;@guillermozalles9303;Who will buy the products, with no jobs?;2024-04-19T01:17:38Z;0;;Who will buy the products, with no jobs?;buy product job;-0.828000009059906;Negative
UCGIyAKO-Q7fTMsGi0uXPrzQ;@NotAvailable_na;😆 That was great. 👍;2024-04-19T00:24:39Z;0;;That was great.;great;0.9269999861717224;Positive
UCBa1XAQjTehfj6m5QKWj8Pg;@jamesdelcol3701;"With AI I can look up the manufacturer&#39;s manual to any tool or piece of equipment. Within a few questions and reading about the equipment I can troubleshoot anything. If my fire alarm is being hooked up, the AI will monitor the progress of the job and inform me. We&#39;ll get better quality because of AI. It will measure and remeasure with drone land surveying technology. You&#39;ll have perfect buildings with no errors.";2024-04-19T00:03:48Z;0;;With AI, I can look up the manufacturer .manual to any tool or piece of equipment. Within a few questions and reading about the equipment I can troubleshoot anything. If my fire alarm is being hooked up, the AI will monitor the progress of the job and inform me. We ll get better quality because of AI. It will measure and remeasure with drone land surveying technology. You ll have perfect buildings with no errors.;ai look manufacturer .manual tool piece equipment question read equipment troubleshoot anything fire alarm hook ai monitor progress job inform get good quality ai measure remeasure drone land survey technology perfect building error;0.6710000038146973;Positive
UC0PaoSxEK2nEmO-Mtk2vGWA;@PlagueOfGripes;Wow! The economy will be so driven by automation, most of the money will be able to be refunded as UBI to the everyday person to fund innovations! Right...?;2024-04-18T23:57:23Z;0;;Wow! The economy will be. Driven by automation, most of the money will be able to be refunded as FBI to the everyday person to fund innovations! Right...?;wow economy drive automation money able refund fbi everyday person fund innovation right;0.4830000102519989;Positive
UC_qFEzh7XI4X4tMNCQBS9ag;@GL-zv8qx;You mean, companies saving money with automation, willingly giving that extra profit to governments to fund ABI? I hope you are being sarcastic.;2024-04-20T03:21:37Z;0;UC0PaoSxEK2nEmO-Mtk2vGWA;You mean, companies saving money with automation, willingly giving that extra profit to governments to fund ABI? I hope you are being sarcastic.;mean company save money automation willingly give extra profit government fund abi hope sarcastic;-0.6589999794960022;Negative
UCpsnX4SCVKZ5KLvcxegaipw;@StGCfiLife;Cure climate change? hahahahaha...when will we glorify REAL intelligence than this artificial version of the real thing.  Humanity is under the spell of feudalist wannabes.;2024-04-18T23:22:39Z;0;;Cure climate change? Hahahahaha...when will we glorify REAL intelligence than this artificial version of the real thing. Humanity is under the spell of feudalism wannabes.;cure climate change hahahahaha glorify real intelligence artificial version real thing humanity spell feudalism wannabe;-0.28600001335144043;Negative
UCGRoqm72BDC7znegEQI3P4A;@arigoldstein939;"So a boomer doesn&#39;t understand AI. SHOCKING!";2024-04-18T22:28:51Z;0;;So a boomer does not understand AI. SHOCKING!;boomer not understand ai shocking;-0.6240000128746033;Negative
