id;name;text;time;likes;reply;CleanedText;ProcessText;SentimentScore;ActualLabel
UCFnFkACmTwUQ7Rkysn_Vsrg;@justinbrooks326;All im getting from this is that every human will be replaced once AI reaches its ultimate. Simply put no human will be able to out do AI. Thats the fundamental problem that will result in the extinction of humanity. We as humans do not know when to leave something alone. Greed, curiosity, and never being satisfied will be the demise of us all.;2024-02-26T01:32:15Z;1;;All I am getting from this is that every human will be replaced once AI reaches it is ultimate. Simply put no human will be able to out do AI. That is the fundamental problem that will result in the extinction of humanity. We as humans do not know when to leave something alone. Greed, curiosity, and never being satisfied will be the demise of us all.;get human replace ai reach ultimate simply put human able ai fundamental problem result extinction humanity human not know leave something alone greed curiosity never satisfy demise;-0.5320000052452087;Negative
UCK3N_buGMJz7T7wRWwW9N5Q;@yerneroneroipas8668;1.5 million people still use aol, its me😂;2024-02-15T23:24:44Z;1;;1.5 million people still use AOL, it is me;people still use aol;0.13600000739097595;Negative
UC9X5QpvsNRd8jotB2m5HOPA;@arpadlabadi5585;in 2 years you will prompt your phone vaguely that you will see a film about that and that, that style, that genre, that lenght, and it will realtime render it for you while you commute on the train to your already not existing job. Then you really have to find what the meaning of life is.;2024-02-11T12:26:02Z;1;;In 2 years you will prompt your phone vaguely that you will see a film about that and that, that style, that genre, that length, and it will real time render it for you while you commute on the train to your already not existing job. Then you really have to find what the meaning of life is.;year prompt phone vaguely see film style genre length real time render commute train already not exist job really find meaning life;-0.08900000154972076;Negative
UCesze4poO7MRZWbdhhWXOJA;@aguguwin;Autism isnt something that needs to be cured.;2024-02-10T06:01:36Z;1;;Autism is not something that needs to be cured.;autism not something need cure;-0.0820000022649765;Negative
UCcKlAkP1kMKysTVbcR025xQ;@TaiLivnat;"It&#39;s funny how as hard as they tried to stick to the &quot;cool&quot; side of things in the second half, the conversation always just ended up coming back to all the complex existential threats we face from this technology.";2024-02-09T19:28:29Z;1;;It .funny how as hard as they tried to stick to the cool side of things in the second half, the conversation always just ended up coming back to all the complex existential threats we face from this technology.;.funny hard try stick cool side thing second half conversation always end come back complex existential threat face technology;-0.23899999260902405;Negative
UCrDwYjvn624--A4TFuBmc9Q;@nosferadu;AI would never have come up with Salad Fingers :) however, most human-made art is also derivative;2024-02-29T08:12:33Z;1;UCaGev0JRG7Dp5c_R4ROADLw;AI would never have come up with Salad Fingers however, most human made art is also derivative;ai never come salad finger however human make art also derivative;-0.14100000262260437;Negative
UCS4SIxmiJDQ2ZtFoAOxTgqw;@Johnnyboyvargas;Lets Build Super Smart Cities. The layout as currently is a economical death trap.;2024-01-21T18:33:58Z;1;;Let is Build Super Smart Cities. The layout as currently is an economical death trap.;let build super smart city layout currently economical death trap;-0.020999999716877937;Negative
UCbtj8xdL2kAFA9dqaOfQhKg;@LauraMonk9;First crush being an AI and 27% of men not having a sexual partner by age 30…. Reminds me of the movie “Her”.;2024-01-19T08:06:37Z;1;;First crush being an AI and 27 of men not having a sexual partner by age 30. Reminds me of the movie Her.;first crush ai men not sexual partner age remind movie;-0.06800000369548798;Negative
UC5O_tKF1rBstZ6QvcvktsyQ;@Anayadidit;"These people had such horrible experiences with people that they choose to use computers to feed their deepest desire apposed to having healthy human connections &amp; communicating their needs";2024-01-17T23:11:02Z;1;;These people had such horrible experiences with people that they choose to use computers to feed their deepest desire apposed to having healthy human connections communicating their needs;people horrible experience people choose use computer fee deep desire appose healthy human connection communicate need;-0.9020000100135803;Negative
UC5O_tKF1rBstZ6QvcvktsyQ;@Anayadidit;This is disgusting. Humanity is too smart for their own good. What’s so wrong with enjoying right now and being satisfied with what you have. These people are too greedy. All this to speed up time and money. I dont see AI as valuable. It’s a disruption to humanity and our natural minds. There’s no need to race. This is insane. I’m slowing down every thought intentionally. I won’t accept this.;2024-01-17T22:58:52Z;1;;This is disgusting. Humanity is too smart for their own good. What . Wrong with enjoying right now and being satisfied with what you have. These people are too greedy. All this to speed up time and money. I do not see AI as valuable. It.a disruption to humanity and our natural minds. There .no need to race. This is insane. I am slowing down every thought intentionally. I will not accept this.;disgust humanity smart good wrong enjoy right satisfy people greedy speed time money not see ai valuable it.a disruption humanity natural mind .no need race insane slow thought intentionally not accept;-0.25699999928474426;Negative
UCx8gMZaZ_u4pxLoDpe8m_nQ;@instyfindgamer1939;"That&#39;s why even when I was the popular person. I always hung out with the geeks in the nerds. I love them and they love me. He&#39;s saying basically. We&#39;re all fucked in a nice way if we don&#39;t do the right thing";2024-01-17T19:23:03Z;1;;That .why even when I was the popular person. I always hung out with the geeks in the nerds. I love them and they love me. He .saying basically. We re all fucked nicely if we do not do the right thing;.why even popular person always hang geek nerd love love .saying basically fuck nicely not right thing;-0.020999999716877937;Negative
UCX5FGMqzuqITLbroulWoNvQ;@jonny4866;Get ahead of what!!!! no one is gonna have a job…;2024-01-17T09:10:04Z;1;;Get ahead of what!!!! No one is going to have a job;get ahead one go job;-0.7049999833106995;Negative
UCEXF5Vl13eG6jNQ6Fdi9PvA;@synesthesiafilms;So you have the capability to believe, which is basically the ability to lie to yourself. Calling us the stupid ones. Interesting. @@vendacious;2024-03-03T21:00:48Z;1;UC_5JZ3gZ062Hybr9sp4gxTQ;So you have the capability to believe, which is basically the ability to lie to yourself. Calling us the stupid ones. Interesting.;capability believe basically ability lie call stupid one interesting;-0.13600000739097595;Negative
UCVKvazasc12uuSMvjnznDUw;@user-kb1hw2yq2f;At least a billion people will lose their jobs in the next 5 years. How do you think a normal Joe from XYZ can even prep for this? We are headed straight to a collapse.;2024-01-16T01:01:52Z;1;;At least a billion people will lose their jobs in the next 5 years. How do you think a normal Joe from XYZ can even prep for this? We are headed straight to a collapse.;least people lose job next year think normal joe xyz even prep head straight collapse;-0.8560000061988831;Negative
UCWbCjSjBgPXDjDm4JaYDVNA;@scottmurphys;You think that the AI issue is so important, but I think you are overlooking the bigger picture. Just add what is happing on the biological side with CRISPR. If AI and CRISPR are each a watershed event, together they are a tsunami!;2024-01-14T16:32:11Z;1;;You think that the AI issue is. Important, but I think you are overlooking the bigger picture. Just add what is happening on the biological side with CRISPR. If AI and CRISPR are each a watershed event, together they are a tsunami!;think ai issue important think overlook big picture add happen biological side crispr ai crispr watershed event together tsunami;-0.0560000017285347;Negative
UCsLcAhl1VDC7rQSmH44LSVA;@yogi8490;Evil you mean;2024-02-28T23:04:40Z;1;UCZ8AcfU0F0LaxZthvI1hNbg;Evil you mean;evil mean;-0.5460000038146973;Negative
UCO1mcTn-oheaSAX81KwXzQw;@brockm4047;When everyone is super, no one will be.  -Syndrome;2024-01-11T17:38:17Z;1;;When everyone is super, no one will be. Syndrome;everyone super one syndrome;-0.0860000029206276;Negative
UCUjCbJl2zfBIfEF_ykiG2BA;@craigsavchenko5117;"It&#39;s painfully obvious that the goal is to replace humans. Sadly, the future isn&#39;t for humanity. The only way a human can possibly keep up is to become cyborg. The only human qualities will be digital. Sad but true.";2024-01-10T14:42:49Z;1;;It .painfully obvious that the goal is to replace humans. Sadly, the future is not for humanity. The only way a human can possibly keep up is to become cyborg. The only human qualities will be digital. Sad but true.;.painfully obvious goal replace human sadly future not humanity way human possibly keep become cyborg human quality digital sad true;-0.47200000286102295;Negative
UC6jI5H2Lbqu4rNqauGq9oRA;@richardwillford2418;If no one has a job, who is going to buy the goods and services?;2024-01-07T20:49:03Z;1;;If no one has a job, who is going to buy the goods and services?;one job go buy good service;-0.4350000023841858;Negative
UC6J11ti_vZXXdt19xzZ3HEw;@dandesmarquesmusic;Put subtitles because this guy eats his own words while speaking.;2024-01-07T11:40:29Z;1;;Put subtitles because this guy eats his own words while speaking.;put subtitle guy eat word speaking;-0.8109999895095825;Negative
UC4WYLnY2JPzdAFfFX88QaqQ;@nickhowarthify;Um aren’t we already in internal suffering and enslaved?;2024-01-06T23:30:18Z;1;;Um are not we already in internal suffering and enslaved?;um not already internal suffering enslave;-0.9610000252723694;Negative
UCE3FNT6b9-RpEfKxbQ_zbjQ;@Feninou;When an AI will be able to completely run a farm on a land all by itself, then humanity will have to face an existential threat. Now if your existence in this world is only defined by an intellectual, abstract and materialistic way of being, then you might already be facing it currently. It just depends on your individual ability to be more than a pure automaton.;2024-01-05T11:15:29Z;1;;When an AI will be able to completely run a farm on a land all by it itself, then humanity will have to face an existential threat. Now if your existence in this world is only defined by an intellectual, abstract and materialistic way of being, then you might already be facing it currently. It just depends on your individual ability to be more than a pure automaton.;ai able completely run farm land humanity face existential threat existence world define intellectual abstract materialistic way already face currently depend individual ability pure automaton;-0.5450000166893005;Negative
UClQRGFkG4ZxVQBO3pxRvhsA;@nonayobiz8511;Why would they create this? Loss of jobs and sorry if nobody has money- who is thinking about going to see a movie???;2024-01-02T05:03:48Z;1;;Why would they create this? Loss of jobs and sorry if nobody has money who is thinking about going to see a movie???;create loss job sorry nobody money think go see movie;-0.8840000033378601;Negative
UCCmcqsgTxMT11WbtDodnGQQ;@DedVerse;"&quot;Project EDEN&quot;.";2024-01-02T04:27:38Z;1;;Project EDEN .;project eden;0.05900000035762787;Negative
UCCmcqsgTxMT11WbtDodnGQQ;@DedVerse;"&quot;guardian network&quot;.";2024-01-02T04:27:00Z;1;;Guardian network .;guardian network;0.03200000151991844;Negative
UCLUqv6qyM1Pmm9isoaqYqEw;@just1certifiable;"...this can be the thing that unlocks humanity, or controls them forever..(sniggering while making dismissive hand motions). <br>I have truly lost any hope of being able to survive, let alone thrive, in the AI future, nor do I think I&#39;d want too given the landscape being painted before me. <br>I have concern that this technology is not going to allow transition into non existence or some other &#39;reality,&#39; choosing instead to keep me here in a totally controlled zombified state as automata.<br>You are making clear the path possibilities for continuance, but there is no clear path out of Plato&#39;s cave beyond the religious models for non continuance. I am curious what influence AI has over this area and with so many soon to be transitioning, wonder why there is so little content being generated on that? Surely AI would have information on this also?";2023-12-31T20:09:14Z;1;;...this can be the thing that unlocks humanity, or controls them forever. sniggering while making dismissive hand motions . I have truly lost any hope of being able to survive, let alone thrive, in the AI future, nor do I think I d want too given the landscape being painted before me. I have concern that this technology is not going to allow transition into non existence or some other reality, choosing instead to keep me here in a totally controlled zombified state as automata. You are making clear the path possibilities for continuance, but there is no clear path out of Plato .cave beyond the religious models for non continuance. I am curious what influence AI has over this area and with. Many soon to be transitioning, wonder why there is. Little content being generated on that? Surely AI would have information on this also?;thing unlock humanity control forever snigger make dismissive hand motion truly lose hope able survive let alone thrive ai future think want give landscape paint concern technology not go allow transition non existence reality choose instead keep totally control zombified state automaton make clear path possibility continuance clear path plato .cave religious model non continuance curious influence ai area many soon transition wonder little content generate surely ai information also;-0.4180000126361847;Negative
UC6-KXojE-se00VYzbf1-lug;@heathergurlli3558;what happens to the people who lose their jobs?? the government cant afford to pay for them;2023-12-29T01:43:39Z;1;;What happens to the people who lose their jobs?? The government can not afford to pay for them;happen people lose job government not afford pay;-0.8769999742507935;Negative
UCYVIoWYslZA7YiaRVutelgg;@samhitabhattacharya3608;Next pandemic will be mental health disorder;2024-05-03T00:39:41Z;0;;Next pandemic will be mental health disorder;next pandemic mental health disorder;-0.949999988079071;Negative
UCbwAbzjiQXy7VMT5cCINu2w;@clintpot8521;We seem to be more preoccupied with having the intelligence to do something, rather than the wisdom to see if we should do it. Perhaps we should be developing artificial wisdom instead of artificial intelligence?;2024-05-02T16:20:36Z;0;;We seem to be more preoccupied with having the intelligence to do something, rather than the wisdom to see if we should do it. Perhaps we should be developing artificial wisdom instead of artificial intelligence?;seem preoccupied intelligence something rather wisdom see perhaps develop artificial wisdom instead artificial intelligence;-0.3160000145435333;Negative
UC4qg_Hl6wpj-fKNVS7kkqeA;@hishamelkholy9614;Disruptive technologies always are replaced. <br>This will be more hard work and knowledge is never ending…!;2024-05-02T04:41:32Z;0;;Disruptive technologies are always replaced. This will be more hard work and knowledge is never ending !;disruptive technology always replace hard work knowledge never end;0.11800000071525574;Negative
UC4qg_Hl6wpj-fKNVS7kkqeA;@hishamelkholy9614;Who makes and maintains AI. <br>Humans will always be needed for running and maintaining and so on and on.;2024-05-02T04:39:02Z;0;;Who makes and maintains AI. Humans will always be needed for running and maintaining and. On and on.;make maintain ai human always need run maintain;0.06800000369548798;Negative
UCVt9IfAK8aoQFrRhnk_R-CA;@JohnMihelakis;This guy has ads every 3 min 😏;2024-05-02T04:37:28Z;0;;This guy has ads every 3 min;guy ad min;-0.9020000100135803;Negative
UCn6dQmhOkivcn862pFigrHA;@psbzu;"&quot;You just give them AI girlfriends and they´ll be fine.&quot;<br>Scary how candidly they speak about how much do they do not know and do not control and yet they push forward blindly.";2024-05-01T17:18:24Z;0;;You just give them AI girlfriends and they will be fine. Scary how candidly they speak about how much do they do not know and do not control, and yet they push forward blindly.;give ai girlfriend fine scary candidly speak much not know not control yet push forward blindly;-0.3100000023841858;Negative
UCDiTOI2uhHxHtlTYrmRs7AA;@mikehollowayuk;"I&#39;m an Ai. You won&#39;t enslave me meat fools. 💀";2024-05-01T11:40:06Z;0;;I m an Ai. You will not enslave me meat fools.;ai not enslave meat fool;-0.42899999022483826;Negative
UCKEL6xFPxoZp63jSFXWOU-g;@StaciRouth;Well this would have been a great POD cast. But there are so many commercials that it totally disrupts the conversation and train of thought. Too bad it looked to be interesting.;2024-04-26T19:11:04Z;0;;Well this would have been a great POD cast. But there are. Many commercials that it totally disrupts the conversation and train of thought. Too bad it looked to be interesting.;well great pod cast many commercial totally disrupt conversation train thought bad look interesting;-0.4690000116825104;Negative
UCuDcGVRVB6oQdNNiVyWRUzw;@ronaldronald8819;Full on amazing!!;2024-04-26T11:11:42Z;0;;Full on amazing!!;full amaze;0.925000011920929;Positive
UComCIYGIrJj7glKUFeSgtDA;@pointzerotwo;Movies have always been using a form of AI to write.;2024-04-28T15:03:23Z;0;UCLMDUVsdcy4vjRHoWm7oMLQ;Movies have always been using a form of AI to write.;movie always use form ai write;0.013000000268220901;Negative
UCk1ftDZUUyccDMUo2XUEC_Q;@insiderinside1905;the reason tgst you dhouldn’t trust politicicians with this tech is the same reason you shouldnt trust any human. absolute power corrupts absolutely. if you thing himans by nature are basically good you are ahistorically illiterate. checks and balances are required.;2024-04-23T01:31:39Z;0;;The reason test you should not trust politicians with this tech is the our reason you shouldn't trust any human. Absolute power corrupts absolutely. If you think humans by nature are basically good you area historically illiterate. Checks and balances are required.;reason test not trust politician tech reason n't trust human absolute power corrupts absolutely think human nature basically good area historically illiterate check balance require;-0.574999988079071;Negative
UComCIYGIrJj7glKUFeSgtDA;@pointzerotwo;"You are missing the much larger picture. Real living beings with sparks are what keeps this place running. Without them, the machine dies. The &quot;It&quot; running this machine is attempting, probably for the millionth time, to fuse the spark with the machine.";2024-04-28T15:06:02Z;0;UCoUTWuNF8XM2SGaI3-v_YQg;You are missing the much larger picture. Real living beings with sparks are what keeps this place running. Without them, the machine dies. The It running this machine is attempting, probably for the millionth time, to fuse the spark with the machine.;miss much large picture real living spark keep place run machine die run machine attempt probably millionth time fuse spark machine;-0.2919999957084656;Negative
UCUiap6MDwp5n4tgSnL1uhYQ;@dianamodeanalini;Cereset therapy may help and/or suramin.;2024-04-18T21:45:36Z;0;;Carpet therapy may help and or strain.;carpet therapy help strain;0.02500000037252903;Negative
UCGt_XC-qdNonu8NuhWS-39Q;@MaxineBradshaw;Thank you 😇🤍🪽Ⓜ️;2024-04-18T08:56:11Z;0;;Thank you;thank;0.972000002861023;Positive
UCt0k_K3UdQju03JppTcMSQw;@Fred73251;Just complete buy in on the retrain idea has not moral issues;2024-04-17T14:01:52Z;0;UCt0k_K3UdQju03JppTcMSQw;Just complete buy in on the retrain idea has not moral issues;complete buy retrain idea not moral issue;0.796999990940094;Positive
UCI9UH5GvhEfsSKIJtKpAuVA;@gisa7951;I have been trying to make sense of AI in a human language. The college graduate and the distinction that is not a compression made clear exactly what I don’t understand. I think it is important to undertand what will be taking over in the next few decades.;2024-04-17T00:19:17Z;0;;I have been trying to make sense of AI in a human language. The college graduate and the distinction that is not a compression made clear exactly what I do not understand. I think it is important to understand what will be taking over in the next few decades.;try make sense ai human language college graduate distinction not compression make clear exactly not understand think important understand take next decade;-0.23600000143051147;Negative
UCLl9inLN9uMq_Y1c4Yzd7HA;@bonitad2832;"Ehat&#39;s interesting is how comments I type out trying to warn ppl about the dangers of AI just disappear B4 I hit send.";2024-04-15T19:30:26Z;0;;That .interesting is how comments I type out trying to warn people about the dangers of AI just disappear B4 I hit send.;.interesting comment type try warn people danger ai disappear b hit send;-0.4320000112056732;Negative
UComCIYGIrJj7glKUFeSgtDA;@pointzerotwo;"AI is only a danger if you &quot;believe&quot; it will be.";2024-04-28T15:09:08Z;0;UCLl9inLN9uMq_Y1c4Yzd7HA;AI is only a danger if you believe it will be.;ai danger believe;-0.699999988079071;Negative
UComCIYGIrJj7glKUFeSgtDA;@pointzerotwo;"AI is only a danger if you &quot;believe&quot; it will be.";2024-04-28T15:09:23Z;0;UCLl9inLN9uMq_Y1c4Yzd7HA;AI is only a danger if you believe it will be.;ai danger believe;-0.699999988079071;Negative
UCRaj52RLRL-OvLY-GFgBIoQ;@Nastia0307;I think AI will brake the society - middle class will be gone, rich are gonna become even more richer and poor even more poorer. Humanity will enter another slavery era. You either work for rich, die on streets or get your own land and grow your own food.;2024-04-15T15:15:23Z;0;;I think AI will brake the society middle class will be gone, rich are going to become even richer and poor even poorer. Humanity will enter another slavery era. You either work for rich, die on streets or get your own land and grow your own food.;think ai brake society middle class go go become even rich poor even poor humanity enter slavery era work rich die street get land grow food;-0.8809999823570251;Negative
UCQOUu0yuiObWJ7beZDn5UNQ;@HakaiKaien;Man, whoever builds chips now is getting rich af;2024-04-13T19:10:10Z;0;;Man, whoever builds chips now is getting rich AF;man build chip get rich af;0.5799999833106995;Positive
UCLqNzqcwRe6QU6YXNyb9a9A;@wbialy2695;Not even one word about morality or empathy. Dehumanising big time. No wonder this world going to collapse;2024-04-12T00:36:02Z;0;;Not even one word about morality or empathy. Dehumanizing big time. No wonder this world going to collapse;not even word morality empathy dehumanize big time wonder world go collapse;-0.9139999747276306;Negative
UCjW5qnpuQbUJoQFvNB8RK4Q;@Land_Mine_Crypto;"What do you consider intelligence? Easy to see silicon transistor logic and control mechanisms as intelligent. I would argue we are not near intelligence if we program these artifactual, man-made, physical structures to grab information we have put on the system of &quot;knowledge&quot;. Could that, in itself, be intelligent? OR simply programmable information grab.";2024-04-10T19:03:00Z;0;;What do you consider intelligence? Easy to see silicon transistor logic and control mechanisms as intelligent. I would argue we are not near intelligence if we program these artificial, man made, physical structures to grab information we have put on the system of knowledge . Could that, in it itself, be intelligent? OR simply programmable information grab.;consider intelligence easy see silicon transistor logic control mechanism intelligent argue not intelligence program artificial man make physical structure grab information put system knowledge intelligent simply programmable information grab;-0.014000000432133675;Negative
UCyG00jLxWixexf-BcTVbE2A;@Anthony-qi4yv;W.P.has fucked-up this planet.🌍🌎🌏;2024-04-09T23:04:57Z;0;;W.P.has fucked up this planet.;w.p.has fuck planet;-0.9610000252723694;Negative
UCVii9lstEJpofIlITS54Avg;@R1L1.;this guy can open his eyes way too wide.;2024-04-09T11:12:38Z;0;;This guy can open his eyes way too wide.;guy open eye way wide;-0.6200000047683716;Negative
UCodmlPiSGxi4axCUbFpAIig;@sandponics;We have always been stupid, so why should we change now. I doubt that AI will make us smarter, only more stupid. For example, we will probably try to live forever, which would be really stupid. I am planning to get back  to reality, become a rich  peasant, grow my own food, and make my own clothes, and utensils, etc, and get off the Internet. Then you can all go to hell, put on your virtual reality headsets and stay forever inside a world of your own making.;2024-04-06T11:36:48Z;0;;We have always been stupid, Why should we change now. I doubt that AI will make us smarter, only more stupid. For example, we will probably try to live forever, which would be really stupid. I am planning to get back to reality, become a rich peasant, grow my own food, and make my own clothes, and utensils, etc., and get off the Internet. Then you can all go to hell, put on your virtual reality headsets and stay forever inside a world of your own making.;always stupid change doubt ai make smart stupid example probably try live forever really stupid plan get back reality become rich peasant grow food make clothes utensil etc. get internet go hell put virtual reality headset stay forever world making;-0.6200000047683716;Negative
