id;name;text;time;likes;reply;CleanedText;ProcessText;SentimentScore;ActualLabel
UCperHDMfOavsGlyiAIb80YQ;@denniszenanywhere;"They didn&#39;t get the context of what he was saying back then -- especially the AI part. If he run for president next year, people will look at him differently.";2023-07-03T16:44:26Z;4;UCANuNFF8d-505_3KIB7PLIw;They did not get the context of what he was saying back then especially the AI part. If he runs for president next year, people will look at him differently.;not get context say back especially ai part run president next year people look differently;-0.2680000066757202;Negative
UCXIEolhKdPgVriGva1AMeyg;@TheBlackClockOfTime;This. I really want sequels for Big Short and Margin Call.;2023-07-03T18:32:01Z;4;UC33CQ9FBw9q75-VNSeKZTjA;This. I really want sequels for Big Short and Margin Call.;really want sequel big short margin call;0.4650000035762787;Positive
UC9ptV-D9eCgwUs9MJjwcJFQ;@down-to-earth-mystery-school;Except, no one is investing in people upskilling. Companies are developing tech, our government officials are too old and out of touch to understand, college and training costs are skyrocketing. The CEOs will make their profit and dump humans with no regret along the way;2023-07-16T13:42:54Z;3;UCX8AaRyFciTPHUvNEXsnAEg;Except, no one is investing in people upskilling. Companies are developing tech, our government officials are too old and out of touch to understand, college and training costs are skyrocketing. The CEOs will make their profit and dump humans with no regret along the way;one invest people upskilling company develop tech government official old touch understand college training cost skyrocket ceo make profit dump human regret way;-0.906000018119812;Negative
UCpVRah3MU4WbdA_IXJ0Jhlw;@donaldbowler4514;Actually it took decades to distribute the wealth by creating laws and unions, and job benefits. During the industrial revolution, most of the ceos gathered it, there was actually a greater wealth disparity back then compared to now, the difference was there was plenty of jobs that humans cold shift to. Now not so much. This will cause massive unemployment unless properly handled.;2023-07-06T14:08:43Z;3;UC7kxsMZ9F8rvUx5b8QN9LAQ;Actually it took decades to distribute the wealth by creating laws and unions, and job benefit is. During the industrial revolution, most of the CEOs gathered it, there was actually a greater wealth disparity back then compared to now, the difference was there were plenty of jobs that humans could shift to. Now not. Much. This will cause massive unemployment unless properly handled.;actually take decade distribute wealth create law union job benefit industrial revolution ceo gather actually great wealth disparity back compare difference plenty job human shift not much cause massive unemployment properly handle;-0.2409999966621399;Negative
UCraCUy_lPZxAMSaPYEqiWdA;@LynMildner;The writers guild should better be replaced by ai judging by the last movies that came out;2023-07-05T04:23:22Z;3;;The writers' guild should better be replaced by AI judging by the last movies that came out;writer guild well replace ai judging last movie come;-0.9120000004768372;Negative
UCfuvoP1o4wxl0hV3zT61XuA;@moomoo-bv3ig;"You were suppose to save your money, with that white collar job, so when the layoff notice comes you would be prepared. No one will feel sorry for you and it might be a tough road for you if you don&#39;t figure that out quickly.";2023-07-04T17:06:02Z;3;;You were supposed to save your money, with that white collar job, When the layoff notice comes you would be prepared. No one will feel sorry for you, and it might be a tough road for you if you do not figure that out quickly.;suppose save money white collar job layoff notice come prepare one feel sorry tough road not figure quickly;-0.8529999852180481;Negative
UChSvrPDNjI33AaObx5CE3yQ;@extremelynice;"Or they&#39;re just investing all their resources into something that&#39;s not even working and never will be. AI is a totally useless idea even on a hypothetical level, not mentioning this abhorrent implementation.";2023-07-05T05:19:00Z;3;UCgsBdHncBSvVTuqt266cyNg;Or they re just investing all their resources into something that .not even working and never will be. AI is a totally useless idea even on a hypothetical level, not mentioning this abhorrent implementation.;invest resource something .not even work never ai totally useless idea even hypothetical level not mention abhorrent implementation;-0.6430000066757202;Negative
UC6fMDIAljI8JT5nprWHKUVw;@christroth8160;AI could destroy invention, innovation and creativity as anyone who does these will be out of work. Does AI have different personalities? Otherwise scripts would be bland and repetitive.;2023-07-04T12:46:11Z;3;;AI could destroy invention, innovation and creativity as anyone who does these will be out of work. Does AI have different personalities? Otherwise, scripts would be bland and repetitive.;ai destroy invention innovation creativity anyone work ai different personality otherwise script bland repetitive;-0.5640000104904175;Negative
UCVnm39aodbVjrmC0rrX85vw;@justinleemiller;Plumber, electrician, carpenter, welder, HVAC technician, automotive technician, hairstylist, makeup artist, chef, baker, bartender, massage therapist, fitness trainer, landscape gardener, housekeeper, tailor, locksmith, plumber, painter, nanny , bricklayer, astronaut, surgeon, nurse, dental technician, caregiver, archivist, sports coach, mail carrier, etc not going away in the near future;2023-07-04T12:36:31Z;3;;Plumber, electrician, carpenter, welder, HVAC technician, automotive technician, hairstylist, makeup artist, chef, baker, bartender, massage therapist, fitness trainer, landscape gardener, housekeeper, tailor, locksmith, plumber, painter, nanny, bricklayer, astronaut, surgeon, nurse, dental technician, caregiver, archivist, sports coach, mail carrier, etc. not going away in the near future;plumber electrician carpenter welder hvac technician automotive technician hairstylist makeup artist chef baker bartender massage therapist fitness trainer landscape gardener housekeeper tailor locksmith plumber painter nanny bricklayer astronaut surgeon nurse dental technician caregiver archivist sport coach mail carrier not go away near future;0.11400000005960464;Negative
UChSvrPDNjI33AaObx5CE3yQ;@extremelynice;"They aren&#39;t going away ever. But they will have better tools and will do the work that they want, without doing the work which they don&#39;t want. AI is NOT one of such tools, and AI will have nothing to do with that. On contrary, when we will give up this useless idea of AI and similar ideas, we will be able to achieve this.";2023-07-04T15:19:17Z;3;UCVnm39aodbVjrmC0rrX85vw;They are not going away ever. But they will have better tools and will do the work that they want, without doing the work which they do not want. AI is NOT one of such tools, and AI will have nothing to do with that. On contrary, when we will give up this useless idea of AI and similar ideas, we will be able to achieve this.;not go away ever good tool work want work not want ai not tool ai nothing contrary give useless idea ai similar idea able achieve;0.05299999937415123;Negative
UC9E_tsUzWITHQBOBTDFsTSw;@lolcatjunior;Look up modular construction/prefabrication. You can build homes lighting fast in factories, faster than traditional construction.;2023-07-06T00:58:26Z;3;UCVnm39aodbVjrmC0rrX85vw;Look up modular construction prefabrication. You can build homes lighting fast in factories, faster than traditional construction.;look modular construction prefabrication build home light fast factory fast traditional construction;0.4569999873638153;Positive
UCkwDbja2BzlpQ3fNi9XO-Jg;@Transcend_Naija;Are you joking?;2023-07-04T08:41:36Z;3;UCPuF-IURaOvVgM37mq86d8w;Are you joking?;joke;-0.734000027179718;Negative
UCn1KSEN_xRN1yFCFaeD2z8g;@winzyl9546;Repetitive work is exactly what machines are made for, humans are not made to do repetitive work.<br>And besides no human can ever compete against a machine in repetitive work.;2023-07-04T11:16:37Z;3;UCPuF-IURaOvVgM37mq86d8w;Repetitive work is exactly what machines are made for, humans are not made to do repetitive work. And besides no human can ever compete against a machine in repetitive work.;repetitive work exactly machine make human not make repetitive work human ever compete machine repetitive work;-0.4180000126361847;Negative
UCgsBdHncBSvVTuqt266cyNg;@josephatnip2398;For decades employers have compartmentalized jobs to small repetitive tasks so employees can be replaced with a new employee very quickly this is why jobs feel unfulfilling mundane and meaningless;2023-07-04T15:19:22Z;3;UCPuF-IURaOvVgM37mq86d8w;For decades employers have  jobs to small repetitive tasks. Employees can be replaced with a new employee very quickly this is why jobs feel unfulfilling mundane and meaningless;decade employer job small repetitive task employee replace new employee quickly job feel unfulfilling mundane meaningless;-0.6779999732971191;Negative
UCAYhj9IlzNQGRon5ac6TI-A;@pedrolplgm;Nous voulons la vérité.;2023-07-04T01:42:36Z;3;;Nous Toulon la v it.;nous toulon la;0.24699999392032623;Negative
UCgAdkXaTTPlr-wJjx4xcH9w;@TomTom-vi6vp;All this AI and yet we can’t accurately predict the weather tomorrow;2023-07-03T22:52:42Z;3;;All this AI and yet we can not accurately predict the weather tomorrow;ai yet not accurately predict weather tomorrow;-0.8240000009536743;Negative
UCDhDvAbVwwOesmHzlTxK3lw;@kompila;UBI is a terrible idea.;2023-07-04T03:59:21Z;3;UCRUekTktV8dN0WzHlz-wxPw;FBI is a terrible idea.;fbi terrible idea;-0.9079999923706055;Negative
UCugMHNJo92pD1bPtJcELyvw;@clonosaurios;@@kompila why?;2023-07-04T23:36:22Z;3;UCRUekTktV8dN0WzHlz-wxPw;Why?;;-0.1940000057220459;Negative
UCT-eAWDJIKdKQ5h75nKSv7w;@jonatand2045;"@@50jakecs<br>Profit is a means to an end, which is to make people produce and innovate. You didn&#39;t pay attention to what i said.";2023-07-04T01:42:43Z;3;UCcKH96svgUOVy4l_Ltno7IQ;Profit is a means to an end, which is to make people produce and innovate. You did not pay attention to what I said.;profit mean end make people produce innovate not pay attention say;-0.11900000274181366;Negative
UChSvrPDNjI33AaObx5CE3yQ;@extremelynice;By generating noise... Random number generators were here before for centuries, what was preventing from using them before?;2023-07-04T14:33:13Z;3;UCOfc2wdDqhOYSE5ZlqpWuGw;By generating noise... Random number generators were here before for centuries, what was preventing from using them before?;generate noise random number generator century prevent use;-0.23100000619888306;Negative
UCWimxwamgJ6L7Ld2ICXP7Tg;@Steven-wq8tx;That’s why you need to up your skill levels or else you’ll be replaced. It’s already replaced cashiers;2023-07-03T16:43:14Z;3;;That .why you need to up your skill levels or else you will be replaced. It.already replaced cashiers;.why need skill level else replace it.already replace cashier;-0.1770000010728836;Negative
UCKo2ICCwiFoaEnz4MgQk2EA;@jorjoperalta;His role is probably the easiest to replace with AI;2023-07-03T16:36:29Z;3;UCnCg4srWyO5q2D3LqPmVVKw;His role is probably the easiest to replace with AI;role probably easy replace ai;-0.1940000057220459;Negative
UCU9jYPPP_Xn9djHLRTf635w;@hammerandthewrench7924;"@@manonamission2000 no it doesn&#39;t. it&#39;s literally completely random. lol. if you are being honest then you lack substantial creative input and have very low expectations lol";2023-07-07T15:27:57Z;3;UCoGZXXnNPdL7AbCslANBqDw;No it does not . It .literally completely random. laughing out loud. If you are being honest then you lack substantial creative input and have very low expectations laugh out loud;not .literally completely random laugh loud honest lack substantial creative input low expectation loud;-0.1379999965429306;Negative
UCFoM03HJAtZs9yFsxSjep1w;@fuleinist;And all prices 😂;2023-07-03T20:20:08Z;3;UC33CQ9FBw9q75-VNSeKZTjA;And all prices;price;0.38100001215934753;Negative
UC-aLaEq_zS0twGRjmcsIyVw;@jdm1039;Great, more job losses.;2023-07-03T15:31:24Z;3;;Great, more job losses.;great job loss;-0.7310000061988831;Negative
UCwFd03snjaUPCaeNxV3BJww;@piplupempoleon4225;@@ulfw people who still have jobs?;2023-07-03T15:48:59Z;3;UCk8Tc_iPZ63dYSjYgHuZKyA;People who still have jobs?;people still job;-0.17100000381469727;Negative
UC43sRL7IF7QJo1c2KArJ2eg;@tutacat;"The writer&#39;s guild strike is much more than AI technologies. Main problem was not keeping many writers, and just getting a head writer to outline the plot and fill it in later";2023-09-17T10:39:56Z;2;;The writer .guild strike is much more than AI technologies. Main problem was not keeping many writers, and just getting a head writer to outline the plot and fill it in later;writer .guild strike much ai technology main problem not keep many writer get head writer outline plot fill later;-0.15199999511241913;Negative
UC43sRL7IF7QJo1c2KArJ2eg;@tutacat;"Don&#39;t say middle class! It&#39;s not middle class, middle classis very small.";2023-09-17T10:34:58Z;2;;do not say middle class! It .not middle class, middle classes very small.;not say middle class .not middle class middle class small;-0.39399999380111694;Negative
UCZVCCSKQJYqy54V_ILu1I-A;@Mark-fh5lp;Mostly women who will lose jobs. Men do more hands on work.;2023-07-09T19:50:27Z;2;;Mostly women who will lose jobs. Men do more hands on work.;mostly woman lose job men hand work;-0.46000000834465027;Negative
UCbsz3pQPvA8erOVTzDjo0eg;@topofthegreen;We are going to have millions of homeless.;2023-07-09T13:15:46Z;2;;We are going to have millions of homeless.;go million homeless;0.6660000085830688;Positive
UCoVa84qhu8MqYQBdwAM1bmw;@alexkoshuta6219;you managed to create a video w/o any useful or even informative content. your job for sure should be and can be replaced by AI. and it actually will be better at it.;2023-07-08T21:03:26Z;2;;You managed to create a video witho any useful or even informative content. Your job for sure should be and can be replaced by AI. and it actually will be better at it.;manage create video witho useful even informative content job sure replace ai actually good;-0.0820000022649765;Negative
UCQGzBiGrluMiJ5iwzAHtUag;@rogue-ish5713;End of Capitalism. I love it;2023-07-07T04:04:44Z;2;;End of Capitalism. I love it;end capitalism love;0.4580000042915344;Positive
UCct2x2wDDmjZdHr1qlgg-Zg;@mikef2811;If AI takes over all those jobs in the future than where will the consumers come from?  NO money, NO buy.;2023-07-06T21:06:37Z;2;;If AI takes over all those jobs in the future than where will the consumers come from? NO money, NO buy.;ai take job future consumer come money buy;-0.765999972820282;Negative
UC5rzwozAtj5gtgJMKYVTYhw;@vikasbamba1624;"Welcome to the era of &quot;HUMANLESS HUMANITY&quot;.";2023-07-06T16:15:16Z;2;;Welcome to the era of HUMANNESS HUMANITY .;welcome era humanness humanity;0.7200000286102295;Positive
UCBaeWjOdoV7vfeOu_peO_VA;@SK-lt1so;"They said EMR&#39;s would eliminate all the &quot;scut-work&quot; in medicine.<br>Instead, the systems just created more.<br>What nonsense";2023-07-06T02:32:32Z;2;;They said EMR .would eliminate all the ductwork in medicine. Instead, the systems just created more. What nonsense;say emr eliminate ductwork medicine instead system create nonsense;-0.4490000009536743;Negative
UChSvrPDNjI33AaObx5CE3yQ;@extremelynice;Running garbage movies through the garbage algorithm. Guess yourself what will come out...;2023-07-05T05:22:59Z;2;UCraCUy_lPZxAMSaPYEqiWdA;Running garbage movies through the garbage algorithm. Guess yourself what will come out...;run garbage movie garbage algorithm guess come;-0.4050000011920929;Negative
UChSvrPDNjI33AaObx5CE3yQ;@extremelynice;"You&#39;re actually much wiser than those idiots susceptible to mass fear. It is the complete uselessness of AI, which I&#39;m more concerned of.";2023-07-05T05:11:00Z;2;UCQURqVKyga49Ng19YpWRdpQ;You re actually much wiser than those idiots susceptible to mass fear. It is the complete uselessness of AI, which I m more concerned of.;actually much wise idiot susceptible mass fear complete uselessness ai concerned;-0.20600000023841858;Negative
UCRXhODEaCzy1EO1VBXcz-qQ;@DeusShaggy;A.I. will destroy society by simply doing its job most efficiently. No nukes, no disruptions of infrastructure, just plain efficiency.;2023-07-05T01:00:12Z;2;;A.I. will destroy society by simply doing it is job most efficiently. No nukes, no disruptions of infrastructure, just plain efficiency.;a.i destroy society simply job efficiently nuke disruption infrastructure plain efficiency;0.017999999225139618;Negative
UChSvrPDNjI33AaObx5CE3yQ;@extremelynice;"AI itself is pretty much a sci-fi at this point. Although, it&#39;s rather just fiction, without science.";2023-07-05T04:33:14Z;2;UCGbn6koXzEpRB6sgz2SosNA;AI it itself is pretty much a sci fi at this point. Although, it .rather just fiction, without science.;ai pretty much sci fi point .rather fiction science;-0.23899999260902405;Negative
UChN4kNXQ_FOmRR8-dKud_mQ;@jayknighttt;replace politicians with Ai;2023-07-04T18:25:11Z;2;;Replace politicians with Ai;replace politician ai;-0.36500000953674316;Negative
UChSvrPDNjI33AaObx5CE3yQ;@extremelynice;@@donaldbowler4514 If only those, who are now working on AI, would start to work on real problems, that would be nice.;2023-07-06T14:20:47Z;2;UCgsBdHncBSvVTuqt266cyNg;If only those, who are now working on AI, would start to work on real problems, that would be nice.;work ai start work real problem nice;-0.6620000004768372;Negative
UChSvrPDNjI33AaObx5CE3yQ;@extremelynice;Different kinds of snake oils, lies and stealing techniques were changing the white-collar jobs for years. This is nothing new.;2023-07-04T14:10:27Z;2;;Different kinds of snake oils, lies and stealing techniques were changing the white collar jobs for years. This is nothing new.;different kind snake oil lie steal technique change white collar job year nothing new;-0.5630000233650208;Negative
UC9KibnPhx5xLEyB1v6z9ZvQ;@david-rd2qc;If AI can replace research and development then…oh boy…. no job will be safe lol 😂;2023-07-04T17:07:01Z;2;UCVnm39aodbVjrmC0rrX85vw;If AI can replace research and development then oh boy. No job will be safe laugh out loud;ai replace research development oh boy job safe laugh loud;0.597000002861023;Positive
UCTQz-noXbrgUxi24bxilcfQ;@Finance-Tools;Fortunately, boring work will be history.;2023-07-04T10:51:40Z;2;;Fortunately, boring work will be history.;fortunately bore work history;0.9240000247955322;Positive
UCFETkjnAPSPYNoNsAYLbGTw;@fimakurnia;i am photo editor. i am being layoff first;2023-07-04T10:34:11Z;2;;I am photo editor. I am being layoff first;photo editor layoff first;-0.35899999737739563;Negative
UC8RI10oKGHfWLsQ015eFpIw;@w3s77;Can AI make political contributions?;2023-07-04T03:29:56Z;2;;Can AI make political contributions?;ai make political contribution;-0.0020000000949949026;Negative
UChSvrPDNjI33AaObx5CE3yQ;@extremelynice;"Who&#39;ve created the most overpaid useless technology ever - AI.";2023-07-04T14:46:19Z;2;UCcWcEDwsShjKwjMEolG5YIQ;Who ve created the most overpaid useless technology ever AI.;create overpaid useless technology ever ai;-0.8989999890327454;Negative
UCZFDO1ITBbcjDeJr62RT5sw;@wizaaeed;A.I. replacing humans because of the human error, soon you will see the ml error that will require real human tuning;2023-07-03T18:33:20Z;2;;A.I. replacing humans because of the human error, soon you will see the machine learning error that will require real human tuning;a.i replace human human error soon see machine learn error require real human tuning;-0.328000009059906;Negative
UCXIEolhKdPgVriGva1AMeyg;@TheBlackClockOfTime;"Yea the feature length film isn&#39;t quite accurate imo (yet). Neither is video (yet).";2023-07-03T18:30:10Z;2;;Yea the feature length film is not quite accurate IMO yet . Neither is video yet .;yea feature length film not quite accurate imo yet video yet;-0.7940000295639038;Negative
UC4bM9ZGdhl40uySLf-gF8LQ;@jamesclarke2789;"Sooooo, prefabricated housing isn&#39;t a thing i guess?";2023-07-04T07:04:14Z;2;UCFsd-dcxBL_555tvnih1Wow;Suitor, prefabricated housing is not a thing I guess?;suitor prefabricate housing not thing guess;-0.210999995470047;Negative
UChzjtlY4IuoPHuw_mwjtL1Q;@edh2246;@@extremelynice.     AI work is useless? Better take a 2nd look.;2023-07-04T14:50:14Z;2;UC_H7NIVPEkw2Or_uMw2glow;. AI work is useless? Better take a 2nd look.;ai work useless well take nd look;-0.47099998593330383;Negative
UChSvrPDNjI33AaObx5CE3yQ;@extremelynice;"It doesn&#39;t do anything useful. And never will. Period.";2023-07-04T14:40:01Z;2;UCoGZXXnNPdL7AbCslANBqDw;It does not do anything useful. And never will. Period.;not anything useful never period;-0.5019999742507935;Negative
UC6P0DbkaZ3EDwhlX08Bo8gA;@GrumpDog;"I don&#39;t think that&#39;s true at all. Current Generative AI enables a lot of control, if you know how to use it.<br>Similar false-claims were made when Photography was invented, as well as digital-art on computers, nearly down to the exact same wording people are using now.<br>Prompting gives the user as much or as little control as they desire. As much control as an author using descriptive writing to describe every detail of a scene in their novel, can have, in drawing images within our imaginations. (Are people gonna claim an author isn&#39;t responsible for creating the scene in our imaginations, as we read their book?)<br>In some cases even more control, if the user was already an experienced artist or photographer, well versed in the concepts and terminology of their fields. Any novice user can throw words into AI, to see what comes out. But an experienced AI prompter, knows how to provide the AI with the kind of information/details which will create exactly the scene they went in imagining/intending. And it&#39;s not just prompts, a lot of time, and trial &amp; error can go into creating exactly what you were imagining/intending to create in the first place. Intention, experience, and patience, makes the all the difference.";2023-07-06T03:55:07Z;2;UCoGZXXnNPdL7AbCslANBqDw;I do not think that .true at all. Current Generative AI enables a lot of control, if you know how to use it. Similar false claims were made when Photography was invented, as well as digital art on computers, nearly down to the exact our wording people are using now. Prompting gives the user as much or as little control as they desire. As much control as an author using descriptive writing to describe every detail of a scene in their novel, can have, in drawing images within our imaginations. Are people going to claim an author is not responsible for creating the scene in our imaginations, as we read their book? In some cases even more control, if the user was already an experienced artist or photographer, well versed in the concepts and terminology of their fields. Any novice user can throw words into AI, to see what comes out. But an experienced AI prompter, knows how to provide the AI with the kind of information details which will create exactly the scene they went in imagining intending. And it .not just prompts, a lot of time, and trial error can go into creating exactly what you were imagining intending to create in the first place. Intention, experience, and patience, makes the all the difference.;not think .true current generative ai enable lot control know use similar false claim make photography invent well digital art computer nearly exact word people use prompt give user much little control desire much control author use descriptive writing describe detail scene novel draw image imagination people go claim author not responsible create scene imagination read book case even control user already experienced artist photographer well verse concept terminology field novice user throw word ai see come experienced ai prompter know provide ai kind information detail create exactly scene go imagine intending .not prompt lot time trial error go create exactly imagine intend create first place intention experience patience make difference;0.07500000298023224;Negative
UC9rWaeJRwrVj0K1RsXb5S5Q;@spacegoat_3d801;Would be nice;2023-07-03T23:23:58Z;2;UC33CQ9FBw9q75-VNSeKZTjA;Would be nice;nice;0.47200000286102295;Positive
UCn1KSEN_xRN1yFCFaeD2z8g;@winzyl9546;You cant even do that anymore. Only a matter of time before a rumba lawn mower with an ai.;2023-07-04T11:39:28Z;2;UCgFEtnLSNFEbHUqYmKIwXbQ;You can not even do that anymore. Only a matter of time before a rumba lawn mower with an AI.;not even anymore matter time rumba lawn mower ai;-0.3659999966621399;Negative
UCjQE3q_tW5lZUajdbJpjTxQ;@TsiHang;​@@ulfwThe rich;2023-07-03T15:50:29Z;2;UCk8Tc_iPZ63dYSjYgHuZKyA;Rich;rich;0.21699999272823334;Negative
UCErvxxslh89XI4I94IUL8fg;@lastChang;Artificial intelligence has already <b>threatened the existence</b> of the 🇨🇳 Chinese regime because AI always tells the truth.;2023-07-03T15:06:02Z;2;;Artificial intelligence has already threatened the existence of the Chinese regime because AI always tells the truth.;artificial intelligence already threaten existence chinese regime ai always tell truth;-0.8420000076293945;Negative
UC4Dl7ZuEfQwzQmJSVcfrRdQ;@CristianmirabalWuno;Internet never threatened human work and utility against a dystopic system;2023-07-03T23:53:26Z;2;UCrFwpHFNs4ASednR8YAV5-w;Internet never threatened human work and utility against a dystopic system;internet never threaten human work utility dystopic system;-0.8379999995231628;Negative
UC_Z4Le72snCwrtu_1aDZkcg;@johnnyboyvan;Downfall of humanity.;2024-03-27T16:44:09Z;1;;Downfall of humanity.;downfall humanity;-0.7829999923706055;Negative
