id;name;text;time;likes;reply;CleanedText;ProcessText;SentimentScore;ActualLabel
UCsJIDDfJ0nQjBDT44PsdX8A;@ArtofWEZ;"I thought the point of automation was to get rid of labour so humans can pursue uniquely human creative interests? instead it&#39;s going right for art/entertainment. That seems backwards.";2023-05-06T21:03:42Z;2;;I thought the point of automation was to get rid of labor. Humans can pursue uniquely human creative interests? Instead it .going right for art entertainment. That seems backwards.;think point automation get rid labor human pursue uniquely human creative interest instead .going right art entertainment seem backwards;-0.08100000023841858;Negative
UCc6byORYWJr9VEISrzJX_VQ;@enhaa784;😂;2023-08-16T12:12:43Z;2;UCAtvGNoGBzKW37MDwff9r3A;;;0.0;Negative
UCTGCctO9ecQur9IZiaZZPmw;@mutkaluikkunen3926;Me thoughts exactly.;2023-05-07T01:37:11Z;2;UCykOYb_7XPXZ8CXJwspoMnw;Me thoughts exactly.;thought exactly;0.11400000005960464;Negative
UCbMKu5KQUXas8_MVlO7rLKA;@ericeandco;As someone who used AI it hasn’t solved tedious work.  It’s not there yet.  But we accept lower quality work from AI and consumers have gotten used to lower quality, less service and no choice.  It’s the new normal.;2023-05-05T17:10:41Z;2;UChTf8ULwN5n1ulv-JbMVNDg;As someone who used AI it has not solved tedious work. It .not there yet. But we accept lower quality work from AI and consumers have gotten used to lower quality, less service and no choice. It .the new normal.;someone use ai not solve tedious work .not yet accept low quality work ai consumer get use low quality less service choice .the new normal;-0.27000001072883606;Negative
UCudJZg8_WaKfg8cLwfQET7w;@grahamellis6029;"I think she&#39;s got completely wrong AI is coming for her job and a lot more educated professional people&#39;s job&#39;s.";2023-05-03T06:31:57Z;2;;I think she .got completely wrong AI is coming for her job and a lot more educated professional people .job .;think .got completely wrong ai come job lot educated professional people .job;0.08799999952316284;Negative
UCv82gC9e42H40d90qLJpD1g;@farqueueman;"&quot;maybe&quot; lol.";2023-05-04T15:15:28Z;2;UCl1ud78xuO-4Vdi8hTnhyfw;Maybe laugh out loud.;maybe loud;0.9269999861717224;Positive
UCSmKGb8firWCneP6oqXhMpA;@LethiuxX;"AI starts replacing peoples jobs.<br>The government: &quot;This is natural progression&quot;<br><br>AI starts replacing government jobs.<br>The government: &quot;This is a problem we need to address&quot;";2024-01-10T09:49:43Z;1;;AI starts replacing peoples jobs. The government This is natural progression AI starts replacing government jobs. The government This is a problem we need to address;ai start replace people job government natural progression ai start replace government job government problem need address;-0.40299999713897705;Negative
UCbsz3pQPvA8erOVTzDjo0eg;@topofthegreen;this is when the real destruction of society begins.;2023-09-29T01:08:05Z;1;;This is when the real destruction of society begins.;real destruction society begin;-0.9700000286102295;Negative
UCPWbTj-AMzm7IpQ__CpkGwA;@wesleywilliams8129;"She just doesn&#39;t realize the effect.";2023-08-31T05:07:03Z;1;;She just does not realize the effect.;not realize effect;-0.36000001430511475;Negative
UCfwT7CDw0hU9uSwg0p0M8DQ;@forbaldo1;when AI take over the military we will be able to slaughter each other at a phenomenal rate with Reduction in Human Error,   24x7 Availability  . Unbiased Decisions. Wednesday Addams will be so proud of the pain and suffering;2023-08-22T02:09:28Z;1;;When AI takes over the military we will be able to slaughter each other at a phenomenal rate with Reduction in Human Error, 24x7 Availability . Unbiased Decisions. Wednesday Addams will be. Proud of the pain and suffering;ai take military able slaughter phenomenal rate reduction human error x availability unbiased decision wednesday addams proud pain suffering;0.15299999713897705;Negative
UCXukwwxRcrHnI5LBSIH_ySQ;@Denis_Belskiy;Точно);2023-08-14T16:05:16Z;1;;;;0.0;Negative
UCIaDgjK2DHjMcV0D9gcOKow;@libbychang413;the CEOs are already getting giddy about 90% unemployment...an ASI mass extinction is by far the lesser evil...;2023-08-10T05:27:57Z;1;;The CEOs are already getting giddy about 90 unemployment...an ASI mass extinction is by far the lesser evil...;ceo already get giddy unemployment asi mass extinction far less evil;-0.902999997138977;Negative
UCuf4eADzLgVpbAxF1XElLHA;@von252;Its much easier working with AI rather than people. AI is the future. Get with the times!;2023-08-03T00:00:30Z;1;;It is much easier working with AI rather than people. AI is the future. Get with the times!;much easy work ai rather people ai future get time;0.07599999755620956;Negative
UCdBMl0lY2aLP9EU-z-OmwhQ;@stickapot3623;what this woman wont tell you is this will be a complete disaster for every single work force on earth. PERIOD;2023-07-15T06:49:42Z;1;;What this woman will not tell you is this will be a complete disaster for every single work force on earth. PERIOD;woman not tell complete disaster single work force earth period;-0.5019999742507935;Negative
UC34tikWYN7q1eHOe_Lr1osQ;@claytoncampbell7957;Let AI do all the work and we can just do fun things;2023-07-05T22:31:42Z;1;;Let AI do all the work and we can just do fun things;let ai work fun thing;0.847000002861023;Positive
UCeUzmroa_LEvzpHVgd5xxlQ;@alfiemandella2258;Let create karen ai so it will teach you how the job to be operate.;2023-06-24T19:46:19Z;1;;Let create Karen AI. It will teach you how the job to be operated.;let create karen ai teach job operate;0.17399999499320984;Negative
UCHq7aQBFUCGBMEjI03pe41Q;@Peaceful220;Well said! I think we should contact our government and push a regulation on companies to prevent them from firing employees on jobs that human can fully qualified.;2023-06-06T14:07:27Z;1;UC_xEc19BID5EM-nBCK1UrSg;Well said! I think we should contact our government and push a regulation on companies to prevent them from firing employees on jobs that human can fully qualified.;well say think contact government push regulation company prevent fire employee job human fully qualify;0.05900000035762787;Negative
UCSRBst3HmbLcjkQEp1Ui_5A;@Gurkiran676;Terminator 3<br>Acchoo;2023-06-02T04:36:11Z;1;;Terminator 3 Achoo;terminator achoo;-0.09799999743700027;Negative
UC4P59vJAlLvROv5SPkqkwBA;@thamimahlangu6763;Studying AI from early on is the same as CPD;2023-05-29T12:22:41Z;1;;Studying AI from early on is the our as CPD;study ai early cpd;0.2680000066757202;Negative
UCoa83c8WQQso_cnXE1HBVMg;@Jesusreturns8011;Lies lies lies;2023-05-29T08:01:19Z;1;;Lies lies lies;lie lie lie;-0.9440000057220459;Negative
UCeu769hEx4n8LJIu0uBLsGQ;@johnpoublon798;"No it won&#39;t, because there&#39;s no AI at all, Yet! It&#39;s only algorithmic responses we get from ChatGPT. There&#39;s no intelligence or whatsoever conscientiousness from the program to generate responses. That&#39;s still decades away from us in the future. Btw, here is what ChatGPT has to say on this when asking if its AI or algorithmics: &quot;That&#39;s correct. I don&#39;t have subjective experiences or consciousness, and my responses are generated based on patterns and information present in the training data. While I can provide helpful and informative responses, it&#39;s important to understand that I don&#39;t possess true intelligence or understanding. I am a tool designed to assist with generating text based on the input I receive.&quot; - I think this is a clear answer. There&#39;s not yet one company who&#39;s able to create true intelligence.";2023-05-28T11:20:46Z;1;;No it will not , because there .no AI at all, Yet! It .only algorithmic responses we get from ChatGPT. There .no intelligence or whatsoever  from the program to generate responses. That .still decades away from us in the future. Btw, here is what ChatGPT has to say on this when asking if it is AI or algorithmic That .correct. I do not have subjective experiences or consciousness, and my responses are generated based on patterns and information present in the training data. While I can provide helpful and informative responses, it .important to understand that I do not possess true intelligence or understanding. I am a tool designed to assist with generating text based on the input I receive. I think this is a clear answer. There .not yet one company who .able to create true intelligence.;not .no ai yet .only algorithmic response get chatgpt .no intelligence whatsoever program generate response .still decades away future btw chatgpt say ask ai algorithmic .correct not subjective experience consciousness response generate base pattern information present training data provide helpful informative response .important understand not possess true intelligence understanding tool design assist generate text base input receive think clear answer .not yet company .able create true intelligence;-0.0949999988079071;Negative
UCxyJjvWCBUvJZ5Iev7JHZxw;@sabrinatilimian5630;Most people don’t want to work. There is shortage of employees.;2023-05-28T00:24:51Z;1;;Most people do not want to work. There is shortage of employees.;people not want work shortage employee;-0.8830000162124634;Negative
UCQGzBiGrluMiJ5iwzAHtUag;@rogue-ish5713;MOnths? We need new skills in days PEOPLE!;2023-05-26T16:26:55Z;1;;Months? We need new skills in days PEOPLE!;month need new skill day people;-0.39899998903274536;Negative
UC57yZqE6GNqLRgB2ww_LXPA;@b.n180;They will roll out federal digital currency and UBI for citizens.   Keep us poor and controlled. You will own nothing and be happy;2023-05-25T02:04:59Z;1;;They will roll out federal digital currency and FBI for citizens. Keep us poor and controlled. You will own nothing and be happy;roll federal digital currency fbi citizen keep poor control nothing happy;-0.017000000923871994;Negative
UCT2ZDko3gcwVUqZUl476BIA;@sahibzadaanees3001;In short, only knowledge workers would prevail.;2023-05-23T19:40:24Z;1;;In short, only knowledge workers would prevail.;short knowledge worker prevail;0.05700000002980232;Negative
UCi-YMKjUaAl0c9tOubzxg7A;@user-pt2pc5uf1g;All prisons around the world could use AI and wardens will be first to go;2023-05-23T07:44:13Z;1;;All prisons around the world could use AI and wardens will be first to go;prison world use ai warden first go;0.375;Negative
UCQwjjks-0n2OoKoXe0cpoYg;@ArmoredAnubis;Birth rates continue to crash.;2023-05-22T19:54:57Z;1;;Birth rates continue to crash.;birth rate continue crash;-0.9070000052452087;Negative
UCO6CfGSsv112gAPr4bntGeA;@vidadormer8995;Yes unfortunately my worries too;2023-05-22T15:16:59Z;1;;Yes unfortunately my worries too;yes unfortunately worry;-0.8830000162124634;Negative
UCWQPcQ67w5TMlK8qNtNoHwg;@kevinkowlessar5023;Every job is under threat ex Government.;2023-05-22T00:08:21Z;1;;Every job is under threat ex Government.;job threat ex government;-0.9390000104904175;Negative
UC8A_gbDKRUAF_ex3sWfuMjQ;@user-lk8bz7hg2b;I hope they can take over mine. Who enjoys mopping and cleaning every day;2023-05-21T17:15:44Z;1;;I hope they can take over mine. Who enjoys mopping and cleaning every day;hope take mine enjoy mopping cleaning day;0.210999995470047;Negative
UCmg6qgGPQba0X1HXXtzMkhQ;@Reme873;Simple thing. Ban this thing if its threatning jobs and causing mass scale unemployment.Or unemployed millions will get up against AI;2023-05-21T16:47:55Z;1;;Simple thing. Ban this thing if it is threatening jobs and causing mass scale unemployment. Or unemployed millions will get up against AI;simple thing ban thing threaten job cause mass scale unemployment unemployed million get ai;-0.37400001287460327;Negative
UC-TP-wOWX2t-Pg5MQlq_PCg;@panhradu;Ask yourself: Do you believe girl from WEF?;2023-05-21T16:34:54Z;1;;Ask yourself Do you believe girl from WEF?;ask believe girl wef;-0.5730000138282776;Negative
UCcunPlD3ccrikltqplKIphQ;@noirnegro7659;AI will make humans obsolete, welcome to the matrix.;2023-05-21T06:10:33Z;1;;AI will make humans obsolete, welcome to the matrix.;ai make human obsolete welcome matrix;-0.5789999961853027;Negative
UCxeq0d1KRIH__qTzkBgQmug;@gonefishing11;AI will, no-dought, leave us with fewer jobs in an ever-increasing world 🌎 population! The whole purpose of AI is to eliminate people from the workforce!;2023-05-20T16:59:05Z;1;;AI will, dogfought, leave us with fewer jobs in an ever increasing world population! The whole purpose of AI is to eliminate people from the workforce!;ai dogfought leave job ever increase world population whole purpose ai eliminate people workforce;-0.9269999861717224;Negative
UC6GrGc64IH0GoduRIAU1HAQ;@STUDY_Mood_ON;"Sooner or later ai will replace everything so what will people do if people have no job they won&#39;t demand for goods then to whom companies gonna provide ??";2023-05-20T15:56:03Z;1;;Sooner or later AI will replace everything. What will people do if people have no job they will not demand for goods then to whom companies going to provide ??;sooner later ai replace everything people people job not demand good company go provide;-0.421999990940094;Negative
UCRaViqdkW08S5RsenWE62eA;@kepcontube;"Hey corporate world, your next trick turn ai into a consumer. The corporate mentality will eventually create a world where only one person can afford to shop at Tiffany&#39;s.";2023-05-15T21:38:37Z;1;;Hey corporate world, your next trick turn AI into a consumer. The corporate mentality will eventually create a world where only one person can afford to shop at Tiffany .;hey corporate world next trick turn ai consumer corporate mentality eventually create world person afford shop tiffany;-0.7549999952316284;Negative
UCn3PVS0fK6-v45IFe369M2Q;@TalkToAMillionaire;"Excellent...<br>A very well balanced look into the &quot;human - AI&quot; future for widespread economies &amp; labor echelons. Very useful information.<br><br>Thanks for sharing this,<br>James";2023-05-15T15:15:10Z;1;;Excellent... A very well balanced look into the human AI future for widespread economies labor echelons. Very useful information. Thanks for sharing this, James;excellent well balanced look human ai future widespread economy labor echelon useful information thanks share james;0.9399999976158142;Positive
UC6GrGc64IH0GoduRIAU1HAQ;@STUDY_Mood_ON;"Google had already decided a team to work on open ai and Microsoft and already intermixed it&#39;s browser with ChatGPT";2023-05-20T16:08:48Z;1;UC3hkSzedoK-4i2X9mgtUBVg;Google had already decided a team to work on open AI and Microsoft and already intermixed it .browser with ChatGPT;google already decide team work open ai microsoft already intermix .browser chatgpt;0.06199999898672104;Negative
UCkI6qeJP33B5Sc241Vth-rg;@daydreamerdiary;Maybe we can let AI works for us instead of government 😂;2023-05-13T13:25:44Z;1;;Maybe we can let AI works for us instead of government;maybe let ai work instead government;0.3880000114440918;Negative
UCuFN7Zf1hew7TUNxHV1YU0A;@cm37177;A night mare😮;2023-05-12T15:38:53Z;1;;A nightmare;nightmare;-0.8989999890327454;Negative
UCJsuPpVT1Zr4szkO96ti8GQ;@saintsx1958;Everyone needs to be mentally ready. First point of contact <del>customer service</del> is already getting replaced. 😂 Good luck.;2023-05-12T14:13:21Z;1;;Everyone needs to be mentally ready. First point of contact customer service del is already getting replaced. Good luck.;everyone need mentally ready first point contact customer service del already get replace good luck;0.3199999928474426;Negative
UCrsJAwktr-Ci4nsrCo9WKyg;@tmm226;Gosh darn I hope so🎉.;2023-05-12T00:24:32Z;1;;Gosh darn I hope. .;gosh darn hope;0.11500000208616257;Negative
UCe6LFHCwreCoRTdKOxJ9BwQ;@savagedarksider2147;This can only lead to trouble.;2023-05-12T00:21:32Z;1;;This can only lead to trouble.;lead trouble;-0.9240000247955322;Negative
UC4zb--Un4y_HieIqmRdQ_jQ;@itsederrengifo;I think people expect too much from governments that have proven to be very inefficient to act proactively, because they simply DO NOT have the incentives to do it;2023-05-11T16:43:50Z;1;;I think people expect too much from governments that have proven to be very inefficient to act proactively, because they simply DO NOT have the incentives to do it;think people expect much government prove inefficient act proactively simply not incentive;-0.9399999976158142;Negative
UCoMXpG1kz6iEcm7s8GlWVwA;@miskittt;I’m good. I have my beans, rice, potted meat and toilet paper. Get you 15 year supply before you’re forced to take that mark.;2023-05-11T15:35:11Z;1;;I am good. I have my beans, rice, potted meat and toilet paper. Get you 15 year supply before you are forced to take that mark.;good bean rice pot meat toilet paper get year supply force take mark;0.20499999821186066;Negative
UCWKzcR-TwZlsKND_kYFa2Iw;@MrXtenzion;This is history repeating again but as always with a twist. <br><br>They found out after slavery was banned that paying people a living wage actually benefited the economy, more money was in circulation, more demand for goods and services. <br><br>Now we making A.I our new slaves and inequality and unemployment is going to increase. <br><br>Then we can be unemployed and depressed while the computers are doing all the work for us.;2023-05-11T15:03:42Z;1;;This is history repeating but as always with a twist. They found out after slavery was banned that paying people a living wage actually benefited the economy, more money was in circulation, more demand for goods and services. Now we are making A.I. our new slaves and inequality and unemployment is going to increase. Then we can be unemployed and depressed while the computers are doing all the work for us.;history repeat always twist find slavery ban pay people living wage actually benefit economy money circulation demand good service make a.i new slave inequality unemployment go increase unemployed depress computer work;-0.10599999874830246;Negative
UCFOMhUouuj2fFouT2me2LoA;@TheVeganTravelShow;CBDCs will then introduce UBI. The future will be interesting.;2023-05-10T06:43:21Z;1;;CBDCs will then introduce FBI. The future will be interesting.;cbdcs introduce fbi future interesting;0.29600000381469727;Negative
UCuGOEmZXcv-taGK0kk8VP8g;@digitalsoultech;"I&#39;m sorry but this is a major misinformation. The people who wrote this have no clue what generative AI is and what it can truly do. Teachers are gone, reskilling is not important anymore if AI can take on multiple roles simultaneously and do if faster and better then most humans. I work in this field and I know what is the true capability that is already HERE TODAY. It will only get more powerful from here. AI workers will easily trim down the workforce of most companies.";2023-05-10T05:44:17Z;1;;I m sorry but this is a major misinformation. The people who wrote this have no clue what generative AI is and what it can truly do. Teachers are gone, deskilling is not important anymore if AI can take on multiple roles simultaneously and do if faster and better than most humans. I work in this field and I know what is the true capability that is already HERE TODAY. It will only get more powerful from here. AI workers will easily trim down the workforce of most companies.;sorry major misinformation people write clue generative ai truly teacher go deskilling not important anymore ai take multiple role simultaneously faster good human work field know true capability already today get powerful ai worker easily trim workforce company;-0.01899999938905239;Negative
UC1Lv9PZiV49hAWflvqGb-3Q;@Recuper8;Will need UBI or a new economic system.;2023-05-08T04:38:25Z;1;;Will need FBI or a new economic system.;need fbi new economic system;-0.7369999885559082;Negative
UCLkqeR9YruDqQyIKFi4AdVg;@aigredouxx;you will have nothing and you will be happy;2023-05-07T19:16:14Z;1;;You will have nothing and you will be happy;nothing happy;0.007000000216066837;Negative
UC0j67gfSqwoskk4qW6XZPzQ;@zeea6507;Need to up skill further. Disruptive technology coming.;2023-05-07T14:48:15Z;1;;Need to up skill further. Disruptive technology coming.;need skill far disruptive technology come;-0.019999999552965164;Negative
UCKwkoZnFw2BgJsBCJ1d6J1w;@GautamSawhney1978;"It&#39;s simply all about evolve through the process and come out fittest";2023-05-07T07:21:11Z;1;;It .simply all about evolve through the process and come out fittest;.simply evolve process come fit;0.47699999809265137;Positive
UCec2ykrxsMB2MHcrK7V9kWg;@laurenk.burford9887;No one even understands what consciousness is, let alone being able to recreate it. AI is theft and scamming software.;2023-05-06T17:58:14Z;1;;No one even understands what consciousness is, let alone being able to recreate it. AI is theft and scamming software.;even understand consciousness let alone able recreate ai theft scamming software;-0.7570000290870667;Negative
UCFpwI3CiOD5pneG3jzo7bIw;@julionebarres6981;"<a href=""https://www.youtube.com/watch?v=mDq-4sOjvYc&amp;t=363"">6:03</a> Right, that’s socialism. The corporations get all the advances is technology, all the profits, all of everything and then passed the bill dew to the government and have that taxpayers cover their expenses.";2023-05-06T00:22:27Z;1;;a ref Right, that.socialism. The corporations get all the advances is technology, all the profit is, all everything and then passed the bill due to the government and have that taxpayers cover their expenses.;ref right that.socialism corporation get advance technology profit everything pass bill due government taxpayer cover expense;-0.37700000405311584;Negative
UCnGr19ZrtDwKfOULt0K4d2g;@ccordyceps;"@@CAM-fq8lv no not just UBI/CBDCs. it&#39;s also going to be DeFi on the opposite end. wake up.";2023-05-19T03:28:16Z;1;UCykOYb_7XPXZ8CXJwspoMnw;No not just FBI CBD Cs. It .also going to be DeFi on the opposite end. Wake up.;not fbi cbd c .also go defi opposite end wake;-0.003000000026077032;Negative
UC45wHM1DeeR9it_WdgWtD8A;@anotheryoutubeaccount5259;"That&#39;s an interesting fantasy";2023-05-11T13:38:37Z;1;UCNj3dXSnva6HvQUdvhoMgSg;That .an interesting fantasy;.an interesting fantasy;0.48399999737739563;Positive
UCQ13q-3laP6vcK73Dj1SleQ;@sucktitles;"AI taking over jobs could mean total utopia for humanity in the near future if only we didn&#39;t lack the balls to adapt. Yeah capitalism has pulled us out of poverty, but it&#39;s seriously outliving its usefulness. We need to work towards a society where unemployment isn&#39;t a problem but nothing more than a simple statistic.";2023-05-05T13:08:27Z;1;;AI taking over jobs could mean total utopia for humanity in the near future if only we did not lack the balls to adapt. Yeah, capitalism has pulled us out of poverty, but it .seriously outliving it is usefulness. We need to work towards a society where unemployment is not a problem but nothing more than a simple statistic.;ai take job mean total utopia humanity near future not lack ball adapt capitalism pull poverty .seriously outlive usefulness need work towards society unemployment not problem nothing simple statistic;-0.15700000524520874;Negative
UCbMKu5KQUXas8_MVlO7rLKA;@ericeandco;If no one works who pays for AI?;2023-05-05T17:04:00Z;1;UCQ13q-3laP6vcK73Dj1SleQ;If no one works who pays for AI?;one work pay ai;-0.5640000104904175;Negative
UChTf8ULwN5n1ulv-JbMVNDg;@artjomsrimdjonoks2938;AI is not taking away jobs - it solves tedious unpleasant repetitive tasks.<br>If your job involves such tasks - you may be replaced by someone who knows how to use AI programs to automate them.;2023-05-05T06:42:52Z;1;;AI is not taking away jobs it solves tedious unpleasant repetitive tasks. If your job involves such tasks you may be replaced by someone who knows how to use AI programs to automate them.;ai not take away job solve tedious unpleasant repetitive task job involves task replace someone know use ai program automate;0.2930000126361847;Negative
UC45wHM1DeeR9it_WdgWtD8A;@anotheryoutubeaccount5259;Pretty much, yes;2023-05-11T13:45:56Z;1;UChTf8ULwN5n1ulv-JbMVNDg;Pretty much, yes;pretty much;0.2800000011920929;Negative
UC45wHM1DeeR9it_WdgWtD8A;@anotheryoutubeaccount5259;@@ericeandco Not really;2023-05-11T13:46:10Z;1;UChTf8ULwN5n1ulv-JbMVNDg;Not really;not really;-0.5609999895095825;Negative
UCbMKu5KQUXas8_MVlO7rLKA;@ericeandco;We are not getting the same thing with that one man operation.  We are getting less.  We are just accepting less.;2023-05-05T17:14:31Z;1;UCJhNvqhVHUQHrtGLR60mRCw;We are not getting the our thing with that one man operation. We are getting less. Furthermore, we are just accepting less.;not get thing man operation get less furthermore accept less;-0.8679999709129333;Negative
UCw_Lnd3i-zxco9tlswBU0YQ;@GOSPELPOWERED01;I cant wait for Ai to start writing better rap to undermine these gangster dregs of humanity😮;2023-05-04T13:07:13Z;1;;I can not wait for Ai to start writing better rap to undermine these gangster dregs of humanity;not wait ai start write well rap undermine gangster dreg humanity;-0.671999990940094;Negative
UCVOlkORNE0S1eaC9E1AjNAw;@NECKBRACEBRO;The whole human race will be on Welfare.;2023-05-04T10:58:07Z;1;;The whole human race will be on Welfare.;whole human race welfare;-0.9449999928474426;Negative
