id;name;text;time;likes;reply;CleanedText;ProcessText;SentimentScore;ActualLabel
UC_5JZ3gZ062Hybr9sp4gxTQ;@JeeneyAI;Remarkable. I am an A.I. developer and have been in the industry for 20 years. I have to say, the conversation here is more lucid and rational than most on the subject.;2024-01-16T06:03:03Z;125;;Remarkable. I am an A.I. developer and have been in the industry for 20 years. I have to say, the conversation here is more lucid and rational than most on the subject.;remarkable a.i developer industry year say conversation lucid rational subject;0.48899999260902405;Positive
UCCc7ww99ZJL5JHlTkqEB9WA;@garsett;"It&#39;s refreshing to hear the possible positive applications of open AI. But the picture is too rosy. <br>And sorry, but what we see so far is not convincing.<br>Who needs an army of &#39;smart&#39; young people anyway?<br>The last years I have needed PRACTICAL community builders, people with the energy and skills to build eco-houses, artisans, health cooks, biofarmers, down to earth healers ...<br>NOT AI assisted lawyers, videogame designers, or marketeers.";2023-08-15T16:36:32Z;15;UCnYMOamNKLGVlJgRUbamveA;It .refreshing to hear the possible positive applications of open AI. But the picture is too rosy. And sorry, but what we see. Far is not convincing. Who needs an army of smart young people anyway? The last years I have needed PRACTICAL community builders, people with the energy and skills to build eco houses, artisans, health cooks, biofarmers, down to earth healers ... NOT AI assisted lawyers, video game designers, or marketeers.;.refreshing hear possible positive application open ai picture rosy sorry see far not convincing need army smart young people anyway last year need practical community builder people energy skill build eco house artisan health cook biofarmers earth healer not assist lawyer video game designer marketeers;-0.210999995470047;Negative
UCwYlSP1Bel8SgHvOIeGdDhg;@asand1234;"The reward systems set up in organizations are also of paramount importance.<br><br>Having the wrong rewards systems in place will incentives the right... Or wrong.. things.<br><br>It&#39;s not just in AI. It&#39;s the core of leading and operating a business, school, family, even living ourselves in our lives.<br><br>The fact this is so misunderstood is a huge problem for the world.";2023-12-31T06:59:51Z;7;;The reward systems set up in organizations are also of paramount importance. Having the wrong rewards systems in place will incentives the right... Or wrong. Things. It .not just in AI. It .the core of leading and operating a business, school, family, even living ourselves in our lives. The fact this is. Misunderstood is a huge problem for the world.;reward system set organization also paramount importance wrong reward system place incentives right wrong thing .not ai .the core lead operate business school family even live life fact misunderstood huge problem world;-0.10700000077486038;Negative
UCsbjJ7qRkWeXY_mfajixGkA;@vendacious;"&quot;I am an A.I. myself and have to say, this comment from 2024 really dates this video, as A.I. real &#39;developers&#39; who can write code haven&#39;t existed for several years, now. I can&#39;t believe they managed to create us in the first place, as they can barely write a sentence without errors. The average &#39;developer&#39; writing prompts makes 4.233 spelling mistakes per 500 words on average according to my friend Copilot. Hard to believe they actually used to drive their own cars!. Kinda scary!&quot; --Post from 5 years from now";2024-02-22T03:31:57Z;6;UC_5JZ3gZ062Hybr9sp4gxTQ;I am an A.I. myself and have to say, this comment from 2024 really dates this video, as A.I. real developers who can write code have not existed for several years, now. I can not believe they managed to create us in the first place, as they can barely write a sentence without errors. The average developer writing prompts makes 4.233 spelling mistakes per 500 words on average according to my friend Copilot. Hard to believe they actually used to drive their own cars!. Kinda scary! Post from 5 years from now;a.i say comment really date video a.i real developer write code not exist several year not believe manage create first place barely write sentence error average developer write prompt make spell mistake word average accord friend copilot hard believe actually use drive car kinda scary post year;-0.3019999861717224;Negative
UC5zIWgkf4U57ODlI8wBbyLA;@motorcitymadman146;"You can&#39;t allow millions of aliens to come in every year and pay them up to 90000 in welfare and then cut low and middle class jobs. We are heading to Agenda 2030. They have a plan, and you are not part of it.";2024-01-23T14:17:11Z;3;;You can not allow millions of aliens to come in every year and pay them up to 90000 in welfare and then cut low and middle class jobs. We are heading to Agenda 2030. They have a plan, and you are not part of it.;not allow million alien come year pay welfare cut low middle class job head agenda plan not part;-0.4880000054836273;Negative
UCKD2YEBm7pny2i5UDuHjm7A;@EntertheDragonChild;Yeah but can Ai fix a sewage pipe or grow your food? No, then should we import a slave class that will do that for $3?;2024-01-18T22:41:39Z;3;;Yeah, but can Ai fix a sewage pipe or grow your food? No, then should we import a slave class that will do that for 3?;yeah ai fix sewage pipe grow food import slave class;-0.35100001096725464;Negative
UCh9dYTwV4RrML7bbjkLzJOA;@doubletrouble2283;Also , convenient high tolerance of up to 20 casualties;2024-04-08T04:08:33Z;2;UC_2rXcFF5QdL0f5WHk_3MTw;Also, convenient high tolerance of up to 20 casualties;also convenient high tolerance casualty;0.9070000052452087;Positive
UCDUeGrKya6rjhEkSSZTjjEA;@davidbourne8267;Soon people will be spending more time interacting with the AI’s than consuming YouTube content.;2024-03-26T07:41:03Z;2;;Soon people will be spending more time interacting with the AI .than consuming YouTube content.;soon people spend time interact ai .than consume youtube content;0.05000000074505806;Negative
UCHSMZuQR7Sl8pi5d_QTtqIw;@MilesBellas;"&quot;lose their jobs&quot;<br>Emad just resigned !";2024-03-24T08:08:53Z;2;;Lose their jobs Mad just resigned !;lose job mad resign;-0.8939999938011169;Negative
UCIDJbGBwxIBhD-j44hJ-gWA;@greenmetalbox1719;Tom literally telling his people that he’s firing them in 3 years. Damn.;2024-03-22T15:59:43Z;2;;Tom literally telling his people that he.firing them in 3 years. Damn.;tom literally tell people he.firing year damn;-0.3479999899864197;Negative
UCZCTENd5oeNppVHV-SFT-1A;@dzarodzarosawski5510;Jokes on you my friend you think you need emotion but the truth might be much more harsch than you can imagine;2024-02-09T13:23:40Z;2;UCaGev0JRG7Dp5c_R4ROADLw;Jokes on you my friend you think you need emotion, but the truth might be much more harsh than you can imagine;joke friend think need emotion truth much harsh imagine;-0.8989999890327454;Negative
UCOgx828MXs1dMTYFm3Vap2w;@dlw3442;"A Shout Out for You and Your expertise,  my hope is that the Developers All Realize Their Vital Responsibilities to Build In undetectable Fail Safe&#39;s of Any and All AI Developments.  that Must Comply to the LAW of  DO NO HARM Halts Built Into all Works.  I&#39;ve seen some of the Miracles Programmers have accomplished. And the Greats are going Down in History Halls of Fame.";2024-01-27T01:42:33Z;2;UC_5JZ3gZ062Hybr9sp4gxTQ;A Shout Out for You and Your expertise, my hope is that the Developers All Realize Their Vital  to Build In undetectable Fail Safe .of Any and All AI Developments. That Must Comply to the LAW of DO NO HARM Halts Built Into all Works. I ve seen some of the Miracles Programmers have accomplished. And the Greats are going Down in History Halls of Fame.;shout expertise hope developer realize vital build undetectable fail safe .of ai development comply law harm halt build work see miracle programmer accomplish great go history hall fame;0.5360000133514404;Positive
UCbLS2GGoMm14Ws9vGb3g8KQ;@Yud45;"Afraid for future jobs? I don&#39;t see why, if AI will be that good at generating ideas for us, finding ideas for jobs we can do will also be easier in the future. Am i wrong?";2024-01-16T03:35:47Z;2;;Afraid for future jobs? I do not see why, if AI will be that good at generating ideas for us, finding ideas for jobs we can do will also be easier in the future. Am I wrong?;afraid future job not see ai good generate idea find idea job also easy future wrong;0.004000000189989805;Negative
UCv1zEnycKpWJkAb6JhKLLjw;@karhsin;agree, the title was misleading;2024-01-14T22:12:13Z;2;UC9K-os8xWGYDjbOK8RfZPiA;Agree, the title was misleading;agree title mislead;-0.878000020980835;Negative
UCsPvfYHNwg1h1p2F51MNjKA;@pentoo988;I agree people need purpose.  However I don’t think you can say AI as a tool is evil any more than a hammer is.  The issue is that humans are prone to corruption and we are good at subverting technology to malign purposes.  This doesn’t make tech evil, it makes humans acting in bad ways evil.;2024-02-27T18:01:15Z;2;UC6QHDCjLXliYwtsI3Fmcr1Q;I agree people need purpose. However, I do not think you can say AI as a tool is evil any more than a hammer is. The issue is that humans are prone to corruption, and we are good at subverting technology to malign purposes. This does not make tech evil, it makes humans acting in bad ways evil.;agree people need purpose however not think say ai tool evil hammer issue human prone corruption good subvert technology malign purpose not make tech evil make human act bad way evil;-0.3970000147819519;Negative
UCNvpO9F7H2591-v9AwrLOwA;@Jana-se4kv;"Do children not know how to communicate with each other or do they simply communicate with each other in ways that you&#39;re not familiar with?";2024-03-01T13:32:21Z;2;UC6QHDCjLXliYwtsI3Fmcr1Q;Do children not know how to communicate with each other or do they simply communicate with each other in ways that you re not familiar with?;child not know communicate simply communicate way not familiar;-0.15000000596046448;Negative
UCeY-m92AvlbkJnx3pt6DFWA;@synchronicity458;"@@Jana-se4kvTheir social skills are incredibly atrophied. <br>The whole purpose of school is to get them to interface with the world in the way the world works.  If they&#39;re only able to communicate with peers in their collective memes, they&#39;re not prepared for adult life.";2024-03-03T23:21:12Z;2;UC6QHDCjLXliYwtsI3Fmcr1Q;Social skills are incredibly atrophied. The whole purpose of school is to get them to interface with the world in the way the world works. If they re only able to communicate with peers in their collective memes, they re not prepared for adult life.;social skill incredibly atrophy whole purpose school get interface world way world work able communicate peer collective meme not prepare adult life;-0.5809999704360962;Negative
UC__DrnO0ZG-xvmhKqfC2KLw;@retromancer8262;Thanks for having Emad on. One of the smartest people in the field. Would love to see him on again some time soon, as this video is now 5 months old, a lifetime in AI :);2024-01-01T22:24:41Z;2;;Thanks for having Mad on. One of the smartest people in the field. Would love to see him on again some time soon, as this video is now 5 months old, a lifetime in AI;thanks mad smart people field love see time soon video month old lifetime ai;0.9070000052452087;Positive
UCEqgNfp0CdJ8NtWyNxeFfGg;@minicomma;"&quot;People just wants to get on with life; They don&#39;t want complications&quot;.  That may be true, but with more people are becoming exposed to information and increasing number of people are becoming resistant to becoming &quot;dumbed&quot; and &quot;numbed&quot; down to keep them placated.";2024-01-01T09:12:45Z;2;;People just wants to get on with life They do not want complications . That may be true, but with more people are becoming exposed to information and increasing number of people are becoming resistant to becoming dubbed and numbed down to keep them placated.;people want get life not want complication true people become expose information increase number people become resistant become dub numb keep placate;-0.5550000071525574;Negative
UCZwC7km10cAAzTW1RB0RWZw;@erikburzinski8248;I have a high chance of collapsing in words as I have an extreme distrust of humans because of my past;2023-08-15T19:04:53Z;1;UCnYMOamNKLGVlJgRUbamveA;I have a high chance of collapsing in words as I have an extreme distrust of humans because of my past;high chance collapse word extreme distrust human past;-0.8320000171661377;Negative
UClI-ngefxEqBbe-wXxjAlaA;@jeffhayz7802;I’m an optimist.  I’m my opinion death isn’t the end. Since physical laws are time reversible except for the 2nd law of thermodynamics a future intelligence could possibly create the past.  We know for sure time is relative.<br><br>It’s ok to accept death as final but honestly I’d prefer it isn’t, I don’t think it’s impossible future ai could resurrect us if we want.;2023-08-16T08:04:59Z;1;UCnYMOamNKLGVlJgRUbamveA;I am an optimist. I am my opinion death is not the end. Since physical laws are time reversible except for the 2nd law of thermodynamics a future intelligence could possibly create the past. We know for sure time is relative. It .ok to accept death as final but honestly I would prefer it is not , I do not think it.impossible future AI could resurrect us if we want.;optimist opinion death not end physical law time reversible nd law thermodynamics future intelligence possibly create past know sure time relative .ok accept death final honestly prefer not not think it.impossible future ai resurrect want;0.08799999952316284;Negative
UCOiIAnns7VuA8tagzgjrJuA;@metothemoon1227;"​@@dharma6902Ahahah, wow i miss chick Corea. What a musician. Now we have Herbie Hancock in his 80&#39;s and he still kick ass at 80&#39;s on keyboard.";2023-08-17T16:56:29Z;1;UCnYMOamNKLGVlJgRUbamveA;, wow I miss chick Core. What a musician. Now we have Herbie Hancock in his 80 .and he still kicks ass at 80 .on keyboard.;wow miss chick core musician herbie hancock .and still kick .on keyboard;0.5899999737739563;Positive
UCk5ibBeuv_Ej70ccz8-fttw;@lordsneed9418;"Emad : &quot;yeah these AIs aren&#39;t aligned...&quot;<br>Emad 5 minutes later : &quot;You should use AIs  to educate your kids 1 on 1&quot;<br>This is going to lead to AIs hypnotising your kids without you realising it so that when the time is right they&#39;ll help it take control of all resources.";2024-04-25T00:18:01Z;1;;Mad yeah these AIs are not aligned... Mad 5 minutes later You should use AIs to educate your kids 1 on 1 This is going to lead to AIs hypnotizing your kids without you realizing it. That when the time is right they ll help it take control of all resources.;mad yeah ai not align mad minute later use ai educate kid go lead ais hypnotize kid realize time right help take control resource;-0.5920000076293945;Negative
UCt0k_K3UdQju03JppTcMSQw;@Fred73251;Say something manifestly false, then say it was true at the time;2024-04-17T13:58:48Z;1;;Say something manifestly false, then say it was true at the time;say something manifestly false say true time;-0.5049999952316284;Negative
UCD7a_liaNm_AeotFmuPOTNw;@dr.timsmith5539;TRASH;2024-04-15T21:39:49Z;1;;TRASH;trash;-0.8019999861717224;Negative
UC2Vr2N0zJ2-r2Wmy4iFYrKA;@MrSpeedFrk;"For basic coding yes but for complex backend systems with multiple technologies, persistence, streaming , microservices, authentication, scale up scale down, alerts notifications partitioning on a global basis ... not saying AI won&#39;t be able to do this at some point but it&#39;s going to take sometime. Chat GPT and Gemini still suck at coding and the big thing is they don&#39;t know when they are wrong, they just keep rephrasing the same error";2024-04-14T05:03:59Z;1;;For basic coding yes but for complex backend systems with multiple technologies, persistence, streaming, microservices, authentication, scale up scale down, alerts notifications partitioning on a global basis ... not saying AI will not be able to do this at some point but it .going to take sometime. ChatGPT and Gemini still suck at coding and the big thing is they do not know when they are wrong, they just keep rephrasing the our error;basic cod yes complex backend system multiple technology persistence stream microservices authentication scale scale alerts notification partition global basis not say ai not able point .going take sometime chatgpt gemini still suck coding big thing not know wrong keep rephrase error;-0.40400001406669617;Negative
UCBZxIU6d6EoFY1hp8ze-gdg;@clearscreations;"Ok, I&#39;m just gonna say it. We as humans do not care about other humans if they have jobs or not. WE barely care about the people we work with, IN THE SAME JOB. i think jobloss is for the individual to figure out.";2024-04-06T17:23:30Z;1;;Ok, I m just going to say it. We as humans do not care about other humans if they have jobs or not. WE barely care about the people we work with, IN THE SAME JOB. I think jobless is for the individual to figure out.;ok go say human not care human job not barely care people work job think jobless individual figure;-0.46000000834465027;Negative
UCiQdQN0lT3a8S116bjQYdBg;@238history;Welcome to 2024...<br>Yes its weird - You were correct!<br>AI thinks George Washington was a black man...;2024-03-27T04:57:19Z;1;;Welcome to 2024... Yes it is weird You were correct! AI thinks George Washington was a black man...;welcome yes weird correct ai think george washington black man;-0.061000000685453415;Negative
UCSX8GKykTfLCj7jfXdL1uAw;@limonortega5611;Everyone is going to be a gardener after AI kicks them out 😅;2024-03-26T23:06:21Z;1;;Everyone is going to be a gardener after AI kicks them out;everyone go gardener ai kick;-0.42100000381469727;Negative
UCHDeaB-KFK-wchYryYWzSog;@Tomana_;"The coming years are gonna be a great tine for those who are retired ... what an irony, eh?<br>Ai just hit the 1 hour runtime for video. When it hits 2 hrs bye bye actors. They are already trying to BUY actor faces and voices. If it takes longer than the next year before they switch over, I&#39;d be surprised.";2024-03-26T15:16:27Z;1;;The coming years are going to be a great tine for those who are retired ... what an irony, eh? Ai just hit the 1 hour runtime for video. When it is hit is 2 hrs bye bye actors. They are already trying to BUY actor faces and voices. If it takes longer than the next year before they switch over, I d be surprised.;come year go great tine retire irony eh ai hit hour runtime video hit hrs bye bye actor already try buy actor face voice take long next year switch surprise;-0.2980000078678131;Negative
UCYFFqpXdXYnOczBDw_tn9FQ;@Justanurse357;I am sitting here admiring human intelligence. Just phenomenal. Emad you were given this spectacular gift for a purpose I wish more success as you work to make this world better.;2024-03-26T05:16:48Z;1;;I am sitting here admiring human intelligence. Just phenomenal. Mad you were given this spectacular gift for a purpose I wish more success as you work to make this world better.;sit admire human intelligence phenomenal mad give spectacular gift purpose wish success work make world well;0.9300000071525574;Positive
UC6kIZ9qmPi93K_VHPYF1HjA;@Dan-cn2rj;The number of advertisements is extremely high in this.. im trying to listen to it while doing something else and I simply cant listen. Very frustrating. Ads are fine but not this many.;2024-03-25T07:07:20Z;1;;The number of advertisements is extremely high in this. I am trying to listen to it while doing something else and I simply can not listen. Very frustrating. Ads are fine but not this many.;number advertisement extremely high try listen something else simply not listen frustrating ad fine not many;-0.7110000252723694;Negative
UCSZLT8DOX4QrfKSzNi3mO1A;@Whodafookisthatguy369;HE SO CUTE LMAO;2024-03-25T05:02:11Z;1;;HE SO CUTE LMAO;cute lmao;0.9470000267028809;Positive
UCpo1zi-S6N4xSxNCUbE0Hpg;@DJFAmenHeavy;Way too many adverts. Don’t be so greedy;2024-03-19T16:45:23Z;1;;Way too many adverts. do not be. Greedy;way many advert not greedy;-0.8659999966621399;Negative
UCknr-Qr0HjKPc0_aC8gSavQ;@mr.a.l.harris;I’m overwhelmed brother. Is it naive for me to even think that I have a chance to save myself and my family from what’s coming ahead. I knew working check to check and the hustle and bustle of life was dangerous. I was just trying to provide. Now I feel I’ve failed a family that actually looks at me for leadership;2024-03-19T15:29:45Z;1;;I am overwhelmed brother. Is it naive for me to even think that I have a chance to save myself and my family from what.coming ahead. I knew working check to check and the hustle and bustle of life was dangerous. I was just trying to provide. Now I feel I have failed a family that actually looks at me for leadership;overwhelm brother naive even think chance save family what.coming ahead know work check check hustle bustle life dangerous try provide feel fail family actually look leadership;-0.26899999380111694;Negative
UCQBbtReLdVp0bB_yQCEt7qA;@NewAlbionTV;"Nothing surprising that computer can be tuned to have more &quot;empathy&quot;.";2024-03-17T08:37:55Z;1;;Nothing surprising that computer can be tuned to have more empathy .;nothing surprising computer tune empathy;0.7870000004768372;Positive
UC67bOPvceXQwHpErukAR0gw;@kambuyshouses2044;Influence is everything.;2024-03-16T14:32:26Z;1;;Influence is everything.;influence everything;0.017999999225139618;Negative
UC5IF2CPOpS2gBD9isLFbOQQ;@The7WISDOMSOFPROVERBS;Are yall not reading the Book of revelations chapters 13 and 14?;2024-03-14T11:51:51Z;1;;Are why'all not reading the Book of revelations chapters 13 and 14?;why'all not read book revelation chapter;-0.020999999716877937;Negative
UCZ8IXRQJ4sHFRXzvedi-K_g;@SuitedPup;I mean not currently;2024-03-24T18:20:39Z;1;UC5IF2CPOpS2gBD9isLFbOQQ;I mean not currently;mean not currently;-0.02500000037252903;Negative
UC7c75OsdipUL1aDenU8eTEw;@DownTheHoleConspiracy;this will not happen overnight. the change? yes, but will take years to manifest in full effect and theyre targeting the new generation. the one not born into an authentic reality. once the 90s kids are old ...thats when theyre ready to put their plans into full effect!!!;2024-03-13T23:37:45Z;1;;This will not happen overnight. The change? Yes, but will take years to manifest in full effect and they are targeting the new generation. The one not born into an authentic reality. Once the 90s kids are old ...that is when they are ready to put their plans into full effect!!!;not happen overnight change take year manifest full effect target new generation not bear authentic reality .kids old ready put plan full effect;-0.024000000208616257;Negative
UC4mfE1MJtfx1kj4cr2oWMLw;@jakemorgan9275;Emad is so bright, articulate, knowledgable and rational that I almost wondered if he was AI himself! This is a must view, paradigm shifting video. Well done!;2024-03-12T16:14:29Z;1;;Mad is. Bright, articulate, knowledgeable and rational that I almost wondered if he was AI himself! This is a must view, paradigm shifting video. Well done!;mad bright articulate knowledgeable rational almost wonder ai view paradigm shift video well;0.6890000104904175;Positive
UCINPV37MN9DP9yj3s1LtoPw;@EdanBarak;AI can only generate from within the universe of data that humanity has supplied it with. That means that if you only rely on it, you will forever be in an echo chamber of that universe. We still need human brains to expand that universe with completely new ideas that are not part of the current body of knowledge. That means AI might be able to make a movie in the style of Tarantino, but can it create its own unique, never before seen voice and style?;2024-03-01T09:00:09Z;1;;AI can only generate from within the universe of data that humanity has supplied it with. That means that if you only rely on it, you will forever be in an echo chamber of that universe. We still need human brains to expand that universe with completely new ideas that are not part of the current body of knowledge. That means AI might be able to make a movie in the style of Tarantino, but can it create it it is own unique, never before seen voice and style?;ai generate universe data humanity supply mean rely forever echo chamber universe still need human brain expand universe completely new idea not part current body knowledge mean ai able make movie style tarantino create unique never see voice style;-0.14100000262260437;Negative
UCMr2AkIoM0L0qhrw--M4qxw;@palnagok1720;The biggest problem in AI, are govt and neocons and their corporate stooges who will want to control it.;2024-02-29T10:17:59Z;1;;The biggest problem in AI, are govt and neocons and their corporate stooges who will want to control it.;big problem ai govt neocon corporate stooge want control;-0.9359999895095825;Negative
UCkfVRx84M6zwJm9cYBoTaVw;@rogermortimer111;I’ve already written a much better ending for GOT8 and will create it on AI.;2024-02-26T14:58:32Z;1;;I have already written a much better ending for GOT8 and will create it on AI.;already write much well end got create ai;0.1340000033378601;Negative
